postContent,themes
"Congratulations to head of Wells Fargo Auto, Tanya Sanders, for being recognized on the Diversity Woman Media's Elite 100 list, which honors Black women who are disrupting the status quo in executive leadership roles across corporate America and beyond. Tanya is a trained engineer and thought leader with more than 20 years of financial services experience, and I'm proud to celebrate all her achievements that have led to this amazing recognition! hashtag#WeAreWellsFargo http://on.wf.com/6047kL5zd",Not Transactions
"So incredibly excited for what we are building together! We are shaping the future of healthcare!! Stay tuned... #ConeHealthProud #RisantProud #ForOurCommunities #Impact
Cone Health Risant Health

https://lnkd.in/geqUr6bQ",Not Transactions
"I'm excited to announce that I have accepted a 2024 Summer Software Engineer Intern position within the Elevance Health Technology organization! I would like to thank Patrick Abell, Ashwini Hassija, Vinod Pallat, Ankur Sehgal Director II Technology, and Anil Bhatt SVP Global Chief Information Officer, for this incredible  opportunity. Looking forward to learning as much as I can through this internship! hashtag#ELVTechIntern hashtag#ElevanceHealthSummerIntern2024 hashtag#ElevanceHealth hashtag#ELVTech",Not Transactions
Great to host our community researchers Karina Coombes and Alex Puruntatameri from Tiwi island this week and get hands on with our project Partner Healthdirect. Translational research in action! Thanks to Sam Georgy and Mathew Simons for all their support!,Not Transactions
"I'm happy to share that I have been PROMOTED to Senior Director of Enterprise Analytics/ CDO at JobsOhio! A Huge Thanks to all the phenomenal men and women in my life and their support,love, strong belief in me!",Not Transactions
"It was an absolute pleasure shipping up to Boston to see some of our wonderful customers at their amazing offices. Justine Shopis at Boston Consulting Group (BCG), Benjamin French Cobb (he/him/his) at Fidelity Investments, plus D'Naysia Stonick and Bridget M Reilly over at State Street are all doing really cool things with video.And what a great visit with Gregory Manning, Chris Cooper, Nathan Welch, Michael Arguin, Katelynn Conlon and the rest of our partners at Brightcove. It was a blast getting some in-person time with you all!Of course, my great teammates truly made the cross-country trip excellent! Thank you for going on another northeastern adventure Malini Sen, MBA, Jonathan Joffe, and for making the trip from a few states over Lindsey Royer. You and all of our Socialivers make these trips so much fun.",Not Transactions
"Nothing business in this post - just personal. Got to play golf with my son, Michael Hearnes, today before he starts his summer internship with Deloitte. So, naturally, I made a hole-in-one because that's what dads do to impress their kids, right?

I love that I'm getting a chance to spend some quality time with family and friends. Don't get me wrong - work is important and fulfilling, but it's not what truly matters. It took me too long to figure that out.",Not Transactions
Complete chaos. Y14 We break down how sales pros can consistently hit their targets quarter after quarter: https://lnkd.in/gcU8r24X,Not Transactions
"Oh when the Spurs, from The Dare Skywalk at Tottenham Hotspur Stadium ",Not Transactions
I'm honored to share that I've recently taken on a new role as SVP / General Manager - Call of Duty at Activision!,Not Transactions
"I am deeply honored and grateful to have been appointed as our healthcare network's new Chair of Diversity, Equity, Inclusion, and Belonging. Thank you, The Christ Hospital Health Network and Andre Boomer, MBA , for your support and trust in me in leading these critical initiatives.",Not Transactions
"Cheers to another year of Growth, Resilience, Initiative, and Teamwork! Celebrating successful milestones and record achievements at Whirlpool Corporation's 2024 National Sales Conference. hashtag#GRIT hashtag#FORWARD hashtag#underthesun hashtag#Whirlpool",Not Transactions
"I'm happy to share that I'm starting a new position as Senior Vice President of Product Strategy at Shaw Systems Associates, LLC!",Not Transactions
"Shepherd Center CEO Sarah Morrison, PT, MBA, MHA, announced last November that she will retire on September 20, 2024, after 40 years of service, and that Jamie Shepherd, MBA, MHA, will take the helm as CEO. Sarah was recently interviewed about her advice for the next generation of health system executives, and here is part of what she had to say: ""Be transparent and humble "" have an open-door policy, and be willing to admit when you were wrong. Have a clear vision and communicate it often. From there, set expectations and hold your team accountable. Finally, be present "" emotionally and physically. Get out from behind your desk and walk the halls. You'll never regret the time you spent showing up for your team."" Read her full response here: https://bit.ly/41w2ieL",Not Transactions
"Ask yourself... Are you??? As many of us are heading back into work today and later this week, no matter your role in the organization, you have an opportunity to be a leader!If you see some trash as you're walking in the building, pick it up! If you see an opportunity to improve things, raise your hand and share your ideas. Step up to take on the big assignment, claim it and do it well! You have 366 new pages to write a great story this year, and I know you will blossom into the leader that people choose to follow! You got this!-hashtag#leadershipquotes hashtag#womenwholead hashtag#leadershiptips",Not Transactions
"Happy hashtag#iwd2024!! Amazing event with wonderful speakers, panelists, colleagues and male allies.Congratulations PSEG WLA (Women's Leadership Alliance) for organizing a wonderful event! YY12hashtag#psegproud",Not Transactions
"""Glenda McNeal has an exceptionally strong track record of spearheading critical partner agreements and navigating the complexity of large, global relationships to benefit both the company and our partners and she will continue to do so in this expanded role,"" said Steve Squeri, Chairman and CEO of American Express. hashtag#savoy hashtag#americanexpress",Not Transactions
Learn more about Logitechs Q4 and full Fiscal Year 2024 results in our shareholder letter. https://lnkd.in/gfMUJTfu,Not Transactions
"I am thrilled to share that yesterday at the NCSL higher education task force summit in Washington D.C., Secretary of Education Miguel Cardona gave a shout out to Idaho and highlighted the impressive collaboration between Micron and the College of Western Idaho. This partnership is crucial in training the workforce that will drive Micron's new $15 billion fabrication facility in Boise. It was a privilege to join Idaho Representative Wendy Horman at the summit and to have the opportunity to hear insights from Secretary Cardona. @wendyhorman Micron Technology",Not Transactions
"I am delighted to announce my next adventure!  After an incredible 5 year journey building out the Experience Design team for JP Morgan's Corporate & Investment Bank's Payments and Operations divisions, I am joining an absolutely stellar cast and crew at Chase Travel that is destined to change how you dream about, plan and experience your next trip!",Not Transactions
"I'm excited to announce that I have accepted a 2024 Summer Software Engineer Intern position within the Elevance Health Technology organization! I would like to thank Nivethitha Murugeson, Neelima Annam, Dominic Cussatt, Ankur Sehgal,  and Anil Bhatt for this incredible  opportunity. Looking forward to a summer of growth, knowledge, and experience through this internship!hashtag#ELVTechIntern hashtag#ElevanceHealthSummerIntern2024 hashtag#ElevanceHealth hashtag#ELVTech",Not Transactions
"Longest winning streak for any professional sport. Ever. Did you know he was forbidden to play squash as a child?6 times World champion, 10x British Open winner, Jahangir Khan is the greatest of all time. 555 matches "" no losses.Last night, I had the honor to meet the champion. I was amazed by his story of overcoming adversity through sheer passion, disciplined execution, and belief in purpose.He was born with medical conditions that held him back, but he never gave up. Training relentlessly for 8+ hours straight every day, with a single-minded focus on performance and perfection, Jahangir was destined to make history. His journey from being forbidden to play squash as a child to becoming the undefeated champion speaks volumes about resilience.His legacy extends beyond the squash court, and it's a testament to the power of perseverance and unwavering commitment. An incredibly inspiring story.hashtag#squash hashtag#goat hashtag#JahangirKhan",Not Transactions
Exceptional leader with extensive health operations experience. Margaret Downs should be top of any healthcare organizations list to hire.,Not Transactions
"Calling all architects!  If you know me, you know how I roll!  Lots of opportunities to make a real difference here at Ulta Beauty!",Not Transactions
"It's Customer Service Appreciation Week! In celebration, we're putting the spotlight on our amazing Customer Service team. We asked each of them what they love most about interacting with our customers. See below to read their answers!",Not Transactions
"Yesterday we reported our first-quarter 2024 results and raised our revenue and earnings expectations for the full year. 

- We achieved record Q1 revenue and record Q1 cash flow. 
- Our non-GAAP earnings per share grew 27% to $2.81.
- Our revenue grew 10% to $2.4 billion and our ending backlog grew to a record $14.4 billion. 
- S&P and Fitch upgraded our credit rating to BBB, reflecting the strength of our business and balance sheet. 

These strong results reflect the need-to-have nature of our technologies and were very well-positioned for continued growth. I'm proud to be a part of this team, tirelessly committed to solving for safer communities, safer schools and safer businesses in all that we do every day.",Not Transactions
"The impact of my time at Truist has transformed my life in numerous and positive ways, both on a personal and professional level. The memories I have at Truist are filled with immense happiness and I was fortunate to work with some who I will forever respect and am honored to call them friends. It has been an absolute joy to collaborate with such skilled and committed teammates, and I am deeply grateful for the growth, obstacles overcome, and accomplishments achieved during my tenure.As the new year arrived, I am looking ahead to the next chapter in my career and am thrilled to announce I have joined JPMorgan Chase & Co. as Chase's Head of Payments Technology. The ability to join a winning organization with such amazing leaders, employees and technologists brings tremendous respect and honor. I look forward to my future with JPMorgan Chase, the best is yet to come!",Not Transactions
"We're extremely proud to share that Eric Appel is the hashtag#GTMAwards Startup CRO of the Year. Yi Yi Yi Cheers to you, Eric! We're beyond grateful for your hashtag#leadership and vision at Island.Thank you to Pavilion and G2 for this recognition, and a special thank you to our team, customers, partners, colleagues, and friends who voted.",Not Transactions
"Now for an unexpected surprise, this is a very nice one.... happy, honored, and humbled to have been selected as a Senior Member of the National Academy of Inventors. (although, comes to mind, the term ""senior"" may be both flattering and perhaps not so much...)https://lnkd.in/ePZY5R7z",Not Transactions
"After a whirlwind tour of Krispy Kreme UK & IRE, Krispy Kreme Australia & New Zealand, Krispy Kreme Mexico, and Krispy Kreme US, I can safely say that I have the sweetest job in the world YY. Just 34 more countries (and counting) in which to meet our amazing team members and sample the most joyful treats!",Not Transactions
"Wrapped up an amazing event for Sunbelt Rentals, Inc., our team is delighted to have been part of such an incredible project! Amazing work to all those involved, we are proud to have such an incredible team!
 
#ImpactXM #greenteam #SunbeltRentals #POWERHOUSE24 #WINTHEDAY #ANYTOWN #WelcomeToAnytown #GeneralSession #IXMCulture",Not Transactions
"We wrapped up our banking conversion with the release of our awesome new national brand. 

Welcome to Flagstar. Were so glad to have you with us!",Not Transactions
"I'm excited to exhibit at  HIMSS24 in Orlando on March 11-15 to connect with friends and colleagues, old and new. Join me and be sure to stop by the Augmedix booth #4370! HIMSS Global Health Conference & Exhibition",Not Transactions
"This month, 30 PG&E coworkers from Electric Operations graduated from our inaugural ""Leading at PG&E"" program, a 10-day training intensive focused on growing leadership skills. I had the honor to close the graduation with some words of advice: ""Continue your learning journey, acquire new experiences and protect your character because they will define your legacy as a leader"".Leaders design the culture of the organization by modeling the right behaviors of civility, trust and respect.Congrats, lead graduates! I can't wait to see what you do next at PG&E and life. hashtag#leadershipdevelopment",Not Transactions
"Last week I reviewed more than 100 resumes for an opening we are working to fill. Here are some thoughts:1. Candidates have about one minute to make an impression with their resumes. Resumes should be clean, not cluttered.2. Tell me a story - your story! It's hard to tell a story with just bullet points. Give a short but sharp narrative - stay away from jargon.3. If you make a positive impression, know that I'm going straight to your LinkedIn profile. How are you presenting yourself on LinkedIn? Are you active? What are other people saying about you?",Not Transactions
"Neela Montgomery Appointed as New CEO of Orveon Global""Neela is a highly accomplished leader in high-growth, vibrant consumer businesses and we are thrilled to welcome her as CEO of Orveon."" - Tricia Glynn, Chair of the Board at Orveon and Managing Partner at Advent International""I see immense opportunity to continue developing the platform's capabilities while nurturing the success of bareMinerals, BUXOM, and Laura Mercier."" - Neela Montgomery, Incoming CEO at Orveon Globalhashtag#leadership hashtag#beauty hashtag#SoRNewsRead our take and check out the key highlights Y",Not Transactions
Great night celebrating the 40 under Forty within Boulder and Northern Colorado! Congratulations to all the honorees! #BW40UnderForty,Not Transactions
To the distinguished D9  community - keep loving on your neos. We need them and they need us. #service #sisterhood.,Not Transactions
#acrm2023 went so fast! An amazing week of educational content and networking and seeing old friends! Looking forward to #ACRM2024!,Not Transactions
Im happy to share that Im starting a new position as Vice President Plant Operations at Polaris Inc.!,Not Transactions
"Kicking the new year off with some a  personal news a  : after an exciting 2.5 years, I'm moving on from Thallo.Big thanks to Joseph Hargreaves, Ryan Gledhill and Adam Dry for being my first official founding team - it's been an honor. Seems like a good moment to put our *then-and-now* founding team photos into the public domain...And to the rest of the Thallovians (past and present), thank you for your trust and all your incredible contributions. Special shoutout to Nicolas Alexander, Scott Gledhill, Kobi Omenaka, Avi S., Nathalie Beken and Ivar Wiersma.So what's my next adventure? As they say: ""watch this space"" for updates. Y Y Thank you to fellow Thallovians: Callum Barry Brandon Olga B. Ivan Djukic Vitalii K. Simonas J. Emma Bennett Contessa Cooper Dmytro Chupryna Saudamini Sharma Tasveera Ladha Sakshi Arora Mariana Zanetti Fonseca Olga Grinina Kiren Shunmugham",Not Transactions
"Today was the grand opening of Boomis new office in Conshohocken! I couldnt be prouder of #TeamBoomis hard work and dedication. This space embodies our commitment to innovation and growth. 

Thank you to Mayor Yaniv Aronson, Tiffany Wilson from the office of Senator Hughes, Dean Miller from Philadelphia Alliance for Capital and Technologies (PACT), and Allyson Dezii from The Chamber of Commerce for Greater Philadelphia for attending our ribbon cutting ceremony, we are thrilled to call Conshohocken Boomis new home. 

Im also REALLY excited about the barista ",Not Transactions
"Vulnerable post 

I was having a blah kinda week. You know one of those weeks where you feel like you're running in a hamster wheel. Well my phenomenal staff at our Collins-Westside location decided to love on me today to show their appreciation during a pivotal time for us all, and ya'll they made me cry. 

A good cry though, one of gratitude. 
As a leader you don't always get it right, but every great leader surrounds themselves with great people, leads with good intentions, cultivates genuine relationships, and stays humble enough to pivot for the greater good. 

This Collins-Westside team, Ebony N. S. and I opened the 1st Walmart Health in the State of Florida, and Suzette Quaintance took the reigns and carried on our reputation of being the ""A"" Team, and boy do I love this team. This was just a handfull of them today, as we are winding down our operations across the enterprise. 

As we approach our final month of delivering care to our communities, what I will miss the most at Walmart Health, are the people. These people believed in our mission, they lived it, they executed it, and they did an amazing job! 

If I could sum up my Walmart Health experience in one word, it would simply be ""PROUD"". 

PROUD of our people
PROUD of our work
PROUD of our imprint
PROUD of our impact
PROUD of the seeds we have planted, that we hope to see grow. 

PROUD, is honestly an understatement, but... it will do for now. 


Grateful, Thankful, and Blessed. ",Not Transactions
Can you confidently say you're allocating your marketing budgets effectively? Mode can help your team determine the impact of various channels and touch points on customer conversions az learn how to optimize performance in Snowflake - all in one place.ai  Check out our course in the the Snowflake Data Cloud Academy Bootcamp: https://lnkd.in/eVkaP4eh ]hashtag#SnowBIBootcamp hashtag#BI hashtag#Analytics,Not Transactions
"The Houston Community College Board of Trustees named Margaret Ford Fisher, Ed.D., as the institution's new chancellor on Jan. 24. She had served as HCC's Interim Chancellor since Sept. 1, 2023.READ MORE: https://lnkd.in/g8gfzecr",Not Transactions
The Growing Private-Sector Involvement in Canadian Public Health Care Systems https://buff.ly/3vKYXwB,Not Transactions
"Do your employees connect with your company's purpose? Maybe, maybe not. According to a recent MIT Sloan study, 72 percent of people want to work for an organization with a purpose they believe in. At Schneider Electric, the number one engagement factor I have and hear from my team members and colleagues is their connection to our purpose, #lifeison. https://lnkd.in/etiU6KJC

And yet, sometimes, it can be hard to understand how your day-to-day job is contributing to the greater cause. As leaders, it's our responsibility to help our employees make that connection and embrace it at a personal level. 

But how do we do that? Here are a few suggestions on how to create a passionate and purposeful team: 

1) Offer Connections: Create a space for safe and open dialogue -- ask how they feel they are contributing to the company's purpose. And if they are struggling to see the connection, offer your own thoughts on how their work is helping to serve the greater good. 

2) Encourage Involvement: Recognize that everyone has their own passions. Provide time and support for employees to participate in employee resource and special interest groups, as well as company-sponsored volunteering and charitable initiatives. Doing so gives employees a greater sense of personal connection to the company, and offers them an opportunity to learn and grow as humans  something thats good for them and good for your business!

3) Celebrate Impact: Acknowledge and celebrate the contributions employees make to your purpose, small or large. Every action counts. And recognizing individuals fosters a people-first work culture, where employees feel valued, seen, and heard.

When individuals and corporations find common ground in purpose, the impact is profound. Let's be leaders who champion this connection. 

How are you fostering the power of purpose in your teams?

#PowerofPurpose #Leadership #EmployeeEngagement #SocialImpact #lifeison",Not Transactions
" and that's a wrap Four fantastic days in Amsterdam meeting our incredibly talented Basware colleagues, setting out our PS strategy for the year and really setting us up to drive customer value.#PSBootcamp #BaswarePS #BaswareAuditRecoveryServices",Not Transactions
"One of the most important jobs of a product manager is guiding the team through decisions. Hearing disagreement and getting commitment.However, decision-making is an often underappreciated skill.Steve Jobs once said about product decision-making, ""People think focus means saying yes to the thing you've got to focus on. It means saying no to the hundred other good ideas that there are. You have to pick carefully.""Check out the video below for insights on how to make solid strategic choices. Y hashtag#productmanagement https://lnkd.in/gBEhSZ4M",Not Transactions
"Hola, Espaa!   We've arrived in Madrid!https://buff.ly/3TJJoxq",Not Transactions
"hashtag#TeamDataminr thanks Nicky de la Cruz, our Senior Director of Accounting and Amigos@Dataminr ERG leader for his meaningful contribution to our organization's culture. Learn why he took on the ERG leadership role Yhashtag#DEI hashtag#leadership hashtag#diversity",Not Transactions
"We're honored to share that we've been named by Forbes as one of America's Best-in-State Wealth Management Teams for 2024, ranking #4 in the state of Illinois. Thank you for the trust you have placed with our team. We remain committed to managing our client's financial lives so they can focus on areas of their life that bring them joy, meaning and purpose. [Source: Forbes.com (Awarded Jan 2024)  Data compiled by SHOOK Research LLC based for the period from 3/31/22""3/31/23. (https://lnkd.in/exXdw9ib)] https://lnkd.in/eGY8xFqZ """,Not Transactions
"No matter the outcomes you're driving or the framework you're using, you need to assess your maturity level to figure out the path forward. Learn how.",Not Transactions
"Today is International Women's Day YaYsIn Beijing, the Power Systems and Services team joined together for a great opportunity to highlight hashtag#InspireInclusion- a theme that calls us to break down barriers, challenge stereotypes, and create environments where women are valued and respected.  I am proud to work at Schneider Electric where inclusion, diversity, equal learning opportunities, focus on STEM roles and more are recognized to achieve our sustainable goals.On hashtag#IWD2024, here is a great video by SE & Plan International on how empowering women in West Africa with fundamental electrical skills opened doors to new opportunities and economic independence. https://lnkd.in/gEajVVzJ We commit to hashtag#InspireInclusion today and every day. Happy International Women's Day! hashtag#InternationalWomensDay hashtag#LifeisON",Not Transactions
Hey Michael C. Thanks Again for the Nutanix refresher course today - I really like how you broke it down into 18 unique segments - Brilliant! Happy Holidays Y'all hashtag#happyholidays,Not Transactions
"Yesterday, we were honored to perform the Maile Lei Untying Ceremony with Hawaiian Electric for our Kapolei Energy Storage facility in West Oahu.  Community engagement and safety are paramount to us at Plus Power, and we were grateful for the participation of many state and local officials and community stakeholders to help us celebrate.This 185 MW / 565 MWh facility, relying on 158 Tesla Megapack 2's, is the largest demonstration in the world of grid-forming services from a standalone battery storage facility. It is committed to provide 50 MW of Fast Frequency Response, virtual inertia, and blackstart services akin to a conventional power plant""but in 250 milliseconds and without emissions or need of water. We are thrilled to work with  Hawaiian Electric on this landmark facility that will help hashtag#Hawaii meet its goal of 100% renewable energy by 2045.  This groundbreaking project is a postcard from the future: Batteries will soon be providing these services, at scale, on the mainland. Representing approximately 17% of Oahu's peak load, KES will be operated by Hawaiian Electric to help balance the  island's  power  grid, enabling the continued growth of both rooftop solar and utility-scale renewable energy. Left to right are Kahu Kordell Kekoa, Hawaii State Energy Office Chief Energy Officer Mark Glick, Hawaii Public Utilities Commission Chair Leo Asuncion, Tesla SVP Drew Baglino, Plus Power Executive Chairman and CEO Brandon J Keefe, Hawaiian Electric Company President and CEO Shelee Kimura, Plus Power Executive Vice Chairman and Chief Commercial Officer Robert Rudd, Campbell Properties President Steve Kelly, Plus Power Executive Vice Chairman and President Alex Fraenkel, and Plus Power Regional Director Project Development (West) Scott Schalich.  Aloha!hashtag#batterystorage hashtag#cleanenergytransition",Not Transactions
Please join us in congratulating Mandy Meadows on joining PepsiCo as Associate Director of Digital Marketinghashtag#digitaladvertising hashtag#commercemedia,Not Transactions
