postContent,themes
Further validation that Basware is going places. This alliance with Deloitte will help to expand our reach and scale our growth. Exciting times!,Transactions
"Yesterday it was rumored to be $500M. Wow! I also heard Palo Alto Networks made an offer to Lacework for $300M. Lacework once was the darling of Cloud Security, raised over a billion dollars -- a boat load of money, and still has ~$100M ARR, is being acquired for 2 to 3x ARR. The reckoning is real!The late-stage investors of Lacework are not having a good week.",Transactions
"Had an incredible experience discussing the latest healthcare trends and policies with my University of Tennessee Healthcare Leadership cohort in Washington DC. We dove deep into topics ranging from cyber security and M&A to AI, telehealth, mental health, and Medicare/Medicaid reimbursement. The highlight of the experience was collaborating with a group of highly knowledgeable professionals. #healthcare #leadership #strategy Lawrence Martin Greg Linton Byron Goad, BS-RRT James Moore  M.D., Ph.D Janessa Sokol, MSML, CPXP Jim Rosenberg Edward Prufer Gregory Bruno, DNP, CRNA Kelsey Melin Lea Barnes, BSN, RN Mercedes Armstrong Dana Morales Hurst Riley R.",Transactions
"#RevOps should roll to the CFO. 

Whoops, did I really just say that out loud? 

Here's the thing: 

RevOps is a long-term play. 

We are the Product Managers of the Revenue Engine. 

Chasing tons of short-term priorities will not lead to the best result.

And also: I've been a CRO twice. 

And maybe I was bad at my job, but my focus was this quarter. Always. 

The truth is, CFOs are the long-term folks.

Their horizon is Exit/IPO.

While they might lack some commercial skills, they are better positioned to give RevOps the room to execute for the long term. 

---

P.S. follow me here for wisdom on #RevOps and #GTM or join my Substack here: https://lnkd.in/ed42zW42",Transactions
"#RevOps should roll to the CFO. 

Whoops, did I really just say that out loud? 

Here's the thing: 

RevOps is a long-term play. 

We are the Product Managers of the Revenue Engine. 

Chasing tons of short-term priorities will not lead to the best result.

And also: I've been a CRO twice. 

And maybe I was bad at my job, but my focus was this quarter. Always. 

The truth is, CFOs are the long-term folks.

Their horizon is Exit/IPO.

While they might lack some commercial skills, they are better positioned to give RevOps the room to execute for the long term. 

---

P.S. follow me here for wisdom on #RevOps and #GTM or join my Substack here: https://lnkd.in/ed42zW42",Transactions
" Exciting news! Parloa just announced a $66m Series B led by Altimeter to scale their conversational AI platform for customer service. 

Read more about this :

https://lnkd.in/eabN_N49

https://lnkd.in/eEbJBwfH

 cc Doreen Huber Pierrick Cudonnec Julien Hobeika EQT Ventures",Transactions
"What does it mean for a PE-backed business to be ""exit-ready?"" A few years ago, we decided to answer this question ourselves, using the actual questions other investors ask us during diligence.

The big takeaway? 

""If you stay ready, you don't have to get ready.""

A few of the other themes Jim and I uncovered during our ""think like a buyer"" exit-readiness workshop in the clip below. ",Transactions
"TechCrunch: Conversational AI platform Parloa has nabbed $66 million in a Series B round of funding, a year after the German startup raised $21 million from a swathe of European investors to propel its international growth.

Aside form lead investor Altimeter, Parloas Series B round included cash injections from EQT Ventures, Newion, Senovo, Mosaic Ventures and La Familia Growth. Todays funding brings Parloas total capital raised to-date to $98 million, following its $21 million Series A funding round led by EQT Ventures in 2023.

Parloa is well-positioned to capitalize on the AI with everything hype that has hit fever pitch these past couple of years, as companies seek new ways to improve efficiency through automation.

Founded out of Germany in 2018, Parloa has already secured high-profile customers such as European insurance giant Swiss Life and sporting goods retailer Decathlon, which use the Parloa platform to automate customer communications including emails and instant messaging.

However, voice is where co-founder and CEO Malte Kosub reckons Parloa stands out.

Our strategy has always been centered around voice first, the most critical and impactful facet of the customer experience, Kosub told TechCrunch over email. As a result, Parloas AI-based voice conversations sound more human than any other solution.

https://lnkd.in/dN25ddHk",Transactions
JC2 Ventures-backed Rubrik has gone public! Congrats to CEO Bipul Sinha and the whole team on their IPO  one of the most anticipated tech listings of the year so far. Rubrik is redefining how organizations secure their data from cyber threats with technology that is disrupting the industry. Ive long been a believer in Bipuls mission to secure the worlds data and this milestone will allow Rubrik to drive even more impact for their customers globally. #RubrikIPO,Transactions
Congrats to the fine folks at Rubrik and the amazing Anneka Gupta on their hugely successful IPO today!  Setting the bar high!,Transactions
"Could not agree more. Value Creations role needs to be focused and results oriented throughout the Portco lifecycle. Too often I see the involvement focused only on the new Portcos and not getting Portcos positioned to capitalize at the finish line.

Great video Paul Stansik",Transactions
Fulton Bank is continuing to grow across the region! Fulton Bank completes Republic Bank transaction. Check out our press release: https://ow.ly/MJJS50RpHio #FultonBank #FultonFinancial,Transactions
This acquisition represents a significant step in Fultons strategic growth. A heartfelt welcome to our new customers and colleagues. #fultonproud #fultonemployee,Transactions
"Always fun catching the boss Jon Gray on camera. This time following our successful first quarter earnings call. For a snappy summary of the highlights, watch below.",Transactions
Great insights from Blackstone Global Co-Head of Real Estate Kathleen McCarthy Baldwin McCarthy. She discusses where we are seeing opportunities in real estate to deploy $65B of dry powder including #datacenters and #rentalhousing.,Transactions
"Fishing for the next great #investment solution? Theres a whole world out there.... 
 
Nearly 90% of companies are privately owned. For years, the most successful institutions have been investing in private markets to grow their portfolios. Today, individual investors can access the same opportunity. So, if your clients are looking for a world of expanding possibility, start building wealth with #privatemarkets. Learn how: https://bit.ly/4dg0P1w",Transactions
"Great news about Honour Capital and the new Honour Ag in today's Monitor. Read it here: https://lnkd.in/ddUp_GQJ

#agfinance #agriculturefinance #inputfinance #agindustry #equipmentfinance #fleetfinance #farming #agriculture

Be sure to follow Honour Ag on LinkedIn! https://lnkd.in/dUyBBV3d

Brian Slipka - Shea Huston - Jason Kleinprintz - Craig Ault - Sarah Zeiher - John Gauger - Ben Utecht - Mason Bloomquist - Kelly Bomier - Benjamin Burch - Ryan Calvert - James Carroll - Erik Harke - Rob Haynes - Russell Johnston - Nicole Magandy - Brent McQueen - Tim Olson - Alex Ondercin - Shannon O'Toole - Steve Pietrowski - Ryan Post - Ariel Waldoch",Transactions
"The Riverside Company announced that its affiliate has signed a definitive agreement to acquire The Townsend Group from Aon plc a leading global professional services firm.

https://lnkd.in/gEbwKJtr",Transactions
" Im excited to announce what weve been working on for the last few months: the creation of Yuna, an AI and storytelling startup, and our $1.6 million dollar pre-seed round  

So whats the story? 

The sobering reality is that the magic of reading books is slowly being replaced by other forms of media. Each successive generation is enjoying fewer of the well known benefits that come with getting lost in a wonderful book (cognitive development, creativity, empathy, to name but a few).

What if we could reverse this trend? What if we could find a way to make reading just as engaging as watching Netflix, and eventually the 1st entertainment choice for children?

And so we wrote Yuna into existence. By combining AI with the enchantment of human creativity, Yuna writes books that are so personalised and interactive that they can be as engaging as any modern media platforms. Leveraging AI to empower writers, illustrators and publishers, Yuna imagines new forms of storytelling:

 Imagine a book that every night writes the next chapter of a personalised adventure involving you, your daughter and dog, weaving your familys interests into the narrative.

 Imagine a book that invites your niece to enter Hogwarts as a 1st year student and experience their own unique story through the wizarding world.

 Imagine a book that helps you discuss difficult topics with your son but in the form of an imaginary tale with him and his favourite character Snoopy. 

Over time, we hope to make these dreams come true, all with a singular goal: to ensure that children build a healthy reading habit for life.

Thanks to the hard work of the incredible Yuna team, weve been testing early versions of these ideas. Over the past 5 months, Yuna has written 100,000+ unique stories to 20,000 monthly active users. And we are growing fast - we expect to write the next 100,000 books within a few weeks of this announcement. Thank you Yuna team - you are truly epic.

A massive thank you to the partners involved in our $1.6M pre-seed round: Canary who led and who have been incredible every day since (special shoutout to Florian Hagenbuch who has been a believer and mentor from day -1); The Positive Ventures team and angel investors who followed the round and recognised Yunas potential to make a positive impact on the world (thank you especially to Fabio Kestenbaum!). Finally - Taahir Munshi, Pedro Sonego de Oliveira, Flora Oliveira, Fabian Wikstrom and Carolina Guimaraes, who played pivotal roles in turning Yuna from distant dream to reality during those early days. 

Now what?

Today, we are launching our beta test product in Brazil in Portuguese. If you are in Brazil, please give it a shot (see link in comments). If you are not, Yuna isnt available to test just yet, but fear not! Yuna is bringing its vision to the  very soon. 

Want to learn more about Yuna? Check out the amazing articles by EXAME, Pequenas Empresas & Grandes Negocios and Startups in the comments below.",Transactions
"I'm thrilled to announce that I have joined Clearlake Capital Group as O.P.S. Managing Director, Human Capital.

The opportunity at Clearlake is especially compelling as it allows me to build a human capital practice for portfolio companies from the ground up, alongside an outstanding team who are eager to help me succeed. I am particularly thankful for the trust that Behdad Eghbali, Jose E. Feliciano, Prashant Mehrotra, Arta Tabaee, James Pade, and Colin Leonard have put in me, and I know that we will achieve great success together.

Clearlake is an investment firm operating integrated businesses across private equity, credit, and other related strategies. Clearlake's core target sectors are technology, industrials, and consumer, all areas I am intimately familiar with from my recent role at Advent International. Clearlake has over $75 billion of assets under management and I'm excited about its growth prospects, and the chance to help build a comprehensive portfolio management practice.
I am coming into this new opportunity informed and energized by my past experiences during the early years at a16z, the hyper-scaling years at Softbank, and my recent tenure with the fantastic team at Advent International. I am eager to work closely with my new team and leverage my expansive professional network in the U.S. and around the world.

Thank you to my amazing network - all of you - who have supported me on this journey. I particularly look forward to working with many of you in the coming years as we help scale, and grow Clearlakes portfolio companies.

Here's to an exciting new chapter!",Transactions
" We're Excited to Announce Our $50M Series B Funding! 

Learn more about our journey & where were headed  https://hubs.la/Q02wqnxn0.

Today marks a monumental milestone for Rad AI as we celebrate the successful closure of our Series B round. A heartfelt thank you to our new and continuing partners as well as investors who share our commitment to transforming radiology through cutting-edge technology.

 The Impact: Why This Matters
Since 2018, Rad AI has been pioneering generative AI in healthcare, introducing the first proprietary LLMs for commercial healthcare applications. Today, Rad AI is the most trusted GenAI platform for radiology workflow, used by over a third of US health systems and 9 of the 10 largest US radiology practices.

Our latest solution, Rad AI Reporting, builds on the success of Rad AI Omni Impressions to fully replace legacy voice recognition software. Rad AI Reporting supports all existing radiologist workflows and introduces new GenAI capabilities to simplify reporting, significantly reducing provider fatigue and burnout while improving productivity. Recently, it was named Best New Radiology Software by AuntMinnie.com, the best-known annual recognition in radiology.

Thank you to our incredible team, whose dedication and innovation has brought us here. The journey continues, and with this support, we are more equipped than ever to advance our mission to transform healthcare.

#RadAI #SeriesB #StartupFunding #TechStartup #HealthTech #RadiologyAI #GenAI #AIinHealthcare #Hiring",Transactions
"It's a big week for Rad AI with the announcement of our $50M Series B Funding round led by Khosla Ventures. 

As we celebrate this milestone and chart out course for the future, I can't help but reflect back to 2019 when Jeff Chang and Doktor Gurson were just getting started. Dr. Chang was a practicing radiologist at Greensboro Radiology and I was leading the sales team at Canopy Partners (a sister company). 

I remember joining Dr. Chang for one of his first sales meetings with our hometown health system Cone Health. We met with key execs, listened to their challenges, and asked probing questions about how #AI might be able to address some of these challenges. Dr. Chang took copious notes and, as we left the meeting, I asked him if he came away with any useful ideas for products. He did indeed and Cone Health ultimately became Rad AI's first health system client. 

I remember this like it was yesterday because I was so impressed with Dr. Chang's commitment to listening and developing innovative products designed to improve care delivery and solve customer challenges. That was 5 years ago and Rad AI has grown tremendously since then, but this customer-first approach is still in the DNA of our company today ... and I hope it always will be.

#TechCrunch #SeriesB #Startups #GenAI #Radiology",Transactions
"I am beyond grateful and humbled to share that Wiz has raised $1 billion at a $12 billion valuation, led by Andreessen Horowitz, Lightspeed Venture Partners, and Thrive Capital, and our amazing existing investors. 

This is so much more than a fantastic milestone. This is a testament to all the amazing people who helped us get here: customers, partners, investors, and most importantly as always, our incredible Wizards. 

At Wiz we know that raising venture capital does not guarantee success. Continuing to work hard, and focusing relentlessly on our customers is what matters most. 

Here is to more magic to come 

https://lnkd.in/ef5_BwVn",Transactions
We are excited to announce two acquisitions today -  APIIDAs federated API management business and the API management assets of Cloud Software Group. Boomi now empowers enterprises to rapidly and securely deliver business value through API products and in one end-to-end platform.,Transactions
"Interested in Bank-Fintech M&A?  

Our in-depth report examines the past 10 years of Bank-Fintech M&A and explores keys for unlocking successful combinations. Combining transaction analysis with expert insights from startup founders, bank corporate development executives, and fintech investment bankers, we provide a view of whats at stake. 

Read the full report here > https://owy.mn/4dEzHcI

Thanks to my Oliver Wyman co-authors Guillaume Lamey and Cathy Gao, and to all of the industry players who provided insight and feedback.",Transactions
"Invitation Homes is excited to announce that we have entered a joint venture with Quarterra Group, Centerbridge Partners, L.P., and other investors, acquiring a minority equity interest in a portfolio of single-family rental (SFR) homes that are part of the Upward America joint venture. In addition, Upward America has chosen our company to provide management services to 4,400 homes, largely located in Florida, Texas, and the Carolinas. #InvitationHomes #invh",Transactions
"In this morning's keynote speech we were pleased to announce new partnerships with cosine solutions and Zylinc which further extend the capabilities of 3E.

On-prem 3E customers using Cosine Matter Planning will be able to move seamlessly to the cloud with the combined solution intact, and new cloud customers will be able to integrate Cosine into their 3E solution as part of their implementation. 

In addition, a new partnership with passive time capture software provider Zylinc enables 3E cloud users to have seamless connectivity with Zylincs technology solution, which provides automatic and accurate capturing of incoming and outgoing phone calls across mobile phones and landlines.

Taken together, these partnerships provide the latest evidence of the flexibility, power, and potential of 3Es open SaaS platform.

Read more here: https://ow.ly/W1uy50RFTrn

#legalbusiness #legaltech #businessoperations #businesstech #3E #Cloud #SaaS",Transactions
"Breaking news! Were excited to announce a merger agreement with Exabeam.

Together, LogRhythm and Exabeam will accelerate innovation for AI-driven security operations for customers around the world and set new standards in cybersecurity. 

By uniting our strengths, we're enhancing our product offerings and revolutionizing the way you protect your organizations against cyberthreats. 

We look forward to meeting our future colleagues from Exabeam and building an awesome culture together.

We will continue to exceed expectations and lead the charge in delivering AI and automation for advanced threat detection, investigation, and response (TDIR). 

Our commitment to security teams is unwavering.

Read the press release: 
https://ow.ly/FfLa50RHcJN 

#LogRhythmAndExabeam #SecurityOperations #SIEM #UEBA #cybersecurity #AI #TDIR",Transactions
An amazing milestone for an amazing company. Proud to play a small part in Indegene's journey to its IPO.,Transactions
" : https://bit.ly/3JO572D

Detroit Voltage, a pioneering Black woman-owned electrical contracting firm based in Detroit, has achieved a significant milestone by securing a six-figure deal with DTE Energy, the largest electric utility company in Michigan. 

This deal not only signifies a momentous achievement for the company but also highlights the entrepreneurial spirit and resilience of its founder and CEO, Deana Neely.

Deana Neely, a licensed electrical contractor with over a decade of industry experience, has been instrumental in the company's success. Her journey into entrepreneurship was inspired by her observations of her ex-husband's...

Finish Reading  --> https://bit.ly/3JO572D",Transactions
When sleeping giants wake up...,Transactions
"Im just back from two amazing days at Recognize, an equity investment platform exclusively focused on the digital services industry. This included the exciting announcement of Recognizes first portfolio company exit. Torc, a next-generation AI-powered talent marketplace platform, was acquired by Randstad Digital, which provides clients with the high-quality, diverse and agile workforces needed to succeed in a talent scarce world. 
 
Day One was a semi-annual meeting of the Recognize CIO Advisory Council, a group of large-scale enterprise CIOs who come together to share challenges and opportunities with each other and with Recognizes managing partners. These CIOs learn about peer solutions and experiences, and the conversations also inform thought leadership around the digital services industry.
 
Day Two was the Recognize Annual General Meeting (AGM), the yearly meeting of limited partners/investors, portfolio company founders and operators, and Recognize leaders. We were treated to presentations regarding the firms investment philosophy and theses, investment themes and targets, portfolio company reviews, and the powerful process by which Recognize executes on investments. 
 
Im looking forward to and have already begun planning our next CIO Council Meeting in November.",Transactions
"PE - McKinsey on ""Bridging PE's value creation gap""


McKinsey on PE Value Creation:

- Today PE firms need to focus on operational value creation
- Start with operational due diligence before acquiring a company
- PE firms can improve performance with a team of operating experts who collaborate with portfolio companies 

(Source: McKinsey & Company, 2024 - Jose Luis Blanco Alvarez, William B., Matthew Maloney, & J. Jason Phillips)







------------------
#pe #privateequity #tech #ceo #cro #saas #gtm #growth #middlemarket #boardofdirectors #board #revenue #revenuegrowth #investing #investment #finance #business",Transactions
"Boomi has made two strategic aquisitions, boosting their AI and API capabilities to new heights! This move will enhance integration and automation solutions, empowering businesses to connect and innovate more efficiently.
",Transactions
"I'm excited to share the thrilling news: the hard work & rewarding outcomes on Tropicana Brands Group's separation from PepsiCo have been recognised by the MCA. The project has been shortlisted for the MCA 2024 finals of Change and Transformation in the Private Sector. 

It has been an incredible journey working with
Areeb Syed Jeff Lischett Kevin Smith Rebecca Williams James Bruce Eric Le Cerf Steve Turner Arnout Van Es Rogier Smeets and
Rob Warneck Sean Tickle Emma Burton Luke Cross Jannus Botha Supratim Guha Haris Nadeem Xindi Li Vivienne R. Andy Robson Jonathan Haiden Mohamed Talaat Metwally Jackson Baida Anna-Sofia Nissila who is also a finalist for the Young Consultant of Year award.

https://lnkd.in/e2YAm9at",Transactions
"Easy Metrics secured a $31M growth investment from Nexa Equity to accelerate our product development, expand organizational capacity, and pursue strategic acquisitions. Our future is bright, and we encourage you to read more about our CEOs vision, and what this investment means for our future.
https://lnkd.in/gJSc_fZA",Transactions
"Easy Metrics secured a $31M growth investment from Nexa Equity to accelerate our product development, expand organizational capacity, and pursue strategic acquisitions. Our future is bright, and we encourage you to read more about our CEOs vision, and what this investment means for our future.
https://lnkd.in/gJSc_fZA",Transactions
"I'm excited to announce the Databricks AI Fund, our second fund at Databricks Ventures!  Just as software ate the world, we believe AI is now eating software - and with the AI Fund, Databricks Ventures is ready to help a new set of founders and entrepreneurs build AI-first companies.

We're proud of our portfolio of 25+ investments and can't wait to see what's coming next.",Transactions
"I am excited to announce our latest strategic acquisition as we continue to expand our portfolio with highly differentiated, customizable solutions in fast-growing, high-margin segments within the functional coatings, adhesives, sealants and elastomer (CASE) industry. ND Industries, Inc.'s products are a natural fit with H.B. Fuller's existing market segment focus and bring new technology to our portfolio  resulting in a powerful advantage for our customers. Welcome to our new employees at ND Industries Inc. I look forward to our future as one team! #welcome #acquisitions #innovation #leadership",Transactions
"On Monday, we broke ground on facilities to support the new Amazon Web Services (AWS) facility, the largest economic investment in Mississippi's history. We're proud to be a partner in this historic $10 billion investment that will drive local job growth, create thriving communities and power the prosperity of the region.
 
Entergy looks forward to this next century of service in Mississippi alongside AWS and we're is excited to play a leading role in this historic, transformative investment for the entire region. Please join me in welcoming AWS to Mississippi! #WePowerLife",Transactions
"We have to define not only the need in climate, but the opportunity... Capital is going to be the feedstock of this revolution... and capital moves to opportunity.  TPG Co-Founder, Executive Chairman, and TPG Rise Climate Managing Partner Jim Coulter discussed the role private capital plays in the climate revolution during last weeks #QatarEconomicForum
 
Watch the full conversation here: https://lnkd.in/e4CJiXxw",Transactions
"Big News!

We are delighted to announce that we have added Enigma Creative Solutions to the team! We warmly welcome the talented group to the Impact XM family. This union enhances our ability to deliver cutting-edge and immersive experiences for our clients.

As we transition to this new chapter, stay tuned for more updates and innovative solutions!

#ImpactXM #EnigmaCreativeSolutions #GrowingTogether #InnovativeExperiences #WePutBrandsInFocus",Transactions
