postContent,themes
"Kicking the new year off with some a  personal news a  : after an exciting 2.5 years, I'm moving on from Thallo.Big thanks to Joseph Hargreaves, Ryan Gledhill and Adam Dry for being my first official founding team - it's been an honor. Seems like a good moment to put our *then-and-now* founding team photos into the public domain...And to the rest of the Thallovians (past and present), thank you for your trust and all your incredible contributions. Special shoutout to Nicolas Alexander, Scott Gledhill, Kobi Omenaka, Avi S., Nathalie Beken and Ivar Wiersma.So what's my next adventure? As they say: ""watch this space"" for updates. Y Y Thank you to fellow Thallovians: Callum Barry Brandon Olga B. Ivan Djukic Vitalii K. Simonas J. Emma Bennett Contessa Cooper Dmytro Chupryna Saudamini Sharma Tasveera Ladha Sakshi Arora Mariana Zanetti Fonseca Olga Grinina Kiren Shunmugham",Not Customer Centricity
"Today, Memorial Hermann Health System officially launched Epic with our first wave of users. Thanks to the efforts of over 2,000 team members and our partners at Epic, we're transforming the experience across our medical group, affiliated practices, clinics, pharmacies, and employer solutions with a transformed experience that will help improve the care we deliver to our patients.

This extensive, two-year journey has touched nearly every part of our organization, marking one of the most significant transformations in my career. I'm eager to see the positive changes as we settle into operational efficiency and our patients engage with new digital experiences.

Congratulations to everyone involved, especially Amanda Hammel and Rick Lyman, DSL, MBA for their pivotal roles in guiding this effort. #EPICTransition #DigitalInnovation #PatientExperience",Customer Centricity
,Customer Centricity
"Great to be back at school  Huge thanks to our friends Mary Callahan Erdoes, Kristin Kallergis Rowland and the entire JPMorgan Chase & Co. team for hosting Blackstone at their offices for an inaugural offsite Blackstone University. Our Private Wealth Solutions business has been hosting BXUs for over a decade in an effort to bring private markets education directly to advisors.",Not Customer Centricity
"This article is written by Lisa Schillaci, Vice President, Hospital Revenue Cycle Operations, about how we have created a more personalized and compassionate approach to collecting patient payments.",Customer Centricity
"While I love to report on the incredible growth and impact of our Experiential Learning Platform, I'm equally proud of the exceptional quality of our coffee.  From the state-of-the-art Saxbys Roastery in South Philadelphia, our team makes magic!  As such, I'm excited to share 2 amazing accomplishments:1.  Saxbys was just ranked #4 nationally in the USA TODAY's ""10 Best Coffee Companies"" AND2.   An exclusive array of our coffees are now being served in the beautiful American Express Centurion Lounge in the Philadelphia International Airport (PHL).  An incredible oasis in the middle of bustling PHL, our amazing coffees are now featured alongside a menu custom-created by world-renowned Chef Michael Solomonov",Customer Centricity
"Pleased to announce I have joined the Customer Centricity World Series as an official judge. For more information on submitting your case for the 5th anniversary edition visit https://lnkd.in/gtVadTEu

#CCWorldSeries #Customerexperience
#Employeeexperience",Customer Centricity
"The world has seen an extraordinary transformation in healthcare delivery, courtesy of the global pandemic. At Elevance Health, we are at the forefront of this change - witnessing a 3% YoY increase in virtual visits, topping 800k in 2023 alone!

Our recent study aimed to gauge consumers' perspectives on virtual healthcare. The results? A whopping 75% of consumers endorse virtual care, planning to continue and recommend these services. They appreciate the accessibility, earning an impressive 90% agreement that virtual care caters to those unable to physically visit a doctor, and 81% acknowledging the improvement in healthcare via integration of virtual care.

Inspired by these insightful findings, Elevance Health keeps evolving with a patient-centric approach, integrating care data, and optimizing virtual health interactions. With rising optimism and growing adoption rates, it's clear that we're only at the initial stage of a virtual care revolution.

https://lnkd.in/gfMN3Eba

Elevance Health
Fierce Healthcare

#VirtualHealthcare #HealthTech #PatientExperience #ElevanceHealth #HealthcareInnovation #Telehealth",Customer Centricity
"Exciting deal!  Can't wait to see how Mass General Brigham has redesigned the model of care to enable home services in the service lines mentioned - ""acute care model that enables patients with serious conditions such as COPD and heart disease to receive short-term, in-patient level care at home"".  It will also be interesting to see how the business model works.  Truck rolls are not cheap and this sounds like a primarily remote offering.  Homecare has proven business models in Hospice, Home Health, and Palliative care and it is exciting to see scaled expansions by trusted brands.",Not Customer Centricity
"I am thrilled to share that I have been recognized by Pinnacle Financial Partners and the Memphis Business Journal as one of the ""People on the Move"" for Women's History Month. I am truly grateful for this honor. As I reflect on this recognition, I am reminded of the quote, ""Don't work for recognition, but do work worthy of recognition."" This is a quote that I strive to live by every day. It is a reminder to focus on doing meaningful work that positively impacts those around me, rather than seeking external validation. I hope that this recognition inspires other women to pursue their passions and make a difference in their communities. Thank you again to Pinnacle Financial Partners and the Memphis Business Journal for this incredible recognition.",Not Customer Centricity
I'm happy to share that I'm starting a new position as Vice President of Transformation at Health Alliance Plan!,Not Customer Centricity
"I'm excited to connect with colleagues and industry peers to discuss the potential of Artificial Intelligence (AI) in healthcare and other industries. AI has the ability to revolutionize patient outcomes, increase productivity, and bring life-saving treatments to the market faster. How is your organization utilizing AI to solve problems and better the future of healthcare. hashtag#AIinHealthcare hashtag#HealthcareRevolution hashtag#PatientOutcomes hashtag#Productivity hashtag#GBIImpact",Customer Centricity
"Thrilled to share that today marks the momentous launch of Kiehls on Amazon. 

This launch marks the shared commitment and mutual ambition to elevate Kiehls presence on Amazon and offer a new level of convenience and accessibility to our customers. We cant wait to embark on this journey and create an enhanced shopping experience for Kiehls enthusiasts!

https://lnkd.in/eGtwYtGf

https://lnkd.in/eEKYHS_q",Customer Centricity
"Angela Snyder, our Chief Banking Officer, discusses how Fulton Bank is using the latest trends in the banking industry to serve our customers better. Read her thoughts on technology, AI, and interest rates in her conversation with Lehigh Valley Business: https://lnkd.in/gfxMztYq",Customer Centricity
UBC is at the forefront of finding creative ways to put #patientsfirst!,Customer Centricity
"I had the opportunity to talk about Verizon Business, what we are doing with SMBs, and a broader look at the industry. 

We are working tirelessly in our local markets daily to support millions of small businesses across the country. Whether through connectivity, solutions, and technology or our Verizon Small Business Digital Ready platform...we are champions of the entire small business community. 

A big thank you to Bloomberg, Bloomberg Businessweek, Carol Massar, and Tim Stenovec for the interview.

Listen to the interview below: 
https://lnkd.in/esq2GkM2

#SMBs #VerizonSMB #VerizonBusiness #SmallBusiness",Customer Centricity
"This article is written by Trent Fulin, SVP and Chief Executive Officer, Houston Methodist Cypress Hospital, about the future bets for our smart hospital.",Customer Centricity
"A few years ago, while getting ready for bed on a Thanksgiving night, my father fell and fractured his hip. I drove to meet him in the emergency room, where the young woman at the front desk looked up at me and said, blandly, You must be here to see Room 4. I was actually there to see my dad, but resisted the opportunity to make that a teachable moment and headed to room 4. When I walked in, the nurse was standing with her hand on my dads shoulder. She greeted me warmly and started sharing what a cool guy my father is, that he must be in a lot of pain but has been joking and making her laugh, that hes been telling her about being with the family for Thanksgiving and even about my work in healthcare.

The Glasgow Consensus Statement  published last week and available at https://lnkd.in/ebr7dJXu  focuses on reinforcing the humanity in healthcare. The primary overarching task is to Connect as Humans. Thats the difference between room 4 and what a cool guy. Human connection is essential, not extra. And it benefits patients, families, and health professionals  I hope we can all rally around that.",Customer Centricity
"I'm passionate about the idea that AI should play a role in improving health and patient outcomes "" that's why I founded Health Data Analytics Institute (HDAI). We knew that data had to be simple and actionable to actually be useful. Our HealthVisiona product converts hundreds of pages of complex data into a single page that tells providers what they need to know about a patient. It was a pleasure to present our story at hashtag#HLTH2023. Thank you to Roberta Schwartz and the Houston Methodist team for sharing both the stage and vision for AI's role in healthcare with us.",Customer Centricity
"Bingham & Taylor is thrilled to cheer on Stephanie Roble and Maggie Shea as they navigate the challenging seas of Olympic trials. Currently leading their trials and showing true grit in the face of adversity, their journey is a testament to resilience, strategy, and teamwork.As proud sponsors, we're committed to supporting their path to Olympic glory, alongside the broader US Sailing team. With strategic planning and targeted support, we're all in on making waves towards success Y YSJoin us in rooting for Team USA's sailing stars as they sail towards the Olympics a hashtag#TeamUSA hashtag#OlympicDreams hashtag#SailingSuccess hashtag#BinghamTaylor",Not Customer Centricity
"Life update! Taking some time to focus on the most important role Ill ever do- being a momma  Hank Spencer and I were blessed with our first baby, LaVada, in May.

Im intentionally going into this without a time frame, however please continue to think of me and reach out with any contract/free lance project management roles in 6-12 months.

Thankful for you all!
Caroline",Not Customer Centricity
Can you confidently say you're allocating your marketing budgets effectively? Mode can help your team determine the impact of various channels and touch points on customer conversions az learn how to optimize performance in Snowflake - all in one place.ai  Check out our course in the the Snowflake Data Cloud Academy Bootcamp: https://lnkd.in/eVkaP4eh ]hashtag#SnowBIBootcamp hashtag#BI hashtag#Analytics,Not Customer Centricity
Attending UKG Aspire 2023 hashtag#ukgaspire,Not Customer Centricity
"Y We are delighted to present our list of the top 50 customer experience influencers to follow in 2024 YThis year's list features trailblazers from across the globe and from many different industries who are revolutionizing CX and inspiring future leaders. Discover who is on the list and why we chose them here: https://lnkd.in/enw6ddS2hashtag#Top50CX hashtag#CustomerExperience hashtag#Influencers2024 hashtag#CXLeadership hashtag#CXAnkesh Agarwal Sudhir Agarwal David Armano Natalia GA3mez Barrera Raluca Berchiu Jeanne Bliss Rebecca Brown Tiffani Bova Caroline Carruthers Rajat Chawla Banu Cinar P M IDM Amanda Cromhout Hussein M. Dajani - CCXP Michael Dart - Chief Customer Officer, Energy Queensland Vaishali Dialani Tom DeWitt, Ph.D.Annette Franz, CCXP Ian Golding Bruno GuimarAes Musa Hanhan, CCXP Smitha Hemmigae",Not Customer Centricity
"Hello 2024! The beginning of a new year is a great moment to reflect on the previous year and focus on goals and opportunities for the upcoming year, so I want to share three priorities for technology, digital and innovation across  Optum  and  UnitedHealth Group  in #2024: 1.              Improve outcomes and operations at scale through the secure and responsible use of data and hashtag#GenAI 2.              Empower our consumers and customers with beautiful intuitive seamless digital tools, capabilities and experiences 3.              Continue to deliver quality solutions with speed to advance our mission to help people live healthier lives and make the health system work better for everyoneAs part of this I know our passionate digital, technology, data and AI teams & partners are going to empower themselves to be more. More zero distance to our consumers, More agile,   More learning, More of themselves,I'm so so very excited to see what our incredible team will accomplish in the year ahead! What goals have you set for this year? hashtag#LetsGohashtag#BeMoreofYourselfhashtag#OptumTechhashtag#OptumAIhashtag#unitedhealthgroup",Customer Centricity
"In the world of rare disease research, innovative development with real-world solutions is key. Are you incorporating the latest patient-centric study design strategies into your rare disease research? Download our comprehensive white paper to learn about optimizing RWD for patient identification, recruitment and retention along with using RWE to demonstrate value in regulatory decision-making: https://hubs.ly/Q023yDht0hashtag#PatientsFirst hashtag#RWE hashtag#RealWorldEvidence hashtag#RWD hashtag#RareDisase hashtag#RareDiseaseStudy",Customer Centricity
"Last week I joined Carol Massar and Romaine Bostick, CFA on Bloomberg TV at #MIGlobal. We discussed where Blackstone is seeing investment opportunities. We also spoke about Blackstone Career Pathways, the firms signature hiring program aimed to broaden the talent networks from which our portfolio companies recruit. Most importantly, I was thrilled to hear Romaine is a loyal customer of Rover.com  one of our most recent investments. Thanks for having me on the show!",Not Customer Centricity
"Today is International Women's Day YaYsIn Beijing, the Power Systems and Services team joined together for a great opportunity to highlight hashtag#InspireInclusion- a theme that calls us to break down barriers, challenge stereotypes, and create environments where women are valued and respected.  I am proud to work at Schneider Electric where inclusion, diversity, equal learning opportunities, focus on STEM roles and more are recognized to achieve our sustainable goals.On hashtag#IWD2024, here is a great video by SE & Plan International on how empowering women in West Africa with fundamental electrical skills opened doors to new opportunities and economic independence. https://lnkd.in/gEajVVzJ We commit to hashtag#InspireInclusion today and every day. Happy International Women's Day! hashtag#InternationalWomensDay hashtag#LifeisON",Not Customer Centricity
Rare disease research brings hope for a better life to patients and caregivers. Is your clinical study set up for success? Download our rare disease white paper series to learn how to optimize your integrated evidence generation strategy and incorporate the latest patient-centric RWD and RWE study designs into your product development plan. https://hubs.li/Q02nZjWL0hashtag#PatientsFirst hashtag#RareDisease hashtag#RWE hashtag#RealWorldEvidence hashtag#RWD hashtag#RealWorldData,Customer Centricity
"So incredibly excited for what we are building together! We are shaping the future of healthcare!! Stay tuned... #ConeHealthProud #RisantProud #ForOurCommunities #Impact
Cone Health Risant Health

https://lnkd.in/geqUr6bQ",Not Customer Centricity
"Everyday LifeChanger Nidhi Singhvi is driven to make sure we get it right for our members at every touchpoint. She leads UnitedHealthcare's consumer experience and resolution team, which works proactively to get after the root cause of problems, so they dont happen again for others. Thanks for all you do every day, Nidhi!  ",Customer Centricity
"A. John Blair, III, MD, sits down with Karen Jagoda for this episode of the Empowered Patient Podcast to discuss driving interoperability and ubiquitous access to healthcare information.
 
But if you look at hospitals, you've got about 70% of the hospitals in the country connected to a national network. That means there's 30% that are not. And then, if you start to break that down and look at rural areas versus urban, there's a big disconnect.
 
 Tune in now for this informative conversation: https://bit.ly/3VHptQA | #EmpoweredPatient #Interoperability #PtExperience #ClinicianExperience #CareAccess #HealthData",Customer Centricity
"Hola, Espaa!   We've arrived in Madrid!https://buff.ly/3TJJoxq",Not Customer Centricity
"We kicked off the year strong, as more than 100 IT leaders came together this week to roll-out our 2024 goals and objectives. Setting specific, measurable, achievable, relevant and time-bound goals upfront provide clarity, motivates teams and drives accountability toward what we are trying to achieve together. I am inspired by our conversations and excited for what's ahead. Thank you for being the best leaders! @ Loggerhead Marinelife Center, Juno Beach, FL",Not Customer Centricity
"Marcus Jackson, Security Officer at St. Joseph Health Medical Center, is Division Support Services' most recent Employee of the Quarter award recipient! YTM Marcus was nominated by a colleague who had witnessed Marcus interacting with a patient's family member and felt that the ""care Marcus provided was such a good example of what our hospital is all about - humankindness and our core values, including compassion."" Thank you, Marcus, for your exceptional demonstration of humankindness, compassion, and grace. Congratulations on being DSS's Employee of the Quarter! hashtag#humankindness hashtag#Recognition hashtag#VMFH",Not Customer Centricity
"Last week I reviewed more than 100 resumes for an opening we are working to fill. Here are some thoughts:1. Candidates have about one minute to make an impression with their resumes. Resumes should be clean, not cluttered.2. Tell me a story - your story! It's hard to tell a story with just bullet points. Give a short but sharp narrative - stay away from jargon.3. If you make a positive impression, know that I'm going straight to your LinkedIn profile. How are you presenting yourself on LinkedIn? Are you active? What are other people saying about you?",Not Customer Centricity
"Happy hashtag#CXDay!! I'm fortunate to work for M&T Bank because of their commitment to hashtag#customercentricity.  My colleagues in CX and my business partners in the Commercial bank are hashtag#doingthework to bring the voice of our customers to the center of everything we do.Shout out to: Chelsey Merlino, Grace Lawson, Van Sedita, Sarah Hudak, Kristin Brewster, Adit Singh, Erin Hurley, CPA, Jessica Cowperthwait, Kitt PizzutelliIn case you're wondering, here are 10 reasons why CX should matter to every organization:1.) Consumers are willing to pay a  16%  price premium in return for a superior customer experience.2.) CX alone drives over  two-thirds  of loyalty "" more than price and brand combined!3.) Improving CX can reduce customer support costs by up to  33%.4.) Customer spending increases by up to  140%  following a positive experience. 5.) Companies that focus on improving their CX can expect a boost in revenue of up to  80%. 6.) Experience-Driven brands report almost  2x  higher YoY growth in customer retention, repeat purchase rates and customer lifetime value than CX laggards. 7.) More than  70%  of people state that they would recommend a product or service following a pleasant experience. 8.) CX leaders bring in almost  6 times  more revenue than laggards. 9.) Customer-centric brands report profits that are  60%  higher than those who fail to focus on CX. 10.) Experience-driven companies grow their revenue at a rate that is  1.4x  faster than their competitors. Source:  CXINDEX",Customer Centricity
"ICYMI: We launched our new mobile app for CenterWell Pharmacy customers last week. Its designed with seniors in mind and features a simple user experience to make things even easier for our patients  and its getting a lot of great attention. Our customers are happy, and Im so proud of the team behind the app who has brought this to life for our pharmacy patients who can now spend less time worrying about their prescriptions and more time living their best lives.


Daniel Polk Tom Kirtz Gaurav Khanna Craig Klopatek Dalia Powers",Customer Centricity
"Walmart Health has a new opportunity to join our team as a Health Center Administrator. If you are passionate about making an impact, join our team as we are changing healthcare.",Not Customer Centricity
Bringing another great convenience to our customers and continuing to transform adaptive retail!,Customer Centricity
"Convenience for you and your customer  a merchant services account simplifies business banking. Open one today and see if you qualify for a $150 bonus: https://bit.ly/3xhl5zC

#SmallBusiness #SmallBusinessSupport #MerchantServices",Customer Centricity
"No matter the outcomes you're driving or the framework you're using, you need to assess your maturity level to figure out the path forward. Learn how.",Not Customer Centricity
What is Meta's Dynamic Media for Catalog Ads and how to make the most of it with Smartly? YsCheck out how our hashtag#AI-powered Dynamic Video Ads will maximize the untapped potential for elevating your hashtag#advertising campaigns. Y https://bit.ly/49phsVMhashtag#worksmartly hashtag#adtech hashtag#meta hashtag#ASC,Customer Centricity
"The potential for hashtag#AI to transform U.S. hashtag#healthcare has been discussed for over a decade but has yet to deliver the kind of broad-based results the industry desperately needs. I am optimistic that will soon change.  For the last four years, my team at Health Data Analytics Institute (HDAI) has been hard at work on building a platform, HealthVision,  that uses machine learning and generative AI to give clinicians the information they need to make better clinical decisions. Here are some of my key takeaways from working on making AI usable for clinicians:- Clinical AI can now be deployed at scale: HealthVision is in production at Houston Methodist, fully integrated with Epic, and will eventually be accessible by thousands of clinicians assisting with a wide range of use cases.- Generative AI fills gaps in previous AI technologies: Generative AI can process raw clinical notes to produce structured data that can be ingested by predictive models in near-real time. This enables continuous updating of patient risk profiles as their care progresses.  - AI turns data complexity into actionable simplicity: HealthVision distills hundreds of pages of medical records into ONE PAGE that presents a holistic and prioritized view of patient risks. On October 8th at 3:40pm PT, I'll be presenting with Roberta Schwartz at hashtag#HLTH2023 about putting data-driven insights into the hands of clinicians and care teams. Our collaboration with Houston Methodist is one of the largest deployments of generative AI within healthcare today. Please join us: I'm eager to share our experience "" and to hear what you're working on in this industry sea change.",Customer Centricity
"I was eating breakfast at the St. Regis New York when Jeff Goldblum sat down near me to have his breakfast. When we were both done, Mr Goldblum asked me what brought me to New York. I said, ""I'm here for business"" and he then proceeded to extemporaneously sing me a  song, ""You're here for business...""What most impressed me about this chance encounter with an actor is how comfortable Mr. Goldblum is with his celebrity status at age 71. All through breakfast he was kind to the staff and did not try to hide who he is. The staff appeared smitten with him.I remember Jeff Goldblum from the movie The Fly while my friends remembered him from Jurassic Park. hashtag#generationaldifferences hashtag#authenticity hashtag#celebrity hashtag#stregis",Not Customer Centricity
"Shepherd Center CEO Sarah Morrison, PT, MBA, MHA, announced last November that she will retire on September 20, 2024, after 40 years of service, and that Jamie Shepherd, MBA, MHA, will take the helm as CEO. Sarah was recently interviewed about her advice for the next generation of health system executives, and here is part of what she had to say: ""Be transparent and humble "" have an open-door policy, and be willing to admit when you were wrong. Have a clear vision and communicate it often. From there, set expectations and hold your team accountable. Finally, be present "" emotionally and physically. Get out from behind your desk and walk the halls. You'll never regret the time you spent showing up for your team."" Read her full response here: https://bit.ly/41w2ieL",Not Customer Centricity
"Day or night, we work tirelessly to guarantee the continuous delivery of clean, safe, reliable and affordable energy. Always prepared, compassionate and ready, we're here for you "" ensuring your energy needs are met, no matter the circumstances.Learn more: nicorgas.com/alwayshere",Customer Centricity
