postContent,themes
"On hashtag#internationalwomensday I spent time talking to the strongest woman I know""a cancer survivor who is also my mom Y We spent time reflecting on the vivid memories of her coming home in tears after being passed over time and time again for her grade 13 promotion with the FDA when she was by far the most qualified (biased Y ). Women in IT during the 80's and 90's essentially had to be superhero's (as most are Ya).Witnessing the glass ceiling at that age provided me with invaluable perspective. Witnessing continued perseverance fueled me to never give up in even the darkest of times. I am extremely grateful to be working for a company that prioritizes the right things and I am very humbled to be in a position to make an hashtag#impact.This is my mom in 1995 receiving her grade 13. Four years later she would lead the FDA through one of the most daunting moments in help desk history""Y2K.",Not Customer Centricity
Reflecting on 16+ years as corporate secretary at Dominion Energy -- working with an incredible Board of Directors. hashtag#governance hashtag#leadership,Not Customer Centricity
Wonderful to see our customer Inspire celebrating their most recent go-live achievement with their Basware gear!  It's been great to work with this team - they are amazing partners.  I look forward to much success in the future.#nowitalljusthappens,Customer Centricity
"Whirlpool Corporation has supported the newly launched Matter 1.2 smart home connectivity update. This update is the first step in bringing major kitchen and laundry room appliances into the Matter (Connectivity Standards Alliance) ecosystem.

The number of connected devices in peoples homes is increasing, said Murat Genc, Whirlpool Corporation's global technology and data officer. Our work to bring Matter support to Whirlpool Corp. appliances will improve user experience with more interoperability across these devices while simplifying development and improving reliability.

#Tech #IOT #Data",Customer Centricity
"Thanks to the amazing team especially Sina Mehdinia, PhD, Kun-Han (Tom) Lu , Kingson Man, Chi Wah (Alec) Wong, PhD, and Allen Mao, we are proud to present the first hashtag#oncology hashtag#LLM framework already improving efficiency in research, care, and operations. Having played with it every day for a few months, HopeLLM never stops surprising us and the early adopters by how well it performs in multiple real world applications. More importantly, it is grounded in City of Hope data, and has never defied its instructions of not hallucinating or providing non-factual information. More to come soon! hashtag#ai hashtag#aiinhealthcare hashtag#foundationmodels",Customer Centricity
"A new level of service has arrived at JFK! On Tuesday, we opened the first ultra-premium Delta One Lounge. We were joined by nearly 600 guests, including some of our most loyal Diamond Medallion and 360 members, to celebrate this monumental occasion and be the first to experience a new standard of elevated service.
 
The 39,000 square foot lounge features multiple luxurious areas to recharge and relax, including the Icon Bar with premium wines and spirits, the elegant Brasserie with full-service dining, and a Wellness Room with state-of-the-art amenities and treatments. No matter what kind of traveler you are, the Delta One Lounge has something tailored for you.
 
At Delta Air Lines, we know that your experience on the ground is just as important as your experience in the air. We cant wait to welcome our Delta One passengers for a truly unforgettable experience. 

#Experience #DeltaOne #Lounge #Premium #Airport #JFK",Customer Centricity
"""Building on this, Zachary Taft, MBA, digital ventures lead at Memorial Sloan Kettering, emphasized the indispensable role of human oversight in validating AI-generated data. He stressed the significance of using AI to streamline the delivery of data to a larger patient population, augmenting the capability of specialists, and fostering collaboration between clinical practitioners, providers, and payers. However, he cautioned against overhyping AI, warning that inaccurate data collection could lead to misguided decisions and potential harm to patients.""",Customer Centricity
Not everyone understands B2B lingo. Professionals on LinkedIn do. Reach B2B audiences with targeting tools built for you. https://lnkd.in/gERfsJnU,Customer Centricity
"Take a little trip with us through the Mercy Center for Performance Medicine & Specialty Care, which opened its doors just over a year ago as one of the largest multispecialty surgery centers in the country. Offering orthopedic specialties, weight loss surgery, neurosurgery, precision medicine and more, this facility was designed from the ground up to offer a one-of-a-kind patient experience that puts your convenience and health as the top priority.",Customer Centricity
"Sometimes, it's the simple things that make the biggest impact. A great example of continuous innovation within our mobile app was the recent enhancements to our HealthSafe ID (HSID) capability for members to register for access.

One of the most frequent pain points we hear from our consumers is difficulty for dual eligible (DSNP) members (people with both a Medicare and Medicaid plan) in registering for an account. This population in particular is often dealing with some of the most complex healthcare challenges, and many times have lower access to digital resources and healthcare literacy.

In our new mobile experience - if the member chooses the wrong registration path or health plan, the HSID application will do everything it can to search for other plans in order to help ensure our members are able to register. This not only eliminates the burden from our members having to try and navigate account setup, it gives better access to the wealth of capabilities our market leading mobile ecosystem has to offer. 

Little changes like this can make a huge difference, in this case: we've seen double digit registration success growth in just a few short days! That's millions more members every year with better access to care. 

I am extremely proud of the team that made this happen. Heather Fisher - Anderson, Jared Carr Mike Litecky Peter Armstrong Amanda Loomis Kenneth Bearl Ashok Singh Bisht Marius Bologa Bridget Feickert Christopher Casey Logan Charles Zachary Crnecki Marta M Saputo Jonathan Daccarett Mike Dahl Eric E. Ryan Felton Tony Gregory Patricia Mazur Bhumika Patel Dan Proskauer John Somrock Abraham Sturman Scott Vandeleest Ashutosh Singh Suthaharan Sivasubramaniam and Sri Chari - thank you all!!!

#theBestMobileAppGetsBetter #dreamTeam #goAppGo",Customer Centricity
"Heres what a product vision is not:

A succinct, bold, 1-2 sentence statement that describes the change your company wants to make in the world.

Thats a company vision, not a product vision.

A product vision, on the other hand, is a ""detailed enough"" description of the actual solution you intend to build, over time, in order to realize the company vision. 

Here are some examples of great company visions: 
- Stripe: Increase the GDP of the internet
- Google: Provide access to the worlds information in one click
- LinkedIn: Create economic opportunity for every member of the global workforce 

Hopefully, its clear that none of these provide any meaningful product vision or direction.

For example, Google's product people could have pursued the company vision by building a universally accessible, multimedia encyclopedia. That would have been one product vision (anyone remember Microsoft Encarta?).

Or, they could have envisioned a better search engine and gotten to work on that. 

Product visions can take many formats, from a simple written story that describes a customers experience with the future product, to a visiontype comprised of (often annotated) mock-ups of the key elements of the product.

All good product visions, regardless of the format are:
- inspiring
- customer-centric
- successful at bringing the solution to life, at least in broad strokes. 

Speaking of broad strokes  good product visions are clear without being overly prescriptive. They are directive enough to provide a solid north star for the product team(s) to work towards, while challenging those teams to figure out the details over time.

Does your company have a true product vision, or are you under the illusion that your company vision is enough?",Customer Centricity
Addressing the underlying issues instead of merely the surface problems can lead to more meaningful change. We believe in addressing root causes to implement sustainable solutions. hashtag#operationalexcellence hashtag#implementation hashtag#consultingservices,Not Customer Centricity
"If you're a Sr Cloud Platform Engineer looking to work for an AMAZING company""..you need to apply!! Come join our team and be part of our Cloud journey!hashtag#hiring hashtag#awscloud hashtag#Azure hashtag#AzureDevOps hashtag#Terraform hashtag#Cloud hashtag#CloudAutomation",Not Customer Centricity
"I commend the Massachusetts Department of Transportation (MassDOT) for outlining a plan that leverages National Electric Vehicle Infrastructure (NEVI) program funding to add more DC fast chargers along major roads. The state will need an estimated 10,000 publicly accessible electric vehicle chargers by 2030 to support future hashtag#EV adoption. We expect to move quickly on these efforts over the next several years, and Eversource will be supporting MassDOT through our EV charging programs.",Customer Centricity
"Sharing the next case study from our American Medical Association Future of Health series featuring Oshi Health's digitally enabled care model.

Read more on their #innovative approach to GI care delivery and how it's helping improve the #patientexperience. https://lnkd.in/erdDgXSD 

Manatt Health Jared Augenstein Allie (Levy) Chafetz Laura Fritsche, MHA Sameer Berry, MD, MBA",Customer Centricity
"With a strong focus on reimagining the future of customer experience, we met this week with my Customer Engagement team to create unforgettable experiences that will elevate Colgate-Palmolive's  brands to new heights. YaTogether, we'll explore cutting-edge strategies, leverage emerging technologies, and implement customer-centric solutions that will exceed expectations.hashtag#Colgate hashtag#CustomerEngagement hashtag#Innovation hashtag#CustomerExperience hashtag#TransformingTheFutureTorrey Moore Michelle Ives Angela Hood Amanda Marshall Jessica T. Joy Ericson Tina L. Orpha Garcia",Customer Centricity
"Why is getting care at a comprehensive cancer center important?  

Studies show that you get better care, which leads to better outcomes and longer-term success.

For over 50 years, Roswell Park has maintained a Comprehensive Designation from the NCI. And were proud to share that in our latest renewal, we were rated Exceptional, the highest rating a cancer center can achieve.",Customer Centricity
"Last week we announced our brand new residential hashtag#EV charger purchase and installation rebate program, now open to eligible customers in northern Illinois. Today at the Chicago Auto Show, we shared that we're launching two more new rebate programs this month for business and public sector customers: a rebate program for the purchase of EV vehicles and fleets; and a rebate program for the expansion of public charging access. These three rebate programs are part of our larger investment to help accelerate an equitable adoption of hashtag#ElectricVehicles in northern Illinois. ""Working with our partners in northern Illinois, ComEd is committed to helping customers benefit from zero emissions vehicles, which can significantly reduce pollution and enhance air quality for all residents across our communities,"" said Erica Borggren, our VP of customers solutions. ""Through new targeted incentives, we are aiming to accelerate the transition toward all-electric fleets, cars, buses and trucks, while at the same time catalyzing the buildout of a regional network of public EV charging to serve more customers "" a key factor to growing EV adoption equitably."" Not only do hashtag#EVs offer fuel and maintenance cost savings and performance benefits, but hashtag#OurCommunities can experience environmental improvements from reduced tailpipe emissions. Electrifying transportation "" including cars, trucks and public transit fleets "" can also create tangible health benefits for all families across northern Illinois, especially communities which have traditionally borne the brunt of climate change and air pollution. More information is coming on February 15 so save the date! Learn more: bit.ly/48c21iT",Customer Centricity
I'm excited to welcome Sam Cooper to Navy Federal Credit Union's internship program! Sam is a student at the University of Virginia and will be spending the summer with us in our Channel Management department. We are proud to have him on our team! Navy Federal Credit Union hashtag#navyfederalcreditunion hashtag#lifeatnavyfederal,Not Customer Centricity
Swimming in data without the insights we need to interpret that data into meaningful actions. Let's focus on delivering solutions that decrease the mental burden and improve care quality. hashtag#ai hashtag#ambientintelligence hashtag#reducetheburden hashtag#bringbackthejoy,Customer Centricity
"I'm happy to share that I'm starting a new position as Managing Director, Wealth Planning & Advice Team Leader, Eastern Division at J.P. Morgan!",Not Customer Centricity
"Congratulations and welcome, Carter Witherspoon !",Not Customer Centricity
I'm excited to announce that I'm a certified NACD director now! Thank you GIA (Gemological Institute of America) for providing the education opportunity! It's an amazing organization with so much compassion for its mission and its people. I'm proud to be a part of it. NACD Northern California Chapter Stanford Women on Boards How Women Lead,Not Customer Centricity
"hashtag#PfizerProud of our commitment to return individual data to clinical trial participants through our new Participant Data Return initiative.  Through this program we are enabling and scaling an end of trial individual participant data return solution that is meaningful and contextualized while simultaneously respecting the scientific integrity of the trial. Pfizer has been building toward this moment for almost a decade, centering the patient from the beginning.  Returning individual participant data is another critical step toward improving the clinical trial experience, building trust with participants, and advancing health information equity. hashtag#PatientCentricity hashtag#PFEColleague",Customer Centricity
"It's November already, and time really does fly. Today, I would like to reflect on the unforgettable hashtag#adobemax2023 event that I attended a few weeks ago. For those who may not be familiar, it is the world's largest creativity conference, drawing professionals and enthusiasts from diverse creative fields such as graphic design, web development, photography, video production, and animation.In this ever-evolving creative landscape, being present at hashtag#AdobeMax provides us with a deeper understanding of our users' needs and leaves us fired up with fresh ideas. AI was the talk of the town this year, as it is everywhere else. We have had the privilege of seeing firsthand the incredible effects of artificial intelligence on the creative industry, thanks to our partner Adobe. Don't miss out and watch Max Keynotes and Max Sneaks (the links are in the comments) to get a glimpse on how the creative world is evolving. I am thrilled about what lies ahead for us and am looking forward to providing this talented and diverse group of creatives with even more valuable solutions.A heartfelt thank you goes out to the passionate Logitech team for your hard work leading up to and during the event, as well as for representing Logitech on various stages and at our booth. Alexandre Zreikat, Andrea Simone Silva, Darren O'Connor, Daniel Sigman, Davi Gordon, Giulio Barresi, Greg Betty, Jean-Christophe Hemes, Karla Ramos, Maxim Bondar, Mathieu Meisser, Mirabela Pirjol, Olivier RiviA re, Pavlo Marques-Vandiak, Sergio Benavent, Ximena Payer, Wendy Spander.  Special thanks to Luyang Zou, an incredibly talented new media artist, for joining us and sharing the stage with Guillaume Bourelly to deliver an inspirational session on 'Creating at the Speed of Thought"". hashtag#AdobeMAX hashtag#Logitech hashtag#MX",Not Customer Centricity
"After 8.5 rewarding years, I am moving on to new opportunities. It's with a heavy heart that I leave behind the amazing people I have worked with at Ball. I will forever cherish the memories and experiences I've gained during my time at the company. But, I am excited about my new role and the challenges it will bring. Thank you, Ball, for an incredible journey!",Not Customer Centricity
"It's official! I am beyond thrilled to announce that I have accepted a new role as Manager, Regulatory Support and Consulting, Division of Research for Kaiser Permanente of Northern California.I am looking forward to meeting my new colleagues and together forwarding the truly remarkable research portfolio of such a renown organization. California dreams do come true!",Not Customer Centricity
"We had the privilege of spending the day immersed in the world of data economics with the Dean of Big Data himself Bill Schmarzo. To say we learned a lot is an understatement. Some key takeaways:1. It's not about being data driven, it's about being value driven.2. Design thinking and data science are 2 sides of the same coin. By applying design thinking methodologies, such as empathy, ideation, prototyping, and iteration, organizations can develop data-driven solutions that truly resonate with users and deliver value.3. Focus on 10% of your data that has 90% of the value. When breaking down business problems into desired outcomes and KPI's, you will start to notice the same KPI's coming up over and over again. Focus on those KPI's.4. AI initiatives need to start small and address a real business problem. 5. Let your voice be heard as the world of AI evolves. It's not too late to affect change. Write to legislators. Stay educated. Highly recommend Bill's books especially "" The Economics of Data, Analytics and Digital Transformation'. He is also a very charismatic and energetic speaker who loves Caribou coffee! hashtag#DataEconomics hashtag#Innovation hashtag#valuedriven hashtag#BillSchmarzo hashtag#designthinking",Customer Centricity
"So excited to welcome APMatching to the Basware family.  Together, we will drive even more value for our customers! 

#nowitalljusthappens",Not Customer Centricity
"Jeffery L. and I are thrilled to announce the results we've had at Assort Health, the healthcare industry's first generative AI for call centers, showcasing our successful case study at the Illinois Bone and Joint's Chicago Division. We're humbled to have been picked up by Aaron Weitzman at Axios, Fortune, The Wall Street Journal, and more. The call center often marks the beginning of a patient's healthcare journey, and it is frustrating and time consuming. Today, If you call your doctor's office and hear the recording say"""" You are the""sixth""caller. Your wait time is""31 minutes' "" you're bound to hang up and give up getting help.The Assort Health team is committed to solving this problem.  We're on a mission to ensure healthcare is accessible for everyone, everywhere, at any time, and are using the latest advances in AI to solve this pressing issue.Assort Health is revolutionizing the way large healthcare organizations handle patient communication. By leveraging Voice AI to take over routine call tasks, we've managed to slash call drop rates by more than two times and halve waiting times within just 30 days with our partners.I'm honored to work alongside some of the brightest minds in the field. Our platform is at the forefront of care navigation technology, powered by an advanced framework that drives ChatGPT's voice interactions. This is an inevitable shift over the next 5 years, and we will be leading that charge.And yes, we're hiring! Thank you to everyone who has supported us along this journey so far. Matt Humphrey, Amit Garg Jenny Friedman Ankit Jain Aditya Khosla Immad Akhund Neil Batlivala Bobby Green Brandon Hull Andrew Tan Brandon K. Sim Trevor Martin. Now, back to work Ys .",Customer Centricity
"Elevance Health CEO Gail K. Boudreaux gave a keynote speech at hashtag#CES about the use of technology to make hashtag#healthcare more proactive, predictive and personalized. The health insurance giant, which serves 117 million people, sees opportunities to leverage hashtag#generativeAI and other technologies to make healthcare easier to navigate, chief AI officer Shawn Wang said during an interview at CES.""We're looking at 'How do we get AI embedded in every major business?' We think about AI as being 'people-first.' You  start with why. Why do we do this? What problem are we trying to solve?"" Wang said. Heather Landi, Fierce HealthcareAt Intelliswift Software, we are helping healthcare payers and providers across a range of hashtag#GenAI applications - from summarization, generating predicting insights, to AI virtual assistant/Chatbot, to automating business processes. Reach out to our healthcare business leaders to collaborate - Hassan M. Sharif, Kristie A. Tran, MBA.",Customer Centricity
"Thank you so much Patrick Wright! I am extremely honored. So proud to be part of this AMAZING AdvoCare team!! Thank you team for pushing me and providing me your invaluable support everyday!!Thank you so much to all my mentors and my family for their continuous support and encouragement.Thank you Rashmi Jain and Abby Taylor for nominating me!Thank you DallasCIO team for bringing us together and celebrating us. I am so glad to be part of DallasCIO. As we always say the answer is in the room!!Congratulations to all the 2024 Dallas ORBIE Awards Nominees, Finalists, and Winners!!hashtag#orbie2024",Not Customer Centricity
"I've said it before, when you capture the consumer you capture the patient and you'll win in the end. I have no idea if Apple can continue to execute at a high-level as it moves deeper into healthcare, but their macro strategy is on point.hashtag#healthcare hashtag#healthcaretech hashtag#consumers hashtag#patients hashtag#remotepatientmonitoring hashtag#wearables hashtag#diabetes hashtag#hearthealth",Customer Centricity
Day 3 of hashtag#DIA (and final) come and talk to us about PV and modernised study design for late phase and observational research hashtag#innovation hashtag#patients first,Customer Centricity
This is what it looks like when you have successful partnerships !,Not Customer Centricity
"sY    z Y  s  sz- z z z   s zzz2- z sz zz Y1""(...) it's about the hashtag#mindset"" Is the phrase that stuck in my head after a conversation with a good friend about dependencies between teams. It made me reflect and I took one step back to embark in a journey which made me think...   zWhen an organization bets for a tech-first approach, the question shifts from ""how can this hashtag#technology solve a user problem?"" to ""how can we use this technology, regardless of any user problem?"" And the anxiety to hunt problems which could fit the technology starts.   szWith a tech-first approach an organization, obviously, is not going to start aligning teams around user-segments but around tech. What does it happen when ""Agile"" starts kicking-in? Teams slice ""epics"" into user-stories but something we don't notice (maybe nobody does) is that we are also slicing the user-journey and so slicing the end-to-end hashtag#value stream to a ""maybe"" or even no-value stream. This is when pointless conversations about dependencies start, feeling that we are solving a big problem for our users when what we are really doing is entering in a maze with no way out.Z s3s s zsAgile, in its core principles, aims to minimize, not manage, dependencies, so, why do Agile teams find themselves managing dependencies without really knowing how they ended up there? The answer lies not in the methodology itself, but in the organizational inertia. Organizations, slaves of their medieval service organization models, struggle to make the shift towards user-centricity, however, none of them lack terms such as ""Tribe lead"" or ""MVP"", I mean, you can put lipstick on a pig, but it's still a pig.s  z sUnfortunately this is not an exception but rather the rule and I understand that organizations want to change but don't really know where to dig, well, here is a simple Roadmap to get started:"" Know your users!!!: simple but we still don't get it. Talk with your users and segment them into specific needs and challenges"" Getting organized around what we want to achieve. Form teams representing the entire end-to-end value stream, not just technology silos. Believe it or not, most of the times, users are not excited about the technology but about seeing their problems solved"" Effectiveness over efficiency. Is not about how many <Agile term> did we deliver, but did we solve any problem for our users?"" Experiment, prototype and iterate quickly, learning from user feedback at each stage is a must plus it helps teams grow and bond"" Be patient, moving from the Middle Ages to the Modern Era does not happen in 2 Sprints Y  hashtag#agile hashtag#change hashtag#empowerment hashtag#leadership hashtag#productmanagmentCredits: Comic AgilA",Customer Centricity
