postContent,themes
"There are several things about Michael Bloomberg's post I love. 1. There's no optimal time for a startup, a turnaround or a job change.  But when you have an idea and the enthusiasm to work hard on it, that makes it a good time "" and usually a good time!2. A great team is the most important thing you can do.  You will rarely get it right with the strategy, the processes, the structure or the culture.  But if you're working with good people who you genuinely believe in and learn from, you'll get the to right answers as you decide and learn and course correct.Hope everyone is having a great holiday.  And a fresh start is ahead for many, actually for all, who choose to see the world a little differently monday.",Not Customer Centricity
,Not Customer Centricity
The launch of Brand Pulse is a testament to Smartlys collective innovation and commitment to solving for brands biggest pain points and dedication to moving the advertising industry forward. And this is just the beginning. ,Customer Centricity
"2024 is our year for implementing care redesign programs across our hospital system. Our goal is to have ambient intelligence cameras in every acute care patient room and remote monitoring devices on all patients staying in an inpatient bed with plans to send them home with the device to continue monitoring in the outpatient setting. 

We know that we are bullish about innovation and sometimes implementing new technology in a hospital setting feels like trying to get your kids to eat their vegetables, but we have seen amazing results once we get through the change management hurdle. 
 With predictive analytics, the AI tools are 75% more accurate at projecting a patient's discharge date compared with our nurses' predictions alone. 
 With virtual nursing, we have been able to eliminate all contract nursing positions and add a fresh set of eyes to the patient floors which has led to great catches in discrepancies. 
 With ambient intelligence, we have seen a 15% increase in our OR capacity without adding any new staff members. 
 With remote monitoring, we have reduced telemetry needs and moved labor from one skillset to another. 

During our first 2024 Innovation Open House session last week, we hosted 20+ attendees from 7 healthcare organizations across the country. We would love to have you join us for future sessions. Please complete this short form if you are interested and we will be in touch https://lnkd.in/gAy-fiE7 ",Customer Centricity
It's been so great to be part of the WEF at Davos this past week. The conversations we have been having about hashtag#sustainability have been thought-provoking and impactful in the best way. Excited to share more about my experience with you all here soon!,Not Customer Centricity
"Elevance Health approaches technology issues "" particularly AI "" by putting people first. We put AI in action by empowering our associates with AI and GenAI powered solutions so they can deliver higher quality experiences to the people we serve. Thank you for the energizing discussion Reena Sooch, Punit Singh Soni, Jerome Revish, and Aashima Gupta at ViVE this week.hashtag#vive2024 hashtag#healthcareIT",Customer Centricity
"Y34 One of my favorite parts of working at Mars is the unique career opportunities and unexpected paths that lead to new adventures. I'm officially stepping into the world of Mars Petcare as Change Experience Senior Manager at Royal Canin! I look forward to embarking on the journey ahead and living our purpose of ""A Better World for Petsa"" each day.",Not Customer Centricity
"This article is written by Evan D. Collins, MD, MBA, Orthopaedic Surgeon and Chief of the Houston Methodist Hand & Upper Extremity Center, about working collaboratively with health care startups on improving our operating rooms.",Customer Centricity
"Last week I had the opportunity to get my team together one last time before saying goodbye to hashtag#wellsfargo.  I spent almost 5 years here, working with these amazing group of individuals to build out a team that earned the trust of its partners. I am so proud of what we have accomplished and the respect we have earned! Thank you team for allowing me to learn from you everyday, it was an honor to lead such a stellar team.To my leaders and mentors Kevin Reen, Serhat Oztop, Kleber Santos and Kristy Williams Fercho thank you for trusting in me, challenging me and giving me opportunities to continue to grow, both professionally and personally.  I will forever be grateful for my experiences, and more importantly, the relationships that Wells Fargo blessed me with.Tim Seagren Debbie Knutson-Smith Laura Melton Miles A. Gustavo O. Andres Wiszberger Ramanan Ganapathy Greg Pleimling Linh Le Joya Mukherjee Wells Fargo",Not Customer Centricity
"As we celebrate National Hispanic Heritage Month, I want to pay homage to my mother, Maria "" born and raised in Southern Spain. She met my father while he was abroad serving in the Navy and moved to the United States with him to raise me and my sister, Maria. With very little extended family in a foreign country, my mother worked extremely hard to learn a new language, a new culture and a new way of life, always striving for the American Dream for herself and her family. Without her courage, strength and determination I would not be where I am today. I am extremely grateful for my Spanish roots and the lessons I learned from my mother. In fact, I'm reminded of a famous Spanish proverb that goes, ""Si te caes siete veces, levAntate ocho"" "" or in English, ""If you fall seven times, get up eight.""  So, this month, I'd like to honor all of my Hispanic brothers and sisters, as well as celebrate our unique cultures and backgrounds. Happy Hispanic Heritage Month!",Not Customer Centricity
"I'm thrilled and humbled with the long list of innovations our cross functional team has worked tirelessly to launch at re:Invent this year. The collaboration these launches took has been incredible, and the way we've rallied across disciplines has been nothing short of inspiring. I'm especially proud of our UX Design & Research team and the role they played bringing these new generative AI capabilities to our customers, helping them revolutionize their CX.hashtag#TeamPride hashtag#GlobalInnovation hashtag#genai hashtag#reinvent2023 hashtag#amazonconnect hashtag#aws hashtag#awsapplications hashtag#ai hashtag#ux hashtag#cx",Customer Centricity
"I've come to think of Koala a bit as a filtering engine. Sounds weird, right?For our customers who are smaller startups, every touchpoint is exciting.- Is it a VC checking things out?- Is it a competitor looking at positioning?- Is it a design partner starting to show more interest?- Could it be our first customer checking out pricing?You don't want to filter anything.But scaled companies are different.Scaled companies typically have hundreds of thousands of ""intent events"" per month.Some have tens of millions per month. As we've broken out of our initial customer base and started to serve these great companies, we've found the need to becoming a filtering engine show each member of the Sales team 5-10 real-time alerts that are relevant to them.This boils down to a few things.ICP Fit. Is this company a company that looks like other companies who have bought from us? The simple metric that most people start with is # of employees, but it turns out that there's lots of other enrichment data that tends to be valuable. Things like:- Overall tech stack: does this company tend to build internally vs. buy?- Specific tech they are using- ARR- Capital raised- Site traffic- Location of HQTypically, we can find 25% of traffic that accounts for 75-80% of conversions. This is your 'A' fit  the stuff that should be going to Sales.Bottom of funnel content. Nagging someone as they first start exploring the tool leaves a bad impression we see best results for Sales teams who are patient. Wait until your buyer is really in the consideration/purchase stage of the journey, starting to consume that content or maybe even kick the tires on the product. Swoop in with a few genuinely helpful pieces of advice or content, and you're very likely to book a meeting!Check out the comments for our guide on how it all works #underthehood!",Customer Centricity
"Honor to watch my good friend and colleague Mark Magnacca present at Tedx at Babson Colege in Boston, MA (virtually). The concept of Moments That Matter is something that Jacob Heugly Rob Jeppsen and Frank DiPuma  CTP LPM talk about everyday. I love how this was presented. How do we learn from the pivotal moments in our lives? Paul R. Butterfield ",Not Customer Centricity
"Truist Wholesale Payments had a packed house earlier this week at the Nacha Smarter Faster Payments Conference in Miami! Our topic was The Need for Speed in the Evolving Payments Landscape and was presented by our own Michelle Ziolkowski and Chris Scott who shared with our client of how businesses of any size can optimize their payment rails. It was a great discussion that shows that Truist Wholesale Payments is leading the change for payments delivered with simplicity, speed and safety!",Not Customer Centricity
This is how you bring a clear path to hashtag#circularity to categories where it simply doesn't exist today. All while improving the consumer experience and innovating at the same time.hashtag#aluminumrecyclesforever hashtag#ballcorporation GEA Group,Customer Centricity
"Our #MobileHealth Program is helping to fill in the gaps of care around the triad! Berry Jones received a diagnosis and treatment plan from Cone Health's Mobile Health Program without having to leave his neighborhood. Hear his experience, and learn more about the program from Olugbemiga Jegede, MD, MHA, CPE, FACP, FAAPL, FACHE! 

https://lnkd.in/eXq_SVgE ",Customer Centricity
"Last week, I had the pleasure of presenting the keynote on Enterprise Architecture Evolution for TechEx Events Intelligent Automation Conference & Digital Transformation Week!  I also had the honor of chairing a panel on Customer Experience to Human Experience and discuss Digital Transformation as a strategy for sustainability as a panelist. It's been a year since I was last in Silicon Valley and it's nice to explore the latest and greatest at this event!

Thank you to my fellow panelists for the engaging discussions! Manav Khatri Saydulu Kolasani, Abhishek Nayak, Yannick Connan, Gopi Polavarapu, Saumya Vardhan, Kamala Manju Kesavan, Dina Ziadlou, D.M.

#fullstackarchitect",Customer Centricity
"Health & wellbeing. People centricity. Slowing down. Emotion first. Purpose. YTMYTMYTMThese are some of the big ideas I took away from VML's The Future 100: 2024 insights report, which companies and brands can tap for inspiration as we create communications, impactful experiences and innovations to engage our audiences "" and help spark purpose-filled growth.Thank you Ellen Hyde Pace for extending the invitation to attend "" I'm excited to find ways to put these fresh insights to work and strengthen my own communications practice.Plus, what a fun outing to an inspiring space with a great group of Colgate-Palmolive colleagues!Read on: https://lnkd.in/eRZ6RMY4",Customer Centricity
"YZWhat an amazing recruiting year!YI want to thank everyone who made these events possible YTMorganizers, attendees and our extraordinary AES teams YTM YLooking forward to a 2024 where our talent attraction team continues to have unparalleled success in discovering and welcoming the best talent! YZYDaniel, Agustina, Kathleen, Federico, Sami, Stephen, Andrea, David, Victoriaasi ",Not Customer Centricity
"Communication and engagement with a variety of constituents is key to driving the energy transition. Our Marketing team is critical in helping us articulate and disseminate messages promoting our programs across all three of our services territories, and I am pleased to share that this team has been recognized for their successful efforts in this years AVA Awards.
 
Eversource was honored for multiple campaigns that provided customers with vital information about how to reduce energy usage and save on their energy bills, through engagement with our Energy Efficiency, Electric Mobility, and Demand Response programs and incentives. Our seven award wins  at the Platinum, Gold, and Honorable Mention levels  are a testament to the strength of our programs, and to our ability to effectively engage with customers across many culturally different communities. 
 
Thank you to AVA and the Association of Marketing & Communication Professionals, and congratulations to the entire EE/EV/DR department for their continued hard work! You can see the full list of 2024 winners here: https://bit.ly/3UopsST ",Customer Centricity
"At hashtag#vive2024 OpenNotes announced the launch of the new OpenNotes Lab - designed to explore the space where patients, clinicians, notes, and AI meet. Really excited to be working with the amazing Liz Salmi and the OpenNotes team (Cait DesRoches, DrPH MSc , Tom Delbanco, MD , Jan Walker, and more) in building the OpenNotes Lab!Y Read more on this announcement: https://lnkd.in/duXjEpaX",Customer Centricity
"Wearable Tech is the future. Rotex, a biometric tech startup has created a technique in producing high-performing yet inexpensive e-tattoos (wearable patches) which can be worn to monitor and track the vital signs of the body. These wearable sensors are capable of picking up and transmitting these vital signs while it can also keep track of pulse rate, heart rate, muscle movement, brain activity, temperature, skin hydration level, glucose monitoring and so on. A great use case is that e-tattoo allows you to control a drone/ play video games by sensing muscle movements.clip credit: GiGadgets hashtag#ai hashtag#healthcare hashtag#healthtech hashtag#innovation hashtag#technology",Customer Centricity
"I recently had the chance to join Paula Thomas in a discussion on what it takes to create and manage a loyalty program. We discussed the key considerations, KPIs and covered some of the key trends in the Loyalty and personalization space. #UARewards, #UnderArmour, #Loyalty #ProtectThisHouse, #LoyaltyTV, #Letstalkloyalty",Customer Centricity
Great night celebrating the 40 under Forty within Boulder and Northern Colorado! Congratulations to all the honorees! #BW40UnderForty,Not Customer Centricity
"We're excited to welcome Jamie Miller to PayPal as our next Chief Financial Officer (CFO).  Jamie brings her deep experience as a CFO,  strategist, and business leader at global companies such as General Electric, EY, and Cargill.  """"Alex Chriss, PayPal President and CEO, said: ""Jamie is an accomplished CFO and business executive who has worked across many industries and guided both public and private  companies through dynamic environments and meaningful transformation during her impressive 33-year career. She brings a proven  track record of driving strong financial results, instilling financial and operational discipline, and demonstrating inspirational  leadership.""https://payp.al/CFO",Not Customer Centricity
Greatful for the WISL Lifetime Achievement Award nomination! There are so many amazing leaders in the Dallas community and nationwide working on encouraging women to pursue STEM careers. It has been a passion and a mission for many technology leaders including me. A lot has been accomplished yet there is even a lot more work ahead of us. hashtag#humana hashtag#leadership hashtag#womenleadership hashtag#womenintechnology hashtag#technology hashtag#healtcare hashtag#womenhelpingwomen hashtag#womeninhealthcare hashtag#womeninstem hashtag#WISL,Not Customer Centricity
"I've always said that pay by bank, using open banking, had failed to launch because the experience sucked. That's changing. In high-value payments (like car deposits) or recurring payments, expect to start seeing discounts or loyalty and rewards for using the pay-by-bank method.Can it ever displace cards?Tough question.hashtag#fintech hashtag#openbanking hashtag#payments Full long read over at fintechbrainfood .com",Customer Centricity
The full-stack architect: A new lead role for crystalizing EA value,Not Customer Centricity
The Logitech Wave Keys keyboard is a great ergonomic device for office workers. Exciting launch for us today! hashtag#WaveKeys hashtag#logilife,Customer Centricity
YDeveloping a data-driven understanding of customer needs YZ Creating collaborative campaigns to target brand awareness Y Building cross-functional teams to inform decisions organization-wide Discover more about the six core capabilities for multidisciplinary teams: https://lnkd.in/geVQpVzs,Customer Centricity
"   3 We are honored to announce that our portfolio company Anchor's founder C. Emre Koksal, has been inducted into the prestigious National Academy of Inventors.The Ohio State University Koksal also is co-founder of FenixPyre.https://lnkd.in/gAsVnCtC",Not Customer Centricity
"Were thrilled to share that APCOs Senior Packaging Technologist Rebecca Kersey is a finalist for the 2024 Women in Packaging Awards. 

Rebecca has been nominated in the Packaging Technology Leader Category which celebrates demonstrated exceptional expertise and contributions as a packaging technologist, that has had a significant impact on the Australian packaging industry.

At APCO, were proud to have a team of experienced professionals making a difference.

Help us congratulate Rebecca in the comments below. 
 
#womeninpackagingawards PKN Packaging News",Not Customer Centricity
"Ys Achieved Amazon Ads Retail Certification! YsE-commerce and retail media, in particular, have grown incredibly over the past couple of years. At its most simplistic form, commerce media is about connecting media investment to sales data. For example on Amazon, an advertiser can measure down to ASIN-level sale. That is why overall we are seeing so much growth in commerce media, because we now have that level of attribution. Learning never stops, no matter where I am in my career journey. This year, as part of my professional growth and development goal, I am committing to taking as many commerce and retail media courses and certification as possible. I loved diving deep into the Amazon Ads Retail Certification course where I learned about retail readiness, Amazon's fulfillment solutions, the different aspects of selling on Amazon.com, how to launch a new product on Amazon.com, as well as, navigating Seller Central and Vendor Central. I highly recommend this course for anyone in advertising and marketing who wants to understand e-commerce operations and advertising campaigns. You do not need to be hands-on-key to take this course and the assessment for the certification. Next up is the ""Amazon Ads Advanced Retail Certification""!https://lnkd.in/gH5_e6uG",Not Customer Centricity
Optimize your rare disease studies by planning your integrated evidence generation strategy earlier in development and leveraging modernized study designs. Download our rare disease white paper series to learn more about leveraging RWD and RWE for patient-centric strategies that will help you overcome challenges in rare disease study design and execution. https://hubs.li/Q02mr9LJ0 hashtag#PatientsFirst hashtag#RareDisease hashtag#RWE hashtag#RealWorldEvidence hashtag#RWD hashtag#RealWorldData,Customer Centricity
"Nothing business in this post - just personal. Got to play golf with my son, Michael Hearnes, today before he starts his summer internship with Deloitte. So, naturally, I made a hole-in-one because that's what dads do to impress their kids, right?

I love that I'm getting a chance to spend some quality time with family and friends. Don't get me wrong - work is important and fulfilling, but it's not what truly matters. It took me too long to figure that out.",Not Customer Centricity
"2024 is bringing about change!  In January Chico's FAS, Inc. was purchased by Sycamore Partners and is now managed by KnitWell Group.  I had such a fantastic time and experience working for Chico's FAS.  As a public-now-private company we achieved our missions focused on awesome product, the wonderful customers they bring joy to, a digital first mentality focused on connected commerce and data, and excellence in operations.  Witnessed by the 250% purchase premium over just 3 years and far more going back 1-2 years more.  A great tour of duty includes a great leader Molly Langenstein my sincere appreciation""great peers Kristin Gwinner David Oliver Wendy Hufford our small but mighty EC, and all peer departments ecommerce, stores, sourcing, planning, marketing, merchants et al""direct reports Deepak Lakshmanan Tom Greger Bryan Tabiadon and many many more in my department and across others I could list hundreds""our informal Friday meetings brought me personal joy.  I am humbled by your service""and lastly of course game changing partners like fabric Bounteous Google poq parcelLab AB Tasty Syte and Clario, Inc. the latter who started the journey with me""etc. etc. etc.  Too many to thank!  The entire experience including the acquisition and new leadership transition was great.  I wish the new company the very best.  I am an Alumnus! My new adventure starts soon""stand by!  Thank you ALL""tagged and not tagged!  Life is a journey I hope you enjoy every moment of it! hashtag#digitalfirst hashtag#productinnovation hashtag#customercentricity hashtag#operationsexcellence",Customer Centricity
"We had the privilege of spending the day immersed in the world of data economics with the Dean of Big Data himself Bill Schmarzo. To say we learned a lot is an understatement. Some key takeaways:1. It's not about being data driven, it's about being value driven.2. Design thinking and data science are 2 sides of the same coin. By applying design thinking methodologies, such as empathy, ideation, prototyping, and iteration, organizations can develop data-driven solutions that truly resonate with users and deliver value.3. Focus on 10% of your data that has 90% of the value. When breaking down business problems into desired outcomes and KPI's, you will start to notice the same KPI's coming up over and over again. Focus on those KPI's.4. AI initiatives need to start small and address a real business problem. 5. Let your voice be heard as the world of AI evolves. It's not too late to affect change. Write to legislators. Stay educated. Highly recommend Bill's books especially "" The Economics of Data, Analytics and Digital Transformation'. He is also a very charismatic and energetic speaker who loves Caribou coffee! hashtag#DataEconomics hashtag#Innovation hashtag#valuedriven hashtag#BillSchmarzo hashtag#designthinking",Customer Centricity
"I am thrilled to share that I have been awarded the Champion of Champion Award for 2023 at Walgreens, a recognition given to those who exemplify our commitment to patients, customers, and fellow team members in delivering our purpose of fostering more joyful lives through better health. This award speaks to the collaborative spirit, dedication, and hard work of our entire team. It's a reminder of the impact we can make in the lives of those we interact with daily, going above and beyond to make a real difference.Being among this esteemed group of colleagues recognized for our contributions is truly humbling. A special shout-out to my colleagues and the business team for their unwavering support and collaboration. Thank you @Walgreens, for this honor and for fostering an environment where passion and purpose drive our actions.hashtag#Walgreens hashtag#ChampionOfChampions hashtag#Teamwork hashtag#Gratitude hashtag#Recognition hashtag#HealthcareHeroes",Not Customer Centricity
" Shhh... Don't tell Jason! 
 
It's our CEO Jason Kurtz's birthday today, and we're planning a surprise celebration! 
 
You know how he's always reminding us to ""make it happen""? Well, we're taking that advice to heart.
 
Let's play a game.
 
We want to wish Jason a happy birthday, but we don't want him to find out about this post too soon. 
 
So, comment below with your birthday wishes, but DON'T TAG JASON!
 
Let's see how long it takes for him to stumble upon this post amidst all the LinkedIn noise.
 
I'll start: Happy birthday, Jason! Thanks for inspiring us to think big, embrace challenges, and celebrate our wins together. From us all at Basware, have a fantastic birthday filled with joy and lots of cake! 
 
Now it's your turn! Wish Jason a happy birthday, but remember  DON'T TAG JASON! 
 
#HappyBirthday #DontTellJason",Not Customer Centricity
"I'm super excited to announce that I am a part of a new venture called the SisStore Joy Bookstore featuring Christian Black Women authors & artisans, and I would love to have your support. If you're in Houston, you can RSVP here for the April 13 grand opening: https://lnkd.in/gGpbRpSm Would love to see you there! The SisStore Joy Bookstore will also be available for shopping online very soon. Here's the link to the bookstore website (with much more coming soon!): https://lnkd.in/gMbWFxqW. We'd love to have you join the new Book Club Membership today!Follow our new Instagram account at https://lnkd.in/geY43_yY for news and updates. Thank you!",Not Customer Centricity
"""We connect brands to the consumers they seek, however they end up buying, however they end up engaging,"" notes Laura Desmond, CEO of Smartly.Listen YZ for a great chat with John Battelle, co-CEO of Signal360, and Laura  on the convergence of hashtag#AI, performance, creative and embracing technology for connection.Y https://bit.ly/3V8zIyPhashtag#worksmartly hashtag#advertising hashtag#adtech",Customer Centricity
