postContent,themes
"We're pleased to announce the CIRCULAR program aiming to achieve a circular battery supply chain through the development of innovative solutions(A) to regenerate materials and prolong battery service life, (B) to facilitate safe and fast disassembly of battery packs through modular designs, advanced materials, and reversible manufacturing methods for rework, repair, reuse, remanufacture, and recycling,(C) to develop cell-level sensing, data analytics, and battery intelligence systems to ensure safety, extend service life, and manage end-of-life of batteries, and (D) to develop technoeconomic, lifecycle, and circularity analysis tools to justify the adoption of these technologies and inform new business models.There is more to circularity than recycling! We are looking forward to reading your concept papers due on March 19, 2024.  Please, see the funding opportunity announcement for details.",Data and Analytics
Big news! Healthcare organizations can now trust that with Microsoft Fabric their data is protected by the most recent security and privacy standards in the industry.,Data and Analytics
hashtag#populationhealth requires an hashtag#integrated data platform to surface hashtag#insights that matter for hashtag#action. hashtag#microsoftfabric is that integrated data platform and now hashtag#microsoftfabric is HIPAA compliant! Protecting hashtag#PHI is #1 priority for hashtag#microsoft and our hashtag#customers.,Data and Analytics
"How to Measure the Cost Savings of Migrating Workloads from On-Premises or COLO to the Cloud?When it comes to migrating workloads to the cloud, the very first question the leadership (the CxO team) will ask is ""how to measure the cost efficiencies of moving the workloads to the cloud""?Please take a look/read my article below and let me know your thoughts.Note: This article reflects my personal knowledge and expertise and not the viewpoint of any organization or entities.hashtag#cloud hashtag#costoptimization hashtag#enterprisearchitecture hashtag#solutionsarchitect hashtag#dataanalytics",Data and Analytics
"10 months ago I was arriving Yto Montreal, to continue my career in Digital and Data in one of the best countries in the world Y Y. Lots of expectations, uncertainties, excitement, desires in my mind; that were not even close to what I have experienced until now; and is not even a year! I feel very fortunate to be able to experience international moves, and of course Canada was not going to disappoint! I need to recognize how lucky I am YTMbecause of the AMAZING GROUP OF PEOPLE I've arrive to work with ; leaders, colleagues and friends from whom I learn every day! a  New city, new culture, new house, new boss, new team""; it is an overwhelming experience. I believe people is the most complex but vital component to succeed in any work assignment or task, and I can certainly confirm if you manage to make it work; is because of the people you have around you hashtag#dreamteam An Verhulst-Santos Marc Dicko Patricia Li Sarah-Anne DUCREUX Myriam Tambe Luc Antoine Anne-Laure Quemard-Sardais Pascal Rosello Dominique Savard Sarah CA tA-Fournier, CRHA Maxime Petit Sandra P. HernandezLukas GaffiA Thomas Dussault Ousmane SidibA Beatrice Abillama Kate Catanzano Tiffany-Ann McNeil Charles DAsilets Farhan Samin Prionta Utkarsh Nagpal Andres Gonzalez Arcaya Constantina Roumeliotis Alban D. Sandrine HAlie Sonia ChangJulie Carbone Pierre Arnaud Yahya Vargas and more! I think now is the best time to be working in Data. I am very proud of all the acceleration and the transformation we are driving with our local Marc Dicko and global teams Asmita Dubey Olivier Girard Ludovic BAguA. Just last month has been a marathon of energy and time dedicated to upskill our teams and design the future of our consumer relations and value driven by DATA. We are ready and looking forward to whats going to come! Thank you team, Merci Montreal & hashtag#LorealCanada. I feel very much at home by now! Y YYai ",Data and Analytics
Any form of automation is super helpful when it comes to performance marketing & at HelloFresh we use Smartly Y3 check out the celebs in our team talk about it Duong Le Emiri Dandoy hashtag#digitaladvertising hashtag#performancemarketing,Data and Analytics
"""Moreover, McDonald's leverages data analytics to tailor its offerings, ensuring menu items and promotions resonate with customer preferences. Automation and AI in operations, such as kiosk ordering and kitchen management systems, streamline service delivery, enhancing efficiency and profitability.""",Data and Analytics
"This is the best summary of the current state of technology for clinicans that I have heard recently""""The area where technology can help clinicians the most is""workflow"" Workflows are sacred to clinicians. They need to be protected and optimized for each clinician. ""Technology is not going to diagnose the patient, technology is going to help us treat patients"" Tech is a tool like a scalpel is a tool. ""AI will help clinicians with cognitive burden. "" We need tools that keep us from having to remember 200 things about 20 patients each day. Great perspective and interview from Margaret Lozovatsky, MD, FAMIA Paulius Mui, MD Graham Walker, MD Vinod Dasa MD Dr Avneesh Khare Alexandre Lebrun Dr Dom Pimenta M.D. Dr Avneesh Khare Sarah Gebauer, MDEd Lee, MD, MPH Ryan Hess, MBA Jeremy Carroll",Data and Analytics
"This is the best summary of the current state of technology for clinicans that I have heard recently""""The area where technology can help clinicians the most is""workflow"" Workflows are sacred to clinicians. They need to be protected and optimized for each clinician. ""Technology is not going to diagnose the patient, technology is going to help us treat patients"" Tech is a tool like a scalpel is a tool. ""AI will help clinicians with cognitive burden. "" We need tools that keep us from having to remember 200 things about 20 patients each day. Great perspective and interview from Margaret Lozovatsky, MD, FAMIA Paulius Mui, MD Graham Walker, MD Vinod Dasa MD Dr Avneesh Khare Alexandre Lebrun Dr Dom Pimenta M.D. Dr Avneesh Khare Sarah Gebauer, MDEd Lee, MD, MPH Ryan Hess, MBA Jeremy Carroll",Data and Analytics
"Y Defense tech is one of the hottest sectors in VC right now. Here's why:"" The U.S. is updating its defense strategy to use cutting-edge technology against growing adversarial threats, emphasizing the need for innovative protective solutions."" Despite large IT investments, government tech is outdated, prompting moves like the ""DoD Software Modernization Plan"" to gain a defense edge with new software."" Rising global threats and a focus on tech are driving more defense spending, especially in IT and cybersecurity."" Better pay and an innovative culture in the private sector attract top talent from federal roles, benefiting defense startups with skilled experts for custom solutions.While the potential for groundbreaking impact in defense tech is exciting, navigating the complex and highly regulated defense procurement landscape requires creativity, influential relationships, and persistence. For startups, it's not just about entering the conversation, but also successfully navigating DoD selling and contracting.For a deeper dive into observations and the opportunities in defense tech ahead, check out our latest blog: https://lnkd.in/gzV9cw5U Please let us know what you think in the comments below.CC: Alex Lehman & Adam Liuhashtag#DefenseTech hashtag#VentureCapital",Data and Analytics
"Just in on the OpsStars Podcast! Ys  Keith Jones Ys Y""aTMi , GTM Systems Lead at OpenAI, joins Y Don Otvos to dive into the importance of community and connections, the role of AI in sales and revenue operations, and managing processes in a fast-paced environment.Check out the full episode. YApple Podcasts: https://bit.ly/48p1EkQSpotify: https://bit.ly/3I7hPbYhashtag#opsstars hashtag#revopsinsights hashtag#openai",Data and Analytics
https://lnkd.in/emAjWFtA,Data and Analytics
"Dinesh Keerthi, MSEE, MBA at St. Jude Children's Research Hospital sharing their BMT data architecture and workflows. They have Epic data (for clinical care), legacy Cerner Corporation data, STEMSOFT Software data (for CTL product lifecycle management, patient clinical data management and CIBMTR reporting), and other sources feeding into Microsoft Azure Synapse, with PowerBI providing analytics.Dinesh calls for a BMT Common Data Model which would enable interoperable analytics.ASTCT & CIBMTR (Center for International Blood & Marrow Transplant Research) hashtag#Tandem24 IT & Informatics Track.",Data and Analytics
"Valuable Insights from the 2024 Chief Data Officer Healthcare Conference in Fort Lauderdale.Knowledge enriching to meet data and analytics leaders across healthcare organizations to discuss key industry challenges and opportunities.Major themes included:- Overcoming data silos and liberating data to improve patient experiences- Building cloud frameworks focused on security, compliance and resilience- Leveraging AI and machine learning responsibly to transform care- Ensuring smooth cloud migrations and avoiding pitfalls - Fostering a data-driven culture and influencing leadership- Navigating staff shortages with data-based demand forecasting- Setting ethical AI strategies for integrity and success I also greatly valued the peer knowledge exchange and best practices around topics like data & AI governance, breaking down silos, cloud interoperability, quantifying AI ROI, and envisioning the data-powered future of healthcare. Apparsamy Balaji Holly Hallman, MBA Shahidul Mannan, MBA Kerri Webster Rasheed El-Moslimany Pinkrose Hamilton Sanjay Pathak, (PhD) Mark Mossel Rupa S. Pey Wen Lim Patrick Stevenson, MBA, PMP, CHCIO, CCSFP Nidhi Goel Prasad N. Vikas Wali Dinesh Kumar Kiran Mysore Drew Smith, MBA Amy Ming, EdD, MBA, RN, PMP Menaka N. Rev Sellappan Erin Pelletier hashtag#cdo hashtag#CDOHealthcare hashtag#ai hashtag#iqpc IQPC Exchange Josh L. Caroline JacklinGrant Nelson",Data and Analytics
"So there's this new tool out there called Motif Analytics. To the extent that I understand it (which, you know, minimally), it's like regex for event data. They created a very specialized language for manipulating and analyzing events, so that you don't have to write some god-awful SQL query full of self-joins and window functions to figure out how often thing X happens after thing Y, without thing Z happening in between. SQL could do this, of course, but the writing a query like that would be long, tedious, and easy to mess up. Motif, by contrast, is precise and compact. If you knew how to use Motif - even if you didn't know it that well and had to frequently look up its syntax when you used it - it would be pretty silly to think, ""eh, forget it, I'll just use SQL instead, the queries are huge and I get them wrong all the time, but at least I don't have ever Google how do to anything."" The thing is, ever since ChatGPT came out, that's basically what we're trying to do to SQL itself? There are tons of companies and products that promise to replace SQL queries with English questions. But, English is to SQL was SQL is to Motif: A more verbose, more tedious, and less precise language that often makes doing a job *harder.* Imagine trying to describe some multi-step SQL query in English - or even just instructing a bot on how to do a join without using the word join. It'd be a nightmare. For fancy analyses, SQL isn't a necessary evil that computers need to understand us; it's a useful virtue that we need to tell computers what we want. So like, yeah, SQL chatbots are cool and all, and I'm sure one day they'll get quite good at writing SQL. But I'm not sure we'll ever want that, not because computers will need SQL to query a database, but because we won't be able to express ourselves in English.",Data and Analytics
"Diffusion can ""render"" algorithms. It implements a maze traversal algorithm purely from pixels, by literally painting a red line from the beginning position to the end on a maze.Very interesting experiment. I always think of diffusion as a renderer, and transformer as the reasoning engine. It seems that the renderer itself can encode very nontrivial, iterative algorithms too, even with the U-Net neural architecture that's far weaker than transformer for sequence learning.This particular experiment uses a flavor called ""Discrete Diffusion"": https://lnkd.in/gQkM25vYSource: https://lnkd.in/gmExxsqx",Data and Analytics
"Ys Don't let your files get out of hand!Stay organized in your development process with these tips from Andy McDonald. In his article, he shares ways you can structure your Streamlit apps: https://lnkd.in/grxYmQjg hashtag#python hashtag#code hashtag#developer",Data and Analytics
"I am pleased to announce the launch of our Craig H. Neilsen Foundation funded project website on accessible housing for the hashtag#spinalcordinjury community. This project is being done in partnership with Spinal Cord Injury Ontario where we are exploring the accessible housing needs of people with spinal cord injury / dysfunction (SCI/D). With this data, we will then work with the SCI/D community to co-design a housing tool-kit to provide knowledge and resources on accessible housing. It is early days in our work here at our St. John's Rehab Research Program at Sunnybrook but look forward to seeing the website grow over time to become an educational resource on accessible housing. https://lnkd.in/gdPcfnWc Grateful to our amazing team supporting this work - Kirstin Yuzwa, peter Athanasopoulos, Chester Ho, Sara JT Guilcher, Krista Best, Anita Kaiser, Vanier Scholar, Christine Sheppard, Vanessa Noonan, Sarmitha S., Eva Cohen, Jeremie Larouche, Julie Sawchuk, Nikoletta Erdelyi",Data and Analytics
"I am passionate about diversity in technology, and I'm happy that Google has announced Google Cloud Launchpad for Women! This is a no-cost, three-week training and certification program designed to equip women of ALL skill levels and functional areas with the expertise and knowledge needed to drive digital transformation at your organizations.This program addresses a critical opportunity to increase female representation in the cloud: women currently hold only 14% of roles in the global cloud market. Please register today!",Data and Analytics
"E-commerce thrives, yet brick-and-mortar stores persist and innovate. Our attendees joined Stephen Ma, Chief Architect at Walgreens who led a riveting  workshop sharing his insights on Walgreen's approach to modernizing edge strategy and evolving Enterprise Architecture to meet modern demands. hashtag#MillenniumLive",Data and Analytics
"Hot off the presses! Sumo Logic unveiled Flex Licensing a first-of-its-kind log analytics pricing plan that offers free, unlimited log data ingest removing common cost barriers around hashtag#analytics so developer, security and operations teams can capture and analyze critical data across their enterprise. hashtag#DevSecOps hashtag#loganalytics",Data and Analytics
"Great transparency from Anthropic sharing the system prompt of the current API of Claude. It helps us understand why it works the way it does.My assumption why the generated text sounds much more human than previous systems:#1 it's more heavily trained on human qualitative annotation (RLHF)#2 the system prompt says ""the way a highly informed individual would"" + gives it a human name (""Claude"") which leads the system to pick the answers with the highest probability of sounding human.Would be super cool for the community to be able to research & explore more of what makes a chatbot sound more or less human (which is a different metric than how accurate it is by the way).",Data and Analytics
"When we get to AGI, it will have come slowly, not overnight. A NeurIPS Outstanding Paper award recipient, Are Emergent Abilities of Large Language Models a Mirage? (by Rylan Schaeffer,  Brando Miranda and  Sanmi Koyejo) studies emergent properties of LLMs, and concludes: ""... emergent abilities appear due the researcher's choice of metric rather than due to fundamental changes in model behavior with scale. Specifically, nonlinear or discontinuous metrics produce apparent emergent abilities, whereas linear or continuous metrics produce smooth, continuous, predictable changes in model performance."" Public perception goes through discontinuities when lots of people suddenly become aware of a technology -- maybe one that's been developing for a long time --  leading to a surprise. But growth in AI capabilities is more continuous than one might think. That's why I expect the path to AGI to be one involving numerous steps forward, leading to step-by-step improvements in how intelligent our systems are.",Data and Analytics
"Even CISA has been hacked through their Ivanti VPN servers.If you have Ivanti or other legacy VPNs that are actively targeted by very bad actors, you are well-advised to assume breach, begin mitigation and move to an end-to-end zero trust solution that will provide access like a VPN or VDI but also make your enterprise more secure.",Data and Analytics
"The zY  s ZYYz (Z) role emerged in the early 2000s as companies recognized the need for a dedicated executive to lead their digital transformation efforts. The role was created to help organizations navigate the rapidly changing digital landscape and effectively integrate technology into their overall business strategy. According to PwC, YY% of public firms now have a CDO, up from Y% in 2014.  Yet, according to NewVantage Partners | A Wavestone Company, YY% of data-intensive firms have a CDO in place.  This data shows the importance and  urgency that companies are placing on data and managing a digital strategy.  Yet, at the same time, the process has been slow:"" Only sY  of CDOs are able to drive innovation using data."" Just YYZ%  of CDOs manage data as a business asset."" Roughly YY%  of CDOs have succeeded in creating a data-driven organization."" About YY%  of CDOs have no single point of accountability for data within their organization."" Only YYZ%  of respondents said the CDO role is successful and established within their organization. 2     s2 Z Ys? Y. s  Y  z zY  "" Anytime a new type of role is created in the industry, everyone is bound to have a different interpterion of what it means.  As this role is often designed to be disruptive, it is important to establish clear responsibilities, priorities, and boundaries.Y. z s 2 s z z "" Without adequate resources and authority, CDOs may be unable to effectively execute their digital strategy and drive digital transformation within the organization.Y.       Y zzs  "" Digital transformation initiatives are almost always massive changes for a company.  CDOs often face resistance from employees who are resistant to change and unwilling to adapt to new technologies and ways of working.Y. YY2  ss     s3s s   "" CDOs can struggle to bridge the gap between different departments and break down silos that prevent collaboration and information sharing.Y. z z z szsz "" Whenever you create a new role for the first time, you're ultimately taking away an area of responsibility of someone else, usually the Chief Information Officer (CIO) in this case.  Is this new position welcomed or feared by other executives?s  z:https://lnkd.in/eu3aiHnFhttps://lnkd.in/eNeERKmb********************************************"" Follow hashtag#JeffWinterInsights to stay current on Industry 4.0 and other cool tech trends"" Ring the Y for notifications!",Data and Analytics
"HHS Release regarding Change Healthcare"". Concerning to say the least !!hashtag#revenuecyclemanagementhashtag#healthcarefinancehashtag#HHS",Data and Analytics
"aRAG demos are easy. RAG in production is much harder. Why is it so?Recently I wrote about Retrieval Augmented Generation (RAG), the technique that enables enterprises to leverage the power of large language models (link in comment ).Many companies have experienced that their technology teams are able to demonstrate the use of RAG quite rapidly. However, when the time comes to put the solution into production, they face difficulties. The users do not accept the solution easily and many don't think it adds a lot of value.We will first see why the demos are easy and then reflect on the challenge of productionising RAG.Why are RAG demos easy?Y Simple architecture: The principle of RAG is quite simple to understand. In the basic RAG pipeline, there are very few components: vector database, source chunking, vector matching and LLM interface. It is easy for engineers to understand the architecture.Y Framework availability: To make matters simpler, helper frameworks such as Langchain and LlamaIndex are available. They come with built-in support for chunking, vector databases and LLMs. It is possible to build an RAG pipeline by writing a few lines of code, if you are using one of these frameworks. The initial results of such a pipeline are very impressive, mainly because of the language abilities of the LLMs. Thus great demonstrations can be built quickly with RAG. YYNow we will see why using RAG in production is challenging. Y Correct but not comprehensive: For simpler questions, the replies are often satisfactory. However, when complex questions are asked, the users find the answers correct, but not satisfactory. They feel that the reply covers only basic aspects, but not what they really needed.Y Source requirements: In order that RAG works, the necessary knowledge sources should be added to the vector index. It takes a lot of effort to judge the requirements of users and accordingly build the index. It does not stop here. The index must be forever updated with current information.Y Easy to add, difficult to remove: Once a source is added to the index, it starts influencing the answers. Many times, multiple sources contain conflicting information (for example, old and new price list). The answers in this case become unreliable.Y Data privacy: The quick RAG implementations typically use an external LLM api such as OpenAI or Google. In such cases, the internal data of an organization is sent to the outside world; creating a possibility of data privacy issues.Y Latency: As the index size grows, it takes a long time to select the right material for a query. This is unacceptable for real time use.Overcoming these challenges involves building a more complex pipeline. I will describe that in a later post, but here are some techniques that can help: reranking, knowledge graph, internal models, trust layers.hashtag#llm hashtag#retrievalaugmentedgeneration hashtag#aiinbusiness",Data and Analytics
" We are thrilled to announce a #partnership between the American Medical Association's Physician Innovation Network and Microsoft for Startups. ""The collaboration between the AMA Physician Innovation Network and the Microsoft for Startups program, extending the reach of the PIN to all startup founders in the Microsoft for Startups Founders Hub, exemplifies shared commitment to fostering #innovation and is a testament to our shared dedication to advancing #healthcare.""

 Just like Founders Hub, PIN is now open to any #founder in the program. Whether startups want to collaborate with #industryleaders or learn from healthcare #experts, PIN provides a unique space for #connection and innovation.

Kerry Amato, CAE, Lori Prestesater Amanda Azadian Stacy Lloyd Tom Davis Ted Roduner Cecilia D. Microsoft for Healthcare

#startupsuccess #startupjourney #healthcareinnovation #healthcareinnovators #healthcareonlinkedin",Data and Analytics
"DI Squared is a proud partner of Mail & Deploy, the ultimate reporting tool for ALL THINGS QLIK. Made to meet the specific reporting needs of every single decision maker in your company. ""If centrally scheduling, generating, and delivering custom reports through a variety of sharing channels is something you are looking to implement, please reach out to Ross Conrad or Brittany Madge hashtag#DISquared hashtag#BusinessSolutions hashtag#Innovation hashtag#DataIntegration hashtag#DataAnalytics hashtag#Qlik hashtag#DataStrategy hashtag#Mail&Deploy",Data and Analytics
"2024 is our year for implementing care redesign programs across our hospital system. Our goal is to have ambient intelligence cameras in every acute care patient room and remote monitoring devices on all patients staying in an inpatient bed with plans to send them home with the device to continue monitoring in the outpatient setting. 

We know that we are bullish about innovation and sometimes implementing new technology in a hospital setting feels like trying to get your kids to eat their vegetables, but we have seen amazing results once we get through the change management hurdle. 
 With predictive analytics, the AI tools are 75% more accurate at projecting a patient's discharge date compared with our nurses' predictions alone. 
 With virtual nursing, we have been able to eliminate all contract nursing positions and add a fresh set of eyes to the patient floors which has led to great catches in discrepancies. 
 With ambient intelligence, we have seen a 15% increase in our OR capacity without adding any new staff members. 
 With remote monitoring, we have reduced telemetry needs and moved labor from one skillset to another. 

During our first 2024 Innovation Open House session last week, we hosted 20+ attendees from 7 healthcare organizations across the country. We would love to have you join us for future sessions. Please complete this short form if you are interested and we will be in touch https://lnkd.in/gAy-fiE7 ",Data and Analytics
