postContent,themes
"A huge thank you to mender, our silver sponsor, Impact Video, and VIP Reception Sponsor for their exceptional contributions that played a pivotal role in the resounding success of the Tech Allies presents Technology Ball 2023 Gala.The bourbon tasting was a tremendous success, and the late-night snack was a delightful touch! Your support and partnership are deeply appreciated. Kent Taggart hashtag#gala hashtag#silversponsor hashtag#techallies hashtag#partners hashtag#VIPExperience",Not Data and Analytics
"Kim Beachley, SPHR, SHRM-SCP  is #hiring. Know anyone who might be interested?",Not Data and Analytics
Yep. New York Magazine has got it right.NYC is back!!!Thanks Phil Guarascio !,Not Data and Analytics
"Amazing news from Dallas! This year's DallasCIO Orbiee awards had an impressive 270 nominees, all amazing talents in their fields. These thought leaders have made significant contributions to the Dallas community and businesses. It's an honor to have been among the 32 finalists, and I want to congratulate the outstanding and inspirational winners this year. Well deserved! #DallasCIO #OrbieeAwards #DallasCommunity #ThoughtLeaders #Humana",Not Data and Analytics
"Listening is a core aspect of leadership but many people in leadership positions don't listen, they may be hearing, but they are not listening. To become an effective leader, you must close your mouth sometimes and truly listen to your team.You should never be too busy to listen because it's the ultimate form of respect anyone can give to another human being. Check out our new Amazon Best Seller, ""Unlock The Hidden Leader, Become The Leader You Were Destined To Be,"" by simply clicking the link below.https://geni.us/4JmlQUhashtag#leadership hashtag#management hashtag#leadershipdevelopment hashtag#employeeengagement hashtag#leaders hashtag#people hashtag#leadershipfirst hashtag#leadershipfirstquotes hashtag#executivesandmanagement hashtag#inspiration hashtag#giffordthomas hashtag#entrepeneurship",Not Data and Analytics
"I'm happy to share that I've been promoted to Senior Vice President, Head of Private Company Relations at Forge!",Not Data and Analytics
"Today will surely be a highlight in my life. I was honored to share a flight sitting next to a true legend! hashtag#genekranzGene Kranz, the iconic NASA Flight Director, continues to inspire generations with his remarkable leadership and unwavering dedication to excellence. From Apollo 13's ""Failure is not an option"" to ""Spaceflight will never tolerate carelessness, incapacity, and neglect,"" Kranz's quotes resonate with the essence of leadership in any field. Sitting beside Gene Kranz on a recent Southwest flight was an unforgettable experience. His stories and wisdom left me in awe, and I couldn't help but reflect on the immense impact he has had on space exploration and beyond. NiSource hashtag#GeneKranz hashtag#Leadership hashtag#Inspiration hashtag#Legacy hashtag#Apollo13 hashtag#nisource",Not Data and Analytics
"Last week I joined Carol Massar and Romaine Bostick, CFA on Bloomberg TV at #MIGlobal. We discussed where Blackstone is seeing investment opportunities. We also spoke about Blackstone Career Pathways, the firms signature hiring program aimed to broaden the talent networks from which our portfolio companies recruit. Most importantly, I was thrilled to hear Romaine is a loyal customer of Rover.com  one of our most recent investments. Thanks for having me on the show!",Not Data and Analytics
"Congratulations to Buddy Hickman, Chief Digital and Information Officer, on being named to Becker's Healthcare Hospital Reviews 133 CIOs to Know list. 

A past board chair for both CHIME and HIMSS, Hickman joined Roswell Park in January. Already, he and his team have delivered a major enterprise network upgrade to benefit patients, clinicians and researchers. 

An industry speaker, author and mentor in the digital health leadership sphere, Hickman has served the health industry as a CIO for more than two decades, including roles at Ernst & Young and PWC.",Not Data and Analytics
This is what it looks like when you have successful partnerships !,Not Data and Analytics
"Caught a glimpse of the clean energy future in Quebec City this weekend, with my friend Elizabeth Mahony, on a green hydrogen-powered train""ride couldn't have been smoother!",Not Data and Analytics
"The AGA DC Nominating Committee is proud to announce that we recently selected two new leaders for the upcoming program year! Crystal Wolf will be serving as the Chapter President-Elect beginning on July 1, 2024, and her presidency will begin on July 1, 2025. Crystal has provided services in finance optimization, governance, risk and control, and compliance for various Federal agencies, including the government's largest loan and grant programs to support families, students, and small businesses across the country. Crystal is a proud CGFM and has been a part of the DC Chapter since 2007 and has been serving as the Chair or Co-Chair of the Member Services Committee since then. Under Crystal's leadership, the DC Chapter consistently puts on sold-out networking events throughout the year as she's looking for new and creative ideas to bring Chapter members together and also connect with other local chapters. Crystal also actively participates in various national and local chapter activities, including participating and moderating training sessions, leading surveys and thought leadership development, and attending the AGA LEAD. We are excited for Crystal to bring her vast AGA experience to this important role!  Wendy Allen was selected to serve as the Treasurer-Elect, also beginning on July 1, 2024, and will support Mona Amatie when her term as Treasurer begins on July 1, 2024. Wendy is a Managing Director in KPMG's Federal Audit Practice. She has over 28 years of accounting experience, including 20 years providing professional audit services to the Federal government. Wendy has been a member of AGA DC Chapter for more than 16 years. As a CGFM herself, Wendy has served on the DC Chapter's CGFM Committee for four years to support our members to pursue the CGFM certification. Her leadership as the CGFM Committee Director led our Chapter to win the national CGFM Chapter awards for multiple years. Wendy has been serving on our Chapter's Strategic Direction Committee since 2020. Wendy leads the Chapter's various survey planning, execution, and analysis efforts, which are critical work for our Chapter to meet the National Association of State Boards of Accountancy (NASBA) requirements in providing CPEs for our luncheon program and to analyze our members' satisfaction with our Chapter's events and programs. Wendy also leads the Chapter's annual operating plan development efforts and currently serves as one of the appointed Chapter Directors.  Please join us in congratulating and welcome our new leaders! AGA DC Nominating Committee -Lal Harter, CICA, Chapter President -Paul Marshall, CPA, PMP, Chapter President-Elect (Nominating Committee Chair) -Caitlin Holmes, CPA, National Council of Chapters Representative and Past Chapter President (2022-23) -Paul Lionikis, Senior Advisor and Past Chapter President (2020-21) -Frank E. Petersen, III, Monthly Luncheon Program and National President-Elect -Thomas Chin, Newsletter and Chapter Director (Appointed)",Not Data and Analytics
I'm happy to share that I'm starting a new position as VP of Product & Customer Success at Ottometric!,Not Data and Analytics
"Were thrilled to share that APCOs Senior Packaging Technologist Rebecca Kersey is a finalist for the 2024 Women in Packaging Awards. 

Rebecca has been nominated in the Packaging Technology Leader Category which celebrates demonstrated exceptional expertise and contributions as a packaging technologist, that has had a significant impact on the Australian packaging industry.

At APCO, were proud to have a team of experienced professionals making a difference.

Help us congratulate Rebecca in the comments below. 
 
#womeninpackagingawards PKN Packaging News",Not Data and Analytics
Addressing the underlying issues instead of merely the surface problems can lead to more meaningful change. We believe in addressing root causes to implement sustainable solutions. hashtag#operationalexcellence hashtag#implementation hashtag#consultingservices,Not Data and Analytics
" It's my 3 year anniversary with JBT!  Thank you to all my wonderful colleagues who make every day the best day.  To all the incredible candidates I meet on their #journeywithjbt and the new colleagues I welcome into the business each year ... thank you, thank you, thank you! #talentacquisition #engineering #manufacturing #hiring #candidateexperience 
 check out our JBT HOT JOBS  at https://careers.jbtc.com/",Not Data and Analytics
"With Love and Gratitude: My Farewell to EPAM Family TM After four unforgettable years, it's with a heart full of gratitude that I bid farewell to my beloved EPAM Systems.To My Dear EPAM Family,From day one, I felt something truly special. EPAM isn't just a company; it's a vibrant community of brilliant minds and passionate hearts dedicated to excellence, and I owe a debt of gratitude. To My Dear Clients and Partners,Thank you for entrusting me with your visions, and aspirations. Collaborating with you has been an honor. Together, we've brought ideas to life and witnessed the impact of our collective efforts. I'm deeply grateful.Special Thanks:Regina, your belief in me has been a guiding light since 2019, and your unwavering support has been a source of strength through every challenge.Elaina, you've been my steadfast supporter and mentor. Each interaction with you was a masterclass in wisdom and inspiration.Max, your leadership has been a lifeline. I'm grateful for your unwavering coaching.Valentin, appreciate you always being there for me, and your support to my crazy ideas. Arkadiy, your down-to-earth leadership and vision have profoundly shaped my journey. Your entrepreneurial spirit has inspired us all and created a legacy that will endure for generations to come.Midwest Business Unit, Thank you for being an amazing team! Your warmth, and support have been the heart of our journey. Boris, Jorg, Antanina, Volha, Yuliya, Vlada, Tatiana, Anastasiya, Darya, Vinod, David, Troy, Kristina, Andrew, Tara, Dave!And million thanks to my partners in crime: Antanina, Vasiliy, Boris, Roman, A. Haletski, Maksim, Ihor, Ilya, Konstantin, Jos, Siarhei, Viachaslau, Artsiom, Aditya, Sai, Aleksei, Stan, Zsolt and many more! With boundless love and appreciation,P.S. I will be thrilled to share my upcoming adventure soon!Warmest regards, Ali Emir",Not Data and Analytics
"After 8.5 rewarding years, I am moving on to new opportunities. It's with a heavy heart that I leave behind the amazing people I have worked with at Ball. I will forever cherish the memories and experiences I've gained during my time at the company. But, I am excited about my new role and the challenges it will bring. Thank you, Ball, for an incredible journey!",Not Data and Analytics
"I'm thrilled to announce that I have accepted the role of Executive Assistant to the Executive Team at Soleo Health! I'm excited to be part of such a dynamic and innovative company, and I look forward to contributing to the growth and success of the organization.",Not Data and Analytics
"Last week, together with Joanne Cooper, Oriane Lacaze, FrAdAric Lenoble and Paul Chapman, we spent great three days with our Central & Eastern Europe (CEE) Team Haleon in Warsaw.We had a well-balanced agenda, with quality time to discuss latest achievements, engaging sessions with each of the CEE Clusters focused on key 2024 opportunities, as well as a few informal occasions to have powerful conversations with CEE colleagues.Several things impressed me, such as how CEE high quality of data and deep analysis can build and inform strategic plans, and how much the team progressed on driving commercial agenda. It was great to do some store checks to see our perfect ""on shelves execution"", and witness how Dare2Grow mindset continues to drive CEE team forward, to break down barriers and turn them into opportunities.I'm reassured of the CEE plans and ambitions, impressed with your courage and empowerment. Thank you for your hard work and dedication. I greatly appreciate all your big and small contributions to deliver better everyday health to CEE consumers and to @Haleon's growth in the EMEA LATAM region.hashtag#HaleonCEE hashtag#TeamWork hashtag#Diversity hashtag#ForHealthWithHumanity hashtag#Dare2Grow",Not Data and Analytics
"I'm happy to share that I'm starting a new position as Assistant Director - Environmental Sustainability and Resiliency at New York City Mayor's Office of Management and Budget! I'm really looking forward to working with Lia Cairone, Kara Kirchhoff, and the strong team they have assembled!",Not Data and Analytics
"Truist Wholesale Payments had a packed house earlier this week at the Nacha Smarter Faster Payments Conference in Miami! Our topic was The Need for Speed in the Evolving Payments Landscape and was presented by our own Michelle Ziolkowski and Chris Scott who shared with our client of how businesses of any size can optimize their payment rails. It was a great discussion that shows that Truist Wholesale Payments is leading the change for payments delivered with simplicity, speed and safety!",Not Data and Analytics
"It's official! I am beyond thrilled to announce that I have accepted a new role as Manager, Regulatory Support and Consulting, Division of Research for Kaiser Permanente of Northern California.I am looking forward to meeting my new colleagues and together forwarding the truly remarkable research portfolio of such a renown organization. California dreams do come true!",Not Data and Analytics
"Attention South Florida CISOs and Cybersecurity leaders.  It's that time again, I will be hosting another one of my Executive Leadership Dinners.  This time locally in the Miami area on 2/29 at STK Miami Beach.  We will be gathering a small number of leaders for an insightful discussion and a little fun.  We have arranged for a Bourbon tasting that night as well.  We already have an incredible slate of leaders confirmed but I have a FEW more spots.   If you are interested in joining, please DM me directly.  To those who have already confirmed I look forward to seeing you all on the 29th.hashtag#CISO hashtag#Identity hashtag#PAM hashtag#BuildingCommunity hashtag#SouthFlorida hashtag#cybersecurity",Not Data and Analytics
"After an 18-month hiatus spent refreshing my ""beginner's mindset,"" advising and mentoring executives and start-ups and tackling personal learning goals ranging from ESG to blockchain to kitesurfing, I have exciting news"" I'm returning to HP as Senior Vice President and Managing Director for North America!I'll be back doing some of my favorite work: innovating and leading market strategy, accelerating services and subscriptions, collaborating with and developing our amazing employees, and driving hashtag#FutureReady growth and experiences for our partners and our customers.Thank you to Stephanie Dismore for your incredible work in this market and for the smooth transition. Looking forward to working alongside David McQuarrie, our amazing North America team and our hashtag#channel partners!",Not Data and Analytics
"Behind every strong woman is a story that gave her no choice and a circle of supporters that lifted her up and said ""yes, you can.""I'm blessed with a network that imagines a gender equal world. A world free of bias, stereotypes, and discrimination. A world that's diverse, equitable, and inclusive. A world where difference is valued and celebrated. Thank you to the strong women in my life who support me fiercelessly, endlessly, no matter the time of day or night. Thankful for the women in my life who celebrate my accomplishments, guide and lift me up through failures and no matter what life throws at me. Thank you to the men who are champions for women, who lift us up, support our careers, and ensure we have a seat at the table. Happy hashtag#InternationalWomensDay! The world, and my world, is better because of you. Yhttps://lnkd.in/eeZ_5N3Dhashtag#InspireInclusion hashtag#HypeWomen hashtag#SheForShe hashtag#HeForSheJen Horonjeff - ""Ask Patients"" Jennifer Goldsack Jane Sarasohn-Kahn Adrienne Boissy Jill Feldman Terri Conneran Andrea Downing Liz Salmi Deven McGraw Lygeia Ricciardi Meg Barron Grace Cordovano, PhD, BCPA Shereese Maynard, MS, MBA She/Her Joy Rios India Williams Valencia Robinson Shamekka Marty PMP, CSM Mariann Yeager Lucia Savage Kat McDavitt Lisa B. Lisa VandeVrede Laura Adams Kimberly Richardson Stacey Tinianov, MPH, BCPA Stacy Lloyd Kerry Amato, CAE Suchi Saria Aafia Chaudhry, MD, MBA, MS Ritesh Patel John Lynn Joe Babaian Colin Hung Rasu Shrestha MD MBA Steven Lane, MD, MPH Kirk L. B. Stephen Konya Christopher P. Boone, PhD Edmondo Robinson Amy Gleason",Not Data and Analytics
"We are proud to announce that Optum President, Heather Cianfrocco, has been recognized as one of Fortune's Most Powerful Women in Business for 2023. Congratulations, Heather! YYTM hashtag#TeamUnited",Not Data and Analytics
"Pantomath is doing for data engineering what DataDog, Dynatrace, AppDynamics, SumoLogic, and ELK have done for software engineering for the last decade; providing game changing observability to a new and emerging data engineering category! Our team is solving technical puzzles at scale, building elegant user experiences, secure deployment models, multi-tenancy, containerized micro-services, and graph data modeling. If you're looking for an amazing team with high agency, access to cloud-native technology, and a time compression algo for professional growth, connect with me here or apply at our careers page below:",Data and Analytics
"A powerful wealth management solution based on a global FIX network, global master data for instruments and legal entities but also live prices (real-time & delayed) for hundreds of exchanges - all designed in Switzerland as a SaaS. Can it get any better? hashtag#wealthmanagement hashtag#madeinswitzerland Ludovico Niccolini",Data and Analytics
I am featured in this article on Edge Computing!,Data and Analytics
I am featured in this article on Edge Computing!,Data and Analytics
"Please join me, Conor Colleary from oracle financial services and Michael Senuta from PNC in Oracle CloudWorld in Las Vegas #OCW23. 

https://lnkd.in/gZ2by96Z",Data and Analytics
"LLM fine-tuning would become to one of the necessary skills in the next year of data science.So, this is how to fine-tune your Llama2 model:https://lnkd.in/eZSkiaeXand this is how to fine-tune your OpenAI chat model:https://lnkd.in/eejg4vfP",Data and Analytics
"Digital Lakes....committed to highlighting Michigan as a technology hub - attracting and retaining top tech talent across industries for the vitality of our companies and economy!!!  If you haven't checked it out, you should!! https://digital-lakes.org/",Data and Analytics
"The potential for hashtag#AI to transform U.S. hashtag#healthcare has been discussed for over a decade but has yet to deliver the kind of broad-based results the industry desperately needs. I am optimistic that will soon change.  For the last four years, my team at Health Data Analytics Institute (HDAI) has been hard at work on building a platform, HealthVision,  that uses machine learning and generative AI to give clinicians the information they need to make better clinical decisions. Here are some of my key takeaways from working on making AI usable for clinicians:- Clinical AI can now be deployed at scale: HealthVision is in production at Houston Methodist, fully integrated with Epic, and will eventually be accessible by thousands of clinicians assisting with a wide range of use cases.- Generative AI fills gaps in previous AI technologies: Generative AI can process raw clinical notes to produce structured data that can be ingested by predictive models in near-real time. This enables continuous updating of patient risk profiles as their care progresses.  - AI turns data complexity into actionable simplicity: HealthVision distills hundreds of pages of medical records into ONE PAGE that presents a holistic and prioritized view of patient risks. On October 8th at 3:40pm PT, I'll be presenting with Roberta Schwartz at hashtag#HLTH2023 about putting data-driven insights into the hands of clinicians and care teams. Our collaboration with Houston Methodist is one of the largest deployments of generative AI within healthcare today. Please join us: I'm eager to share our experience "" and to hear what you're working on in this industry sea change.",Data and Analytics
"Data & AI is core to our success at Whirlpool Corporation. We just completed our inaugural hashtag#WhirlpoolAtlasDataAISummit2023 enabling 3000+ hours of learning in one day to accelerate our digital journey across the company with applied data & AI products. 

Thanks to hashtag#whirlpoolpeople around the world and our partners/speakers for their support Yusuf Abbasi Danielle Brown Andy Walter Priya Srinivas Juliano Pavanelli Stefanovitz Devon Voster, Ph.D. Prashanth H Southekal, PhD, MBA, ICD.D Jennifer Springer Radhakrishnan Kodakkal Frederic Laluyaux Aaron Youngstedt Aiya Reed Pravallika Yemba Peter Kirer Traci Robinson Fallon Nyce Rebecca Steketee Christine Grammier Nicole McKeith Nash Bryan Stiekes Zach Cardwell Winnie Wu Scott Fleming Natalia Isaevich and the organizing team.",Data and Analytics
ICYMI:  Check out our Predicting Outages Digital Event with these industry expert presenters and learn how predicting outages is transforming hashtag#gridreliability and hashtag#wildfire risk mitigation.View it here: https://bit.ly/46ieKjOhashtag#GridTransformation hashtag#GridModernization hashtag#DataDrivenDecisions hashtag#ActionableInsights hashtag#AdvancedAnalytics hashtag#PredictiveAnalytics,Data and Analytics
"I'm passionate about the idea that AI should play a role in improving health and patient outcomes "" that's why I founded Health Data Analytics Institute (HDAI). We knew that data had to be simple and actionable to actually be useful. Our HealthVisiona product converts hundreds of pages of complex data into a single page that tells providers what they need to know about a patient. It was a pleasure to present our story at hashtag#HLTH2023. Thank you to Roberta Schwartz and the Houston Methodist team for sharing both the stage and vision for AI's role in healthcare with us.",Data and Analytics
"In a recent article, my colleagues Cedrik Kern and Oliver Rueckert dive into the transformative journey of agriculture through the lens of AI and data. They discuss the realm of precision agriculture, where the power of AI is harnessed to enhance yields, enrich decision-making, and enable sustainable practices. Though the journey to becoming data-driven has its complexities for farmers and agribusiness companies, the article offers insightful stories from organizations such as the Royal Swatini Sugar Corporation and KWS, portraying the successful embrace of data-driven solutions. The article is  a call to trust in the use of data and AI to catalyze unprecedented agricultural advancements. Read the full article for a deeper understanding of how data-driven and AI technologies are fertilizing the future of agriculture. hashtag#AI hashtag#Agriculture hashtag#DataAnalytics hashtag#Innovation hashtag#Sustainability.",Data and Analytics
YDeveloping a data-driven understanding of customer needs YZ Creating collaborative campaigns to target brand awareness Y Building cross-functional teams to inform decisions organization-wide Discover more about the six core capabilities for multidisciplinary teams: https://lnkd.in/geVQpVzs,Data and Analytics
"In a time when theres so much excitement around technology connecting us even more, how can it disconnect us. To efficiently measure and solve problems and then make an impact, we need to get hashtag#ZeroDistance to the frontlines! I had the opportunity to co-author an article with the ridiculously brilliant Rohan Murty published in Harvard Business Review about disconnected systems and how to proactively address them.
Through cross-functional collaboration and getting to the frontlines, we can continue to make great progress to better serve consumers, clinicians and colleagues better
Optum
UnitedHealth Group
Lolita Verny-Acosta",Data and Analytics
"You will NEVER grow on LinkedIn without using AI.Here is the Ultimate ""AI for LinkedIn"" Cheat sheet.a (Save for later)az This sheet will cover leveraging AI for LinkedIn in:1i a- Profile optimization2i a- Lead generation3i a- Analytics and data analysis4i a- Content writing5i a- Content design6i a- Networking7i a- Scheduling and strategy8i a- Job seekingY Get the high resolution version for FREE: 1. Follow me 2. Like this post 3. Comment ""SHEET""And I will DM you the PDF file right away. a  ________________Re-post it if your followers would find it valuable. aTM  Save for later.a Follow me for daily AI prompts, tools, guides, and tips. hashtag#ai hashtag#aitoolshashtag#chatgpthashtag#cheatsheethashtag#chatgptpromptshashtag#artificialintelligence",Data and Analytics
