postContent,themes
" Episode #21 of the #HealthyReturns podcast features Jeff Glueck, Founder & CEO of Salvo Health.

 Salvo is a chronic metabolic and gastroenterology company targeting the over 60 million Americans with chronic gut and GI conditions, providing them with digital wraparound care.

 Patients are treated through an app, specialized virtual care teams, and various intervention programs including:

 Low-FODMAP elimination diets
 microbiome restoration
 cognitive behavioral therapy
 lifestyle coaching (sleep, exercise, stress, etc.)

 On the heels of a recent $5m raise, Salvo has plans to take their whole-person approach used for chronic gut and GI patients, and apply it to other chronic conditions. Future partnerships will include specialty clinics beyond gastroenterology such as obesity medicine, bariatric, and endocrinology.

 Todays episode covers:

 digitization in healthcare
 microbiome in health and disease
 whole-person care
 Salvos recent capital raise
 low cost health interventions


 This was a fun one...Jeff has spent his career digitizing whole industries and according to him: healthcare is next.

Listen Now   

Spotify >>> https://lnkd.in/dxxwXu-F
Apple Podcasts >>> https://lnkd.in/dweJtgYR",Human-Centered Design
"Had an amazing time last week celebrating with our customers at SAP SuccessFactors HR Connect in Nashville TN. Congratulations to Love's Travel Stops (Jerome Charleston & Madhu Bhoompally) for winning the customer Innovation Award! We appreciate your partnership and engagement throughout the years. AI and how SAP SuccessFactors can help organizations ignite the potential within their workforce was front and center. It was great spending time with my fellow colleagues, customers and our robust partner community!  Thank you to everyone who participated in this amazing event! #HRConnect #SAPSuccessFactors #SAPCommunity #CustomerInnovationAward #Grateful",Human-Centered Design
"Today, our team at Best Buy announced yet another example of how were personalizing and humanizing technology in ways no one else can. Best Buy Envision is an app, designed exclusively for Apple Vision Pro, that helps customers see how their favorite tech products will look and feel in their homes before they buy it. #BestBuy #BBY",Human-Centered Design
"I was thrilled to present at the ""Human Centered Design in Hospitals"" event last month, hosted by Highland and organized by Amrita Kulkarni. 

While I was there sharing our own stories of impact fromSt. Jude Children's Research Hospital, I was also lucky enough to learn from Brian Graziano and Christopher Neuharth.  Some reflections below! 

1. Working in design & innovation in hospitals requires you to be multilingual: A core capability of innovation & design teams must be ""speaking the language"" of basically every department, including the C-Suite. Our portfolio of projects demands rapid fluency in the language of patient experience, IT, HR, security, systems, audit, legal etc. 
 
2. ""Learn to Spear Fish"": In a discussion about prototyping and piloting, I was inspired by hearing, ""Your organization needs to eat, now."" It really got me thinking about a posture towards sourcing projects from collaborators and also putting novel ideas out in the wild in days, not months. 
 
3. ""'Nobody's job' might have to become your job"": By way of the remit of innovation & design groups, sometimes projects emerge because there is no clear, single accountable leader.",Human-Centered Design
"One of Procter & Gamble's strategic priorities is to lead with deep consumer insights, which help us deliver breakthrough innovations and superior products that better peoples everyday lives. 

With an understanding that almost 70% of a laundry loads carbon footprint is in the consumer use phase, driven by the energy required to heat water, the Tide team did just that. In partnership with Electrolux Group, GE Appliances, a Haier company and Samsung Electronics, a new line of washing machines are now Tide Cold Certified  meaning these machines can wash clothes just as well  or even better  in cold water with Tide products as they do in warm. Its a simple, and easy, way to do laundry more sustainably. And were proud to be at the forefront of this effort.

Working together with our partners enables us to further advance Tides ambition of turning three out of four loads of laundry to cold water washing in the U.S. and Canada by 2030. Together, we can create a positive, long-lasting impact on the #planet.

Read more about the new Tide Cold Certification here: https://lnkd.in/dkSrimY4 
#innovation",Human-Centered Design
"""Emotion dominates our short-term decision-making and is critical in encoding memories, which is fundamental to the long-term success of a brand."" https://lnkd.in/gSTVxhrX",Human-Centered Design
"Today I wrapped up a fantastic few days at the #IOFM conference held at Disney's Yacht and Beach Club in Florida and now reflecting on the insightful experience in Charlotte. Here are some key takeaways:

- Live events remain invaluable; engaging with professionals face-to-face highlighted the real challenges they face and how we can assist immediately.

- The buzz around AP and Invoice Automation in the US is undeniable. Professionals we interacted with emphasized the urgent need for support, noting that the US continues to lag behind Europe in this regard.

- Compliance is a rising concern in the US, especially for large companies operating internationally. The focus on reducing risks ties into a growing awareness of the importance of staying compliant.

- Collaboration was key throughout the event, showcasing the power of teamwork in driving impactful outcomes and value for our partners and clients.

- The exceptional experience, including an exclusive dinner at Epcot and front-row seats for the Firework show, highlighted the commitment to creating memorable moments for our guests (Im a Disney World fan so this was easy for me!)

Exciting times lie ahead at Basware with a strong focus on delivering value for our customers alongside our outstanding partners! 

#apautomation #baswareisnumber1

Lea Jesserer Jen Le Anna Hauskins Mike Goode Ryan Drotar Jay Wick Kevin Zirkle Luke Porter Ravit Gutman Kerry Hutchinson Frankie Lake Gareth Partridge",Human-Centered Design
"As we drive back to Boston after a successfully field deployment to kick off our next fundraising round and start shipping the next dozen serial numbers, I cant help but reflect on, in appreciation of everyone onsite these past two weeks who provided invaluable feedback and worked directly with Luminous XR-001. 

Were extremely fortunate to such friendly people onsite esp. Mike and Jeff who helped educate us deeply about their onsite processes, letting us throw and catch mods ourselves by hand, giving us insights to fine tune and improve robot and flow of work cycle times. When we release XR-002, these guys are the ones directly responsible for some key updates - Forever appreciative 

And of course, our robot production numbers would be zero if it wasnt for our fantastic crew mates: Angel, Orlando, Edwardo, Chino, & Maritza. Our robots are here to help, but yall are the real heroes physically building our sustainable future, one panel at a time ",Human-Centered Design
