postContent,themes
"Rolling out v1 of an AI ICP (Ideal Customer Profile) builder soon. Here's how it works:1. Users input up to 250 URLs of their top customers and prospects.2. Each URL is enhanced with data...think firmographics, tech used, etc.3. AI highlights commonalities across your best customers4. User receives ICP report (in <1 hour) ICP report includes an Ideal Customer Profile summary, filters to use to find ideal prospects, count of prospects in your ICP, analysis of your best customers, & enhanced data CSV.Interested in beta testing? I'd love to get your feedback along the way.Feel free to message, email, or comment and I'll set up a trial for you.hashtag#idealcustomerprofile hashtag#ai",Human-Centered Design
"I am very excited to annonce that we released the latest addition to the Ergo Series by Logitech. Say Hello to Wave Keys, designed to feel instantly familiar and help you work comfier for as long as you need, one keystroke at the time. Over the past months, working on Wave Keys and the Feel the Wave campaign has been an incredible human journey. I had the chance to collaborate with talented people from different teams, expertises and geographies, and work together as ONE team driven by a desire to turn the work life into a feel-good story! BIG congrats to Olessia Hageman, Axelle JustafrA, Art O Gnimh, Tanyel Yalazoglu, Jingyan Ma, Sacha Nordmann, Sweny Ko, Guillaume HAMON, Agnes Lisowska Masson, Jeanette Wu, Idil Serez Burian, Sacha Martin, Stephanie Kronenberg, Winnie Fok, Maxime Jaccoud, Wendy Spander, Parekhit Bhattacharjee, Nichole I., Malin SArensson, Jean-Philippe Tuttle, and everyone involved. Finally, very special thank you to Kafai Mak, Jules O'Brien, Jak O'Hare, Taryn Paterson, for the great partnership on the Feel the Wave creative campaign! YS https://lnkd.in/eXG9SfNNhashtag#feelthewave hashtag#logitech hashtag#wavekeys",Human-Centered Design
"Celebrating 4 Years of Sydney Health Platform!

Four years ago, we embarked on a journey to revolutionize healthcare access and wellness for our members. Today, we're excited to celebrate the 4th anniversary of our AI-Enabled Sydney Health Member Platform, a game-changer in the world of health and wellness! 

Our platform was designed with one goal in mind - to make health and wellness easy, personalized, and resourceful for our members. With a registered membership now standing at a staggering ~18 million, we're proud to see the impact we've had on people's lives.

Here's how the Sydney Health platform is making a real difference:

 Virtual Care: Access to healthcare from the comfort of your home.
 Claims and Bill Pay: Streamlined and hassle-free transactions.
 ID Card and HealthPass: Instant access to your health information.
 Personalized Find Care: Tailored healthcare solutions at your fingertips.
 AI Enabled Conversational Chat: Real-time, personalized support at your convenience.
 Unified Electronic Health Record Tracker: Seamlessly manage your health records in one place.

Our platform goes beyond the basics, helping our members in their wellness journey:

 AI Nutrition Tracker: Smart guidance for healthier eating.
 Health Assessment: Understand your health status and areas for improvement.
 Activity Tracking: Stay active and motivated with ease.
 Personalized Health News: Stay informed about your health in a way that matters to you.

Our team and leaders have put in countless hours to create a humanized experience that combines cutting-edge technology with a human-centered design approach. This blend of tech and empathy has given birth to what we call ""Techequity,"" ensuring that everyone has easy access to their health and wellness needs.

I am incredibly proud of the work that the Elevance Health enterprise has accomplished over the past four years. Our mission is to empower individuals and elevate the health of humanity, and the success of the Sydney Member Platform is a testament to our dedication.

A big thank you and congrats to our team, leaders, and most importantly, our members, for being a part of this incredible journey. Here's to many more years of transforming healthcare and wellness together! #HealthTech #Wellness #Anniversary #Techequity #ElevanceHealth #sydneyhealth

Let's continue to make a positive impact on millions of lives!

Kimberly Rival Matthew Penwell Ajoy Ranga Kumar Gudavalli Rajeev Ronanki Katie Bradley",Human-Centered Design
"Celebrating 4 Years of Sydney Health Platform!Four years ago, we embarked on a journey to revolutionize healthcare access and wellness for our members. Today, we're excited to celebrate the 4th anniversary of our AI-Enabled Sydney Health Member Platform, a game-changer in the world of health and wellness! Our platform was designed with one goal in mind - to make health and wellness easy, personalized, and resourceful for our members. With a registered membership now standing at a staggering ~18 million, we're proud to see the impact we've had on people's lives.Here's how the Sydney Health platform is making a real difference:a  Virtual Care: Access to healthcare from the comfort of your home.a  Claims and Bill Pay: Streamlined and hassle-free transactions.a  ID Card and HealthPass: Instant access to your health information.a  Personalized Find Care: Tailored healthcare solutions at your fingertips.a  AI Enabled Conversational Chat: Real-time, personalized support at your convenience.a  Unified Electronic Health Record Tracker: Seamlessly manage your health records in one place.Our platform goes beyond the basics, helping our members in their wellness journey:Y AI Nutrition Tracker: Smart guidance for healthier eating.Yo Health Assessment: Understand your health status and areas for improvement.Y Activity Tracking: Stay active and motivated with ease.Y Personalized Health News: Stay informed about your health in a way that matters to you.Our team and leaders have put in countless hours to create a humanized experience that combines cutting-edge technology with a human-centered design approach. This blend of tech and empathy has given birth to what we call ""Techequity,"" ensuring that everyone has easy access to their health and wellness needs.I am incredibly proud of the work that the Elevance Health enterprise has accomplished over the past four years. Our mission is to empower individuals and elevate the health of humanity, and the success of the Sydney Member Platform is a testament to our dedication.A big thank you and congrats to our team, leaders, and most importantly, our members, for being a part of this incredible journey. Here's to many more years of transforming healthcare and wellness together! hashtag#HealthTech hashtag#Wellness hashtag#Anniversary hashtag#Techequity hashtag#ElevanceHealth hashtag#sydneyhealthLet's continue to make a positive impact on millions of lives!Kimberly Rival Matthew Penwell Ajoy Ranga Kumar Gudavalli Rajeev Ronanki Katie Bradley",Human-Centered Design
"This article is written by Lisa Schillaci, Vice President, Hospital Revenue Cycle Operations, about how we have created a more personalized and compassionate approach to collecting patient payments.",Human-Centered Design
Beautiful,Human-Centered Design
"I'm thrilled and humbled with the long list of innovations our cross functional team has worked tirelessly to launch at re:Invent this year. The collaboration these launches took has been incredible, and the way we've rallied across disciplines has been nothing short of inspiring. I'm especially proud of our UX Design & Research team and the role they played bringing these new generative AI capabilities to our customers, helping them revolutionize their CX.hashtag#TeamPride hashtag#GlobalInnovation hashtag#genai hashtag#reinvent2023 hashtag#amazonconnect hashtag#aws hashtag#awsapplications hashtag#ai hashtag#ux hashtag#cx",Human-Centered Design
"This article is written by Trent Fulin, SVP and Chief Executive Officer, Houston Methodist Cypress Hospital, about the future bets for our smart hospital.",Human-Centered Design
"This idea is far from unhinged! 

Check out this video showing a newly designed hinge developed by Carter Worthen, a lead operations specialist in our Gas Distribution Operations in Utah, after he witnessed a coworker sustain an injury from a falling bin door.
 
The hinge is designed to prevent potential injuries by preventing bin doors from inadvertently opening on our trucks. Once our Safety and Fleet Maintenance team completes its testing, the hinges will be installed throughout our Gas Distribution fleet. These hinges can also be used for our trucks on the electric side  and potentially help our industry peers too!",Human-Centered Design
"In the latest edition of PowerGrid International, my colleague Isabelle Hazlewood takes a deep dive into how our team at Eversource Energy partnered with diverse stakeholders and used feedback from our customers to develop our Community Solar Access Program. Designed to overcome market barriers that hinder low- to moderate-income community solar development, the program aims to provide each customer with on-bill savings of $420 per year. Read more about how community solar could help to solve the energy affordability crisis and advance an inclusive clean energy transition: https://lnkd.in/epseQFG7",Human-Centered Design
"Pringles launches a new "" designed for recycling' paper-based tubeTracy Murphyhashtag#sustainablepackaging hashtag#packaging hashtag#packagingsolutions hashtag#packagingindustry hashtag#packagingdesign hashtag#packagingideas hashtag#packaginginnovations hashtag#packaginginnovation hashtag#ecofriendly hashtag#circulareconomy hashtag#recyclable hashtag#sustainability hashtag#recyclablepackaging hashtag#recycling hashtag#environmental hashtag#sustainable hashtag#development hashtag#flexiblepackaging hashtag#plasticpackaging hashtag#plastics hashtag#plasticpollution hashtag#plasticwaste hashtag#biodegradable hashtag#endplasticwaste hashtag#ecofriendly hashtag#plasticfree hashtag#plasticfreepackaging hashtag#singleuseplastic hashtag#plasticrecycling hashtag#wastemanagement hashtag#resourceefficiency hashtag#environment hashtag#recycledpackaging hashtag#recycledmaterials hashtag#compostablepackaging hashtag#compostablehashtag#co2 hashtag#co2reduction hashtag#co2emissions hashtag#co2neutral hashtag#co2footprint Stay up to date on Corrugation & Packaging Industry news follow our Hashtag hashtag#cpmirror https://lnkd.in/dBSF-5FK",Human-Centered Design
"hashtag#weekendreflection: In my first week in the new role at LifeStance Health I visited a few clinics in the region and quickly learned that ""hashtag#culture"" is not just a buzzword""it's a powerful differentiator that sets us apart in the realm of excellence.YY hashtag#Service as the Core: I met Jayce, the front office coordinator and noticed that she greeted patients by their name at the check in window. And they were escorted in and out cordially by their clinicians. Every interaction was rooted in a dedication to providing unparalleled care to our patients.ai  hashtag#Relational Excellence: I met Rachel, the administrative director and noticed the relational aspect with our clinicians as partners and patients as individuals rather than mere customers. This humane approach fostered environment of trust and empathy. Y ""asi  hashtag#Championing Culture: I met Michele, our clinician as she was desperately problem solving the prescription issue to make sure there is no inconvenience to her patient after they left the clinic. Ys As the Chief Medical Officer, I am honored to be a champion of this culture. It's not just a part of our identity; it's our strength, guiding us towards innovative and compassionate healthcare solutions that are hashtag#patiencentered""People don't care how much you know until they know how much you care."" - Theodore RooseveltWith this cultural foundation, I look forward to visiting many more teams across the country and work shoulder to shoulder to support and engage our hashtag#clinicians in our journey towards demonstrating hashtag#HealthcareExcellence. hashtag#LFST hashtag#CulturalDifferentiator hashtag#PatientCentricity hashtag#FutureOfHealthcare YY",Human-Centered Design
"Maybe it was growing up in a house where people knit sweaters and wrote books, but I've always thought it was important to make stuff. In the agency world, I gravitate towards the kind of work where our teams help build things (brands, experiences, spaces) that make life better.That's one reason I'm excited to be working with Modus again (my first boomerang!): we are a digital agency that designs, builds and markets products and experiences that people love. If you're looking for a capable partner with balanced strategy, UX/UI design and engineering capabilities, let's talk. Actually, get in touch either way, I'd  love to hear what's on your mind. snewkirk@modusagency.com",Human-Centered Design
"A few years ago, while getting ready for bed on a Thanksgiving night, my father fell and fractured his hip. I drove to meet him in the emergency room, where the young woman at the front desk looked up at me and said, blandly, You must be here to see Room 4. I was actually there to see my dad, but resisted the opportunity to make that a teachable moment and headed to room 4. When I walked in, the nurse was standing with her hand on my dads shoulder. She greeted me warmly and started sharing what a cool guy my father is, that he must be in a lot of pain but has been joking and making her laugh, that hes been telling her about being with the family for Thanksgiving and even about my work in healthcare.

The Glasgow Consensus Statement  published last week and available at https://lnkd.in/ebr7dJXu  focuses on reinforcing the humanity in healthcare. The primary overarching task is to Connect as Humans. Thats the difference between room 4 and what a cool guy. Human connection is essential, not extra. And it benefits patients, families, and health professionals  I hope we can all rally around that.",Human-Centered Design
"Sometimes, it's the simple things that make the biggest impact. A great example of continuous innovation within our mobile app was the recent enhancements to our HealthSafe ID (HSID) capability for members to register for access.

One of the most frequent pain points we hear from our consumers is difficulty for dual eligible (DSNP) members (people with both a Medicare and Medicaid plan) in registering for an account. This population in particular is often dealing with some of the most complex healthcare challenges, and many times have lower access to digital resources and healthcare literacy.

In our new mobile experience - if the member chooses the wrong registration path or health plan, the HSID application will do everything it can to search for other plans in order to help ensure our members are able to register. This not only eliminates the burden from our members having to try and navigate account setup, it gives better access to the wealth of capabilities our market leading mobile ecosystem has to offer. 

Little changes like this can make a huge difference, in this case: we've seen double digit registration success growth in just a few short days! That's millions more members every year with better access to care. 

I am extremely proud of the team that made this happen. Heather Fisher - Anderson, Jared Carr Mike Litecky Peter Armstrong Amanda Loomis Kenneth Bearl Ashok Singh Bisht Marius Bologa Bridget Feickert Christopher Casey Logan Charles Zachary Crnecki Marta M Saputo Jonathan Daccarett Mike Dahl Eric E. Ryan Felton Tony Gregory Patricia Mazur Bhumika Patel Dan Proskauer John Somrock Abraham Sturman Scott Vandeleest Ashutosh Singh Suthaharan Sivasubramaniam and Sri Chari - thank you all!!!

#theBestMobileAppGetsBetter #dreamTeam #goAppGo",Human-Centered Design
"Every day at Leaf Home our marketing, sales and field teams  are in touch with thousands of homeowners who are looking to learn more about the products and services we provide. We strive to deliver a seamless and exceptional customer experience and our online Self-Scheduler is the latest example of this commitment.   We now  allow homeowners to schedule home visits  for estimates in a few quick clicks through our web experience. YTM Simple but powerful because previously, the process involved speaking with up to three separate people Y  , which could be frustrating and time-consuming for busy homeowners.  This improvement is not only  good for our customers, but it also benefits our business. We see a higher number of appointments, lower cancellation rates and higher sell-through rates when homeowners are setting up their own appointments. Y Leveraging this tool has also freed up time for our team from calendaring tasks, creating a true win-win from both a customer experience and operational efficiency standpoint.  Launched as an A/B test and now being rolled out to all our users, this is the outcome of a  phenomenal partnership between our Growth Product, Technology and Transformation teams Brian Swedenberg Phil Newlon Jeremy Hough Samantha Albarran Y Giving more power to the customer is at the heart of building a great hashtag#d2c business and we are always looking for new digital ideas to test that simplify and elevate the hashtag#customerexperience in the home services space.Y If you have an idea, we would love to hear from you.",Human-Centered Design
"I'm excited to share our latest pharmacy innovation- a brand new CenterWell Pharmacy App. It's a game changer that lets our customers manage their prescriptions anytime, anywhere, and however they want. Designed with seniors in mind, the simple user experience makes it easy for our patients to access their prescription refills, real-time order status, savings, transfers, and more. It takes the complexity out of something they do daily- staying on top of their prescriptions- which we know plays a big role in health outcomes and well-being.To my amazing team who made this possible for our customers, thank you! Tom Kirtz Daniel Polk Gaurav Khanna Craig Klopatek Dalia Powers The work you do every day to prioritize and focus on the health and well-being of our members is amazing and always appreciated.",Human-Centered Design
So proud of Humanas newest awesome app that simplifies our customer experience and improves developer productivity all at once! Congratulations!,Human-Centered Design
"6 months ago, I shared my new role as the President and Co-Founder of Vale Health. Today, a lot of work from countless people allowed us to announce the first health system going live with their wellness marketplace. https://lnkd.in/gNEVh7yE 

As you will see, we started with better sleep as a health goal. We believe we are the first to really combine evidence-based wellness products, apps, and education with direct links to the clinical services of high quality health care providers into one experience. Now, people can have a trusted wellness marketplace linked to their trusted provider for their total health and wellness needs. 

Many more person-centered goals and categories are coming soon. You will also see the launch of the other founding health systems this year. 

These are still early days, and we know there is a lot to learn still, but I do want to pause today and thank the many people and organizations that came together to get us to the first milestone.

Vale Health, Abundant Venture Partners, Abundant Health Acquisition (aha!), Froedtert Health, Inception Health, Healthcare Financial Management Association (HFMA)

Mark Lodes, Bradley Crotty MD MPH, Erin DeJarlais, PT, MBA, DPT, Stephen Basilotto

Ochsner Health, Novant Health, Cone Health, Memorial Hermann Health System, St. Luke's University Health Network, Ballad Health, Bassett Healthcare Network, Baylor Scott & White Health, LifeBridge Health, MemorialCare, Northwestern Medicine, OSF HealthCare, UCHealth, The University of Kansas Health System, Providence ",Human-Centered Design
"ICYMI: We launched our new mobile app for CenterWell Pharmacy customers last week. It's designed with seniors in mind and features a simple user experience to make things even easier for our patients "" and it's getting a lot of great attention. Our customers are happy, and I'm so proud of the team behind the app who has brought this to life for our pharmacy patients who can now spend less time worrying about their prescriptions and more time living their best lives.Daniel Polk Tom Kirtz Gaurav Khanna Craig Klopatek Dalia Powers",Human-Centered Design
"ICYMI: We launched our new mobile app for CenterWell Pharmacy customers last week. It's designed with seniors in mind and features a simple user experience to make things even easier for our patients "" and it's getting a lot of great attention. Our customers are happy, and I'm so proud of the team behind the app who has brought this to life for our pharmacy patients who can now spend less time worrying about their prescriptions and more time living their best lives.Daniel Polk Tom Kirtz Gaurav Khanna Craig Klopatek Dalia Powers",Human-Centered Design
"ICYMI: We launched our new mobile app for CenterWell Pharmacy customers last week. It's designed with seniors in mind and features a simple user experience to make things even easier for our patients "" and it's getting a lot of great attention. Our customers are happy, and I'm so proud of the team behind the app who has brought this to life for our pharmacy patients who can now spend less time worrying about their prescriptions and more time living their best lives.Daniel Polk Tom Kirtz Gaurav Khanna Craig Klopatek Dalia Powers",Human-Centered Design
"ICYMI: We launched our new mobile app for CenterWell Pharmacy customers last week. It's designed with seniors in mind and features a simple user experience to make things even easier for our patients "" and it's getting a lot of great attention. Our customers are happy, and I'm so proud of the team behind the app who has brought this to life for our pharmacy patients who can now spend less time worrying about their prescriptions and more time living their best lives.Daniel Polk Tom Kirtz Gaurav Khanna Craig Klopatek Dalia Powers",Human-Centered Design
"ICYMI: We launched our new mobile app for CenterWell Pharmacy customers last week. It's designed with seniors in mind and features a simple user experience to make things even easier for our patients "" and it's getting a lot of great attention. Our customers are happy, and I'm so proud of the team behind the app who has brought this to life for our pharmacy patients who can now spend less time worrying about their prescriptions and more time living their best lives.Daniel Polk Tom Kirtz Gaurav Khanna Craig Klopatek Dalia Powers",Human-Centered Design
"ICYMI: We launched our new mobile app for CenterWell Pharmacy customers last week. Its designed with seniors in mind and features a simple user experience to make things even easier for our patients  and its getting a lot of great attention. Our customers are happy, and Im so proud of the team behind the app who has brought this to life for our pharmacy patients who can now spend less time worrying about their prescriptions and more time living their best lives.


Daniel Polk Tom Kirtz Gaurav Khanna Craig Klopatek Dalia Powers",Human-Centered Design
