postContent,themes
"aRAG demos are easy. RAG in production is much harder. Why is it so?Recently I wrote about Retrieval Augmented Generation (RAG), the technique that enables enterprises to leverage the power of large language models (link in comment ).Many companies have experienced that their technology teams are able to demonstrate the use of RAG quite rapidly. However, when the time comes to put the solution into production, they face difficulties. The users do not accept the solution easily and many don't think it adds a lot of value.We will first see why the demos are easy and then reflect on the challenge of productionising RAG.Why are RAG demos easy?Y Simple architecture: The principle of RAG is quite simple to understand. In the basic RAG pipeline, there are very few components: vector database, source chunking, vector matching and LLM interface. It is easy for engineers to understand the architecture.Y Framework availability: To make matters simpler, helper frameworks such as Langchain and LlamaIndex are available. They come with built-in support for chunking, vector databases and LLMs. It is possible to build an RAG pipeline by writing a few lines of code, if you are using one of these frameworks. The initial results of such a pipeline are very impressive, mainly because of the language abilities of the LLMs. Thus great demonstrations can be built quickly with RAG. YYNow we will see why using RAG in production is challenging. Y Correct but not comprehensive: For simpler questions, the replies are often satisfactory. However, when complex questions are asked, the users find the answers correct, but not satisfactory. They feel that the reply covers only basic aspects, but not what they really needed.Y Source requirements: In order that RAG works, the necessary knowledge sources should be added to the vector index. It takes a lot of effort to judge the requirements of users and accordingly build the index. It does not stop here. The index must be forever updated with current information.Y Easy to add, difficult to remove: Once a source is added to the index, it starts influencing the answers. Many times, multiple sources contain conflicting information (for example, old and new price list). The answers in this case become unreliable.Y Data privacy: The quick RAG implementations typically use an external LLM api such as OpenAI or Google. In such cases, the internal data of an organization is sent to the outside world; creating a possibility of data privacy issues.Y Latency: As the index size grows, it takes a long time to select the right material for a query. This is unacceptable for real time use.Overcoming these challenges involves building a more complex pipeline. I will describe that in a later post, but here are some techniques that can help: reranking, knowledge graph, internal models, trust layers.hashtag#llm hashtag#retrievalaugmentedgeneration hashtag#aiinbusiness",Human-Centered Design
"2024 is our year for implementing care redesign programs across our hospital system. Our goal is to have ambient intelligence cameras in every acute care patient room and remote monitoring devices on all patients staying in an inpatient bed with plans to send them home with the device to continue monitoring in the outpatient setting. 

We know that we are bullish about innovation and sometimes implementing new technology in a hospital setting feels like trying to get your kids to eat their vegetables, but we have seen amazing results once we get through the change management hurdle. 
 With predictive analytics, the AI tools are 75% more accurate at projecting a patient's discharge date compared with our nurses' predictions alone. 
 With virtual nursing, we have been able to eliminate all contract nursing positions and add a fresh set of eyes to the patient floors which has led to great catches in discrepancies. 
 With ambient intelligence, we have seen a 15% increase in our OR capacity without adding any new staff members. 
 With remote monitoring, we have reduced telemetry needs and moved labor from one skillset to another. 

During our first 2024 Innovation Open House session last week, we hosted 20+ attendees from 7 healthcare organizations across the country. We would love to have you join us for future sessions. Please complete this short form if you are interested and we will be in touch https://lnkd.in/gAy-fiE7 ",Human-Centered Design
"Users prefer to learn by doing. Not by reading instructions. Every extra word is an opportunity for users to abandon the product. They have more important stuff to do.This is where intuitive design come into play.Let's break it down: 1. Intuitive Navigation: Design your interface in a way that feels natural to the user. Familiar patterns, like swipe to refresh or pinch to zoom, are more effective than instructions. 2. Visual Cues: Use icons, colors, and visual hierarchy to guide users. A well-placed arrow or a different button color can direct users more efficiently than text. Make sure that the design is also aesthetically pleasing. 3. Progressive Disclosure: Only show users what they need when they need it. Overloading them with information upfront is overwhelming. Gradually guide them through complex features. 4. Feedback Systems: Implement immediate feedback for user actions. If they press a button, make something happen. It's a non-verbal way of saying, ""Yes, you're doing it right."" 5. Testing and Iteration: Test your design with real users. What seems intuitive to you might not be for others. Iterate based on feedback to ensure your product truly minimizes the need for instructions. 6. In a world where attention spans are short, the best way to engage users is to let them dive right in. Design for action, not for reading Y hashtag#UX hashtag#productdesign hashtag#productmanagement",Human-Centered Design
"On CNBC's Equity & Opportunity Forum, #LCDACEO Ozzie (Oswaldo) Gromada Meza emphasizes the vital bridge between the business case and human-centric approaches to DEI initiatives. As Ozzie noted, ""The humanity piece, along with the business case, is really going to be very important for us to really connect with those who today, are pushing back.Though diversity, equity, and inclusion discussions are facing backlash, projections show over half of the workforce and consumer base will be people of color by 2025proving the critical nature of continuing constructive conversations. Stay tuned for the release of the full conversation.#LCDALeaders #InclusiveLeadership #CorpGov #CorpDEI CNBC Events",Human-Centered Design
"I spent over two decades in the financial services industry learning, growing, serving teams and  adding value to organizations. I am immensely grateful to all my colleagues at JPMorgan Chase & Co. and M&T Bank for the experiences. I have always been fascinated by the Automotive, Healthcare industries and the opportunity to create delightful experiences in these spaces. Holman, Chris Conroy, Bob White Mindy Holman Kristina Nicoles have invited me to do exactly that. I believe in human centric transformations. I also believe experience management + experience innovation can be industry agnostic. I look forward to bringing a multi faceted mindset, while learning a new industry and getting to know the amazing people who deliver these services every day. Thank you all for the incredible outpouring of support. I will lean on you as I embark on this exciting journey!",Human-Centered Design
"I spent over two decades in the financial services industry learning, growing, serving teams and  adding value to organizations. I am immensely grateful to all my colleagues at JPMorgan Chase & Co. and M&T Bank for the experiences. I have always been fascinated by the Automotive, Healthcare industries and the opportunity to create delightful experiences in these spaces. Holman, Chris Conroy, Bob White Mindy Holman Kristina Nicoles have invited me to do exactly that. I believe in human centric transformations. I also believe experience management + experience innovation can be industry agnostic. I look forward to bringing a multi faceted mindset, while learning a new industry and getting to know the amazing people who deliver these services every day. Thank you all for the incredible outpouring of support. I will lean on you as I embark on this exciting journey!",Human-Centered Design
"I spent over two decades in the financial services industry learning, growing, serving teams and  adding value to organizations. I am immensely grateful to all my colleagues at JPMorgan Chase & Co. and M&T Bank for the experiences. I have always been fascinated by the Automotive, Healthcare industries and the opportunity to create delightful experiences in these spaces. Holman, Chris Conroy, Bob White Mindy Holman Kristina Nicoles have invited me to do exactly that. I believe in human centric transformations. I also believe experience management + experience innovation can be industry agnostic. I look forward to bringing a multi faceted mindset, while learning a new industry and getting to know the amazing people who deliver these services every day. Thank you all for the incredible outpouring of support. I will lean on you as I embark on this exciting journey!",Human-Centered Design
"I spent over two decades in the financial services industry learning, growing, serving teams and  adding value to organizations. I am immensely grateful to all my colleagues at JPMorgan Chase & Co. and M&T Bank for the experiences. I have always been fascinated by the Automotive, Healthcare industries and the opportunity to create delightful experiences in these spaces. Holman, Chris Conroy, Bob White Mindy Holman Kristina Nicoles have invited me to do exactly that. I believe in human centric transformations. I also believe experience management + experience innovation can be industry agnostic. I look forward to bringing a multi faceted mindset, while learning a new industry and getting to know the amazing people who deliver these services every day. Thank you all for the incredible outpouring of support. I will lean on you as I embark on this exciting journey!",Human-Centered Design
"I spent over two decades in the financial services industry learning, growing, serving teams and  adding value to organizations. I am immensely grateful to all my colleagues at JPMorgan Chase & Co. and M&T Bank for the experiences. I have always been fascinated by the Automotive, Healthcare industries and the opportunity to create delightful experiences in these spaces. Holman, Chris Conroy, Bob White Mindy Holman Kristina Nicoles have invited me to do exactly that. I believe in human centric transformations. I also believe experience management + experience innovation can be industry agnostic. I look forward to bringing a multi faceted mindset, while learning a new industry and getting to know the amazing people who deliver these services every day. Thank you all for the incredible outpouring of support. I will lean on you as I embark on this exciting journey!",Human-Centered Design
"I spent over two decades in the financial services industry learning, growing, serving teams and  adding value to organizations. I am immensely grateful to all my colleagues at JPMorgan Chase & Co. and M&T Bank for the experiences. I have always been fascinated by the Automotive, Healthcare industries and the opportunity to create delightful experiences in these spaces. Holman, Chris Conroy, Bob White Mindy Holman Kristina Nicoles have invited me to do exactly that. I believe in human centric transformations. I also believe experience management + experience innovation can be industry agnostic. I look forward to bringing a multi faceted mindset, while learning a new industry and getting to know the amazing people who deliver these services every day. Thank you all for the incredible outpouring of support. I will lean on you as I embark on this exciting journey!",Human-Centered Design
"I spent over two decades in the financial services industry learning, growing, serving teams and  adding value to organizations. I am immensely grateful to all my colleagues at JPMorgan Chase & Co. and M&T Bank for the experiences. I have always been fascinated by the Automotive, Healthcare industries and the opportunity to create delightful experiences in these spaces. Holman, Chris Conroy, Bob White Mindy Holman Kristina Nicoles have invited me to do exactly that. I believe in human centric transformations. I also believe experience management + experience innovation can be industry agnostic. I look forward to bringing a multi faceted mindset, while learning a new industry and getting to know the amazing people who deliver these services every day. Thank you all for the incredible outpouring of support. I will lean on you as I embark on this exciting journey!",Human-Centered Design
"I spent over two decades in the financial services industry learning, growing, serving teams and  adding value to organizations. I am immensely grateful to all my colleagues at JPMorgan Chase & Co. and M&T Bank for the experiences. I have always been fascinated by the Automotive, Healthcare industries and the opportunity to create delightful experiences in these spaces. Holman, Chris Conroy, Bob White Mindy Holman Kristina Nicoles have invited me to do exactly that. I believe in human centric transformations. I also believe experience management + experience innovation can be industry agnostic. I look forward to bringing a multi faceted mindset, while learning a new industry and getting to know the amazing people who deliver these services every day. Thank you all for the incredible outpouring of support. I will lean on you as I embark on this exciting journey!",Human-Centered Design
"I'm proud to share that #CoalitionGreenwich recognized JPMorgan Chase Commercial Banking among the global leaders in its Digital Transformation Benchmarking Study. Our digital banking platform Chase Connect scored No. 1 across Payments & Treasury Management, Credit Underwriting & Servicing and Trade Services highlighting our commitment to tech innovation and great client experience. Learn more about this year's recognition here: https://lnkd.in/eNQtRSCD",Human-Centered Design
"JPMorgan Chase & Co.'s new Chase Media Solutions unit is a stroke of genius. Critics referencing #privacy concerns don't know what they're talking about. Why is it a stroke of genius? Because Chase will get paid twice. And merchants will pay twice. It's too funny. I've seen some criticism of this announcement from folks who think Chase will be selling customer data to advertisers. That's not how it will work. Instead, Chase will sell ad space on its digital properties to advertisers buying into Chase's pitch that the bank can improve ad targeting by analyzing the customer's spending patterns. It's a great move by Chase because they'll make $ by selling ad space and by generating more sales on its cards. It's an appealing deal for advertisers because--unlike other advertising approaches--they only pay when the customer makes a purchase. The irony is that when the purchase is made, the advertising firm not only pays for the ad, it pays the interchange fee on the card purchase. Another reason this is a stroke of genius is that the new advertising service could enable Chase to bundle--at some point--pricing for the advertising with interchange fees.The achilles heel here is that even Chase--as big as it is--doesn't have a 360-view of its customers' spending habits. Today's consumer spending behavior is so fragmented and specialized that it's likely that many Chase cardholders only use their Chase card for specific types of purchases--which will limit the range of advertisers any one cardholder will see.That might be a good thing, though--for both the cardholder and Chase. Might mean more relevant ads.From a broader banking industry perspective, this is an interesting move by Chase. Most of the community-based institutions I've talked to have historically been hesitant to--or outright against--putting 3rd party ads on their digital properties. And even if they want to do it, it begs the question how they would do it. Maybe a new service offering from a Q2, Alkami Technology, and/or NCR Voyix?https://lnkd.in/eyzCKudT#banking #marketing #digitalbankingMary Wisniewski Jason Henrichs   Jim Marous Alex Johnson Alex Jimenez Efi Pylarinou Al Dominick",Human-Centered Design
"Yesterday, we heard from an amazing panel on the importance and need for Rear Seat Safety and the challenges and opportunities for diverse occupants!Thank you to our panelists; Dr. Kristy Arbogast, Dr. Cecilia Sunnevng, Dr. Jessica Jarmakian, Dr. Amanda M. (Mandy) Agnew, and Suzanne Tylko for a riveting and thought provoking session  ",Human-Centered Design
"I'm ready to head to Vegas for Google Cloud Next  24  it all starts tomorrow!The GrowthLoop team is excited to share how #GenerativeMarketing is changing the game through next-level personalization, cross-channel journeys, and real-time marketing measurement. Come meet us at booth #1350.I can't wait to make connections and share learnings along the wayWhat are you most excited about during #Next24? And will I see you there?#GoogleCloudNext",Human-Centered Design
"The HGTV Smart Home Giveaway 2024 is coming soon! This year's HGTV Smart Home checks all your must-have home boxes. It's packed with the latest design, cool tech, and features a sustainable steel roof manufactured with steel by #USSteel and crafted with precision by McElroy Metal. You don't want to miss this! https://bit.ly/3TNwaQl#HGTVSmartHome #HGTV #metalroofs #Sustainability #Innovation #ConstructionTech #SmartHomes #EcoFriendlyLiving #GreenBuilding #ModernArchitecture #SustainableDesign #BuildingMaterials #EcoInnovation #RenewableMaterials #HomeDesign #ad #FutureHome #SustainableLiving #SteelInnovation",Human-Centered Design
"Our Place designed a new non-stick pan without any harmful chemicals. Instead, it uses a nearly invisible pattern to create a hydrophobic surface. http://f-st.co/4ITWV1j",Human-Centered Design
"Very excited to be moderating a panel next Thursday, April 18 at 2:35 PT at the TRANSACT event in Las Vegas. I'll be joined by Ginger Bergman, Aparna Mohan and Tamara Romanek for a fun, robust discussion on Faster Payments in the U.S. We'll discuss the latest trends, consumer behavior and the future of paymentsand more! Looking forward to seeing everyone there! #ETATRANSACT #T24 #TRANSACT2024 #PaymentsEvent #Payments",Human-Centered Design
"One of the early stops on my  listen and learn' tour was Grapevine, Texas. I met with a high energy group committed to delivering great experiences for our clients at Holman. We discussed topics that are top of mind for many industries. 1. Balancing the human experience with tech and digital enablement 2. Talent + hybrid + wfh experience 3. What's over the horizon As we celebrate our 100 yr anniversary in Dallas this weekend, I am excited to continue the tour and share out. Bob White Tim McHugh Kristina Nicoles",Human-Centered Design
"""In the best case scenario, there's no  daylight' between what customers expect from the company they buy from, the brand and the experience delivered.""The experience gap created between customer expectations and a company's ability to meet those expectations is widening.  CXOs should be creating the environment for the entire organization to close that gap.Thanks to CX Dive for allowing me to provide my perspective here.  It's a great article that Joanie Bily also contributed to.#customerexpereince #cxo #ceo #brand #marketing #medallia",Human-Centered Design
"Innovation. New treatments. And, above all, patients. This is what we are committed to because the future of vascular care can't wait.  Explore our vascular innovations here: https://brnw.ch/21wIPnK",Human-Centered Design
"What an inspiring few days spent with the Kenvue R&D Leaders in Boston, where we came together to discuss how we'll continue to better serve our customers, driving maximum impact through innovation!  The work we do in R&D is grounded in creating technical solutions that meet consumer needs. And as scientists, it's these moments of connection that are invaluable when it comes to learning from one another and adapting so that we can perform at our very best. Together, we're focusing on human-centric innovation that's grounded in science, so that we can put the power of everyday care into people's hands. I am so proud of the incredible teams and leaders within R&D! This most recent gathering was proof of what I already know  that we've never been more equipped to bring a new view of care to the world. #WeareKenvue #KenvueScience",Human-Centered Design
" Exciting News at Britax Americas! We are overjoyed to announce that our Willow Brook S+ Travel System has been named the ""Best Car Seat With A Rebound Bar & Stroller Combo"" by Good Housekeeping in their latest Parenting Awards! This recognition highlights our commitment to innovation, safety, and convenience for parents and their little ones.Good Housekeeping praised the Brook+ stroller for its easy and intuitive buckles, spacious under-seat basket, and convenient toddler snack tray. The smooth reclining stroller seat and adjustable footrest ensure comfort from birth through preschool, promising lasting value for families.The Willow S infant car seat, featuring the extra stability provided by the anti-rebound bar on the car seat base and our revolutionary ClickTight system for effortless and secure installation, now brings this convenience to even more families. Discover more about the award-winning Willow Brook S+ Travel System and how it's setting new standards for family travel: https://bit.ly/3uXBkOX#BritaxCelebrates #GoodHousekeepingAward #WillowBrookSPlusTravelSystem #BritaxSafety #InnovationForFamilies",Human-Centered Design
"Zonzon is excited to introduce a brand new update to our #app! We now have a sleek, modern and visually appealing UI redesign and a more intuitive user experience for our members. The updates include:

Direct Messages: Connect instantly and privately with your #neighbors.
Profile Interests: Find out which neighbor(s) share similar #interests.
Interest Groups: Join discussions with like-minded neighbors.
Performance Improvements: Enjoy a faster, smoother experience.

Zonzon is designed to connect and bring people together in real life (#IRL) where they live (#Apartments, #Condos & #HOAs). Its a smaller, more private community focused platform.",Human-Centered Design
" Exciting news! Parloa just announced a $66m Series B led by Altimeter to scale their conversational AI platform for customer service. 

Read more about this :

https://lnkd.in/eabN_N49

https://lnkd.in/eEbJBwfH

 cc Doreen Huber Pierrick Cudonnec Julien Hobeika EQT Ventures",Human-Centered Design
"Zonzon is excited to introduce a brand new update to our #app! We now have a sleek, modern and visually appealing UI redesign and a more intuitive user experience for our members. The updates include:

Direct Messages: Connect instantly and privately with your #neighbors.
Profile Interests: Find out which neighbor(s) share similar #interests.
Interest Groups: Join discussions with like-minded neighbors.
Performance Improvements: Enjoy a faster, smoother experience.

Zonzon is designed to connect and bring people together in real life (#IRL) where they live (#Apartments, #Condos & #HOAs). Its a smaller, more private community focused platform.",Human-Centered Design
"At IKEA, we aim at offering a wide of range of products that the many love, trust and can afford.

This doesn't happen by itself though... we call Democratic Design our approach for designing, developing and evaluating IKEA home furnishing products to ensure that they integrate good function, beautiful form and long-lasting quality, while also securing sustainability and low prices.

At IKEA Supply Data & Technology, we also thrive to use these five dimensions to guide us to develop great digital products. On our journey to transform how we operate IKEA, it is so inspiring to have such a compass to make things better by making better things!

If you want to try this with us, we have plenty of opportunities, so have a look at our job portal!
And for those interested in a great leadership and impactful position in Information Security and Data Privacy, check this one out in particular: https://lnkd.in/gK3x5dXB

Anette Karlsson, Anne Hannikainen, Bjorn Block, Camilla Axelsson, Claudio Marconi, Dan Gustafson, Evisa Kica Ibraimi, PhD, CIPP/E, Fredrik Bjurling, Dr. Hartwig Hennighausen, Heidi Holm, Ilaria Tamburriello, Marcus Svantesson, Niklas Osslen, Pascal Pauwels, Pia Nilsson, Richard Thorell, Robert Pernetun, Sarah Wittbom, Sebastian Welter, Silvina Weihmuller, Steve Portner

#IKEA #IKEASupply #DigitalTransformation #JoinUsInIKEASupplyDataAndTechnology",Human-Centered Design
