postContent,themes
"I read through several articles and blog posts each day as part of my ongoing professional development. Each week, I curate a few of my favorites, including a brief introduction explaining why I find the post valuable and recommend you read it.

Heres a summary of this weeks content:

* Microlearning's impact on corporate training
* How LXPs can personalize lifelong learning
* Taking your first steps towards agile L&D transformation
* A guide to equitable decision-making
* ChatGPT prompts for combatting imposter syndrome.

Check out all of this week's content via the link: https://lnkd.in/eWu_yQ8g

#Microlearning #LXP #Agile #ProjectManagement #DEI #DecisionMaking #ChatGPT #ImposterSyndrome",Organizational Change Management
"Yesterday, we came together in Houston to promote Y and celebrate YZ our many employee networks. Very proud of the work we're doing to build a more inclusive and diverse workplace!",Organizational Change Management
"I spoke with MedCity News at Oliver Wyman's Health Innovation Summit last week. Here are some insights into how we approach our technology investment strategy:

 There are two parts to AI - the product and change management - and they must work together 

 Choosing a certain vendor may not be just because of their technology but also price, accessibility, EHR integration, and other secondary factors 

 Prioritization is overrated - focus on solving many problems at the same time in order to try out different solutions in different environments 

#healthcareinnovation #healthtech #digitalhealth",Organizational Change Management
"In this episode, Roberta Schwartz, Executive Vice President and Chief Innovation Officer of Houston Methodist Hospital, explores the concept of smart hospitals and her vision for healthcare innovation. Dr Schwartz explains how Houston Methodist Hospital adopts a unique approach by collaborating with external innovators and startups, rather than recruiting from unrelated industries, offering operational expertise to navigate the healthcare landscape. She highlights the challenges of implementing innovation, including resistance to change, emphasizing the importance of involving operational teams in the process. Dr. Schwarz also talks about the importance of team members with dual roles, balancing operations and innovation to bridge the gap between novel solutions and practical implementation to reshape healthcare for a more patient-centric and adaptable future.Join the conversation and learn how innovation and smart hospitals are reshaping healthcare!Spotify: https://lnkd.in/gj-W7U8BApple: https://lnkd.in/ggxS6882Google: https://lnkd.in/gZ3V5cJp?iHeart: https://lnkd.in/grDtDk83Amazon Music: https://lnkd.in/gCpws-XFhashtag#SmartFromTheStart hashtag#NeverStopCaring hashtag#compassionatecare hashtag#healthcare hashtag#innovation hashtag#healthtech hashtag#digitalhealth hashtag#aihealthcare hashtag#smarthospitals hashtag#healthcaretechnology hashtag#artificialintelligence hashtag#nursing hashtag#nursingleadership",Organizational Change Management
"As change leaders, it can be easy to focus on organizational change and miss the need to evolve our own behaviors. This Harvard Business Review article is a great reminder that listening to your colleagues, acting on their feedback, and deliberately practicing new behaviors are all necessary and helpful parts of this integral leadership process. hashtag#ChangeManagement",Organizational Change Management
"In this episode, Roberta Schwartz, Executive Vice President and Chief Innovation Officer of Houston Methodist Hospital, explores the concept of smart hospitals and her vision for healthcare innovation. Dr Schwartz explains how Houston Methodist Hospital adopts a unique approach by collaborating with external innovators and startups, rather than recruiting from unrelated industries, offering operational expertise to navigate the healthcare landscape. She highlights the challenges of implementing innovation, including resistance to change, emphasizing the importance of involving operational teams in the process. Dr. Schwarz also talks about the importance of team members with dual roles, balancing operations and innovation to bridge the gap between novel solutions and practical implementation to reshape healthcare for a more patient-centric and adaptable future.Join the conversation and learn how innovation and smart hospitals are reshaping healthcare!Spotify: https://lnkd.in/gj-W7U8BApple: https://lnkd.in/ggxS6882Google: https://lnkd.in/gZ3V5cJp?iHeart: https://lnkd.in/grDtDk83Amazon Music: https://lnkd.in/gCpws-XFhashtag#SmartFromTheStart hashtag#NeverStopCaring hashtag#compassionatecare hashtag#healthcare hashtag#innovation hashtag#healthtech hashtag#digitalhealth hashtag#aihealthcare hashtag#smarthospitals hashtag#healthcaretechnology hashtag#artificialintelligence hashtag#nursing hashtag#nursingleadership",Organizational Change Management
Proud to announce this partnership and to continue supporting the mission of local community health systems seeking to maintain their independence,Organizational Change Management
"Thank you for the feature, CIO! It was my pleasure to discuss my transition into the CEO role and the steps that I took to get there. If you're looking to make a similar move - I'm confident that you'll find a good nugget of wisdom or two in the article. In short - remain flexible, take on new responsibilities, embrace technological advancement, and allow yourself to develop the soft skills of a CEO while you get yourself ready. Being at the forefront of integrating new technologies into your business will differentiate you more than anything. Your time will come, just bet on yourself. hashtag#Transitioning hashtag#BecomingCEO hashtag#EmbraceTechnology hashtag#Upskilling",Organizational Change Management
"A bunch of CEOs said in a survey that half their jobs can be done by AI. Do you think AI can replace the CEO? I say yes and no. Yes, in that I'm sure we will have some virtual companies operated mostly or entirely by AI in the future. No, in that I think as long as people need to be managed, inspired, led, etc. human leadership is unparalleled. Either way, the future is getting more interesting. Thoughts?",Organizational Change Management
"This week I was honored to testify before congress on the vital issue of ""Securing the Federal Software Supply Chain,"" joined by prominent policy and association leaders James Lewis, Jamil Jaffer, and Roger Waldron, in a Cybersecurity, Information Technology, and Government Innovation subcommittee hearing chaired by Rep. Nancy Mace (R-SC). I commend Chairwoman Mace and Ranking Member Rep. Gerry Connolly (D-VA), who continue to press for heightened federal supply chain resilience following high-profile hacks by threat actors "" including hostile foreign nations "" that compromised major federal computer systems, exposing sensitive data. Nation-state adversaries and other malicious entities actively pose a fundamental threat to national security and global competitiveness, elevating the critical importance of software supply chain risk management.My testimony included an urgent Call to Action for the Government to shore up our collective software bill of materials (SBOM) vulnerabilities. We must:1 "" Prioritize awareness and education on the desired outcomes not just the compliance activities2 "" Fund the supply chain risk programs3 "" Make supply chain security "" hardware, SBOM, services "" the cost of doing business both in support of the government, as well as within the critical industrial base it relies on4 "" Ensure there is good contracting language to support these changesIt's imperative we view these solutions as an investment in national security, not merely an expense. By upskilling personnel and leveraging supply chain security for prevention and resolution, we profoundly impact the federal software supply chain, fortifying our nation's security posture and global competitiveness. There's no question America is being targeted by our adversaries, who are relentlessly trying every digital backdoor in our multi-tier supply chains. Are we prepared to leave even one unlocked? Urgent and proactive measures are crucial to secure our ever-expanding digital infrastructure.   See hearing here: https://lnkd.in/emRbzqcW  hashtag#cybersecurity hashtag#congress hashtag#supplychain hashtag#resilience hashtag#supplychainresilience",Organizational Change Management
"Optimize your advanced planning systems (APS) transformation by integrating cutting-edge tech with profound organizational insight""crafting a strategy that delivers enduring impact.In our latest blog, McKinsey Operations experts explore how companies can improve planning and performance through deep end-to-end process revamps and the integration of APS to embed resiliency, effectiveness, and efficiency demanded in today's environment.Learn more azi  https://lnkd.in/gVvm7B_vhashtag#supplychain hashtag#advancedplanningsystems hashtag#APS",Organizational Change Management
Enjoyed speaking with Vanguard Law Magazine about my work as employment counsel for NFP!https://lnkd.in/gm3Z5psu,Organizational Change Management
Webster signs definitive agreement to buy Ametros to support the banks long-term deposit strategy and enhance its healthcare financial services expertise. https://bit.ly/3TrltnZ,Organizational Change Management
"Year end always presents us with an opportunity to reflect, and I appreciate this opportunity more and more as the years go by.  2023 at City National Bank was one of the most challenging years of my career, but it was also hands down the most exciting and fulfilling. Our Strategy and Transformation team had a HUGE impact across the enterprise, and we are poised for an even bigger 2024 as we continue to build our change management muscle and accelerate the transformation fly wheel. I'm looking forward to connecting and partnering with new ambitious and driven transformation leaders in the months to come!",Organizational Change Management
We have some very exciting activity happening across Honeywell to further enhance our recently announced Mega trends while simultaneously building upon our customer and partner relationships. See John Waldrons perspective below. #honeywell #GenAI #futureshapers #innovationinaction,Organizational Change Management
"Software engineers are as valuable as ever, but will hashtag#GenAI change that?Our latest Tech Hiring Trends report shows that 62% of software and talent leaders believe software engineers are more valuable than capital because they've long been the biggest drivers of innovation.With the rise of hashtag#AI, industry shifts, such as automation, are afoot and impacting the role of software engineers within organizations.hashtag#Karat President and Co-Founder Jeffrey Spector chats with CNBC's Rachel Curry about the coexistence of AI and software engineers in today's evolving tech landscape.Read on to uncover more expert insights!  Y",Organizational Change Management
"Leadership is changing "" but the need to balance traditional management with new ways of leading is creating a handful of tensions.",Organizational Change Management
"Thank you to Associated Bank & NEW Manufacturing Alliance for offering an upskilling course on data analytics. If you want to enhance your skills, I would recommend investing your time in this certification. https://lnkd.in/eAhGyKBB",Organizational Change Management
"Celebrating the completion of our inaugural New Leaders Experience (NLE) program by a group of our leaders this week! Cone Health prioritizes the development of our leaders to ensure that we impact the lives of our patients, communities, and teammates successfully. Congratulations to these amazing leaders on their completion of the NLE program, and for their commitment as leaders at Cone Health. We look forward to our continued partnership with them on our journey together! And, my sincere thanks to the leaders of this program who made this achievement possible, including Eric Gordon, Anita Badgett, Laura Small, and Colin Cowne. hashtag#leadership hashtag#ConeHealthProud hashtag#NewLeaderExperience",Organizational Change Management
Cigna Group is revamping its leadership approach with CFO Brian Evanko will take on the newly created additional roles of president and CEO of Cigna Healthcare.,Organizational Change Management
Always happy to contribute to Beckers thought-provoking questions. Giles Bruce,Organizational Change Management
"CEO: ""We need to replace our entire product team""Me: ""Um, ok, let's talk about this for a moment""""As a CPO and product advisor I've met plenty of CEOs and execs who are frustrated with the results they see from their product teams.Often they feel like all they need to do is replace the existing team with more experienced, ""better"" PMs. But really they're blaming PMs for some of their own shortcomings as leaders.Results from a product team depend on putting great PMs in a great environment.If you don't have a great environment, it doesn't matter how good your PMs are, you'll still be disappointed with the results.Maybe your PMs really are awful, but before you fire them all and hire new ones, I'd make sure you fix the environment:a) It's much faster, cheaper and less painfulb) You'll have to do it anywayc) You'll be surprised by what you can get from your existing teamSo how do you create a great environment for PMs as a leader?YZ  Have consistent goalsOf course you want to be agile, but try not to change the priorities all the time. Every quarter is ok, but every week or two and your teams will never get going.Y Minimize distractionsProgress is inversely correlated to the number of initiatives you have. Make sure your teams aren't getting distracted by execs' pet projects, internal requests or customer feedback. Have a very small (1-2) number of priorities for them to focus on.Yo Explain the contextSpend the time up front to explain your goals and the features you're asking for. If all you're doing is demanding widgets from your product team, likely they'll have a very different idea from you of what they are building and why.Y Talk about the moneyYou can't expect your PMs to make commercial decisions if they don't have visibility of the business financials. Make this a part of every discussion (but just a part - it's not everything!)Y Be explicit where you will take riskTeams are usually quite conservative when it comes to risk, because when the site goes down they get blamed. If you want to move quickly, be very clear about the risks that you are willing to take. Y Manage their role breadthPMs can be excellent at lots of things - comms, analysis, delivery, user interviews"" pretty much whatever you need them to, but they can't do it all at the same time - there are only so many hours in the day. Make sure tasks as split evenly across design, engineering and data.Y Agree a lightweight reporting processAs a leader you need status updates. To fly blind would be reckless. But bloated reporting burns many hours each week. Take 1-2 hours up front to co-create a reporting process with your PMs (i.e. tell them what you really need, and let them figure out the best way to deliver it) and you'll save them huge amounts of time going forward.And if there's anything I can do to help, give me a shout. We've got lots of tools on Hustle Badger to accelerate product teams, and I offer private workshops and advice.",Organizational Change Management
"Mattie Moo...a GenAI infused chatbot we built, in partnership with Google, for Wisconsin's Department of Workforce Development and a part of our Virtual Career Center (VCC) platform. The VCC solution was born out of the covid pandemic, with unemployment rates at record highs, in helping people find jobs and get back to work.  Better job matching, access, upskilling and citizen services were all realized along with better efficiencies and ways of delivering services - that are changing how government agencies are now working.Citizen experiences & services, cloud and data/AI (including GenAI, of course) are a few areas of focus and differentiators for government agencies in 2024.",Organizational Change Management
"I'm excited to share that my role has been expanded as Chief Operating Officer -  Finance effective from October 2023. While, I will continue driving Finance Transformation, I will also be managing new operational responsibilities including shared services. BMO Finance has been on a great transformation journey where we are not only changing the Operating Model but also advancing our Financial/Strategic Analytics. The teams have made great progress in Automation, and implementation of new technologies along with new data infrastructure. I am looking forward to continue to build ""Finance of the Future"".hashtag#financetransformation hashtag#bmogrowthegood hashtag#cfo hashtag#finance hashtag#cdo hashtag#cdao hashtag#coo",Organizational Change Management
"The SAP Industry Heroes program celebrates individuals and companies who leverage technology to transform their business in innovative ways. These pioneers, armed with a potent blend of innovation, determination, and empathy for change management are reshaping the shopping experience, driving operational efficiency, and connecting with consumers in unprecedented ways.We are grateful to recognize our SAP Retail Industry Heroes at NRF 2024 and share their stories on harnessing the power of technology to transform traditional retail into an innovative, customer-focused paradigm. During NRF 2024, the Retail Industry Heroes shared their stories and learnings at the SAP booth, including how to build sustainable innovation cultures, successfully adopt Business AI, and drive meaningful business impact.  You can also read more about our SAP Retail Industry Heroes  -> https://lnkd.in/gFyYRY6e",Organizational Change Management
"Jed Finn, who  took over  this month as head of hashtag#MorganStanley Wealth Management in the wake of the parent bank's CEO shift, is reworking senior executive roles atop his new domain. hashtag#wealthmanagement hashtag#wealthadvisor",Organizational Change Management
"Frosts solid Q4 performance and record 2023 #earnings capped off an impactful year and powerful start to 2024, where our continued growth is fueled by strong execution from Frost bankers throughout the state. 

While many banks have scaled back, weve deepened our investments in products for our customers and within communities across Texas. We continue to see positive momentum from our Progress mortgage and home equity loan products, designed to help make homeownership attainable for all. And were excited about expansion, bringing more physical locations to Austin and other key markets where Frost can make a real difference  making peoples lives better. 

To complement this growth, weve recently announced a new Frost marketing campaign, strategically designed to showcase our unmatched customer experience while staying true to our timeless values. Were optimistic about the impact this will make on customer acquisition and reaching new folks across our Texas communities. 

Read more from my conversation with American Bankers Catherine Leffert on the state of commercial real estate and how Frost is focused on the relationships weve built with borrowers.",Organizational Change Management
"Benchmark analysis helps corporate strategy-makers understand how leading companies do business "" and to consider ways to emulate those approaches. You can do the same with your life.",Organizational Change Management
"12 signs of a high-performing employee:1. They treat everyone equally (regardless of their level)2. They focus on outcomes and not just the KPIs.3. They focus on solutions, not just problems.4. They support their colleagues' progression.5. They protect their time for what matters.6. They lead others (even without the title).7. They fight against micromanagement.8. They listen before they speak.9. They are open to new ideas.10. They upskill themselves.11. They don't gossip.12. They are humble.In a time of ruthless competition. These 12 signs will make you stand out. Being a strong employee isn't just about your work.It's how you are as a person. Tag your high-performing colleagues below ai - - - - -Liked this content? aTMi  Repost it to your network and follow Chris Donnelly for more. Y Want to level up your career performance? I'll be sharing all my top tips in my newsletter.Don't miss out. Subscribe here: https://lnkd.in/etHmmvSx",Organizational Change Management
"10 months ago I was arriving Yto Montreal, to continue my career in Digital and Data in one of the best countries in the world Y Y. Lots of expectations, uncertainties, excitement, desires in my mind; that were not even close to what I have experienced until now; and is not even a year! I feel very fortunate to be able to experience international moves, and of course Canada was not going to disappoint! I need to recognize how lucky I am YTMbecause of the AMAZING GROUP OF PEOPLE I've arrive to work with ; leaders, colleagues and friends from whom I learn every day! a  New city, new culture, new house, new boss, new team""; it is an overwhelming experience. I believe people is the most complex but vital component to succeed in any work assignment or task, and I can certainly confirm if you manage to make it work; is because of the people you have around you hashtag#dreamteam An Verhulst-Santos Marc Dicko Patricia Li Sarah-Anne DUCREUX Myriam Tambe Luc Antoine Anne-Laure Quemard-Sardais Pascal Rosello Dominique Savard Sarah CA tA-Fournier, CRHA Maxime Petit Sandra P. HernandezLukas GaffiA Thomas Dussault Ousmane SidibA Beatrice Abillama Kate Catanzano Tiffany-Ann McNeil Charles DAsilets Farhan Samin Prionta Utkarsh Nagpal Andres Gonzalez Arcaya Constantina Roumeliotis Alban D. Sandrine HAlie Sonia ChangJulie Carbone Pierre Arnaud Yahya Vargas and more! I think now is the best time to be working in Data. I am very proud of all the acceleration and the transformation we are driving with our local Marc Dicko and global teams Asmita Dubey Olivier Girard Ludovic BAguA. Just last month has been a marathon of energy and time dedicated to upskill our teams and design the future of our consumer relations and value driven by DATA. We are ready and looking forward to whats going to come! Thank you team, Merci Montreal & hashtag#LorealCanada. I feel very much at home by now! Y YYai ",Organizational Change Management
"2024 is bringing about change!  In January Chico's FAS, Inc. was purchased by Sycamore Partners and is now managed by KnitWell Group.  I had such a fantastic time and experience working for Chico's FAS.  As a public-now-private company we achieved our missions focused on awesome product, the wonderful customers they bring joy to, a digital first mentality focused on connected commerce and data, and excellence in operations.  Witnessed by the 250% purchase premium over just 3 years and far more going back 1-2 years more.  A great tour of duty includes a great leader Molly Langenstein my sincere appreciation""great peers Kristin Gwinner David Oliver Wendy Hufford our small but mighty EC, and all peer departments ecommerce, stores, sourcing, planning, marketing, merchants et al""direct reports Deepak Lakshmanan Tom Greger Bryan Tabiadon and many many more in my department and across others I could list hundreds""our informal Friday meetings brought me personal joy.  I am humbled by your service""and lastly of course game changing partners like fabric Bounteous Google poq parcelLab AB Tasty Syte and Clario, Inc. the latter who started the journey with me""etc. etc. etc.  Too many to thank!  The entire experience including the acquisition and new leadership transition was great.  I wish the new company the very best.  I am an Alumnus! My new adventure starts soon""stand by!  Thank you ALL""tagged and not tagged!  Life is a journey I hope you enjoy every moment of it! hashtag#digitalfirst hashtag#productinnovation hashtag#customercentricity hashtag#operationsexcellence",Organizational Change Management
"One of the things I love about User Centricity at Mars is connecting with our associates around the world. Super energized this week to design think, create, and upskill with some of our amazing leaders with Royal Canin Mexico. Kudos to teammates Kara Konicki for leading an incredible session and Premal S. for her facilitation skills. And thank you to Cesar Gutierrez, Nuria Gonzalez and Mariana Barron for being the amazing hosts. hashtag#usercentricity hashtag#designthinking hashtag#creativity hashtag#innovation hashtag#proudlymars",Organizational Change Management
"It was great to be at hashtag#LEAD2024 yesterday talking about hashtag#AI's potential for businesses and the UK's economyYY. During my talk, I announced a brand new, free AI training module specially designed for marketers.Our data shows that many Brits aren't sure how to get started with AI - with searches for "" how to use AI' up 1,270% since 2022 Y. Our recent Economic Impact Report also revealed that AI has the potential to deliver a mega  400bn for the UK by 2030.Y Training resources, like our new Marketing Strategy and AI module, are key to helping us unlock that potential. At Google, we're committed to providing everyone with the skills they need to make the most of technologies like AI. This new training module builds on our experience upskilling over 1 million people across the UK since 2015 through Google Digital Garage. If you're a marketer and would like to learn how to use AI to optimise data, earn consumer trust and better connect with customers, check out the module: https://lnkd.in/eQ3cZHcthashtag#AI hashtag#DigitalSkills hashtag#Training hashtag#Marketing hashtag#Advertising hashtag#LEAD2024",Organizational Change Management
