postContent,themes
"Welcome, Thor Brun! For decades our family office clients have sought our legal, tax, and planning advice for their businesses. Our newest team member in MPW Consulting, LLC brings that expertise. Thor's strategic and business consulting background across diverse industries helps clients reach their goals of business growth, operational development, financial analysis, turnarounds and M&A. Please welcome Thor Brun.",Organizational Change Management
"It was great to see the progress made on Newell Brands' packaging sustainability goals we communicated over the last few years. Here are a few of the learnings from the process and after talking with other companies. 1.  Develop proof of concept reporting systems and baseline where you are at before setting goals. Data collection, validation and reporting can be very time-consuming.2. Develop goals based on external stakeholder needs (e.g. consumers, customers, investors, regulators) and align with internal stakeholders' ambitions. Its ok to admit your company may not want to be the industry leader. You can pick strategic areas to go beyond goals.3. Understand the technical feasibility of goals. That includes an understanding of the current state of infrastructure. This is especially true for 100% recyclability goals. Unfortunately, the U.S. infrastructure can't support most of these goals yet. 4. Create great partnerships with those tasked with meeting the goals (e.g. packaging engineers). This includes providing the tools and support necessary to meet the goals.Please share any others you may have. Great job Adam Brandimore, Lauren Jones, Frances Mazur-Batistoni and others for the work over the years developing and driving the packaging sustainability goals.",Organizational Change Management
"Thrilled to be among the 30,000 attendees at Google Next Vegas this week!   It's was an incredible opportunity to connect with the brightest minds in tech, explore groundbreaking solutions, and witness  AI innovation unfold.I was selected to be part of the Leaders Circle track, designed for senior executives to dive deep into strategic business challenges.  Katie Couric  moderated many of the panel discussions with the industry leaders. It was a pleasure to be on the panel ""How Tech Innovators Are Framing the Future of Business"" with David Kline  and Sandeep Dadlani. Alison Wagonfeld  was an amazing moderator!!Google revealed the release of Gemini Pro 1.5!   I have high expectations and want to explore the 19 built in Responsible Controls. Early insights suggest its potential for significant impact in AI advancements.  It's an incredibly exciting time to be in tech with AI revolutionizing the industry.",Organizational Change Management
"""Architecture plays a vital role and thus, the role of the Solution Architect"" -- said Anthony Sneed when I posed him the question about steps enterprises can take to control the cost of Cloud Migration -- a topic that is at the top of mind on the eve of my fireside chat with Yar Savchenko tomorrow at the Innotech Dallas event at 1 PM CT on the topic -- ""Are you happy with Cloud Migration -- A Reality Check!""Developers focus on the services needed from an applications perspective but it is the Architect who has to ensure that the overall solution is cost-effective, compliant, conforming to standards, secure while addressing several non-functional requirements. Rameshwar Balanagu shared his own first hand experience in ensuring that the right governance mechanisms are in place through Architecture Review Boards to ensure that these controls are exercised on cloud deployments.This is what happens when members of the Chief Architect Forum get together and have a discussion with a purpose!What say you? Are you happy with Cloud Migration? What are some other steps that enterprises can take to control the cost of cloud migration? Please jump right in with your comments!Mark Patton:: Madhav Renduchintala :: Chandra Gundlapalli :: Narender Chinthamu MBA,TOGAF 9, PSM I, GCP, AZURE,SAFe :: Ryan Plant :: Fred Crable :: John Dougherty",Organizational Change Management
"Things not adding up? Struggling with incoherence? Welcome to professional Everything Everywhere All at Once.The Hope  On one hand, we're hearing things that inspire and give hope. A call for courageous leaders who get into the details in all the right ways, empower teams, and have the potential to improve our organizations. Agency, connecting with customers, seeing the impact of our work. Focusing on outcomes instead of outputs. The potential of AI. All of these things speak to purpose, hope, possibilities, and opportunities. They talk about fulfillment, career enhancement, and purpose.The Reality (For Many)  Multiple rounds of layoffs (amidst record profits). Truly hurtful hiring practices (""Oh whoops, we've decided to restructure, offer rescinded, thanks for the 3hr assignment""). Thoughtless RTO mandates. Same old corporate doublespeak in all companiesstartups, 100y  enterprises, and everything in between. Tech CEOs are saying dumb, insensitive things that are so predictably biased that it hurts to listen. Gaslighting is in full effect.A rapidly declining sense of loyalty in companies. We're still working through the trauma of the pandemic. The climate change news is terrifying. Global conflict. A reported epidemic of loneliness (here in the US).We're bombarded by a full range of perspectives on AI, from blind AI fan-boy enthusiasm all the way to complete Luddism and genuine fear for jobs and everything in between. Across the spectrum of companies, regardless of maturity, we're hearing about things that are not good, or at least not as good as we thought (or wanted to believe).The Advice...  And then you have people dealing with all this in their own way or trying to help others, -Give them a version of harsh truth / tough love in an effort to help.-Help them be more resilient, accepting, and pragmatic.-Support their job search and analyze the current job market. Discuss how roles will change or not change. -Urge people to adapt their skills and encourage companies to transform.They are all doing what people do for the most part, which is trying to help in their own way. But sometimes it isn't landing. There's a deluge of coping advice.My realization  People are tired. People feel in limbo. People are questioning themselves, their companies, and their craft. It's not the rate of change that is truly gripping people, it is the tension of the change.It is crucial to be empathetic, sensitive, and helpful in genuine ways. Our default ways of helping may not even be helpful right now, so it's important to be super self-aware. We all need someone to listen and not lecture.I've written, taught, spoken, and drawn infographics for many years about good products, high-performing teams, feature factories, and continuous improvement. It's my thing, I guess. In the last couple weeks I've had the time to connect with so many friends and hear about what's going on in people's heads lately.Things are tough.Be kind.",Organizational Change Management
"At some companies, efforts to change are met with organizational drag, which is a kind of corporate self-sabotage.  What to do?  Meeting sabotage with sabotage is effective if you don't want something to move forward, but if your professional mission is to make things better, don't go it alone.  There are always agents  not CIA agents, but change agents  hiding in plain sight around most companies.  Find your people. #LinkedInTopCompanies #Innovation #Changemanagement #professionaldevelopment",Organizational Change Management
"At some companies, efforts to change are met with organizational drag, which is a kind of corporate self-sabotage.  What to do?  Meeting sabotage with sabotage is effective if you don't want something to move forward, but if your professional mission is to make things better, don't go it alone.  There are always agents  not CIA agents, but change agents  hiding in plain sight around most companies.  Find your people. #LinkedInTopCompanies #Innovation #Changemanagement #professionaldevelopment",Organizational Change Management
"At some companies, efforts to change are met with organizational drag, which is a kind of corporate self-sabotage.  What to do?  Meeting sabotage with sabotage is effective if you don't want something to move forward, but if your professional mission is to make things better, don't go it alone.  There are always agents  not CIA agents, but change agents  hiding in plain sight around most companies.  Find your people. #LinkedInTopCompanies #Innovation #Changemanagement #professionaldevelopment",Organizational Change Management
"At some companies, efforts to change are met with organizational drag, which is a kind of corporate self-sabotage.  What to do?  Meeting sabotage with sabotage is effective if you don't want something to move forward, but if your professional mission is to make things better, don't go it alone.  There are always agents  not CIA agents, but change agents  hiding in plain sight around most companies.  Find your people. #LinkedInTopCompanies #Innovation #Changemanagement #professionaldevelopment",Organizational Change Management
"A few years ago I worked with an airline to improve the utilization of the commercial cargo with very nifty AI-based Revenue Management solutions. The technology could get the airline 10ppt extra utilization across its entire network (worth over $100M per year in bottom line) but they could not get to that value until they got airport palletizing procedures to be optimized and cargo sales reps to use the technology in their day to day workflow. Both critical non-tech changes.For real value, it's #NeverJustTech - There is so much more to consider in order to maximize the performance of digital and AI solutions. Every time a new solutions gets introduced to optimize a process or a customer experience, there will likely be changes required upstream and downstream of that process as per my airline example. That's why business leaders must own the reimagination of that business process with technology AND also own the change management. It's also why such efforts are so often failing if they are tucked too low in the organization with managers who don't own the end-to-end process or if they are being pushed by IT. #McKinseyDigital #RewiredBook",Organizational Change Management
"Healthcare has been through lots of centralizing and outsourcing over the last decade plus.  This coupled with a workforce that has become more virtual since COVID-the human connection has been lost.  A prime example of this is access and navigation centers.    We are bringing that human connection back through assigning schedulers, nurse intake and other key support resources to physician teams.  This will include regular huddles and direct communication between physicians, APPs and the support teams.  Technology will be and enabler of huddles and relationship building. Having these direct connections and relationships between team members will help smooth out any nuances in a day and allow the workforce to be in person or remote.  The trusted relationship is key.  Proud of this team for making that vision a reality at CITYOFHOPE 

#humanconnection",Organizational Change Management
"Im thrilled to share my completion of Topgolf Callaway Brands' first Operations Management Academy course!
 
Over the past year and a half, a group of us have been immersed in a program focused on honing our skills and knowledge of how TCBrands manages the Supply Chain organization. Through a combination of coursework, hands-on exercises, and collaborative events, we've gained insights into how the company runs and how we can continue to drive organizational success.
 
Grateful for the experience and opportunity to meet and learn from so many wonderful people! Excited for whats to come! 

( Big smiles from Jeff, Gregg, and Mike! Appreciate you guys!)",Organizational Change Management
"When you take a company-centric sales approach:

 you force B2B buyers down the funnel before theyre ready to buy
 youre not aligned with how buyers want to buy 
 you damage your brand
 you lose delas

But in reality, the B2B buying process is complex and looks like a maze. 

And you need to:

 Deliver value through multiple touchpoints
 
Because its the accumulation of touchpoints over time that drives your buyers to take action.

 Give them the time they need to make buying decisions 

Because it takes time for B2B buyers to:

1- Become problem aware
2- Prioritize solving this problem
3- Become category/solution aware
4- Ensure the buying committee is on board
5- Allocate a budget to solve this problem
6- Choose your brand & buy

 Understand how they prioritize problems, and research & evaluate solutions 

Because its the foundation of how you do marketing, unless you want assumption-led growth. Making customer research a priority is no longer optional.


So when you figure out all of this and adapt your GTM strategy accordingly, youll attract your ideal customer.

----
 Hi, Im Alon. I build, execute & optimize GTM strategies for B2B SaaS marketing teams and CEOs looking to grow fast and efficiently.

DM me GTM to see how I can help you. 

#gtm #b2bmarketing #marketingstrategy #customerresearch",Organizational Change Management
"In theory, it is easy to say that you should work on important things. In practice, it is extremely hard to do it because of the pressure of product delivery work, trying to meet your teams day-to-day expectations, and the irresistible pull of Slack dopamine hits. A short, practical guide on balancing the urgent & the important:",Organizational Change Management
"I had the opportunity to visit the Mexico Novartis Corporate Center this week with my IT leadership team, where we had a packed and fruitful agenda. The energy and passion of our colleagues there was truly inspiring. Here are some of the highlights and learnings from our trip:

> We had an excellent Town Hall with the entire IT Community in Mexico, where we introduced the entire US&I LT and discussed the strategic direction and priorities of our function, as well as the opportunities and challenges we face in the US market. We held an open Q&A session where I was impressed by the enthusiasm, engagement, and professionalism of our colleagues, and their continued desire to focus on the US business and grow the talent across all IT functions. 
> We strategized as a team on our refined Ways of Working, including improved KPIs and leveraging the feedback from our extended team to improve how we show up as a part of the larger DD&IT organization. We also had an opportunity to meet with the ITLT on the ground, and addressed their questions on how we deliver value to our customers and stakeholders. 
> We had the opportunity to meet with our individual team members in Mexico face-to-face and discuss individual team priorities.
> We worked with our various P&O colleagues on topics such as attracting and retaining talent in the NOCC as well as advancing our interactions as a team, with a focus on enhancing our collaboration and communication skills. 
> We also had some fun and bonding activities, such as a cultural tour of the city where we immersed in the wonderful Mexican Culture. 

I want to thank everyone who made this trip possible and successful, especially our hosts Juan Antonio Rosario, Giorgio Diaz and Tania Del Villar Orozco and of course Rodrigo Reygadas the NOCC site head in Mexico, who were very gracious and hospitable. I also want to thank my leadership team for their dedication, commitment, and passion for our function. I am proud to be part of such a diverse and talented group of leaders, and I look forward to continuing our journey together. 

Masayuki Aoki, David Li, Cristina Lopez-Santos, Eva Perez Casesmeiro, Isabel Perez Ennes, Mark Pohan, Laura Pujadas, Vikram Singh, Mark Tramposch, Giorgio Diaz, Juan Antonio Rosario, Linda Gaffney, Juliana Leal Valera, Juan Luis Martinez, Gabriela Mendoza, Ana Santiago, Merlin V., Bernd Bucher",Organizational Change Management
,Organizational Change Management
"Im thrilled to share my completion of Topgolf Callaway Brands' first Operations Management Academy course!
 
Over the past year and a half, a group of us have been immersed in a program focused on honing our skills and knowledge of how TCBrands manages the Supply Chain organization. Through a combination of coursework, hands-on exercises, and collaborative events, we've gained insights into how the company runs and how we can continue to drive organizational success.
 
Grateful for the experience and opportunity to meet and learn from so many wonderful people! Excited for whats to come! 

( Big smiles from Jeff, Gregg, and Mike! Appreciate you guys!)",Organizational Change Management
"Inspiring day with John Muir Healths clinical operational  leaders partnering to understand psychological safety, leader standard work, and humble inquiry to unleash our team's potential as problem solvers. Grateful to Lisa Foust for her invaluable guidance and setting the stage on the impact of leaders behaviors on teams and the organization. #Leadershipdevelopment #Psychologicalsafety
#Engagement 
#Leaderstandardwork
#Humbleinquiry",Organizational Change Management
"We're delighted to introduce our first broad-based employee ownership plan with PFB Corporation, in partnership with Ownership Works.  We love the alignment created by the Ownership Works program, and we're proud to partner with the entire PFB team on this journey. 

https://lnkd.in/g4amxRVz",Organizational Change Management
"  Five industry leaders, one insightful dialogue.

Here's the inside scoop from AspenTech CEO Antonio Pietri's conversation with industry leaders Jennifer Richmond from Wood, Bob Maughon from Circular Logic Executive Advisors, LLC, Wade Maxwell from ExxonMobil, and Mark Browning from AspenTech.

 Asset-intensive industries are undergoing profound transformation, and companies must keep pace in order to remain competitive.

 Attracting and investing in the next generation of engineers is imperative for the industry as a whole to do better, faster.

 While the industry transformations that will come as part of the #energytransition may be challenging, they also represent an enormous opportunity for those companies able to take advantage of them to remake industries for a sustainable future.

#PartneringForTheFuture",Organizational Change Management
"We're delighted to introduce our first broad-based employee ownership plan with PFB Corporation, in partnership with Ownership Works.  We love the alignment created by the Ownership Works program, and we're proud to partner with the entire PFB team on this journey. 

https://lnkd.in/g4amxRVz",Organizational Change Management
"During my career I have been privileged to work in some fantastic companies and had the opportunity to grow in ways I never would have imagined. A lot of this growth was down to the people I worked with, who inspired and developed me, shared feedback to make me stronger and believed in me when I most needed it. There are too many to mention but you know who you are  .

Every experience brings different learning. But when your growth has been defined by job title, level, promotions and status, moving to a newly formed, flat organisation with high growth ambitions can be confusing. It can be difficult to recognise growth without tangible symbols, and the workload, urgency and ambiguity can be overwhelming. 

At TBG we wanted to create an event to explore what is different about this type of experience - and how we can make the most of it whilst building understanding of what skills and experiences we are adding to our toolkit.  Last Thursday we hosted a morning of activities - including an insightful panel discussion featuring Russell Kronenburg, Malcolm Devine and Isabelle Ehrmantraut, interactive workshops to explore trust, feedback and reframing and an overview of how we will enable people growth as the business grows. It was a brilliant opportunity to step back and take stock of how far we have come and the road ahead. 

A massive thank you to everyone who got involved - especially the brilliant team of volunteers from across our team who put their hearts and heads into the event. You really brought this to life. 

Anthony Assaker Alan Rochford Babette Mcilmail Noel Dalton Victoria Spencer-Allen Jo McLean ( nee Hipgrave) Amanpreet Kaur Sungoo Tiare Shim Bernard De Grove Sinem Yurdakan Ince Felicity Criddle Lateef Bello Alexis Le Guinio Auke Geirnaert Julie-Jayne Berenger Michael Hoogewijs

#tropicanabrandsgroup #inspiration #professionalgrowth",Organizational Change Management
"We're delighted to introduce our first broad-based employee ownership plan with PFB Corporation, in partnership with Ownership Works.  We love the alignment created by the Ownership Works program, and we're proud to partner with the entire PFB team on this journey. 

https://lnkd.in/g4amxRVz",Organizational Change Management
"  Five industry leaders, one insightful dialogue.

Here's the inside scoop from AspenTech CEO Antonio Pietri's conversation with industry leaders Jennifer Richmond from Wood, Bob Maughon from Circular Logic Executive Advisors, LLC, Wade Maxwell from ExxonMobil, and Mark Browning from AspenTech.

 Asset-intensive industries are undergoing profound transformation, and companies must keep pace in order to remain competitive.

 Attracting and investing in the next generation of engineers is imperative for the industry as a whole to do better, faster.

 While the industry transformations that will come as part of the #energytransition may be challenging, they also represent an enormous opportunity for those companies able to take advantage of them to remake industries for a sustainable future.

#PartneringForTheFuture",Organizational Change Management
"We're delighted to introduce our first broad-based employee ownership plan with PFB Corporation, in partnership with Ownership Works.  We love the alignment created by the Ownership Works program, and we're proud to partner with the entire PFB team on this journey. 

https://lnkd.in/g4amxRVz",Organizational Change Management
" What an amazing way to kick off Q2! 

Since my company Organized SHIFTTM has established a partnership with CenterPoint Energy over the years through the guidance of the innovative and #inclusive #leadership of folks like Leviticous ""Vic"" Cleveland, Marco Martinez, Jacob Bunch, Takea Reshay Reeder, Camille Alfaro and @Kimberly Blasingame, we have successfully led group #coaching, multisensory and #immersive #upskilling and development.

Most recently, our efforts supported the #CenterPointEnergy #SupplierDiversity 2-day proactive business strategy meeting, an Earn Your Business with Seasoned Suppliers facilitated panel, and #groupcoaching session.

Helping to celebrate their 40-year commitment to provide diverse suppliers equal opportunity in sourcing and #supplychain processes, Organized SHIFTTM engaged in cultivating strong working relationships using #innovative and immersive approaches designed for #continuousimprovement to meet business objectives and opportunities.

Its so amazing to see the #success of our work partetning with a #Fortune500 industry titan like CenterPoint Energy to upskill seasoned leaders across industries, company size, and culture. 

From customizing our immersive coaching and developmental experiences for large group facilitation, to addressing gaps, barriers, and blind spots leveraging the proprietary #SHIFT approach, our emphasis extends beyond individual skill development. 

We aim to improve team and leadership dynamics, organizational culture, performance results, and overall success. 

Captured below is #SHIFT in action, engaging with #suppliers from across the nation who shared their experiences with us showcasing how much they learned about themselves as #inclusive leaders, in such a short time. 

We are excited to #MakeSHIFTHappen


#leadership #leadershipdevelopment #supplierdiversity #inclusion #esg #LeanSixSigma #manufacturing #speaking #supplychain #womeninbusiness #ThrowbackThursday",Organizational Change Management
"Did you know that the majority of organizations realize less than one-third of the expected impact from digital investments?

However, there's a shift occurring as leading companies leverage digital and AI to accelerate value creation.

Our analysis of over 1,000 companies unveils the secrets behind their success and the transformative potential of digital and AI. Explore the findings here: https://mck.co/4aVeWHT

#NeverJustTech",Organizational Change Management
