postContent,theme
"At Health Evolution's 2023 Summit, CEOs from health systems, health plans, and life sciences companies, as well as select policymakers, investors, retailers, and technology leaders, came together to discuss the top challenges and opportunities facing the health care industry""and to chart a path forward together. Throughout these conversations, four major themes emerged:
1. Cross-industry collaboration is vital to moving the health care industry forward;
2. The acceleration of innovation in health care isn't slowing;
3. The industry must integrate new innovations and technologies to harness their promise for both health care companies and patients; and
4. Focusing on proactive, preventive, and accessible care is imperative.
Click the link below to read highlights from the conversations, featuring perspectives from Meera Mani, MD-PhD, Partner, Town Hall Ventures; Hemant Taneja, CEO & Managing Director, General Catalyst; Frederick Isasi, Executive Director, Families USA; Alice Hm Chen, MD, Chief Health Officer, Centene Corporation; Cheryl Pegus, MD, MPH, Partner, Morgan Health Ventures; Mario Schlosser, Co-founder & President of Technology, Oscar Health; Neil de Crescenzo, CEO, Optum Insight; Clive Fields, MD, Co-founder & Chief Medical Officer, VillageMD; Laura S. Kaiser, FACHE, President & CEO, SSM Health; Bernd Montag, PhD, CEO, Siemens Healthineers; Mark McClellan, MD, PhD, Director, Duke-Margolis Center for Health Policy and former Commissioner, FDA; Meena Seshamani, MD, PhD, Deputy Administrator & Director of Center for Medicare, Centers for Medicare & Medicaid Services; Amy Abernethy, MD, PhD, President of Product Development & Chief Medical Officer, Verily, and former Principal Deputy Commissioner, FDA; and Joaquin Duato, Chairman & CEO, Johnson & Johnson.
Learn how these leaders and organizations are working to drive collaboration and collective action in health care""and where they're leading the industry next.
https://lnkd.in/gQRnZ-Ua
#healthcare #healthcareinnovation #leadership #HESummit23",Health outcomes
"This. Is. Huge.
Practical education of this nature from a young age can change lives, break generational cycles, and set up young people for the reality of life in the working world.
YYYYYY
#education #change #stategovernment #fined #michigan",Regulation/Legislation
"Why do businesses play a key role in advancing #HealthEquity? Because employers own some of the major drivers of health #disparities""determinants such as income, economic stability, benefits (PTO, health insurance, mental health supports), and social conditions in the communities in which they operate. With this power comes a responsibility to act.
Business leaders looking for a place to start should consider this excellent piece from Harvard Business Review: https://bit.ly/3CHNvCp.
Authors Shantanu Nundy Lisa Cooper, and Ellen Kelsay outline several opportunities that companies can pursue to improve health equity among their employees and communities. Take note and take action!
""By using a health equity lens and proven strategies to eliminate disparities, employers can improve business outcomes, create a better employee experience, and advance health for all.""
#equity",Health outcomes
"Manufacturing has become critical to every element of our economies and societies. Thanks to my fellow panelists for a great discussion at #WEF2023 on what must change as a mindset as we look at manufacturing going forward. With the help of #technology, we can reshape manufacturing & supply chains to be more resilient, sustainable and inclusive.
Looking forward to more interactions here in #Davos in the next days.
World Economic Forum",Supply chain
"I am incredibly proud to work alongside Amy Brady, Angela Mago, and Victoria O'Brien, influential and impressive leaders recently recognized by American Banker at the 21st annual Most Powerful Women in Banking gala. Not only do they model values-forward leadership and have a positive impact on all who are fortunate to know them, but they make KeyBank a stronger company each and every day. Please join me in congratulating them on this prestigious and outstanding accomplishment.",MISC
"Discover BDO's predictions for the tech industry in 2024, including one X-factor that could vastly accelerate innovation. hashtag#Tech hashtag#QuantumComputing",MISC
Things are getting a little...spooky around here. Y Are you ready? Find everything you need for a hauntingly happy Halloween! Y https://bit.ly/407TsD8,MISC
"At Collective Health, our North Star has always been""and always will be""to make accessing and using your health benefits and health insurance plan as delightful and powerful as your favorite technology-enabled user experience (think Amazon, Apple, Uber, Zoom). And while we have always been at the cutting edge of user experience in the health benefits and health insurance plan market, these recent improvements to our My Collective member app really showcase the power of the technology stack, data, and user experience capabilities we have invested hundreds of millions of dollars developing over the last 9+ years.
And there are many more exciting and powerful new features and updates to come in the months ahead!",Health Insurance
"We are excited to announce our two major efforts (among many more) going into this year's annual enrollment:
First, we are thrilled to announce a 10-year partnership with ApolloMed on a collaborative new health plan that is focused on serving minority communities through differentiated benefits. ApolloMed is one of the premier healthcare provider organizations comprised of independent and employed physicians""and will work together with us to build tailored, culturally competent benefits and services for its large population of Asian-American, Hispanic, and African-American patients. In the words of their co-CEO Brandon Sim:
""In SCAN, we have found a partner who understands as much as we do that healthcare is local, and that healthcare must be tailored to diverse and traditionally underserved populations. SCAN's focus on historically marginalized communities is the exact mission that ApolloMed was founded to address, and we view SCAN as a partner that can work with us to deliver exceptional healthcare to not only the communities we're based in today but also new regions as we grow together.""
Second, we are thrilled to announce the creation of the Medicare Advantage industry's first women's focused product. Recognizing the central role women play in shaping their families' healthcare decisions, we wanted to deliver a Medicare Advantage experience that offers an additional layer of support. Our ""Inspired"" health plan will connect members with their own women's health advocate, a healthcare professional who can assist members in receiving personalized care. The plan will also offer $0 estrogen therapy, access to fitness facilities and on-demand live streaming fitness; reimbursement for weight management programs; and other benefits. We are thrilled to partner with Cedars-Sinai (thank you Tom Priselac for your partnership!) and other provider partners on this new product offering that we hope will lead others to build customized experiences for women.
Huge kudos to all of the amazing members of the SCAN team who helped launch these efforts with incredible passion for our mission of keeping *ALL* seniors (regardless of their race, culture, or gender) healthy and independent. Thanks to Marissa Plescia and MedCity News for telling our story.",Health Insurance
"Next week, UnitedHealth Group will release its 2022 Sustainability Report. I'm incredibly proud of the work our company has done to deepen our impact on the people we care for and the employees who work here "" and I'm excited for everyone to see how we've progressed on our commitments over the last year.",Environmental Sustainability and Climate
"""The pursuit of profit with purpose requires patience,"" reminds George Serafeim in his article for Financial Times that illuminates the evolving dynamics between business aspirations and societal change.
In a world quick to mythologize the binaries of purpose and profit, George Serafeim underscores the potential harmony of the two. Drawing attention to the evolving landscape, he emphasizes that our aspirations to integrate purpose in business might challenge us, but it's an effort deeply entrenched in possibility. As he notes, ""It is a myth that the pursuit of purpose in business is futile because it is antithetical to profit.""
Y Link to the article: https://lnkd.in/dWw2ziVg
For those interested in this topic, join the upcoming LinkedIn live #event hosted by Roche Digital InnoLab on 5th September: ""How businesses can lift up the world: a panel on purpose-driven companies"", featuring insightful speakers such as Roche's CFO Alan Hippe and George Serafeim himself.
YRegister for the event here: https://lnkd.in/dYNgfPUF
#RocheInnolab #purposedrivenbusiness
#purpose",MISC
"Wishing you and your loved ones a joyous and prosperous Diwali! May the Festival of Lights illuminate your path toward success and happiness! a 
hashtag#HappyDiwali hashtag#FestivalofLights",MISC
Danielle Renaldo is #hiring. Know anyone who might be interested?,MISC
"At Collective Health, we think of open enrollment as a road trip with interesting and informative stops along the way to finally being enrolled in the right health benefits for your needs. To help better prepare for it, we've put together a short (yet handy) summary of tips to help you and your teams get the most out of this important time of year and to maximize the odds of your people making the most appropriate benefit elections for their needs. Below is a link to the guide!
Pro tip #5: Inject some fun into it!",MISC
"Had a fantastic two days at Deutsche Telekom's Digital X event in Cologne. Such a unique and creative blend of conference and networking event in a city takeover format. Met many customers, partners and members of the media. Especially grateful to Hagen Rickmann from Deutsche Telekom and Ruediger Hoppen from TUV Rheinland for sharing the main stage with me yesterday. And congrats to the #DocuSign team who executed our participation in this event so well.",MISC
Pleased to share my thoughts in Bloomberg Tax on how businesses can best position themselves to comply with the global tax deal and prepare for the complex data challenges to come. Read more below: https://lnkd.in/eahdNwha,Regulation/Legislation
"Exciting news from Rackspace University at Rackspace Technology! Our AWSome certification program is a great way for tech professionals to advance their skills and knowledge in Amazon Web Services (AWS). I can't wait to see how this will impact providing our customers with the best support!
#AWS #Certification",MISC
"If you're a legal professional that has been impacted by a layoff, our Chief Legal & Administrative Officer at Collective Health, Ron Bell, is organizing a webinar to provide practical advice and resources to hopefully make your job search more productive and easier. More details are in Ron's LinkedIn post below.",MISC
Very grateful for the honor of sitting down with US Ambassador Susan Rice at Dreamforce to discuss the future outlook for businesses and their stakeholders amidst ongoing geopolitical uncertainty and global challenges. #df23,Geopolitics
"On this Veterans Day, we express our deepest gratitude to and salute the brave men and women who have served this Nation.
Thank you YoY 
hashtag#ReserveCitizenAirmen | hashtag#VeteransDay | hashtag#ReserveReady hashtag#AimHigh hashtag#GoBlue",MISC
"Ready to level up your business? Ys From cloud infrastructure and cybersecurity to data management and applications, these are the factors that can help you leverage the power of AI. Let's embrace the future together!
#AI #BusinessGrowth",Data privacy and cybersecurity
"Nearly 8 in 10 senior IT and security leaders lack confidence in their company's security posture (via BitSight).
If you're not 100% confident, take this quiz to reveal your Cyber Threats Readiness Score and what actions you can take next:",Data privacy and cybersecurity
"How can tech companies build trust with customers and stakeholders while forging ahead on innovation? Prioritizing privacy and ESG will be critical. Read BDO's survey of tech CFOs to learn more.
#Innovation #Tech",Data privacy and cybersecurity
"Cybercriminals and digital environments have completely changed, but most businesses haven't evolved their cybersecurity approach along with the changing landscape. Learn how to mitigate cyber threats (via Forbes).
#Cybersecurity",Data privacy and cybersecurity
"It is more important than ever for companies to protect their sensitive information from phishing attacks and data breaches. Cybersecurity risks must be assessed and countered to preserve business integrity worldwide. BDO Digital covers 10 of the latest cybersecurity threats to business in 2023:
#Cybersecurity #RiskManagement",Data privacy and cybersecurity
"We're at the early stages of potential security risks presented by AI. We're also at the early stages of potential security *benefits* presented by AI. This VentureBeat article explains how self-healing software and AI can strengthen cybersecurity.
https://bit.ly/3pSffRH
#AI #Cybersecurity",Data privacy and cybersecurity
"As cyber threats become more complex, so do the cybersecurity strategies used to protect against them. If you're responsible for your organization's security, you might be interested in learning more about the 3 Components of Perpetual Defense: https://bit.ly/3uNHHTL
#Cybersecurity",Data privacy and cybersecurity
"Cloud technology revolutionized the way companies manage their systems and data over the past decade. BDO has 3 top cloud security challenges that organizations should consider when managing risk.
#Cybersecurity #CloudData",Data privacy and cybersecurity
"I am thrilled to share that BDO Digital USA is the 2023 Microsoft Security Partner of the Year!
Congratulations to each and every one of our talented team members - your hard work and dedication contributed to this remarkable accomplishment!
Being chosen as the Microsoft Partner of the Year is a true testament to our expertise, cutting-edge solutions, and unwavering commitment to delivering top-notch security services to our valued clients.
I couldn't be more proud!
Learn more: https://bit.ly/44jskSp
#MicrosoftPartner #CyberSecurity #MicrosoftPartnerOfTheYear #MicrosoftInspire",Data privacy and cybersecurity
"Customer relationship management software, or CRM, is a technology that companies use to manage all customer relationships. Learn what your organization should consider to protect it from potential cyber attacks (via BDO Digital):
#Cybersecurity",Data privacy and cybersecurity
This is a great deep dive into how Qualcomm's hardware-based #IoT security technologies make retail payments safer and seamless.,Data privacy and cybersecurity
"This recent Qualcomm OnQ blog post outlines five benefits of on-device #AI, such as enhancing privacy and security, and reducing energy costs. #ArtificialIntelligence",Data privacy and cybersecurity
"As October is Cyber Security Awareness month, I wanted to bring attention to how we at Roche ensure everyone stays safe and secure online. It is vital that we recognize the heightened risks we face in today's digital landscape. Cyber security is not just a compliance-driven IT topic; it's a shared responsibility and an opportunity!
In an era where cyber threats are constantly evolving, we must unite as a team to deliver the security and privacy that our regulators require, our customers expect and our patients deserve. Each of us has a crucial role to play in keeping our digital environment secure.
Learn more about Roche's cybersecurity strategy at https://lnkd.in/eGNwyurM
#CyberSecurity #InformationSecurity #Rocheproud #RocheInformatics",Data privacy and cybersecurity
"AI holds the potential to completely disrupt every industry, but none more so than medicine. In healthcare, AI will mean more breakthroughs delivered to more people, more quickly.
Yesterday, I attended #DHNY23 for the first time, where we discussed the impact of data and digital technology on drug discovery. I believe that over the next two decades, we will see advances in biology and technology have a dramatic positive impact on human health""a time where we can hopefully cure many currently incurable conditions, transform others into manageable chronic disease, and be better prepared for future pandemics.
Digital advances are revolutionizing every aspect of healthcare, and my Pfizer colleagues and I are excited to harness these advances to help achieve our goal of significantly improving human health for everyone on the globe.",Data privacy and cybersecurity
"Excellent essay on the implications of generative AI for the big 5 tech companies. Like much of what is written elsewhere, I think the predictions for Google are too dire - I would be surprised if they don't integrate their industry leading AI models into the flagship search product for queries where that makes sense (note: not most commercial queries, which are the only ones with ads).
I think the unresolved economic challenges of serving the AI results (given huge compute costs) and the legal/economic rights issues on the training data will be challenging for all, especially large players like Google and Microsoft.
All that said, does feel like a really meaningful discontinuity for so many products and services, including search.",Data privacy and cybersecurity
"Great insights on the essential strategies for building a secure, robust, and resilient AI environment. Read this article to discover the key principles that pave the way for a successful and secure AI implementation. #ResponsibleAI #SecureAI",Data privacy and cybersecurity
I've had the pleasure of working alongside our Data Freedom team here at Rackspace Technology and have seen all their innovations for data agility. It's no surprise to me that a recent Enterprise Strategy Group found that Rackspace Data Freedom can potentially reduce data transfer costs by a whopping 83% and data storage costs by up to 84%! Dive into our Data Agility Report to learn how data storage and management solutions can improve time-to-value.,Data privacy and cybersecurity
"Yesterday, I joined other cybersecurity industry leaders calling on Congress to continue to prioritize funding Cybersecurity and Infrastructure Security Agency's operations. The cybersecurity of the U.S. government, our critical infrastructures and America are a bipartisan a cause we can all continue to stand behind. CISOs: Your voice matters. If you want to add your name in support of CISA and its critical mission, please email govaffairs@tenable.com. Advocating for stronger national cybersecurity capabilities is in all of our best interest.
Art Coviello, Jr Niloofar Razi Howe George Kurtz Alex Tosheff Jason W. Brad Arkin Joseph Burkard Dave DeWalt Jason D. Ron Green Esmond Kane Nathan Lesser Mark McClain Stuart McClure Jim Nelms Gary Owen Bryan Palma Rick Vadgama, CISSP Mark Weatherford",Data privacy and cybersecurity
"Was able to join LiveNOW FoxNews US with Andrew Craft to talk about social media and potential U.S. ban on TikTok. Banning TikTok is like dumping a cup of water on a forest fire...""Thanks, but barely even putting a dent in cyber aspects of the strategic conflict we are engaged in."" Lots more to be done.
https://lnkd.in/gtyjdFxw
#cyber #socialmedia #tiktokban",Data privacy and cybersecurity
"Live at 440AM Central Y 3! Worth it to join CNBC's ""Worldwide Exchange"" with Frank Holland this morning to chat about AI impacting cybersecurity among other topics.
https://lnkd.in/eFbjvW-x",Data privacy and cybersecurity
"Rep Torres is on the money here. While this incident might not have been a cyber outage, it highlights the need for a better assessment of vulnerabilities and systemic dependencies which can cause similar outage or worse. Better believe bad actors are learning from this, we need to as well and use as an opportunity for continuous improvement.
https://lnkd.in/eDzVNjCS",Data privacy and cybersecurity
"Great to join CNN This Morning with Amara Walker to talk about the dangers of #TikTok and other social media platforms.
https://lnkd.in/gMtG4K4n",Data privacy and cybersecurity
"Great joining CNBC"" s ""The Exchange"" with Kelly Evans to discuss the cybersecurity threat landscape and concerns about spy balloons, AI.",Data privacy and cybersecurity
"The U.S. Securities and Exchange Commission's (SEC) new rule on cyber risk management and incident disclosure is right on the money. Too many companies have treated cybersecurity as a nice-to-have, not a must get done. Now it's abundantly clear that corporate leaders are responsible for the cybersecurity of their organizations.
When cyber breaches have material impact, investors have the right to know about an organization's cyber risk management pactices. This is a dramatic step toward greater transparency and accountability and will greatly improve our cybersecurity preparedness as a nation. The SEC's rule will force what companies should have been implementing all along; informed cyber risk management practices. Requiring companies to provide annual updates of their cybersecurity risk management strategy and governance and report material breaches within four business days will force leadership to pay attention and keep customers and investors better informed as to who they trust with their business.",Data privacy and cybersecurity
"Great to speak with Jon Fortt today on CNBC to discuss Cybersecurity, Tenable, AI, China, Microsoft and more",Data privacy and cybersecurity
Glad to join Amara Walker on CNN this morning to discuss the ongoing ransomeware attacks on casinos.,Data privacy and cybersecurity
"Last week we were privileged to host a dinner featuring a select group of startup leaders operating at the cutting edge of GenAI. While the conversation was lively and wide-ranging, we honed in on what some of the core implications for modern enterprises would be. Here were 3 key takeaways:
1) The path to widespread AI adoption in enterprises will likely take 2 to 5 years. Currently, there is a lot of enterprise experimentation with applications where hallucinations remain an issue. Additionally, there are challenges with scaling infrastructure to meet large-scale adoption. 2) We are still in the early days of figuring out what we can do with this technology similar to the early days of the Apple app store where the current set of GenAI applications are not necessarily revolutionary. The more interesting use cases are still to come. As a result, emerging players will have to help enterprises learn where and how to adopt these new applications, plus define their outcomes and return on investment. 3) For company builders, governance and safety need to be a bottom-up priority where you are able to respond to the evolving regulatory landscape. However, determining the appropriate regulations for GenAI is difficult because predicting the societal risks at the burgeoning stages of AI is akin to predicting the risks of social media at its onset in the early 2010s.",Data privacy and cybersecurity
"Excited about the possibilities of #GenAI, but worried about the dangers? Here's what to watch out for when integrating #LargeLanguageModels:
Y Security risks like bad actors injecting nefarious code into models
Y Fraud enabled by voice cloning and other sophisticated deep fakes
Y Legal liability: who is accountable for algorithmic decision-making?
Check out Vectara CEO Amr Awadallah's Seamless North Africa presentation to learn more about these risks, plus those around #AIbias, #AIexplainability, and #hallucinations ai ",Data privacy and cybersecurity
"#ChatGPT has been banned in #Italy over #dataprivacy concerns. The Italian DPA is worried that ChatGPT might be in breach of the European Union's General Data Protection Regulation (#GDPR) and is opening an investigation.
Good thing we've been cooking up a solution Y Want to be the first to know when we launch Private ChatGPT?
http://ow.ly/CiTC50NxFSR",Data privacy and cybersecurity
"We're setting the new gold standard for generative AI use of business data with Grounded Generation Y Learn more about how Vectara's best-in-class retrieval, summarization, and data privacy capabilities are empowering developers to build AI products that all but eliminate LLM hallucinations:
http://gag.gl/i3QEZy
#GroundedGeneration #ML #AIHallucinations #AI #LLMs",Data privacy and cybersecurity
"Learn all things #GenAI and how to balance Q&A, conversational AI, and research & analysis abilities with concerns about hallucinations, data privacy, and cost Y Register now to join tomorrow's webinar on #GroundedGeneration from Vectara with Justin Hayes https://lnkd.in/g9xfwz4U
#GenerativeAI #LanguageModels #FoundationalModels",Data privacy and cybersecurity
"Fine-tuning is the Y to creating ChatGPT-like models for your data, right? With risks like model poisoning, copyright issues, and bias ... maybe not!
CEO @[Amr Awadallah](urn:li:person:L-RR4JipQY) shares why fine-tuning may not be the best solution for hallucinations and other ways to improve accuracy and data privacy in AI Y
Check out his recent talk at Stanford ai 
#finetuning #GroundedGeneration #GenAI #EthicalAI",Data privacy and cybersecurity
"From Tel Aviv to Zurich: it was wonderful to host GTM Capital's first international CIO/CISO dinner in Zurich last night with our PortCos. Engaging and insightful conversations around cloud/IT spend & management, Generative AI & LLMs, and challenges in cybersecurity and securing data in the cloud and on-premise.
Vectara Cyera",Data privacy and cybersecurity
