postContent,theme
"It was a pleasure to be part of Roche's LinkedIn Live Digital InnoLAB TechTalk earlier this week. I was impressed that more than 1000 people joined the event and followed the discussion on the topic of purpose-driven companies. Thank you to Stephanie Sassman and Professor George Serafeim for the great talk and for bringing unique perspectives from Women's Health as well as research to the table! Big thanks also to the organizing team, very well done!
One of the most important topics we discussed was purpose versus profit which actually is purpose AND profit. My key takeaway for Roche and our industry is that if we want to make healthcare sustainable, we need profits in order to fund R&D. Without profits, we cannot invest and ensure we are doing now what patients need next. Moreover, purpose needs to have an exciting and energizing element. I look forward to continuing the conversation!
In case you watched it: What is your key takeaway from the event?
In case you haven't watched it yet, here is the recording: https://lnkd.in/ed-CxbVu",MISC
"Just sent out the last Cloudflare employment offers of 2022. Received roughly 400,000 applications, up 49% over 2021. Of those, we interviewed 15,805 candidates to ultimately hired 1,418. 37% of the hires were designated fully remote, up from 14% in 2021. Hiring is part of everyone's job Cloudflare but special thanks to Janet Van Huysse, Scott Tomtania, and their incredible team who help us recruit and hire the best so we can continue to live up to our mission of helping build a better Internet. #hiring2022",MISC
"#GenerativeAI is a powerful technique that promises to revolutionize how we interact with computers Y But it can have serious drawbacks related to trust, privacy, and cost a Join our webinar on June 6 to learn more about how our #GroundedGeneration approach addresses those drawbacks, making generative AI safer and more cost-effective to use. Register today!
http://gag.gl/oo5Z67
#LLMs #ConversationalAI",Cost management / reduction / optimization
"Praying for the victims of today's devastating earthquake in Morocco. YTMY12Y2Y12
If you are inclined to help, The New York Times article below has links to several relief organizations that are providing assistance to victims on the ground.
https://lnkd.in/gHVPZ3K6.",MISC
Great #opportunity to join TimkenSteel! #AtOurCore #itsecurity,MISC
Charlie Mattheis #Kudos #ThankYou very much for everything you do,MISC
"Take a moment to read through the findings of America's Health Rankings Annual Report, just released by the United Health Foundation this morning. It shows the prevalence of eight chronic conditions in the U.S. is higher than it's been in the report's history. Conditions like diabetes, depression and cancer that impact the lives of millions of people each day and remain a focal point for health disparities across the country. It's a sobering reminder for anyone working in health care. And it's just one of the many reasons we are working to build a health system equipped to treat the people who need us most. https://lnkd.in/gSJEgRhh",Health outcomes
"We stand with the people of Turkey, Syria and all those impacted by the devastating earthquakes. Like many of you, I'm deeply saddened to see the destruction and humanitarian crisis unfold. Thank you to all our leaders and to everyone helping to keep our EY family safe, offering support to our colleagues, their families and friends. We will keep them in our thoughts and prayers and do all we can to support those in need.",MISC
"Lawmakers recently introduced a bill that would have broad implications for the regulation of digital assets. Find out its potential impact on taxpayers, via BDO.
#Tax #CFTC",Regulation/Legislation
Welcome to the team Archie McAlexander! #pineapplepeople #greatplacetowork,MISC
"Divorce changes pretty much everything. Whether it's a surprise or something you're both on board with, you've gone from a ""we"" to a ""me"" "" and that can take some getting used to.
Maybe you were involved in the family finances while you were married, or maybe not. Either way, now the checkbook is in your hands. And that checkbook may look different than what you expected.
Why? Frustratingly, research shows that women's household income falls almost twice as much as men's post-split. And divorce can affect women's money in a lot of other ways, too.
That's a lot. And dealing with it is also pretty urgent. Financial instability is stressful and disruptive (especially if you're in a pretty emotional place right now).
That's why the Ellevest team put together a post-divorce guide at the link below. Our all-woman team of financial advisors has helped thousands of women model out the impact of a divorce settlement and what it ""means for their finances before it's too late.",MISC
"Find out how strategic tax leaders can help tech companies drive business performance with insights from BDO's 2023 Tax Strategist Survey. Thans Matthew Dyment and Dan Fuller for these tax insights for Tech companies.
hashtag#TaxTech hashtag#TaxPlanning",MISC
"Humbled to have been given the opportunity to give a Last Lecture to the Stanford University Graduate School of Business Class of 2023. A huge privilege to share my personal story and some of the biggest lessons I've learned throughout the highs and lows. Here are a few short clips from ""How to Live an Asymmetric Life.""
Link to the full talk here: https://lnkd.in/g-3E_9Rx hashtag#personalgrowth hashtag#mba hashtag#fear hashtag#lifelessons hashtag#entrepeneurship",MISC
I'm happy to share that I'm starting a new position as Chief Financial Officer at 48forty Solutions!,MISC
"It's the era of the employee""where companies will be measured not only by their performance, but also by how well they treat their people. Leaders who view the current macro environmental challenges as opportunities and take the initiative to focus on their employees, will not only create an environment where their people can thrive but will also reduce costs and improve their bottom line. The latest article from Fortune from this week's #CEOinitiative roundtable discussion explores this topic:
https://lnkd.in/gaSueWey
#EmployeeExperience #CEOinitiative",Workforce strategy
Qualcomm made the Forbes list of America's Best Employers For Diversity 2023. #TeamQualcomm,MISC
"NEWS RELEASE: Boise woman found guilty of felony insurance fraud
https://lnkd.in/gxSRTs_A
The Idaho Department of Insurance announced today that Alene Bako of Boise, Idaho was sentenced in Ada County for two counts of felony insurance fraud. Ms. Bako pled guilty in August 2023; her sentencing was held October 27, 2023.",MISC
"It was thrilling that Nasdaq today shared the news about SCAN's planned combination with CareOregon and the formation of the HealthRight Group on its iconic Times Square billboard.
The underlying intent of the combination is simple:
To improve care for frail and vulnerable populations of all kinds.
As a not-for-profit platform, HealthRight aims to inspire change in a healthcare industry that more often than not puts profit and quarterly earnings before the people that is charged to serve.
SCAN's strength is in the Medicare program, where we have 6 years straight of 4.5 Star performance (a feat accomplished by only 2 other plans in the country).
CareOregon's strength is in the Medicaid program where it has received national accolades for its patient-centered approach to serving the physical and behavioral health needs of people that society has too often forgotten.
Together, HealthRight will exceed $6.8B in revenues and 3000 employees and serve more than 800,000 people.
We simply can't wait to get started together!",Health Insurance
"#RedOctober is off to an exciting start with a Wild Card sweep and the Phillies now in Atlanta. Congratulations to the Philadelphia Phillies on a great win in the Wild Card Series.
Independence Blue Cross is proud to be the Official Health Insurance Partner of the #Phillies and home to an enthusiastic associate fan base. #IBX will be cheering loudly for #Philadelphia tonight as they go into Atlanta to face the Braves in Game 1 of the NLDS. Go Phillies!!
#NLDS #MLB #Fightins",MISC
"We are hiring for a Communications and Engagement Coordinator!
Wharton's Environmental, Social and Governance (ESG) Initiative brings together Wharton faculty and students to conduct academically rigorous research, develop new curricular materials, and co-curricular experiences that shape the future of investing, consulting, and strategy on ESG factors. Join our growing team!
The Communications and Engagement Coordinator (CEC) will help support ESG Initiative marketing activities and small- and large-scale events. The CEC will play an important role in the success of ESG Initiative events by contributing their expertise in marketing, communications, event planning, and coordination, etc. See the job posting and apply at https://lnkd.in/eVzgr7tv.
#esg #hiring #whartonesg",MISC
Eric Becktel is #hiring. Know anyone who might be interested?,MISC
"I have had the honor and privilege of working with many talented women. I'm indebted to them for their contributions to Pfizer and for teaching me some of the most important lessons of my career. Today, on International Women's Day, I want to say: Thank you for being my mentors, colleagues & friends. #IWD",DEI
"Attention job seekers! A new opportunity has just opened up for a Senior Executive Management Assistant (administrative assistant) position in Lansing reporting to me! This has potential to be a hybrid position, where you could work from home up to two days per week. If you're interested, check out the job posting below and feel free to send a private message with any questions. Don't miss out on this chance to join our team!
Job Posting: https://lnkd.in/gPsnS3rB",MISC
We're honored to be named a winner in the Exabeam 2022 Partner of the Year Awards for the third consecutive year. We're recognized explicitly as 'Services Partner of the Year in the U.S. and Canada' for our ability to help clients thwart digital adversaries. #cybersecurity,MISC
"Last chance to sign up to our first launch event for Vectara happening today (Mon) at 4pm pacific. The in-person venue is now full; however, you can sign up for the online version, which will also give you access to the online recording of the talks. You can sign up here:
https://lnkd.in/g9hTjMhr
hashtag#ai hashtag#ml hashtag#genai hashtag#llm hashtag#chatgpt Databricks SonoSim, Inc. Matei Zaharia Amin Ahmad hashtag#piedpiper",MISC
"I don't believe that Elon will do well with his investment in Twitter.
But it is impossible to deny his incredible impact on the world as the driving force behind Tesla and SpaceX. And he may be just getting started. I think most of the media missed the point with last week's Starship launch by deeming it a failure, when it was really a remarkable existence proof and very promising for the future.
In essence, it demonstrated a leap frog in rocket payload and efficiency, which when perfected would enable human travel to Mars and radical transformation of cross ocean airfreight. The first 30 minutes of the last episode of the All-In Pod covered this and included a SpaceX board member. I really recommend listening - such a refreshing, optimistic lens on human ingenuity, commitment and the final frontier.
On a related note, I do think this podcast has become must listen - and many clearly agree with me. It is now one of the most popular tech podcasts in the world (#2 on Spotify, for example).",MISC
"We have some exciting #commsjobs at Oxfam America. Take a look and come join our team! #brand #media #digitalmarketing
Director, Media Relations: https://smrtr.io/fCdp_
Associate Director, Brand and Engagement: https://smrtr.io/fBs6f
Digital Marketing and Fundraising Specialist: https://smrtr.io/fCdrf",MISC
"Join the NASAA team! We're hiring for three exciting positions:
- Manager, Events and Membership
- Senior Accountant
- Specialist-Regulatory Services
If you have a passion for investor protection and want to make a difference in the financial industry, apply now: https://lnkd.in/eRJqvGb",MISC
Calling all #socialmedia gurus! Are you looking to join a team of marketing rockstars? I'm #hiring and would love to connect. Check out the role below Y and apply today!,MISC
"When we invite someone to join our team, we are bestowed with the awesome responsibility to provide the care and inspiration and support that that precious human being needs to become everything he or she was meant to be.",MISC
"Last week, we hosted over 70 go-to-market leaders from our portfolio of software companies at the annual AKKR Sales & Marketing Summit. And boy did we have an action-packed program! From tapping into the power of storytelling to cultivating an engaged customer base, this year's discussions put the customer's journey at the heart of it all. Here's to new ideas, tried-n-tested tips, and of course friendships and relationships that span the globe. hashtag#AdvanceYourJourney",MISC 
"This summer, we've been thrilled to welcome a new class of interns to our stores, supply chain facilities and HQ teams across the country. Our interns have shared their talents and positive energy with us while adding significant value to the business through their efforts and insights. It's been such a joy to see them meet new teammates, develop new skills, explore their ambitions, and imagine the career possibilities with Team Target.
So in honor of #NationalInternDay, a special shout-out to Target's 2023 Summer Interns "" thank you for all you are doing to help us care, grow and win together! We are so glad that you chose to spend your summer with us. And, to the Target team members who have made this summer a valuable and memorable experience for our interns "" huge thank you for sharing your own talents and time, and showcasing the joy and potential that comes with a career at Target.",Workforce strategy
"As I reflect on 2022, I am filled with #gratitude for being able to work with gifted colleagues from Deloitte from so many disciples, countries and backgrounds, all passionate about transforming health and committed to a #futureofhealth which is more equitable and sustainable than the system we have today. Our clients have been through the toughest of times, traversing a #pandemic that won't quit, #inflation, #profitability challenges, #laborshortages and crushing #clinicianburnout. Our #lifesciences and #healthcare industry has responded with #innovation, #tenacity, and grit.
Today, #retailers, #techcompanies, #financialservices firms, the #startup community and incumbent firms have responded to #customer demands that life sciences and health care (LSHC) should be more #convenient, #cost #effective, #effecient, and deliver better #outcomes. Enlightened #employers have realized that #health for their #customers and #employees needs to be optimized for their businesses to be #resilient. And most importantly, #communities have risen up to team with all these stakeholders to bring about a #healthequity revolution so that we all have a fair opportunity to live abundant lives.
There is so much work to be done, but these seeds of change have been planted and this gives me so much hope for 2023 and beyond. It gives me hope that together we can transform this #fragmented industry to one that re-emerges as a renewed, reinvented, and reinvigorated health ecosystem.
At Deloitte we believe that our businesses and teams work #bettertogether and as an industry it is clear when we work cross industry, discipline and background, we will certainly be better. And that gives me hope for a better tomorrow.
Below are some pictures of our LSHC industry practice coming together in 2022. The first is our trip to visit our colleagues and the the innovation ecosystem in #Israel. The second at our LSHC happy hour at our partners, principals, and managing directors meeting in San Diego, and the final a holiday party hosted at our consulting leader's home in Chicago.
2022 was tough and amazing, and the best is yet to come! Happy holidays however you celebrate them and see you all in 2023.
Jeff Ellis Lynne Sterrett Daniel Ressler David Green Pete Lyons Tina Wheeler Greg Reh Vicky Levy Ilan Birnfeld Gal Ratzkowski Amit Harel John Haughey Seema Pajula Stacy Janiak Kevin Westcott Anthony Waelter Monica O'Reilly Stanley E. Porter Jason Salzetti Jennifer Radin Kulleni Gebreyes Maggie Zellers Chris Zant Neal Batra Josh Lee Teresa Leste Samantha Gordon Jeanette Yung Julie Landmesser",MISC
"Registration is now open!

FPA Annual Conference 2023 is a three-day event that provides you with what you need to pursue mastery in the business, practice, and profession of financial planning. Join your colleagues from September 27-29 at the Phoenix Convention Center in Phoenix, Arizona. We'll see you there!

Learn More: https://bit.ly/3NDbn0h

#fpaannual",MISC 
Looking forward to this amazing panel discussion amongst front line leaders in the debates and battles over accountable capitalism. #WhartonESG #esginvesting #esgstrategy #esgleadership Monica D. Viviana Alvarez Sanchez Jennifer Grancio Arthur van Benthem,Environmental Sustainability and Climate
"WTS South Carolina Partners are hiring! These firms are actively supporting the vision of WTS - equity and access for women in transportation. #WTSSC #WTS #hiring

CDM Smith:
Marketing and Proposal Specialist, https://lnkd.in/gnkjshnp

HNTB:
Project Manager II - Transportation, https://lnkd.in/g8-KQGsG
Environmental Planner V, https://lnkd.in/geWzHkMd
Project Manager I - Engineering, https://lnkd.in/gsm3Zh9W
Environmental Planner II, https://lnkd.in/gMgHR7-Y
Bridge Engineer III, https://lnkd.in/gqWvHrgi

HDR:
Traffic EIT, https://lnkd.in/gMUKHku3",MISC
"We are excited to welcome the Front Barnett team to Mesirow! This acquisition aligns well with our focus on comprehensive, personal financial planning, and the team's capabilities and commitment complement our firm's 86-year history of advising families, entrepreneurs and non-profits on their most important financial goals. We look forward to ongoing organic growth and continued momentum through potential future acquisitions in the wealth management space.",Cost management / reduction / optimization
Should you fine tune or embrace RAG first? Amr Awadallah is walking us through this decision point. hashtag#kmworld,MISC
"Moving fast requires trust. Moving forward requires disruption. Today we completed our acquisition of Aerojet Rocketdyne. With this effort, we're furthering our mission to deliver our customers what they need, when they need it "" and driving performance and innovation at every turn. With an unmatched workforce of more than 50,000, we're ready to show our customers "" and the world "" what's next. Welcome to the team, AR. https://bit.ly/3qaXywP",MISC
"Congratulations, ideaForge. Qualcomm Ventures is proud to support your technological contributions to India.",MISC
"To all the fantastic mothers out there, especially those in our EY community, I'd like to wish you a very special Mother's Day this year. My mother and my wife (mom of our four kids) have been a driving source of inspiration for me my entire life "" the guidance they have offered me and our family, and the sacrifices they have made really shine a light on what it means to be a great mom. I wouldn't be where I am today without them. It's an honor to spend the day celebrating them!",MISC
"Unlock Exclusive Savings with FPA Membership!
As an FPA member, you gain access to the FPA Marketplace, your ultimate source of savings on essential products and services for financial planning professionals. From marketing and fintech to education, compliance, insurance, and more - find it all in one place, powered by Chalice Network .
But that's not all! BenefitHub grants you access to incredible savings from top companies like Verizon, Costco, Geico, Disney, and many more. The best part? The savings you enjoy through the FPA Marketplace more than cover your membership cost!
Don't miss out on this unbeatable benefit! Log in now with your FPA credentials and start saving!
#FPAofMiami #Savings #FPAmarketplace #MembershipBenefits #FinancialPlanning #JoinNow",MISC 
"Enjoyed chatting with Liz Claman on Fox Business today about our roadmap and the role of AI.
#docusign
https://lnkd.in/g_35gDey",MISC
"Earlier today, Medtronic reported another quarter of strong performance with revenue of $8.0 billion, which increased 5% organic. Our results are broad-based as we deliver on our commitments across multiple businesses and geographies. Guided by our Mission and powered by our people, we're creating innovative products and therapies for millions of patients around the world, while also positioning ourselves for long-term sustainable growth. For those of you celebrating Thanksgiving this week, I hope you enjoy a happy and safe holiday with loved ones.
https://bit.ly/3MTjBjO",MISC
"Trump is no Putin strongman, but he knows how to rule like one.",MISC
"From tailored experiences to increased productivity, the advantages of personalized on-device hashtag#AI are far-reaching. hashtag#TeamQualcomm",MISC
"Thank you, Elizabeth Mitchell, Erika Fry, and Patrick Conway for being such great co-panelists at this week's Fortune Brainstorm Health 2023 Conference. It was great discussing how employers can improve their workforce's health while also bolstering their bottom lines with you all.",Workforce strategy
"Congratulations to EY for being named the top tax firm in 2023 by Accounting Today. Day in and day out, I am impressed by this team's exceptional service and dedication to providing innovative tax solutions to our clients. Read below for the full list: https://lnkd.in/eBBsVVPE",MISC
"This Veterans Day FIS would like to thank all military veterans, active duty, and their families for their service and sacrifices they make every day.
In observance of Veterans Day, FIS Salute "" the veterans inclusion network "" hosted their signature event this week at FIS headquarters in Jacksonville, FL where keynote speaker, Lieutenant General (ret) Mark Hertling, shared his ""Elements of Leadership."" We were also joined by FIS Salute Executive Sponsor, Nathan King, SVP, Division Executive, Implementations, and FIS Board of Director and USMC Veteran, Jim Stallings, Jr. During the event, we welcomed transitioning veterans to attend and held a networking hour with FIS colleagues and leaders, as well as conducted informational interviews. To learn more about career opportunities for military veterans, join our Inclusion & Diversity Talent Community: http://spr.ly/6043uQlAt",MISC
"CALLING ALL HR PROFESSIONALS IN THE US!! www.HRSearchPros.com
More HR openings throughout the US!!
www.HRSearchPros.com
I am working on a variety of HR openings with several different companies throughout the US in a variety of industries "" some of them offering relocation. If you are an HR professional and are actively looking for a new role, passively looking for a new role, or just want to discuss what is happening in the HR marketplace, please contact me Ralph Chapman, HR Search Pros, Inc., rchapman@hrsearchpros.com
JOB 1050 - HR Director - TX JOB 1049 - HR Manager "" IN
JOB 1048 - HR Business Partner - WA
JOB 1047 - HR/Labor Relations Manager "" IN
JOB 1046 - Compensation Associate - NY
JOB 1044 - HR Manager - TX
JOB 1043 - HR Manager - NY
JOB 1032 - Senior HR Generalist - MI
JOB 1031 - Senior HR Generalist - VA
JOB 1025 - Campus Recruiter - NY
JOB 1015 - Diversity, Equity, and Inclusion (DE&I) Associate - NY
I look forward to hearing from you! Thanks in advance!
hashtag#HRjobs
hashtag#HRBPJobs
hashtag#HRGeneralistjobs
hashtag#SeniorHRGeneralistjobs
hashtag#SrHRGeneralistjobs
hashtag#HRManagerJobs
hashtag#HumanResourcesJobs
hashtag#HRManagerJobs
hashtag#HRDirectorJobs
hashtag#plantHRjobs
hashtag#manufacturingHRjobs
hashtag#HRopenings
hashtag#hiring
hashtag#openpositions",MISC
"Will the labor market and consumer resilience that we saw this summer continue through the new year? In EY-Parthenon Chief Economist Gregory Daco's latest newsletter he outlines his concerns about the economic outlook and shares why he believes current global optimism will eventually dissipate. Despite unexpected consumer spending and surprisingly robust job growth this summer, Greg warns that cost fatigue, rising hashtag#InterestRates and a cooling hashtag#LaborMarket will soon be felt more widely by consumers and businesses alike. For more on the latest macroeconomic outlook and predictions, read the full newsletter.",Economic Outlook
"At our Raytheon Technologies facility in Huntsville, Alabama, I recently visited the Customer Experience Center where the Collins Aerospace team is collaborating with the U.S. Army to develop innovative solutions that will power the next-generation of rotorcraft. Through the team's integrated solutions, including avionics and flight controls, we're improving efficiencies and increasing capabilities for our customers to deliver world-class aviation technology in support of key Army Aviation programs.",MISC
"are you ready for your next step in hashtag#finance? TimkenSteel Corporation is seeking an individual that has experience in hashtag#costaccounting and hashtag#ERPsystems (hashtag#SAP), as well as possesses strong hashtag#analyticalskills for our Manufacturing Finance Lead role. If this could be a fit for you or someone you know, click below to learn more!
hashtag#manufacturing hashtag#AtOurCore hashtag#financejobs hashtag#accountingjobs",Workforce strategy
