postContent,theme
Cybersecurity Awareness Month is upon us and Hewlett Packard Enterprise recently opened a state-of-the-art Cyber Defense Center at our Houston HQ. Learn highlights about the new center and our approach to cybersecurity:,Data privacy and cybersecurity
"At #FortuneBrainstormTech today, I will join Jo Ling Kent and Jonas Andrulis for a discussion on advancements in AI and supercomputing.
AI has the ability to solve some of the most pressing societal challenges we face today, and it is imperative it is done so sustainably, responsibly, and with data privacy at the helm. Scaling AI intentionally and ethically in a way that aligns with business values and society's well-being should be non-negotiable.",Data privacy and cybersecurity
"The 2023 Elastic Global Threat Report is available now! Elastic Security Labs threat researchers have identified threats and trends that you should prepare for. Download the free 2023 Elastic Global Threat Report to learn how you can prevent cybersecurity threats through enhanced visibility, novel capabilities, and seasoned expertise. Learn more here a https://gag.gl/iPSs6Q",Data privacy and cybersecurity
Data privacy will be one of the most important considerations for public and private organizations as they think about leveraging large language models (LLMs) for building their own generative AI applications. Great insights from David Erickson on how to get this right using (Elasticsearch Relevance Engine) ESRE from Elastic.,Data privacy and cybersecurity
"Elastic has a unique role in the Generative AI ecosystem. With our Elasticsearch Relevance Engine (ESRE), we enable everyone to build generative AI applications. Today, we launched one such generative application of our own - the Elastic AI Assistant - a generative AI sidekick powered by ESRE to boost the abilities of every cybersecurity practitioner. Check out this blog from H. Michael Nichols.",Data privacy and cybersecurity
excited to participate in the #TIEcon2023 Cybersecurity forum. Should be a great set of sessions on some very pressing topics...,Data privacy and cybersecurity
"This year's RSA Conference 2023 had the theme of ""Stronger Together,"" and I couldn't agree more. I had the opportunity to engage with a diverse group of customers, partners, and colleagues at the conference, and together, we shared ideas and worked on solving some of the most pressing cybersecurity issues facing our society.
I also had the privilege of meeting with EAD Eric Goldstein and Technical Director Chris Butera, from the U.S. Cybersecurity and Infrastructure Security Agency (CISA) to discuss our growing relationship. Among other things, we discussed our recent partnership as the newest member of the Joint Cyber Defense Collaborative.
I look forward to continuing to work together to strengthen our national cybersecurity efforts and make our digital world a safer place for everyone. #RSAC2023 #StrongerTogether #CISA #JCDC #elastic",Data privacy and cybersecurity
"There has never been a greater need for strengthened public private partnership around critical areas like #cybersecurity and #generativeai. Many thanks to Iranga Kahangama,Steven M. Kelly, CISSP, Travis Berent, Jen Easterly, and Ambassador AndrA Haspels for graciously hosting us earlier this week.",Data privacy and cybersecurity
"Generative AI represents an inflection point in cybersecurity. It presents both an opportunity and a challenge. There's a new opportunity to elevate and advance the skillset of your analysts but the challenge is your adversaries are using GenAI, too.
My perspective is that security is a data problem. This is even more clear now that generative AI is on the scene. Companies that approach modern security challenges through a search lens have the advantage. If you're interested in learning more about this approach, check out the latest report from IDC on the Elastic AI Assistant:",Data privacy and cybersecurity
"Announcing a first-of-its kind #cybersecurity professional certificate program on edX from EC-Council.
This is an exciting one: demand for cybersecurity specialists is SOARING, and I don't see it slowing across industries. Unemployment for cybersecurity is basically 0%.
Further, EC-Council is the best corporate partner I can think of here. They've certified over 230,000+ people around the world. We're about to supercharge that. #NoBackRow",Data privacy and cybersecurity
"Justine Lupul at Lumen Public Sector joins other #fedIT experts from #IRS, #USArmy and #DHS #CISA to discuss 3 areas that #federalgovernment IT should prioritize in FY23. It shouldn't be a secret that #ZeroTrust and #Cybersecurity top the list.
Read the full article on Government Technology Insider, http://bit.ly/3HlYcfB",Data privacy and cybersecurity
"Black Lotus Labs has discovered three malware campaigns in the past year that used compromised business-grade and small office/home office (SOHO) routers. China-based actors have been observed targeting several industries, and recently, Lumen rediscovered malware being used in a campaign to research US military websites. Stay vigilant and prioritize cybersecurity measures to protect your organization. #cybersecurity #malware #infosec",Data privacy and cybersecurity
"Together with other European business leaders, we have written to President Von Der Leyen, Executive Vice-President Vestager, Commissioner Breton, and the Swedish Presidency, urging them to pause and rethink the #DataAct.
Our three major concerns are:
a Under the business-to-business data-sharing chapter, there are still not enough safeguards to ensure that trade secrets, cybersecurity, and health and safety are secure.
a Regarding business-to-government data sharing, the text is far too open, leading to potential misuse and risking data breaches.
a On the parts that facilitate #cloud switching, the text should preserve contractual freedom, to allow customers to get the best deals possible.
SAP welcomes the objectives of the EU Data Act to create a common EU regulatory framework for the #DataEconomy and to facilitate data sharing. However, in its current state, it poses a major risk to both cybersecurity and European competitiveness.",Data privacy and cybersecurity
"Today marks the end of #CybersecurityAwarenessMonth here at Cisco and across the industry.
One of the most pressing issues we face when it comes to cybersecurity is the skills gap. Nearly 3.4 million cybersecurity jobs will go unfilled by 2025, and just 15% of companies globally feel their infrastructure is mature enough for today's cybersecurity demands.
It's more important than ever to bridge this gap by expanding the talent pool and reducing industry burnout. I'm incredibly proud of the work our Cisco teams are doing to address the skills gap in the industry through Cisco Networking Academy. In fact, this month we introduced an Ethical Hacker course along with new multi-cloud certifications that are focused on networking & security"" we're excited about the impact these programs can have.
Cybersecurity Awareness is important year-round, not just during this one month. I believe together, we can create a ripple effect of cyber awareness and action at a time when security is more critical than ever.",Data privacy and cybersecurity
"Cisco believes security and inclusion are critical for AI to benefit society, and President Biden's executive order on AI today strikes the right balance in encouraging innovation and cybersecurity while also advancing equity, civil rights, and workforce development.",Data privacy and cybersecurity
"Out today, Cisco's #Cybersecurity Readiness Index highlights that only 15% of organizations have a cybersecurity posture that's mature enough to defend against the threats of a hybrid world. We measured the cybersecurity readiness of companies across five key pillars - identity, devices, network, application workloads, and data - and the results were clear: no matter what kind of business you operate and no matter where you are in the world, security resilience is imperative in today's world.
At first this may sound frightening, and it's true that we're facing a threat landscape that's more expansive than we've ever seen, with attack methods changing at a rapid pace and bad actors getting more sophisticated. In fact, 82% of leaders expect a cybersecurity incident to disrupt their business within the next two years. We've been living and working in new ways for over three years, and we know people, devices, workloads, and applications will continue to be more and more distributed moving forward. Organizations are accelerating their multi-cloud adoption more quickly than many expected. In this dynamic environment, a number of my peers have expressed that they don't worry about if a breach will happen, but when.
But despite so much uncertainty, I remain optimistic. I believe the data highlights the opportunities that exist for the public and private sectors to work together to close the readiness gap. With tighter alignment and partnership, we can truly reap all the benefits of our connected world, without fear of disruption. We all depend on a secure world, and if we share threat intelligence, cooperate on legislation to keep everyone safe, and rally around the idea that security and privacy are human rights, we can realize a truly secure and inclusive future for all.
As the builders of the internet, security remains critical for Cisco's business and our ability to support our customers' resilience. Our team is dedicated to building the simple, intelligent, interoperable, and platform-driven solutions our customers demand today and will need tomorrow. You'll be hearing more from us in the weeks and months to come, and I'm so excited about what's ahead for Cisco and security.
To learn more about Cisco's study, check out the full report:",Data privacy and cybersecurity
"Today, I'm thrilled to announce Cisco's intent to acquire Splunk, the leader in cybersecurity and observability. We're bringing together two powerful innovation engines to create one of the world's largest software companies, and together we will help make organizations more resilient and secure in an AI-powered world. Learn more:",Data privacy and cybersecurity
"Wrapping up an incredible week in Europe! After Mobile World Congress, I traveled to London and Brussels. It was fantastic to engage with both customers and government leaders on critical topics for the region like cybersecurity, digital #skills, and Cisco's support of Ukraine.
In addition to many other impactful government meetings in Brussels, I had the opportunity to meet European Commission VP Margaritis Schinas and we announced that Cisco will train 250,000 people in #cybersecurity skills over the next three years through our Cisco Networking Academy program. This is just one way we are continuing to address the cyber skills gap and train the workforce to address the constantly evolving threat landscape. You can learn more here: https://lnkd.in/emN8bRe5
As always, nothing energizes me more than being back with our employees! I was thrilled to have the opportunity to host All Hands with our teams in the UK and Ireland, as well as Belgium and Luxembourg. For both meetings, we had employees joining us in-person, as well as virtually from across the region. Our teams asked thoughtful questions about our business and culture, and we had a lot of fun getting together! It's so important for me to continue to hear from you, and your customers, and I look forward to seeing more of you around the world during my future travels!
Jeff Sharritts David Meads Arnaud Spirlet",Data privacy and cybersecurity
"This week, we are hosting over 9000 customers in Amsterdam for #CiscoLiveEMEA. While I wasn't able to attend in-person, our teams have shared incredible #innovation across #security and networking, #sustainability, and skills. Here are a few of the highlights!
Security is a top priority for Cisco and our global customers, and we introduced new risk-based capabilities across our security portfolio to protect multi-cloud environments. We believe Risk-Based Authentication and our industry-first Business Risk Observability Platform will both be game-changers for our customers.
We also know that customers are extending their networks to new places, while looking to simplify their IT operations. We announced new cloud management tools for industrial #IoT applications, a simplified dashboard to converge IT and OT operations, and flexible network intelligence across all industrial assets, all aimed at keeping our customers as agile as possible.
I've talked many times about our commitment to building sustainability into our technology products to help our customers achieve their own goals. Soon, Carbon Emissions Insights in Webex Control Hub will provide collaboration customers with Scope 2 emissions data and recommendations for optimizing energy consumption.
Finally, we continue to be focused on promoting digital skills through our Networking Academy program. This week, we shared our goal to train 10M people across EMEA in digital and cybersecurity skills over the next 10 years, as part of our plan to train 25M people worldwide in the same timeframe.
I'm so proud of our teams and all they've done to bring this incredible innovation to customers, as well as their continued focus on sustainability and skill-building. I'm excited to see even more great innovation from the teams this year! Learn more about Cisco Live EMEA here: https://lnkd.in/gdrrBDRV",Data privacy and cybersecurity
"This week, members of Cisco's executive team and I had the opportunity to attend the World Economic Forum in Davos, and before heading home, I stopped by to visit our customers and employees in Copenhagen.
In Davos, we connected with a number of Cisco customers and government leaders from around the globe and discussed many of the challenges we are all facing. The good news is, it was incredibly clear that #technology is more important than ever and customers in all industries, as well as governments, will continue to invest in building out their technology strategies to be more resilient in the future.
I spoke on two panels - one with Francine Katsoudas and Shelley Zalis, CEO of The Female Quotient, on resilient leadership and another on the increasing importance of #cybersecurity. In particular, the theme of cybersecurity was a part of nearly every one of my conversations throughout the week, and I'm
excited for all that Cisco can continue to do to secure the world.
I was also honored to attend a small roundtable with
Ukrainian First Lady Olena Zelenska and other business leaders. I left that meeting inspired to do more to help them begin to rebuild and am working on plans for how Cisco can continue to have a positive impact for the people of Ukraine.
"" In Copenhagen, we had the chance to connect with customers and government officials to learn more about the opportunities to
continue to digitize Denmark. I also had the privilege to speak at the AmCham Denmark New Year's reception and chat with the US Ambassador to Denmark, as well as local leaders from both Danish and American companies, about the importance of the priorities in the country and their plans for the future.
I also hosted my first in-person Town Hall of the year with our fantastic Denmark team. Jeff Sharritts, Mark Patterson, and I had the chance to answer a number of insightful questions, and it's always a pleasure hearing the perspectives from our teams in the region.
Weeks like these keep me energized. I'm thrilled to continue to travel more in the new year and excited about what's ahead for Cisco!",Data privacy and cybersecurity
"While regulations provide a starting point, minimizing cyber risk requires companies to go beyond basic compliance. Foster a culture of security, dedicate resources, and implement layered defenses. Read more of Lynx's hashtag#cybersecurity thoughts in hashtag#ForbesTech",Data privacy and cybersecurity
"Our strategic collaboration with Boston Consulting Group to deliver enterprise-grade, secure generative AI helps businesses unlock greater levels of value from custom datasets while maintaining high levels of security and data privacy.
AI requires a truly democratized approach that enables more secure and scalable choice so enterprises can safely benefit from the technology.
By combining the complementary advantages of Xeon, Gaudi accelerators and production-ready hybrid cloud-scale software to power BCG's GenAI model, Intel is delivering new levels of customer productivity and efficiency across the diverse and emerging array of AI and deep learning functions that customers need to address new possibilities with AI.
https://on.bcg.com/3MliIQZ #BCG #GenAI #Xeon #Habana",Data privacy and cybersecurity
"5 conversations you won't want to miss at ScaleUp:AI:
Y Unlocking value with AI
Leading organizations are already experimenting with AI to drive better customer experiences, uncover new revenue opportunities, optimize operations, and free up employees to focus on higher-value work.
Y Responsible AI scaling and ethical design
Experts will share tips for designing, training, building, and scaling ethical AI systems, from data governance to understanding output and everything in between.
Ys Collaboration and workforce transformation
Our speakers will share strategies for ensuring that AI enhances productivity without disrupting workflows and specific examples of how AI is supercharging the workforce and improving collaboration.
Y How AI is transforming specific industries (and national security)
From AI's transformative role in cybersecurity and risk mitigation to leveraging real-time AI to improve patient outcomes, subject-matter experts will explain the transformational power of innovation in outdated, bureaucratic systems.
YY Lessons from AI pioneers and insights for the future
Insights from an investor's perspective from working with AI scaleups and pioneers in the field, perspectives from the highest levels of leadership in some of the most innovative enterprises in the world, and predictions from co-authors of one of the most transformational papers in AI research.
REGISTER HERE: https://bit.ly/3PJtkJR",Data privacy and cybersecurity
"IoT devices have been proliferating for years, but as the world around us becomes ""smarter"", new risks surface just as quickly. It is encouraging to see the US federal government's continued emphasis on cybersecurity as a critical focus area.
https://lnkd.in/gDUw9yBP",Data privacy and cybersecurity
"The SEC's new cybersecurity disclosure rules are another reminder that cybersecurity is one of the most critical risks to business continuity. Research has shown that for many companies, the mean time to remediate (""MTTR"") threats is well beyond four days. In those cases, simply remediating the issue would go beyond the four day limit. The timely launch of Palo Alto Networks Cortex XSIAM has the promise to bring MTTR down to hours, and then minutes. #cybersecurity #mttr #paloaltonetworks",Data privacy and cybersecurity
"For the first time, the World Economic Forum listed widespread cyber crime and cyber insecurity among the top 10 most severe short-term and long-term risks facing organisations and governments. As the world becomes more digitally engaged, effective cybersecurity will be of critical importance. #cybersecurity #cybercrime #cyber",Data privacy and cybersecurity
"Morgan Stanley's Exceptional Leaders / Exceptional Ideas series interviews Nikesh Arora, CEO & Chairman of Palo Alto Networks, to talk about the threat landscape, how the pandemic changed the approach to cybersecurity, and how a platform approach is inspiring better security outcomes. #cybersecurity #security #ceo #leaders",Data privacy and cybersecurity
"""Cybersecurity is a data problem""...The AI & ML embedded in our products leverages the unparalleled depth of data from our 60k+ active firewall customers to drive precise security outcomes and real time threat remediation. #cybersecurity #security #data #ai #ml
https://lnkd.in/gNUCerNx",Data privacy and cybersecurity
"We were pleased to have our CEO Nikesh Arora participate in a Fireside Chat at the Goldman Sachs Communacopia & Technology Conference this week. It was a fascinating conversation covering the strength of our three platform approach, new innovation & growth vectors, how new SEC regulations may impact customers, the future of cybersecurity, and more.
https://lnkd.in/gbR_qzTJ",Data privacy and cybersecurity
"At this year's Kaseya Connect Global, we unveiled IT Complete 2.0, introduced our Cyber Insurance Fast Track Program for customers and announced two acquisitions!
We've expanded our Security Suite to include automated network penetration testing with Vonahi's technology and we've grown our MSP Enablement Suite with audIT's automated sales presentation solution.
With more than 1,000 total integrations across Kaseya's product suites, Kaseya provides a unified, seamless experience for its customers within IT Complete. To train IT and security professionals on the robust platform, Kaseya launched the Remote IT and Security Management Certification Program, modeled after Cisco and Microsoft's certification programs.
Read all about the news announced in this MSP Today article. And welcome to the Team, Vonahi and audIT!",Data privacy and cybersecurity
"Karen Schuler continues her series on assessing your Data Privacy Strategy. Thanks Karen these are great assessment tools which companies can consider in their data privacy strategy journey. Find out how your tech company can elevate its data privacy compliance strategy to build resiliency and growth, via BDO. hashtag#Cybersecurity hashtag#DataPrivacy",Data privacy and cybersecurity
"Our annual Tech CFO survey revealed that data privacy is a top business priority for 2023. One interesting takeaway: while 72% of tech CFOs say their company's use of customer data fully adheres to data privacy policies, that leaves 28% who did not agree.
Check out the full report for more insights: https://lnkd.in/eH4BfRCs.
#data #privacy #tech",Data privacy and cybersecurity
"Tech leaders: Find out how you can help establish a strong foundation for your company's privacy and data protection program with key considerations from BDO.
#Cybersecurity #DataSecurity",Data privacy and cybersecurity
"Over the past year, I've spent a significant amount of time engaging with hashtag#K12 leaders across schools and districts, and a recurring theme echoes loud and clear: the complex landscape of data management and accessibility. In my latest blog, I discuss why connected, secure, and accessible data is the foundation that schools need today to support every child and lay the foundation to leverage technologies like AI to personalize education for every student journey.",Data privacy and cybersecurity
"I was truly honored to speak at The White House at First Lady Dr. Jill Biden's Back to School Safely: Cybersecurity Summit for K-12 Schools today.
Thank you, First Lady Dr. Jill Biden, Secretary of Education Miguel Cardona, Ed. D. Secretary of Homeland Security Alejandro N. Mayorkas, Deputy National Security Advisor Anne Neuberger and all others involved in this initiative.
As part of this effort across the government and private sector, we will continue our commitment to protecting and safeguarding every one of the 45 million students we serve and are proud to expand our current cybersecurity investments to provide free and subsidized security-as-a service trainings, tools and resources to all U.S. school districts.
Data privacy and security are the foundation of achieving PowerSchool mission to personalize education for every student journey.
#PowerSchool #Cybersecurity #personalizededucation",Data privacy and cybersecurity
"Breaking news about cyberattacks on government agencies have underscored the vital importance of cybersecurity for all businesses, big or small.
These attacks can have far-reaching impacts. They can breach our data privacy, disrupt our businesses, and diminish our trust in digital systems. While large corporations may have the resources to navigate these threats, what about small to medium businesses?
- Risk Assessment: Identify digital assets, assess their value, and understand potential risks
- Security Measures: Implement cybersecurity measures such as strong passwords, multi-factor authentication, encryption, and regular software updates
- Incident Response Plan: Create a plan for responding to cyber incidents, including containment measures, stakeholder communication, and recovery plans. Regularly back up data",Data privacy and cybersecurity
"Edge Computing is a distributed computing standard that focuses on processing and storing data closer to the source of data generation, such as IoT devices or local servers. By doing so, it reduces the need to rely solely on centralized data centers or cloud services for data processing.
This approach offers several benefits, including reduced latency, improved processing speed, and enhanced data privacy. It can help optimize and enable faster, more efficient use of real-time data analytics to drive informed decision-making.
Additionally, Edge Computing can improve data security and privacy by reducing the amount of sensitive information transmitted and stored in centralized locations, which is particularly important in today's increasingly regulated digital landscape.
What are some of the deficiencies of using Edge Computing?
#distributedcomputing #datasecurity #iot",Data privacy and cybersecurity
