postContent,themes
"I'm excited to share that I'll be a part of the Aspen Ideas Festival this year, joining global leaders to discuss critical issues at the intersection of health care and technology.
 
At Amazon, Success & Scale Bring Broad Responsibility  and thats something those of us working on health care across Amazon think about every day. We believe generative AI and Large Language Models have the potential to inject more humanity into health care and enhance the experience for providers and patients - in ways that are truly transformative. 
 
On Thursday, June 27, I'll join Katie Couric, Sandra Abrevaya, Dan Sheeran (he/him) and Alex Rives  to unpack how AI is shaping the future of health care and the advancements Amazon is making in this area. More details below. I hope to see you there! 
 
https://lnkd.in/gz8zwWCP 
 
#AspenIdeas #HealthcareInnovation #AIinHealthcare",AI or Machine Learning
"Conversational AI is revolutionizing how businesses engage with customers.Numentica is thrilled to announce our partnership with Kore.ai, a Global Leader in Conversational AI. Together, We aim to create innovative solutions that will drive growth and success for our customers and transform the way businesses interact and engage with their customers.#Numentica #Koreai #ConversationAI #CustomerExperience #Collaboration #Innovation",AI or Machine Learning
"Dear Friends and Colleagues,

I would like to share with you that on May 20, 2024, our beloved dad, Shan K. Thever, passed away.

Our dad was a vibrant personality, energetic professional and dedicated husband, father and grandfather. He was an inspiration in so many ways and to so many people. 

He came to this country with only a few hundred dollars in his pocket. Through his determination, hard work and tenacity, he successfully completed his undergraduate education at UCLA and received his JD from UCLA School of Law. 

Our dad went on to establish and lead a successful law practice for decades. He was a trailblazer and a pioneer both in and out of the courtroom. He was courageous, took risks and overcame numerous obstacles, and was a preeminent attorney, successfully arguing cases in front of the California Supreme Court. He served as the Director of the Small Law Firm Center at the New York City Bar Association and for the past five years he served as the Deputy County Council for Los Angeles County as a member of the Ethics, Transparency and Legislative Affairs team.

Our dad was a colleague, friend and confidant of Governors, County Supervisors, Council Members and so many others. In addition to numerous awards and appointments, he received the inaugural Trailblazer Award from the South Asian Bar Association and was recognized by the U.S. House of Representatives, receiving a U.S. Congressional Commendation for being an inspiring leader in the South Asian community and a true advocate for political change among the Asian population.

He was an inspiration not only for the professional success he achieved, but also for the way he lived his life. He believed in living a productive and meaningful life, in helping others, in lifting his community and in creating greater opportunity for his children than he had himself. He instilled in us a deep responsibility to, in turn, create greater opportunity for our children and generations to come. He also instilled in us the importance of public service and of being contributing members of society and having a meaningful impact on the world.

In his personal time he loved to be with his family celebrating holidays, cooking together, and discussing politics and current events over a bottle of Cabernet. 

He loved his grandchildren more than anything and was so very proud to see the young people they are and the success they continue to achieve. He was happy to see the wealth of opportunity in front of them. 

While he may not be here in physical form, our dad is always with us. He lived a successful, productive and impactful life, and this world is a better place because of him.

We ask that if you have any special anecdotes, stories or memories about our dad to please share with us via private message.",Not AI or Machine Learning
"DallasCISO recently hosted the inaugural CISO hashtag#ORBIE Awards for the Inspire Leadership Network. As our collective defense network expands, we look forward to collaborating with CISO chapters nationwide. The Answer Is In The RoomDallasCISO | BayAreaCISO | HoustonCISO | ChicagoCISO | BostonCISO | CapitalCISO | GeorgiaCISO | MinnesotaCISO | SeattleCISOhashtag#collectivedefense hashtag#leadership hashtag#CISO",Not AI or Machine Learning
"Congratulations to Trent on this well deserved promotion.  He has spent his entire 13 year banking tenure with SouthState, another wonderful example of the career development that occurs here.",Not AI or Machine Learning
I'm happy to share that I'm starting a new position as Managing Director / Technology Fellow at Goldman Sachs!,Not AI or Machine Learning
Another good resource for folks passionate about learning data science and then some,AI or Machine Learning
"Our founder Barney Hussey-Yeo spoke to Forbes about what's on the horizon for Cleo  

(Spoiler alert: big things) 

https://lnkd.in/e7EmY_PZ",AI or Machine Learning
"Pantheon Platform joins forces with Lytics to revolutionize digital marketing!The partnership, unveiled at Google Cloud Next '24, empowers businesses to deploy personalized website experiences swiftly, leveraging cutting-edge AI technology. Read the comments from Zack Rosen, CEO of Pantheon, James McDermott, CEO of Lytics, and Paul Tepfenhart, Global Director of Retail and Consumer Solutions at Google Cloud.Check out the comments to read more about how this collaboration will transform your Digital Marketing Strategies. #opensource #digitalmarketing #marketing #partnership #AI #website #personalization",AI or Machine Learning
"*Attention* all amazing CX and customer insights leaders on parental leave! Y Ashton Media are on a mission to not only deliver the very best content and networking-led events for our industries (and nailing it Y ), but to create events that are more representative, accessible and inclusive for the communities they serve. We're always experimenting with new ways that we can be better for our communities, and for our upcoming Customer Connect event on 9th November in Sydney, we're thrilled to offer a special discount to anyone in the industry currently on parental leave. We know the juggle is hard, but if you're looking to stay ahead of the curve, hear from some of the best CX and insights leaders in the industry, and share ideas and learn from your peers, get in touch with me directly for details on how to qualify for this discounted pass at stacey@ashtonmedia.com.auAnd a big thank you to my amazing colleague Emily Wintour for the idea on this one. hashtag#CustomerConnect23",Not AI or Machine Learning
Have you joined the 96% of brands implementing hashtag#GenAI into their hashtag#advertising strategy? asTMi Generative hashtag#AI is not just a fleeting trend; it's a digital advertising hashtag#evolution marketers can't afford to overlook. YYCheck out our hashtag#blog and get a copy of our new GenAI hashtag#eBook to discover the untapped potential that GenAI holds for digital advertisers.Y https://bit.ly/3Teyy3zhashtag#worksmartly hashtag#adtech,AI or Machine Learning
"As I approach my 17th anniversary Schneider Electric I have so much to be thankful.  At Schneider I have been invested in, given opportunities before I thought I was ready, and had the incredible experience of working with amazing people all over the world.  This place has challenged me, accepted the challenges I brought, and allowed me to be my authentic self. 

Yesterday I had the great honor of meeting our former CEO and now Chairman of the board, Jean-Pascal Tricoire a true visionary that continues to inspire so many.  Our company has transformed in so many ways in my time here, and I am greatful for JPTs leadership and vision.  A true impact maker who has made the world a more sustainable, inclusive and digital place!",Not AI or Machine Learning
I had a fantastic discussion with Lisa Martin at hashtag#CES2024! We talked about bringing the world of AI and APIs together and what's on the horizon for Boomi...there also may have been a mention of robot lawnmowers.,Not AI or Machine Learning
 IT'S HERE!!!!!!Today the Vizit team and Salsify team are thrilled to announce the availability of a first-of-its-kind Conversion Optimizer for your PDPs in Salsify!This is #AI and automation at its finest.The Vizit app works like an AI merchant and instantly rearranges your product page imagery to maximize conversion potential with online shoppers.It's so easy to use.Just install Vizit and our AI does the rest.You can rest easy knowing you are maximizing impact with consumers while you sleep.Want early bird access? Drop us a note. And also be sure to read up on Salsify's new PXM Advance Platform - It has a whole host of powerful new features that the most sophisticated digital teams are using to sell more stuff and outperform competitors.#ecommerce #pim #pxm #digitalcommerce #retail #digitalshelf #contenteffectiveness #digitalmerchandising #visualcontent,AI or Machine Learning
"""Glenda McNeal has an exceptionally strong track record of spearheading critical partner agreements and navigating the complexity of large, global relationships to benefit both the company and our partners and she will continue to do so in this expanded role,"" said Steve Squeri, Chairman and CEO of American Express. hashtag#savoy hashtag#americanexpress",Not AI or Machine Learning
"Diffusion can ""render"" algorithms. It implements a maze traversal algorithm purely from pixels, by literally painting a red line from the beginning position to the end on a maze.Very interesting experiment. I always think of diffusion as a renderer, and transformer as the reasoning engine. It seems that the renderer itself can encode very nontrivial, iterative algorithms too, even with the U-Net neural architecture that's far weaker than transformer for sequence learning.This particular experiment uses a flavor called ""Discrete Diffusion"": https://lnkd.in/gQkM25vYSource: https://lnkd.in/gmExxsqx",AI or Machine Learning
"Thankful to American Banker for the recognitions and an amazing team Ally that is behind this recognition

At Ally innovation is expected, is in our DNA and we proudly wear it in our sleeves!  Frankly, that is our customer expectations!

Sincere and relentless efforts of our colleagues, continued culture of innovation and a desire to make a difference in our customers financial lives is what we aim to do and this recognition is a byproduct of that.

Proud and humbled!
#doitright #innovation #digitalbanking",Not AI or Machine Learning
"Finally getting around to posting more about last weeks events!Last Friday and Saturday I had the pleasure of being one of 50 students selected to participate in the #TruistImmersiveLearningEvent. Together over the two days Green Team (Tharun Kumar Reddy Vattam, Deepthi Meher, Ayisha R., Fred Schuck, Riona Adela, Ruthvika Kosuri, Trinity Wells, and myself) participated in rapid prototyping and demoing a booking solution for IHG Hotels & Resorts utilizing Amazon Web Services (AWS), Verizon, Wicket, and Figma. The entire experience was unique, exciting, and a tad stressful (of course in a good way). I'm incredibly grateful for the chance and am hoping to participate again next year if Truist will have me!While we didn't come first in the pitch competition, all of the Green Team members came first in my heart; such an amazing experience to work with all of these skilled and hard-working individuals. It was also amazing to have real-time support from individuals from each of these companies as well as #TeamTruist staff. Special shoutout to Mike DeYoung, Brandon Castagna, Spencer Hawkins, Shannon Vanderhill, Michael Senuta, and David A. Lane for being our teams facilitators and guides through our rapid-prototyping journey.Another thank you to Eric Fender and Kourtney S. Peterson, MPA as well as the other UNC Charlotte Belk College of Business staff who helped organize the event and make it all possible. Thank you as well to, Edward Lopez, CCXP, Laura Smith, and again Shannon Vanderhill, MFA for introducing me to Design Thinking and inspiring me to seriously consider it as a career field I'd like to get into.Once again, thank you again to everyone I've tagged, getting to meet any of you is already a great joy for me, getting to meet all of you was beyond that, it was inspiring. I wish all of you good things to come!#InnovativeLeadership #RapidDevelopment #Charlotte #UNCCharlotte #BCOB",Not AI or Machine Learning
"I'm ready to head to Vegas for Google Cloud Next  24  it all starts tomorrow!The GrowthLoop team is excited to share how #GenerativeMarketing is changing the game through next-level personalization, cross-channel journeys, and real-time marketing measurement. Come meet us at booth #1350.I can't wait to make connections and share learnings along the wayWhat are you most excited about during #Next24? And will I see you there?#GoogleCloudNext",AI or Machine Learning
Any form of automation is super helpful when it comes to performance marketing & at HelloFresh we use Smartly Y3 check out the celebs in our team talk about it Duong Le Emiri Dandoy hashtag#digitaladvertising hashtag#performancemarketing,AI or Machine Learning
"It was announced this week that Elon Musk's xAI will build the ""world's largest supercomputer"" in Memphis!

xAI is working to ""develop the 'theory of everything' for large neural networks"" and exploring the mathematics of deep learning in order to take AI to the next level.

Exciting times ahead and happy to call Memphis my second home.

Fun fact: Currently, the fastest computer in the world is also housed in Tennessee (Oak Ridge). The 296-ton machine was built by Hewlett Packard Enterprise and chip manufacturer AMD and cost $600 million to make.",AI or Machine Learning
"Peter Pezaris, our Chief Strategy and Design Officer, recently sat down with Keith Shaw to give a demo of New Relic AI, the first generative AI observability assistant, and to talk about the exponential potential of generative AI in the observability space. Watch the interview Yoai ",AI or Machine Learning
"A new research article just came out that reminded me of the spaghetti sauce lesson. Do you know it?

A market researcher trained in psychometrics was hired in the 80s by Campbell Soup. His task was to help identify the perfect flavor for Prego brand spaghetti sauce (which was getting beat in the market by Ragu). 

Instead of a single, better-than-Ragu sauce, the researcher identified distinct clusters of customer preferences. His results led to the launch of varied sauces like Chunky, Spicy, and Extra Smooth, which, in turn, led to Prego's sales skyrocketing.

In the new article ( https://buff.ly/3wND6Fv ) published just a few days ago, customer satisfaction researchers identified the drivers of satisfaction in airline travel (the specific drivers they uncovered isnt really the point of this post, but you really want to know what they were, right? OK:

	Inflight entertainment
	Seat comfort
	Online booking
	Online support)

The primary interest of the researchers was whether machine learning algorithms beat traditional logistic regression in identifying satisfaction drivers (yes! Random Forest for the win!). 

But Its the secondary finding that reminded me of the spaghetti sauce lesson:

The satisfaction of one segment of customers was most strongly driven by service quality, while another was most strongly driven by amenities.

In my experience, companies often analyze satisfaction feedback across the customer base as a whole. But that approach often averages out distinct segments in a way that ends up reflecting no one!

If you have open-ended customer feedback and want to identify your customers satisfaction drivers, give me a call. I can help. If you dont collect open-ended customer feedback, give me a call, I can help!   carstendhohnke.com

#CustomerSatisfaction #MachineLearning #MarketSegmentation #DataScience #CustomerExperience #BusinessStrategy",AI or Machine Learning
"We're excited to unveil our new logo, which represents a new energy in banking. Stay tuned for more and see this exciting new brand come to life.",Not AI or Machine Learning
Im passionate about the idea that AI should play a role in improving health and patient outcomes  that's why I founded Health Data Analytics Institute (HDAI). We knew that data had to be simple and actionable to actually be useful. Our HealthVisionTM product converts hundreds of pages of complex data into a single page that tells providers what they need to know about a patient. It was a pleasure to present our story at #HLTH2023. Thank you to Roberta Schwartz and the Houston Methodist team for sharing both the stage and vision for AIs role in healthcare with us. ,AI or Machine Learning
The full-stack architect: A new lead role for crystalizing EA value,Not AI or Machine Learning
"The impact of my time at Truist has transformed my life in numerous and positive ways, both on a personal and professional level. The memories I have at Truist are filled with immense happiness and I was fortunate to work with some who I will forever respect and am honored to call them friends. It has been an absolute joy to collaborate with such skilled and committed teammates, and I am deeply grateful for the growth, obstacles overcome, and accomplishments achieved during my tenure.As the new year arrived, I am looking ahead to the next chapter in my career and am thrilled to announce I have joined JPMorgan Chase & Co. as Chase's Head of Payments Technology. The ability to join a winning organization with such amazing leaders, employees and technologists brings tremendous respect and honor. I look forward to my future with JPMorgan Chase, the best is yet to come!",Not AI or Machine Learning
"I'm excited to share that I'm starting a new position as Senior Director, Services Strategy at Schneider Electric!Thanks for giving me this opportunity Asha Devasia to join your team and contribute to making the great strategic ambitions for Global Services a reality.This means that my chapter with hashtag#TeamRWE is coming to end. I'm extremely grateful for the trust, support and opportunities Jens BA gsted Orfelt provided me as well as for the fantastic colleagues I was able to meet & work with over the last year. I wish you all the best and will especially cheer on hashtag#TeamRWE APAC from the sidelines when you'll successfully master the various upcoming project milestones in the region.",Not AI or Machine Learning
"TV Talk Show: On vacation in #India, I was invited by DD Uttar Pradesh, a 24/7 Satellite Channel under the Ministry of Information and Broadcasting, Government of India, to record a special session on Artificial Intelligence (AI).

 There's a lot of discussion about how AI can revolutionize education and healthcare worldwide. However, it's important to recognize the significant implications of AI in agriculture as well.

 While India has more than 20 official languages and a multitude of regional languages and dialects, AI holds immense potential for preserving and revitalizing endangered languages. This technology can be used to create language learning tools, analyze historical texts, and even generate new content in these languages.

 Additionally, we explored how AI can help revolutionize spiritual content based on our rich cultural legacy and a vast collection of manuscripts. We also delved into the question of whether AI can truly help mankind, particularly in the realm of emotional or spiritual intelligence.

Huge thanks to the Executive Head and staff at Doordarshan Kendra for giving me this opportunity!

  

#analytics #artificialintelligence #datascience #education",AI or Machine Learning
"Looking forward to joining Johnny Minassian Philip Tseng and Catherine Ulozas at hashtag#AltsLA this week for a robust panel discussion on private market investments and our portfolios.  John L Bowman, CFA David Ott , Liberty Mutual Investmentshashtag#CFASocietyLosAngeles hashtag#CAIAAssociation hashtag#WilliamKelly hashtag#PaulHamann hashtag#DebraHaym hashtag#MarketsGroup hashtag#ALTS hashtag#ALTSLA",Not AI or Machine Learning
To the distinguished D9  community - keep loving on your neos. We need them and they need us. #service #sisterhood.,Not AI or Machine Learning
"Thanks for having me today and sharing your knowledge Ingrid Gerbino, MD FACP and Virginia Mason Franciscan Health - leaving the day with a full head and a full heart! Watch out everyone back home - I have plans!",Not AI or Machine Learning
"UnityAI, a Nashville-based healthcare tech startup, has closed its seed funding round with $4 million, led by Max Ventures, with significant contributions from Whistler Capital Partners LLC and others. Founded by former HCA Healthcare engineers, UnityAI aims to revolutionize hospital operations by optimizing patient flow using advanced hashtag#AI technologies. This funding will enable UnityAI to expand its innovative solutions, aiming to improve operational efficiency and patient care in hospitals. https://lnkd.in/e5Mwtt8Xhashtag#HealthcareInnovation hashtag#UnityAI hashtag#SeedFunding hashtag#AIInHealthcare",AI or Machine Learning
No surprise to see Anushka Sunder recognized on Private Equity Internationals #Future40 list of #dealmakers. Anushkas special ability to source bespoke transactions has made her a key leader on our team and across the firm. Congrats Anushka! https://lnkd.in/efhQbA26,Not AI or Machine Learning
"AI is coming for drug discovery in a big way.

Xaira is one of this years most richly funded new companies, not only in biotech but across the startup world. 

Historically, theres been a fair amount of luck involved in discovering antibodies, and it is rife with failure  only about 10% of drugs that make it to human testing are ever approved. 

Using AI to make drugs isnt a new idea. Investors have poured hundreds of millions of dollars into earlier startups with little to show for it. And many scientists remain deeply skeptical of de novo antibody generation  using computers to design brand new proteins. 

Xaira and several other new biotechs believe they can change that with new generative AI methods that can design complex molecules from scratch, find new targets, and cut months or even years from the process.

Let's all hope so.

#healthcare #innovation #drugdiscovery",AI or Machine Learning
"Congratulations to the Google Translate team for bringing over 100 more languages to Translate and almost doubling our language offering!  

It's fantastic seeing the progress weve made towards our goal of using #AI to bring 1,000 of the worlds most spoken languages to Google Translate, and the role this plays in helping us at Google to achieve our overarching mission of making the world's information universally accessible and useful. 

AI is already helping to connect billions of people across the globe, from helping people to understand international websites, to giving holidaymakers the option to veer off the beaten path, to assisting those who need to overcome the language barrier when they first move to a new country. 

Were excited to see this new update will open up more of the world to more people. 

Check out our blog post to learn more about our multi-year 1,000 languages initiative: https://lnkd.in/ezVnJ7FX

#TechforGood #GoogleTranslate",AI or Machine Learning
"What continues to set Leadership Houston apart is its ability to forge lasting relationships. Some of my favorite Houstonians are from my Class XXXVII family. We volunteer together, we wine taste together, and sometimes we lunch together.Today, we gathered to celebrate two, outstanding honorees at the Inspire Luncheon. Congratulations to Linda Toyota and Bob Harvey. Your contributions to Houston are, in a word, inspiring.Cheers to my friends, Sharon Watkins Jones, Emily Anderson, PE, PMP, Gary L. Marsh, JD, SHRM-SCP, Hami Arrington, MBA, Aline Nahhas, Shachella James, PMP, Kristin Landry, PE, Lisa Bourgoyne, Tonya Knauth, and to all Class XXXVII alumni not pictured below. Yhashtag#leadership hashtag#inspired",Not AI or Machine Learning
"It seems to me that before ""urgently figuring out how to control AI systems much smarter than us"" we need to have the beginning of a hint of a design for a system smarter than a house cat.

Such a misplaced sense of urgency reveals an extremely distorted view of reality.
No wonder the more based members of the organization seeked to marginalize the superalignment group.

It's as if someone had said in 1925 ""we urgently need to figure out how to control aircrafts that can transport hundreds of passengers at near the speed of sound over the oceans.""
It would have been difficult to make long-haul passenger jets safe before the turbojet was invented and before any aircraft had crossed the atlantic non-stop.
Yet, we can now fly halfway around the world on twin-engine jets in complete safety. 
It didn't require some sort of magical recipe for safety.
It took decades of careful engineering and iterative refinements.

The process will be similar for intelligent systems.
It will take years for them to get as smart as cats, and more years to get as smart as humans, let alone smarter (don't confuse the superhuman knowledge accumulation and retrieval abilities of current LLMs with actual intelligence).
It will take years for them to be deployed and fine-tuned for efficiency and safety as they are made smarter and smarter.

https://lnkd.in/eaJ5uuMk",AI or Machine Learning
#exciting new chapter,Not AI or Machine Learning
