postContent,themes
"Repping the brand and talking about Tropicana Brands Group "" s bright future as an independent company, our plans for hashtag#AI and how we're wiring for agility with Krystina Gustafson at Groceryshop 2023!",AI or Machine Learning
#GenAI won't replace searching and browsing in the #DigitalWorkplace. Drawing on one of the fundamental UX frameworks it becomes possible to see how it will all work in practice: https://lnkd.in/ez6q8ZUD #Intranet #DigitalEmployeeExperience #AI #Copilot,AI or Machine Learning
"Ys  BREAKING: OpenAI just made intelligent robots a realityIt's called Figure 01 and it's built by OpenAI and robotics company Figure:"" It's powered by an AI model built by OpenAI"" It can hear and speak naturally"" It can understand commands, plan, and carry out physical actionsWatch the video below to see how realistic it's speech and movement abilities are. The ability to handle objects so delicately is stunning.Intelligent robots aren't a decade away. They're going to be here any day now.If you want to learn more about what's happening in AI and robotics, join Superhuman - my newsletter with 600k+ readers: https://lnkd.in/exuKYiaE",AI or Machine Learning
"Last week I had the opportunity to attend the #TSIAWorld #Interact conference and engage in meaningful discussions about Operationalizing #AI in global technology & service businesses. It was a fantastic opportunity to learn, share, network and explore various AI strategies being deployed in some of the worlds leading companies. 

While there, I shared perspectives and insights with my fellow SE #impact makers Brent Cogswell, Marie-France Crevecoeur and Srinivas GPM,Surapani. #learningeveryday",AI or Machine Learning
"Shout out to Apollo Global Management, Inc.! Thank you to wonderful volunteers who shared their afternoon at The Ali Forney Center!",Not AI or Machine Learning
We are so excited to share that the inaugural six Boomi AI agents will be available in the Boomi Enterprise Platform as part of the platform license! Check it out: https://bit.ly/4cigjRf,AI or Machine Learning
"Real-Time Enterprises, such as Tesla, significantly out perform those which are not. (Gen)AI will further accelerate the competitive edge of these companies because they typically have shorter cycle times and higher benefits from automation. All companies can become a real-time enterprise. Here are the key tips on how to build one... Thanks to Andy Walter Filippo Passerini Javier Polit Vittorio Cretella for their coaching on digital transformation back in P&G and the learnings from our work with Danielle Brown Yusuf Abbasi and Elton Ware at Whirlpool envisioning the data & AI transformation. hashtag#ai hashtag#data hashtag#cloud hashtag#digitaltransformation hashtag#realtimeenterprise hashtag#cio hashtag#cdo hashtag#cto hashtag#genai",AI or Machine Learning
"The AI revolution is in full swing, but where are the women? In some of the most recent AI panels, discussions and summits I have been at women are sorely underrepresented. It was so stark that some of the men at these events even made comments about it. Which I really appreciated because we absolutely need their support with remedying this issue. This imbalance will greatly hamper the development of AI solutions that truly reflect the needs of our society.

As a data person, I needed some baseline data!! A survey by Junior Achievement (JA) conducted by the research group Engine shows that only 9 percent of girls between ages of 13 and 17 are interested in careers in STEM (Science, Technology, Engineering and Math). This is down from 11 percent from a similar survey in 2018. Why are girls less interested in careers in STEM and how do we get them interested? 

Additionally, companies must implement targeted recruitment strategies to attract and retain female talent especially in the field of AI. Statistics show that women will not apply for positions unless they feel they are over 90% qualified for the job. They may need to be nudged to apply for jobs that they have the aptitude for. I can personally attest to this. Much of my career moves came from gentle nudging.

Now more than ever, mentorship programs and networking opportunities can provide invaluable support and guidance for women entering the AI field. Knowing there are others they can relate to and garner support from will make a huge difference. At any AI event I go to, I find other women to talk to and it instantly puts me at ease. 

Interested in thoughts on how we can get ahead of this issue before its too late. This is a real problem..

#WomenInAI #DiversityInTech #AIForAll",AI or Machine Learning
Proud to be working with this team.  Contact me for more information on Digital Twin technology.,Not AI or Machine Learning
"Thrilled to share that I'll be joining the incredible Tupperware team as President & CEO!From San Francisco to Stockholm to SAo Paulo and Shanghai:  let's get this Tupperware party started.With its OG brand, entrepreneurial spirit, and ingenious products, Tupperware is a brand and business in the unique position to thrill and delight new consumers with innovation just as the very first Tupperware container did over 70 years ago.I am honored to guide this legendary brand as we grow the  business, remove complexities and strengthen our financial position.",Not AI or Machine Learning
It was great to speak at Gartner Supply Chain Planning summit with Kelly Nothaft and share our story!hashtag#zebratechnologies hashtag#supplychain,Not AI or Machine Learning
"Amazing experience and great takeaways from InspiHer conference. Spelllbinding interview with Molly Bloom. Thank you Kris Heinzen , Sandeep Dadlani , Mahmoud ElAssir",Not AI or Machine Learning
"60 Minutes features how NVIDIA and AI are creating new opportunities across fields like healthcare, robotics and more. Get a glimpse into how accelerated computing and #AI are reshaping industries.",AI or Machine Learning
About to go on for the keynote at a SOLD OUT Databricks Data + AI World Tour in Chicago! Great turnout at the Sears Tower! Over 1000 people registered!,AI or Machine Learning
"Huge congrats to Aperiam portfolio company Prescient AI on its successful $10m Series A  fundraise! Prescient is one of the fastest growing companies in our portfolio and it's been an absolute pleasure working with Michael True and team.What they do: Prescient AI leverages proprietary machine learning models and first-party data to assess the direct impact and ""halo effects"" of ads, including those not clicked on. Tailored to each brand, it attributes omnichannel revenue across all media and uses backtesting to forecast future spend outcomes, offering accuracy and confidence scores for each platform recommendation.What this means: brands using Prescient AI can automate their media planning and greatly increase ROAS, predict profitability and maximize revenue generated by ad campaigns.Check out their new Amazon halo effects product in the comments.",AI or Machine Learning
"Thank you, Carnegie Mellon University - Integrated Innovation Institute, for featuring me in the Faculty Spotlight, sharing my hashtag#AppliedAI course, and introducing my hashtag#CoparentingAI concept! It's been a privilege to teach in Carnegie Mellon University for the last 8 years. I'm very proud of my students and grateful to the CMU leadership team for this opportunity!Thank you Jess Ignasky for the interview!hashtag#cmu hashtag#cmuiii hashtag#cmusv Sancus Ventureshttps://lnkd.in/gFFzam6y",Not AI or Machine Learning
"YY Honoring Rebecca Puleo, our January 2024 DAISY Nurse at Cone Health | Wesley Long HospitalYZRebecca treats her patients with the same warmth and care she shows her family. The nominator, whose wife recently received exceptional care from Rebecca, says, ""When I couldn't be there unconditionally, I felt comfortable leaving my wife with Rebecca."" Rebecca's dedication, compassion, and critical care knowledge make her an Exceptional Nurse! I'm proud to have you as part of our team, Rebecca! Congratulations on being selected for the DAISY AwardYZ hashtag#DAISYNurse hashtag#ConeNursesRock hashtag#CompassionateCareErin Bull Zoe Suggs Elsie Graves Vi-Anne Antrum, RN, FACHE",Not AI or Machine Learning
"Congrats Joel Tracy of IMC Logistics, Inc., the 2024 Tennessee Large Corporate #ORBIE winner!",Not AI or Machine Learning
"The White House, in collaboration with innovative providers and payers, published a set of principles aimed at defining commitments to guide healthcare's use of AI. Large-scale AI models (frontier models) are a once in-a-generation opportunity to improve healthcare. Houston Methodist is honored to be a part of this trailblazing industry collaboration working together to harness the tremendous promise of frontier AI models in healthcare. hashtag#healthcareAI hashtag#healthcareinnovation hashtag#HealthcareonLinkedIn
https://lnkd.in/gFAegH9W",AI or Machine Learning
"Be pragmatic, excited, and responsible: how to get hashtag#GenAI done. Who better to learn from than the sparkling Sandeep Dadlani, Chief Digital and Technology Officer at America's fifth-largest firm, UnitedHealth Group.Rohan Kulkarni HFS Research hashtag#generativeai hashtag#healthcare",AI or Machine Learning
"The best way to learn how to use AI in your work is not to read about itit's to use it.The fine folks at GoPractice, Inc built a hands-on generative AI simulator designed specifically for PMs. Through simulations and real-time exercises, it teaches you how to apply generative AI to create products and automate processes at your company.You'll learn how to do things that used to require an advanced ML team, that now can be done in a few hours by a single product manager.Even better, for a limited time, they made the course completely free for people that follow me. Learn more and sign up here:https://lnkd.in/gRTCc9xpP.S. I'm not affiliated with these guys, and I'm not making anything off of this. I just think this is very cool, and will help a lot of people, so I'm happy to spread the word.",AI or Machine Learning
Really enjoyed talking about such a key topic today with Edward Contreras that we needs to get our arms around. #artificalintelligence #ai #cybersecurityleadership #cisos #generativeai,AI or Machine Learning
"While most business leaders are striving to grasp an understanding of the potential impact of Generative AI for their companies and customers speakers at The Wall Street Journal event are already focused on what is coming next, which they call Artificial General Intelligence (#AGI). They define AGI as the state where AI can perform all human cognitive skills better than the smartest human.

Learn about artificial generative intelligence here! https://lnkd.in/gyRtivxv

#genAI #analytics",AI or Machine Learning
"I am loving hearing Evan D. Collins, MD, MBA do a lecture at the Ion about technology in the Operating room environment as an example of how to work with health care systems.",Not AI or Machine Learning
"In 2010, I launched Heller Search Associates with two assets: a considerable network of CIOs and a wonderful colleague, Carol Lynn Thistle. Carol Lynn and I were hustling for business for our new executive search firm when I received a call from a procurement leader at Toyota North America. Barbara Cooper, Toyota North America's then-CIO, had nominated Heller Search to be certified by the WBENC as a women-owned business. The certification sounds simple: just be a woman and own a business. But in fact, this was an expensive, protracted process (for what was then a fledgling two-person firm), which Barbara not only funded; she made sure her expert team guided us through. Today, as a much larger firm "" but still woman owned "" we continue to renew our certification and display it proudly in our marketing, and I will always be thankful to Barbara for helping Heller Search so early in our existence. Barbara used her resources and influence to put a woman's network into action, as so many of us women in technology are doing today. This week, in celebration of International Women's Day, I would like to honor this tradition of women helping women by quoting some of the most meaningful pieces of advice from women CIOs, whom I have had the honor to publish in my column and in The Heller Report over the years.First up in our series on inspirational advice from female executives is Penelope Prett, who was CIO of Accenture when I interviewed her back in 2020. Penelope currently leads Accenture's Workday business group. ""We live in a world of publicity and social media, where people are always watching what you are doing. When you live in this world, and represent your company, you need an identifiable personal brand. I'm not talking about writing a lot of white papers. It's about having the confidence in who you are and communicating, in a few simple words, your unique value. My responsibility is to help people recognize their personal brand and to use it as the foundation of their confidence to lead.""hashtag#IWD2024 hashtag#IWD hashtag#InspireInclusion hashtag#womenshistory hashtag#executivesearch hashtag#technology hashtag#leadership hashtag#careers hashtag#investinwomen",Not AI or Machine Learning
"Last month was full of exciting news across Azure Data & AI! We're providing our customers with more generative AI model choices and greater flexibility to customize their generative AI apps.Learn about our approach to providing the most comprehensive collection of frontier and OSS models in Azure AI, and much more, in this month's blog: https://lnkd.in/gP2_P5p9- Access new open source foundation models for vision and the hashtag#Whisper model from OpenAI- Manage hashtag#LLMOps with code-first prompt flow experiences and model monitoring for generative AI- Discover the best techniques to improve information retrieval for generative AI apps",AI or Machine Learning
"What an incredible weekend seeing the UnitedHealth Group mission come to life! Colleagues and partners across the enterprise came together to support the UnitedHealthcare Childrens Foundation and celebrate the impact of our sponsors of UHCCFs Frosty Fat Tire event to provide medical grants that help children across the country get the care they need. And I had the privilege of sitting down with Michael Baker to touch on the impact of advanced technologies like generative hashtag#AI to simplify health care and accelerate the transition to value-based care. The amazing work of UHCCF and the tech innovations that improve care affordability and access are just a glimpse at the many ways hashtag#TeamUnited is helping people live healthier lives and making the health system work better for everyone. Jill Awe Terry Clark 
 
Learn more about UHCCF and this amazing event: https://lnkd.in/eSAT6gdN",AI or Machine Learning
"Cognizant is proud to collaborate with Microsoft, bringing the power of hashtag#GenAI into our TriZetto Healthcare Products platform. I am excited to see the progress our two industry-leading companies make in helping improve healthcare for millions of Americans. Powered by Microsoft's Azure OpenAI Service, we'll be supporting healthcare providers and insurance companies to reduce hidden costs, while enabling better outcomes for patients through: 1. Access to innovation and data insights2. Process automation3. Improved regulatory compliance4. Enhanced data security",AI or Machine Learning
"What an amazing week in the French countryside with L'OrAal Mastering ECcommerce Excellence. We ate, we laughed, worked and learned. A special thanks to my Challenge Team!!! Matt Steiner Kenny Ng Maryann Adamec Oliver Rogers and Jenni Johanna Toft",Not AI or Machine Learning
"Have faith, don't be afraid to change and find the courage to let go of things you have no control over. Sometimes, we try so hard to hold onto something good without realizing that something is so much better waiting for us. Check out our new Amazon Best Seller, Unlock The Hidden Leader, Become The Leader You Were Destined To Be, by simply clicking the link below.https://geni.us/4JmlQU#leadership #management #leadershipdevelopment #employeeengagement #leaders #people #leadershipfirst #leadershipfirstquotes #executivesandmanagement #inspiration #giffordthomas #entrepeneurship",Not AI or Machine Learning
"Every month is #EmployeeAppreciationMonth for me because I work with the best #cyber team! Check out some pics from the 125 Global Information Security (#GIS) employee engagement events held across the globe this quarter. These events are focused on fostering employee connection and collaboration to support, uplift, and celebrate one another. Bank of America values the unique talents and perspectives all our employees bring, and I'm personally committed to creating an environment where we all can thrive!",Not AI or Machine Learning
"""I believe even more about how profound hashtag#spatialcomputing is. When you've tried it, it's an aha moment, and you only have a few of those in a lifetime,""Tim Cook, CEO of Apple, Sep. 2023Starting tomorrow you will see a lot more folks experience this aha moment when they get introduced to hashtag#spatialcomputing. This photo is from my time at Magic Leap. Having worked in the hardware industry with both HTC VIVE and then Magic Leap, I've had the chance to give demos to dozens of people, and I can only imagine the excitement and some nerves that Apple Store staff across the US are feeling tonight on the eve of the hashtag#AppleVisionPro launch. Tomorrow is a very exciting day for them, for the company, and for those of us in tech. Remember is not about the hardware, it's about starting to experience the expansion of computing. I'm heading to my local Apple store in the DC area tomorrow to pick up my hashtag#APV. Will be sharing more video from there. hashtag#tech hashtag#business hashtag#spatialcomputer hashtag#AI hashtag#XR hashtag#gaming hashtag#futurecompute hashtag#applestores hashtag#demo hashtag#magicleap hashtag#AIhardware hashtag#AIwearables hashtag#technology hashtag#ahamoments hashtag#timcook",AI or Machine Learning
"Thank you to all of my colleagues in Exelon for coming out last night and supporting the EAARA Signature Event (Family Reunion). A special congratulations to Jamil Muhammad on his next chapter in life after 15 years of excellence at ComEd, you will be missed.",Not AI or Machine Learning
Great to partner with ARM to bring the latest and greatest Cortex-R82 core to lead future data center SSD in AI era!,AI or Machine Learning
"I was on hashtag#CNBC recently discussing why investor focus around hashtag#GenAI should turn from ""enablers"" to ""adopters."" Those opportunities may be found in services areas like software, financial, healthcare, media and more. https://lnkd.in/eCxmT_wU """,AI or Machine Learning
What an incredible weekend seeing the UnitedHealth Group mission come to life! Colleagues and partners across the enterprise came together to support the  UnitedHealthcare  Children's Foundation and celebrate the impact of our sponsors of UHCCF's Frosty Fat Tire event to provide medical grants that help children across the country get the care they need. And I had the privilege of sitting down with Michael Baker to touch on the impact of advanced technologies like generative hashtag#AI to simplify health care and accelerate the transition to value-based care. The amazing work of UHCCF and the tech innovations that improve care affordability and access are just a glimpse at the many ways hashtag#TeamUnited is helping people live healthier lives and making the health system work better for everyone. Jill Awe Terry Clark  Learn more about UHCCF and this amazing event: https://lnkd.in/eSAT6gdN,Not AI or Machine Learning
Great to see this kicking off today!,Not AI or Machine Learning
"Ken ""KT"" Tagashira, our President & CEO since 2021, has made a significant impact during his time at Wheeling-Nippon Steel. His leadership in promoting safety, environmental compliance, and customer satisfaction is some of the important aspects in helping Wheeling-Nippon Steel achieve greatness. All of us at WN wish him all the best in his new assignment at Nippon Steel and for his future endeavors in Japan. Good luck KT!",Not AI or Machine Learning
"So proud to participate in the UnitedHealthcare Children Foundation's first ever Innovation on Ice where our amazing sponsors raised nearly $160k which will provide medical grants for 91 children!So thankful for all our speakers, sponsors and volunteers! Thank you Sandeep Dadlani , Michael Baker , Julie Durham , Jared Carr , sara cassidy , Kelly Devoy , Zachary Crnecki , Jill Awe , Molly Hickey , Adam Caplan , and most of all Ann Boss-Cronin our fearless ringleader! You all made a huge difference today - in the words of Sandeep ""this is the most important thing we will do all week""Looking forward to tomorrow's Frosty Fat Tire event with UHCCF!",Not AI or Machine Learning
"Phew! A breathless day comes to an end in the world of AI. It seems there a two broad camps: one that thinks GPT4o is a big step towards AGI and the other which thinks the live demo was a dud. I subscribe to neither. I have talked about my opinions on the demo itself in a previous post. Let's now get to specifics of how I think this affects our work at samvid.ai

I spent the better part of the day using GPT4o on the kinds of documents we see in our work. As I have mentioned in many other posts, transformers are perception devices and GPT4o is exactly that, the best perception machine in the market. It can now retrieve basic information from unstructured documents with a high degree of accuracy. Old GPT4 was pretty bad at this (why was RAG even a thing given this performance level?) and it took very little to confuse the model. GPT4o is a remarkable improvement on that. However, GPT4o is also showing signs of overfitting. Suppose facts A and B exist in a document with no apparent connection between them. The old GPT4 would have given a McKinsey-like answer with deliberate vagueness about this connection. GPT4o, on the other hand, will go out on a limb and claim there is no relationship between A and B despite the lack of evidence, a fact that may be obviously wrong when evaluated by a domain expert. 

All this is great for samvid.ai . Two thoughts come to mind:
1. My team and I have no interest in spending additional time retrieving basic information from documents. It always seemed like a waste of resources. Would rather focus on higher order problems.
2. The goal of samvid.ai is to unlock the latent knowledge in documents using our #sootras, #neeyums and #essences and use this knowledge for enterprise decision making. Literally nothing about this mission has changed. If anything, our value proposition has gotten stronger. 

It has been a glorious day. Onward and upward.
#enterpriseai, #resoponsibleai #sootras #neeyums #essences",AI or Machine Learning
Im happy to share that Ive obtained a new certification: Gen AI for Business|Data & AI - Champion from Colgate-Palmolive!,Not AI or Machine Learning
#Healthcare can embrace all of what #AI offers while keeping #humankindness at the center of the care we deliver,AI or Machine Learning
"Men struggle with mental health.  The struggle for men is very real...but the topic of mens mental health gets little ""air time"". The biggest cause of mens mental health struggles are work pressures.  Employers MUST work to grow awareness, destimatize and become more vocal on this issue.They say it starts with one guy - if that is true - then I am willing to be that guy.  I am okay with the world knowing I struggle. hashtag#mentalhealthmatters hashtag#mensmentalhealth",Not AI or Machine Learning
"The reversal curse is a cognitive bias where machine learning models, specifically language models, struggle to understand the equivalence of statements when their components are reversed. For example, while a model might correctly identify that Tom Cruises mother is Mary Lee Pfeiffer, it may fail to recognize that Mary Lee Pfeiffers son is Tom Cruise. the research made by Lukas Berglunds delves into this phenomenon through a series of experiments and data analyses.

Read this story from katerinaptrv on Medium: https://lnkd.in/guqUucC2",AI or Machine Learning
"Today, I had the honor of attending the 12th Annual Women Veterans in Higher Education Conference at Cal State Fullerton, all thanks to an invitation from Mylene Noche-Gallagher. Representing SCE at this event was more than just a professional opportunity; it was a profound journey back to the roots of a community I hold dear""the sisterhood of female veterans.The conference was filled with powerful conversations, but the stories shared in a breakout session exclusively for women veterans particularly resonated with me. These testimonies delved deep into the challenges of military service, highlighting the systemic barriers that persist, including sexual harassment, assault, sexual discrimination, and gender bias. These are stark realities that too many of our sisters in arms endure, often in silence. I realized how much I've taken this bond for granted. The shared experiences,  understanding, and unwavering support that come with this sisterhood are invaluable. It's an anchor, a source of strength, and a reminder of the resilience and solidarity that define us.As a proud U.S. Army veteran now with SCE, I am more motivated than ever to advocate for and empower my fellow female veterans. We share a common thread that weaves through our lives, a testament to our collective spirit and determination. Let's continue to support, uplift, and inspire one another, honoring the bond that ties this remarkable community together. hashtag#2024WomenVets",Not AI or Machine Learning
