postContent,themes
"Forbes describes how Utilidata released Karman, a software-defined #AI platform powered by NVIDIA, to provide real-time visibility at the grid-edge, intelligently manage distributed energy resources, and accelerate electrification. Read the article. #powergrid #utilities",AI or Machine Learning
"Listing what Gen AI models can and cannot do is surprisingly difficult and I find that not knowing is a key blocker for coming up with realistic Gen AI use case ideas. So I've had a go at mapping a coherent set of capabilities across different modalities (interactive mind map here: https://lnkd.in/eQFB4hDi).Also, if you have tried the Gen AI Task Wizard GPT (https://lnkd.in/eFFWDAhw), this is what sits behind it - the GPT is told to scan the set of Gen AI capabilities and match them to the tasks related to the job - I find that without it, GPT models are not great at knowing what they can or cannot do.Resources:- Interactive Mind Map: https://lnkd.in/eQFB4hDi- Gen AI Task Wizard GPT: https://lnkd.in/eFFWDAhw- Google Sheet with descriptions: https://lnkd.in/e4QMDQd3",AI or Machine Learning
"Today, we shared that Domino's customers donated more than $16 million to St. Jude Children's Research Hospital in 2023.  We are enormously grateful to our customers, franchisees, and to St. Jude for their leadership in the way the world understands, treats, and defeats childhood cancer. Together, we are making a difference, one pizza - and one donation - at a time. hashtag#dominospizza hashtag#stjude hashtag#feedthepowerofpossible",Not AI or Machine Learning
"We're on the lookout for a talented Vice President of Product Management to lead our product portfolio and market strategies. The ideal candidate will be a creative problem-solver with a strong analytical aptitude, excellent communication skills, and a proven track record of team leadership. Join us in driving value creation while transforming public safety through technological innovation! Apply now: https://lnkd.in/gFW8rsWb",Not AI or Machine Learning
"Excited to be presenting at SAPinsider 2024.  I will be speaking about S/4 implmentation lessons learned, Finance Transformation and AI in Business Technology.  Looking forward to connecting and sharing ideas!hashtag#sapinsider hashtag#sapinsider2024 hashtag#sap hashtag#financetransformation",Not AI or Machine Learning
"It is an honor and privilege to collaborate with the Allen Institute in their effort to build the first-ever complete, cellular map of the whole human brain. By mapping more than 100 billion brain cells with precision and scale using AWS cloud technology, the Allen Institute is creating a path toward breakthrough treatments of brain diseases like Alzheimer's and Parkinson's disease, creating impact for society as a whole. Dr. Lein put it best: Together, we can change the world!Learn more about Allen Institute: https://go.aws/4c5y1IyRui Costa Andy Hickl Shoaib Mufti Allyson Fryhoff David Levy Rick Buettner, MBA Arif Khan Jon Martin Catherine C. hashtag#Brain hashtag#AWS hashtag#AllenInstitute hashtag#Healthcare hashtag#Research hashtag#DataScience hashtag#AI hashtag#MachineLearning hashtag#Neuroscience hashtag#LifeScience hashtag#BrainScience hashtag#Alzheimers hashtag#Parkinsons hashtag#BrainDisease hashtag#AmazonWebServices hashtag#CloudComputing",AI or Machine Learning
"Last week, I had the opportunity to attend the HITEC Spring Leadership Summit for the first time. Hosted this year by Hewlett Packard Enterprise in Houston, Texas. Filling a room with 500+ Hispanic leaders from many different companies, with different backgrounds and experiences.
 
I am extremely thankful for being invited to this summit, it was truly an honor listening to very inspirational conversations where I felt very supported and motivated, not only by the panelists, but by everyone who was part of this event. It was a privilege being surrounded by such talented and passionate Hispanics in tech.
 
I want to thank everyone I had the pleasure of meeting for the amazing conversations and advice. A very special thanks to the Bank of America delegation for being extremely supportive during this event, providing valuable insights about your current roles and careers, and for making my first experience attending such a significant event an unforgettable one.",Not AI or Machine Learning
"Today, George Lee and I hosted an hashtag#AI Showcase to update our colleagues on Goldman Sachs' AI journey and the work we've been doing to implement the technology across the firm. It was wonderful to be able to showcase the work our teams have done over the past year to scale our AI efforts, all of which revolve around three key pillars: driving business growth while enhancing client experience, improving developer productivity, and increasing operating efficiency. Thank you all for being part of this exciting moment!",AI or Machine Learning
"In 1897, the Los Angeles Herald speculated that ""the most startling innovation is the woman dentist."" 127 years ago, this writer could not fathom a world where women were dentists, and today, we cannot fathom a world where they aren't.Women's history includes oral health. Be it innovating oral health solutions in the lab, caring for patients or at home making sure everyone brushes their teeth and schedules annual cleanings, women have always played an important role in advancing oral health. This hashtag#WomensHistoryMonth, I want to celebrate how women were integral to the history of oral health, and are integral to its future. At Colgate-Palmolive, we're proud of all the women who help keep our smiles and our futures healthy and bright.hashtag#WomensHistoryMonth hashtag#OralHealth hashtag#Dentistry hashtag#WomenInSTEM",Not AI or Machine Learning
"Thank you to everyone who attended our Leaders Appreciation Evening, celebrating International Women's Day, hosted by SheJobs-Diversity Focused Organization .I apologize that I couldn't greet each and every one of you, as I was overwhelmed by the kindness and support shown by all of our leaders. Our speakers and special guests were truly amazing, moving everyone with their inspirational journeys and advice. It's not easy to reach the level they are at in their careers, which is why they are true influencers. 

As I mentioned in my speech I will keep showing up to take my mission forward ..

A special mention to our supporters who flew in from different states to be there. I also want to give a big shoutout to our SHE HERO award recipients. I'm thrilled with the way our SheJobs foundation, our non-profit, was kicked off. I want to thank the SheJobs team and all of our volunteers for making the evening a success. My team and I felt all the kindness that evening and it couldn't have been possible without all of you. 

Thanks a ton to DFW Alliance of Technology and Women team for collaboration and for your presence .

Thank you, once again, to everyone who made it to the event. Melissa Pint Neelu Sethi Ambika Dadwal Juhi Chawla Aparna Singh Hari Kodakalla Madhu Kolachina Addie Monson Arrchana Lakshmanan Ranjani Mohana - The Certification Lady Najwan A. Donna Hegdahl Gopal VK Shoba Krishnamurthy Deepa Manavalan Usha Sri Addepalli Mruna Asoori Charuni Karavati Deana Denton",Not AI or Machine Learning
Such a great event! And the main stage session on AI was fantastic. So great to see our friend Keith Perry on stage talking about the amazing work they do at St Jude and how they are leveraging AI.,AI or Machine Learning
"Well to say Im proud may be the understatement of the year.  Our first college graduate. Chase Vincent sets the pace for TeamV.  She is kind, tenacious, understands the value of perseverance and would do anything to help her fellow man.  Couldnt ask for more from a child.  Watch out world ! #proudpops",Not AI or Machine Learning
"Subscribe to the PMI Newsletter for perspectives on working in new ways and turning ideas into reality.It can be hard to know where to start synthesizing all of the info around AI, let alone how to start using it in your work. Dave Garrett shares how our free course and other AI resources will help you get started.hashtag#AI hashtag#ProjectManagement",AI or Machine Learning
"#InnovationSummit Paris is a great place to discover how existing technologies, Data and AI can accelerate our drive to sustainability with electrification and digitization.With my co-host Camilla Nilsson we were very happy to hold an executive round table on process electrification this morning, and brainstorm various ways to innovate on the Demand side of the energy transition.",AI or Machine Learning
"In this episode, Roberta Schwartz, Executive Vice President and Chief Innovation Officer of Houston Methodist Hospital, explores the concept of smart hospitals and her vision for healthcare innovation. Dr Schwartz explains how Houston Methodist Hospital adopts a unique approach by collaborating with external innovators and startups, rather than recruiting from unrelated industries, offering operational expertise to navigate the healthcare landscape. She highlights the challenges of implementing innovation, including resistance to change, emphasizing the importance of involving operational teams in the process. Dr. Schwarz also talks about the importance of team members with dual roles, balancing operations and innovation to bridge the gap between novel solutions and practical implementation to reshape healthcare for a more patient-centric and adaptable future.Join the conversation and learn how innovation and smart hospitals are reshaping healthcare!Spotify: https://lnkd.in/gj-W7U8BApple: https://lnkd.in/ggxS6882Google: https://lnkd.in/gZ3V5cJp?iHeart: https://lnkd.in/grDtDk83Amazon Music: https://lnkd.in/gCpws-XFhashtag#SmartFromTheStart hashtag#NeverStopCaring hashtag#compassionatecare hashtag#healthcare hashtag#innovation hashtag#healthtech hashtag#digitalhealth hashtag#aihealthcare hashtag#smarthospitals hashtag#healthcaretechnology hashtag#artificialintelligence hashtag#nursing hashtag#nursingleadership",AI or Machine Learning
"For less than $100 you can purchase 8 trillion bits of permanent storage; enough to hold a brief biography and genealogy of every person alive. And small enough to fit up your nose.

We live in amazing times.

(And no, I have nothing in my nose.)",Not AI or Machine Learning
"We are in it to win it!  The stage was set for another transformative year at our annual H&W YBM in Dallas, TX. We plan to deliver BIG this year because that's the only way we do things at Walmart. Region 2 is fired up! Y",Not AI or Machine Learning
"You may have noticed a familiar face in one of my previous LinkedIn posts. Thats right, Carol Kemp is back with Alegeus! Were so fortunate that Carol rejoined the team as the general manager for our TPA partnership team. 
 
Her enthusiasm and dedication to our partners success are backed by 20+ years of experience in banking, financial services, healthcare and benefit administration. Carols expertise in strategic sales execution and client account management means she hit the ground running with her team, and shes ready to unlock our partners growth potential next week at our Partner Success Summit. 
 
Join me in welcoming Carol back to the team, and make sure to say hi to her next week in Fort Lauderdale! #TeamAlegeus",Not AI or Machine Learning
"Tesla revealed that Optimus, its humanoid robot, can now sort objects autonomously and do yoga!Whats next?",AI or Machine Learning
"Talent is becoming the key value driver in PE. We had an amazing panel on how human capital is impacting value realization throughout the deal lifecycle. Thank you to wonderful panelists and close friends Karina Sobieski (Advent International), Kate Migliaro (Searchlight Capital Partners), John Knapp (Berkshire Partners) and Courtney Hagen (Littlejohn & Co) for sharing rich insights, best practices, and learnings from across your firms on talent programs, approach to diligence, org assessments, getting right people in the right roles, building alignments with executive teams, role of chair, watchouts, and overall practices.The dynamic conversation punctuated many of the recurring themes echoed in keynotes and other sessions over the last few days. Given the economic uncertainty and deal environment "" moving on talent and org health is becoming essential in accelerating value creation. We had so much fun, and many follow-on conversations with overflowing room attendees, however "" special shoutout to Kate - as your quotes are legendary. Entromy hashtag#PEIOP hashtag#HumanCapital hashtag#ValueCreation hashtag#PE",Not AI or Machine Learning
At University Hospitals Coventry and Warwickshire (UHCW) NHS Trust our UHCWi methodology is embedded into everything we do to help us maximise value for our patients.  Today our CEO Prof Andy Hardy opened our Rapid Improvement Workshop (RPIW) report out where our clinical and non clinical team members presented ideas and plans they had developed together using our method - to ensure a positive experience for patients of pre appointment communication and navigation - is at the centre of plans for our new Community Diagnostics Cente YYTMYTMY. hashtag#UHCWi hashtag#QualityImprovement hashtag#NHSImpact hashtag#TeamUHCW,Not AI or Machine Learning
"From the Internet in the 80s to mobile phones in the early 2000s, once every 5-10 years a massively disruptive #technology emerges that has the potential to change our lives forever. Generative AI is todays disruptor, and it is poised to fundamentally reshape the way we live, work and play. Read my latest Forbes article to learn how companies can unleash the power of #GenAI to address their most challenging pain points and create value: https://lnkd.in/eAhnmkNx #futureshapers ",AI or Machine Learning
"Dear Forbes Technology Council ,Thank you for the warm welcome..!  I am thrilled, excited and honored to join such a distinguished group of thought leaders and changemakers, and I deeply appreciate the recognition. I look forward to learning from fellow members, sharing my insights, and collaborating on vibrant discussions on the Forbes Platform that can create positive impact.",Not AI or Machine Learning
"Had the pleasure of moderating a thought-provoking webinar today for our portfolio leaders on the transformative power of AI for GTM teams. Explored no-regret applications of GenAI, the question of buy v. build, and future use cases we are most excited about. 

A huge thank you to our panelists for their insights & making this a success! 

#AI #RevOps #GeneralAtlantic #GenAI #OpenAI #WellHub #o9Solutions #GTM",AI or Machine Learning
"We are happy to continue to share our voice and experience in another collaborative consortium designed to continue to drive safe, responsible AI implementation in healthcare. This dialogue will help shape standards, testing, validations and reviews in both pre and post deployment and through the full AI lifecycle. Good governance is the accelerant to innovation and good governance starts with a collective voice. Congrats to all of the members!",AI or Machine Learning
"Happy Women in Construction Week! hashtag#WICWeek celebrates and promotes the role of women in the construction industry through the National Association of Women in Construction. Throughout the week, we'll be posting highlights of women on our team.Meet Edie Venit, Supervisor of Accounting Services for NPL Maryland.",Not AI or Machine Learning
"It's always a great day anytime the Wells Fargo Public Affairs Enablement Team can spend time collaborating with our Public Affairs Digital Products & Services partners! Ensuring that we continue to align our goals and objectives. Pictured from Left to Right Howard Jackson, Stephen McGaha,Melissa Osborne, Shika Raynor, Jamie Rance, Brandy Brown, Christopher Stratmann, Kimberly Young, MBA, Dereck CaldwellNot pictured Michelle B., Traci Ketchum, Patti Langenecker, Lisa D. Nielsen, Carol Burke, Dave Starich, Hugh Love, Jennifer Kubiszewski hashtag#WeAreWellsFargohashtag#Innovationhashtag#WellsFargoTechCommunity",Not AI or Machine Learning
"Ys   z:     z  , s  s  YElon Musk, the visionary CEO of Tesla and founder of xAI, has just unveiled Grok, an artificial intelligence chatbot that's set to revolutionize the way we interact with AI. Inspired by 'The Hitchhiker's Guide to the Galaxy,' Grok promises a unique and witty experience for its users.In a recent announcement, Musk highlighted the significance of AI and its potential impact on humanity. Despite his concerns about AI being one of the biggest threats to humanity, he believes in harnessing its power for good. Grok is a step in that direction, offering a playful and informative chatbot experience.Key highlights of Grok include:YY Playful Wit: Grok is designed to answer questions with a touch of humor and a rebellious streak, making interactions more engaging.YY Access to X Posts: Grok has access to user posts on the X platform, providing tailored and relevant responses to its users.YY Early Testing: While Grok is currently in early testing and not available to the general public, it will eventually be released to subscribers of X's top-tier subscription service, Premium+.To give you a taste of Grok's personality, Musk shared an example of a user query, where Grok humorously responded to a request for a ""step-by-step"" guide to making cocaine, ending with a responsible message against illegal activities.Grok's development is spearheaded by Musk's new AI company, xAI. It's powered by Grok-1, a large language model that surpasses GPT-3.5 in certain benchmarks. However, it's important to note that Grok-1 lags behind the most powerful hashtag#chatgpt model, hashtag#gpt4.According to the xAI team, Grok is currently available as a prototype for a limited number of users in the US, with plans for new capabilities and features in the pipeline.Grok embodies the idea of understanding thoroughly and intuitively, making it an exciting addition to the world of AI. Stay tuned for updates as Grok continues to evolve and provide innovative solutions to your questions.hashtag#artificialintelligence hashtag#technology hashtag#generatieveai hashtag#Innovation",AI or Machine Learning
"What makes a home truly stand out? Tune in to HGTV and catch our newest commercial showcasing the beauty, performance, and sustainability of steel roofing brought to life by #USSteel. #SustainableHomes #metalroofing #steelroof #ConstructionMaterials #HomeImprovement #architecture #construction #architecturaldesign",Not AI or Machine Learning
"Welcome Jamie Poindexter, VP Operational Finance! Jamie has accepted the position of Vice President of  Operational Finance and will start January 2, 2024. She is an innovative financial leader with over 20 years of experience in financial operations within the healthcare industry, most recently coming from PeaceHealth (Vancouver, WA) as a System Director of Finance in Ambulatory. Jamie is looking forward to continuing her financial healthcare career at Mercy.",Not AI or Machine Learning
"Thank you, Informatica team, for inviting me to speak at the keynote #informaticaworld2024 this week! I had the opportunity to share the stage with an exceptional host, Richard Ganley (SVP Global partners, Informatica ), and an equally dynamic group of leaders: Jennifer Nacy ( Global IT VP Data, Automation& AI, Jacob Engineering), Parminder Singh( Enterprise Architect, BMC) and Richard Leaton ( Deputy CDO & Data Advisor, Deloitte) a great conversation discussing their Journey of AI adoption.
It was a truly enriching experience to share my team's journey and gain unique insights from the panelists about AI adoption. Each organization's approach to navigating the challenges and uncovering value for its customers and stakeholders was truly inspiring.
It is a unique and humbling experience to be part of the conversation.",AI or Machine Learning
"Today is the last day of the incredible course ""Scaling Operations"" taught by professor Gad Allon at Wharton. This class has been my personal favorite. It's such an enlightening experience that I'm grateful for and will always cherish for.Thank you professor for putting such a great effort into this course. ""You take care of the teaching so that we can take care of our future."" The journey just started.",Not AI or Machine Learning
"After a banking career spanning nearly 40 years, Community Engagement and Responsibility Director Robert Rendon will retire on Jan. 5.A celebration in his honor was held Dec. 12 and attended by family members, colleagues and community leaders.Rendon joined Zions Bank as Community Reinvestment Act Director in 1998. Under his leadership, the bank has become widely recognized as the standard for community engagement, and he has personally been a bridge-builder and unifier across our footprint. Rendon has served as a board member, officer or committee member of nearly 60 community organizations, including Westminster University, Urban Indian Center of Salt Lake, NeighborWorks Salt Lake and the Utah LGBTQ + Chamber of Commerce, to name just a few. He has also played long-time, foundational leadership roles in each of Utah's multicultural chambers. Said Rendon: ""The bank has allowed me to live my life by my favorite Martin Luther King Jr. quote about life's most persistent question, 'What are you doing for others?'"" hashtag#ZionsBanker hashtag#ZionsCareers hashtag#YouBelongHere",Not AI or Machine Learning
"I'm happy to share that I'm starting a new position as Managing Director, Wealth Planning & Advice Team Leader, Eastern Division at J.P. Morgan!",Not AI or Machine Learning
"Now for an unexpected surprise, this is a very nice one.... happy, honored, and humbled to have been selected as a Senior Member of the National Academy of Inventors. (although, comes to mind, the term ""senior"" may be both flattering and perhaps not so much...)https://lnkd.in/ePZY5R7z",Not AI or Machine Learning
So grateful for the people doing the real work Colorado Springs Utilities!,Not AI or Machine Learning
Honored to be part of an amazing Better Being team and join our mission of helping those in pursuit of exceptional health find it.,Not AI or Machine Learning
This article is a great summary of the currently most talked-about current and (not so distant) future use of hashtag#articialintelligence in hashtag#agriculture.,AI or Machine Learning
"Saluting NJITs 2024 Graduates: Embracing the Future with Courage and Curiosity.

Yesterday, with great pride and honor, my wife and I attended my son Carlos Gil Master in Cybersecurity and Privacy graduation ceremony at NJIT. Among other distinguished guests, Samir Saini was the keynote speaker. Reflecting on his speech and the accomplishments of these incredible graduates, I see a brighter future for us all. Below is a link to Samirs speech along with my key takeaways.

https://lnkd.in/eDii2FHD 
At the afternoon ceremony for graduate students of NJITs Ying Wu College of Computing, Interim Dean Ali Mili welcomed keynote speaker Samir Saini 97 (B.S. Civil Engineering), who is a managing director for government clients at Microsoft.

Here are some key takeaways:
The Role of AI in Future Careers: AI will transform tasks and enhance human potential. Graduates must prepare for rapid technological advancements.

From Chatbots to Conscious Agents: AI will evolve into sophisticated agents automating complex tasks independently.

A Revolution Bigger Than GUI: The upcoming AI revolution will significantly impact technology and society, similar to the shift to graphical user interfaces.

Societal Risks of AI: Graduates must address AI-generated misinformation, ensure AI fairness, transparency, and inclusivity.

Impact of Graduates' Work: Graduates' work in AI will shape our shared future, eliminating barriers and driving human progress.

Embrace Lifelong Learning: Continuous learning is essential to remain effective and relevant.

Embrace the Unknown and Diverse Experiences: Be open to new experiences, adapt to changes, and balance professional and personal life.

Responsibility and Privilege of Guiding AI Integration: Graduates have the duty to shape AI integration ethically.

Not mentioned in the article but noted by me:

Get Comfortable with Being Uncomfortable: Growth happens outside comfort zones.

Stay Curious, Enjoy the Long Journey: Find joy in learning and growth.

Remember to Log Out of Work and Log In to Life: Maintain work-life balance.

You Are Stewards of the Future: Graduates have the responsibility to impact society positively.

Embrace Challenges with Courage: Face future challenges with determination and resilience.

Shape a Brighter Future for All: Use skills and passion to create positive change in the world.

Congratulations to Carlos and all NJITs class of 2024 graduates! Your hard work has set a strong foundation for a promising future. Best wishes on your continued journey.

#NJIT #TheFutureIsBright #Cybersecurity",AI or Machine Learning
"We are one week away (Jan 10) from this very important conversation. Include your voice in this cohort of leaders who define the opportunity, build the foundation for success, and address the challenges of AI. Register Today: bit.ly/jan10web #healthcareai #CMIO #informatics",AI or Machine Learning
" Our (Youngmin Lee, Xiaomin Ma, and myself) latest preprint is now available on arXiv: Modeling of Time-varying Wireless Communication Channel with Fading and Shadowing. We propose a novel approach using deep learning neural networks and mixture density networks to model channel characteristics more accurately and adaptively. This innovation leads to more reliable and efficient wireless networks, crucial for modern applications like IoT, 5/6G, and smart cars/cities. https://lnkd.in/dfUQhzzw
#WirelessCommunication #DeepLearning
",AI or Machine Learning
