postContent,theme
"Are you ok? It's a simple question that carries a lot of weight, and during #MentalHealthAwarenessMonth and beyond, it's so important to check in with each other and ourselves. This past weekend, I had the opportunity to do just that. Thanks to ServiceNow's commitment to living our best lives, our entire company had a wellbeing day on Friday that allowed me to get outside and do what I love to do to help with my mental health--exercise. As a family, in honor of Memorial Day, we enjoyed the annual walk we do every year.
Prioritizing yourself is not always easy. As a working mom/parent, I understand. Please know that you are not alone if your mental health is deteriorating. There's no shame in asking for help. So, I'll ask you again: are you ok? #MentalHealthAwarenessMonth #wellbeingmatters",
"How will the newly released NIST Cybersecurity Framework 2.0 affect organization's cyber risk programs?
 
In a recent interview with Legaltech News, Managing Director Rocco Grillo discusses key updates to the NIST CSF including an emphasis around governance and supply chain risk management. Read the full article here: https://okt.to/bBqTFJ
#AMon #NIST #CSF #CyberRisk",Supply chain
"Cloudflare is named one of The 100 Most Loved Workplaces in America for a second year in a year. I say this often "" the two best parts of my job are the people I get to work with and our customers. I am constantly reminded how much a group of passionate people rowing in the same direction can achieve, and I am lucky to be part of it. It is great to be recognized by Newsweek again. https://lnkd.in/gT-_9xwr",
"As #battery production ramps up in the United States, there's a huge opportunity before us. We can use digital tools to drive productivity and improve performance. We can create more resilient supply chains and advance #sustainability.
My message at the Battery Gigafactories conference this year centered on this idea: so much is now possible.",Supply chain
"Y Embrace the Future of (Personalized) Beauty! Y
I've just wrapped up an energizing conversation with industry leaders at the CEW (Cosmetic Executive Women) panel, moderated by Rachel Francois St. Fleur, where we took a deep dive into the exciting trajectory of personalized beauty.
Personalized beauty is a nascent field, and over the next 5 years, I envision 3 game-changing dimensions that will unequivocally reinforce why Personalized Beauty works better!
1i a Battle for Data Domination - Possessing an extensive, qualitative data set can be a strong defensive moat. Direct-to-consumer strategies are crucial to acquiring proprietary data, which can be activated through AI to provide superior personalized experiences. Various data sources, such as consultations, environmental data, computer vision, self-testing, and sensor technology, offer potential for the industry. Data quality, ownership, and consumer adoption are key factors in enhancing personalized beauty solutions. See my article below.
2i a Scale of micro-manufacturing systems - enabling a paradigm shift in where customization occurs - from the fulfillment centers (current Prose model) to the point-of-sale, and ultimately, transitioning to the intimate space of consumers' bathrooms to enable a daily and mono-dose personalization.
3i a The rising integrated product-service modality, hinged on AI, aiming to revolutionize personalization. The emergence of beauty AI-Powered Assistants and vertical super-apps will layer a multitude of services atop the personalized product offering.
I find myself fascinated by the unfolding ""Battle for Data Ownership"", a competition I believe holds the power to shape the industry's future. The pursuit of data ownership can reinforce market defensibility, potentially nudging us towards a 'winner-takes-all' scenario.
Stay tuned for my next post where we deep-dive into the scale of micro-manufacturing systems. Let's shape the future of personalized beauty together! YY
#FutureOfBeauty #PersonalizedBeauty #Data #AI",Supply chain
"Honored to have the opportunity to represent the American business community this week at the third meeting of the USMCA Free Trade Commission in CancAon, Mexico. This roundtable brought together government officials and business executives representing our three countries to discuss the importance of full implementation of the USMCA to support North American competitiveness, investment and supply chain resiliency.
The USMCA can be a model for how the U.S., Mexico and Canada can capitalize on our close regional ties, but it will require all three governments to live up to and uphold the spirit of the agreement. The rewards are worth it""if the USMCA works as intended, it can help address bigger geopolitical challenges and strengthen our supply chain resiliency.
We live in a world and time where our shared values are under attack. And so we must do everything possible to unleash the power of commerce to preserve, protect and expand democracy""for the good of our people and people around the world.",Supply chain
"Huge news today as Panasonic will acquire Blue Yonder!  Thrilled to be joining such a legendary technology company.  Together we will accelerate the autonomous supply chain and combine the ""power of 3"" - AI/ML, Cloud and Edge - to make the supply chain more frontline-enabled and drive huge customer value!  Looking forward to what's next and our future innovations together!  Learn more here https://lnkd.in/gs-SU5S #supplychain #cloud #ai #machinelearning #edge #iot",Supply chain
"2023 is shaping up to be a year of exciting advancements in #connectedcare that improve the lives of people with #chronicconditions and their dedicated care teams. Check out in pharmaphorum my thoughts on this year's trends in #DigitalTherapeutics, #PrecisionEngagement, #RemotePatientMonitoring and #DecentralizedClinicalTrials. #BetterTogether #TeamGlooko http://bit.ly/3lyXncl",
"Sending warm wishes to each of our Deloitte Consulting team members in India and around the world celebrating Diwali today. As the Festival of Lights illuminates our lives, it is a moment for us to come together, reflect on the year gone by, and look ahead with hope. Diwali is not only a time for celebration; it is a reminder of the power of light to conquer darkness. It inspires us to find innovative solutions, to navigate challenges with resilience, and to stand strong as a united force. Let's embrace the spirit of Diwali and carry it with us throughout the year, uplifting one another and fostering a culture of collaboration and inclusion. To our incredible team in India, whom I'm always excited to spend time with (see the below photos from past visits) and where Diwali holds a profound cultural significance, may you find moments of joy and fulfillment amidst the festivities. Excited to see you all in the coming months. hashtag#Diwali hashtag#FestivalofLights hashtag#Inclusion hashtag#Deloitte",MISC
"We celebrated a momentous occasion for Intel and the global semiconductor industry - the opening of Intel's Fab 34 in the ""Silicon Isle"" of Ireland!
Fab 34 signifies the birth of the first-of-its-kind, end-to-end, leading-edge semiconductor manufacturing value chain in Europe. We are sending Intel 4 into high volume manufacturing, and we can proudly put a checkmark on the second node in our ambitious five nodes in four years roadmap. As we shared at our #IntelInnovation event, this is the beginning of the age of the AI PC. And Ireland will be manufacturing the chips that help bring AI everywhere!
I want to express my deepest gratitude to all those who have made this facility a reality, and to the Irish government, thank you for your unwavering support. It's an exciting time for Intel, for Ireland, and for the entire European technology community! #IntelEurope",Supply chain
"We're excited to share our commitment to global #growth and cutting-edge #innovation: With our #investment plan, we spend EUR 2 billion to supercharge production capacities, igniting research, and create new education centers around the globe. Part of the plan is a new $220 million rail manufacturing facility in North Carolina. Stay tuned, as we'll be rolling out even more investments across the US YoY  soon.",Supply chain
"I have known Patrick McIntyre for many years, so I wasn't surprised that this 13-year-old would be excited to attend Johnson & Johnson's Annual Shareholders Meeting last week. I WAS surprised that he showed up with his own printed copy of our proxy statement, to which he'd added blue sticky notes so he could follow along! Did I mention that he wants to be a CEO some day? 
 
Patrick's mother, Jennifer McIntyre, is a Vice President of Finance at Johnson & Johnson and a long-time colleague. When she mentioned that Patrick was coming to the company's Take Our Children to Work event, I noted that it was on the same day as the Shareholders Meeting""so I invited him to attend. 
 
When the meeting was over, Joaquin Duato, the Chairman and CEO of Johnson & Johnson, presented Patrick with a special memento: a framed copy of Johnson & Johnson's first annual report from 1944. Patrick says he plans to hang it on his bedroom wall. I say that, one day, we'll all be working for Patrick.",
"#COVID19 exacerbated long-standing health workforce challenges that continue to threaten health systems worldwide. Ahead of the Fifth Global Forum on Human Resources for Health, my latest LinkedIn piece reflects on how to go beyond applause and really support #healthworkers ai ",
"My thanks to President Alain Berset, President Filipe Jacinto Nyusi, Health Ministers and all the guests who joined us at a historic #WHA76. I met most of them to discuss how World Health Organization can better support their countries to deliver #HealthForAll through health promotion and prevention, through enabling access to quality and affordable health care services in communities, through improving our defence mechanisms for outbreaks and pandemics.
To pathogens, we are all one, and that's how we must see ourselves: one people, sharing one planet, working together with one purpose "" the highest attainable standard of health for all people. #WHO75",
"#COVID19 demonstrated the incredible power of vaccines, tests, treatments and other medical technologies to save lives.
But it also exposed the vast inequalities of our world, in terms of access to those products. And this was not the first time in human history.
At the World Local Production Forum today, I called on government to foster an ecosystem for local production by:
1. providing an enabling environment and incentives for local production, and ensuring compliance with quality standards
2. providing investment and funding
3. facilitating the exchange of knowledge and technology between the public and private sectors
4. building the capacity of the workforce
5. ensuring market access for local manufacturers, by improving supply chain management and expanding market reach
If we can do all this, the sustainability of local production and hashtag#AccessToMedicines will be guaranteed.",Supply chain
"Later this afternoon, Karen Knudsen MBA PhD will join leaders from the #colorectalcancer community at The White House, focused on accelerating efforts to reduce the deadly impact of colorectal cancer. Participants will share updates on the progress of several key initiatives around awareness, prevention, screening, and treatment "" all to deliver on the President and First Lady's re-ignited #CancerMoonshot goal of reducing cancer deaths by 50% over the next 25 years.
The event will be livestreamed at 3pm ET: https://lnkd.in/gm7NGrVZ",
"Y INADIT - C'est la 1A re fois dans le monde qu'une banque est attaquAe en justice pour sa contribution aux dArA glements climatiques.
AprA s avoir envoyA en octobre dernier une mise en demeure A  BNP Paribas, nous attaquons la banque en justice pour non respect de son devoir de vigilance en matiA re climatique, avec Les Amis de la Terre France et Notre Affaire A  Tous, Oxfam France .
Depuis..
- 10 ans on Achange avec #BNP
- 5 ans le Gouvernement refuse de rAguler les banques
- 3 mois on a mis en demeure BNP
On passe donc A  la vitesse supArieure !
Pourquoi BNP ?
- Elle a une empreinte carbone A  la France entiA re
- C'est la 1ere banque au monde A  financer 8 grandes entreprises du pAtrole et gaz, comme Total, BP, Shell...
BNP nous a rApondu fin janvier. Mais sa rAponse est insuffisante pour rApondre aux exigences scientifiques AlAmentaires : est-ce que la banque demande A  ses entreprises clientes de cesser de dAvelopper de nouveaux projets de pAtrole et gaz ? Non. Est-ce qu'elle demande aux entreprises d'avoir un plan de sortie progressif en dehors du pAtrole et gaz d'ici 2050 ? Non.
Par exemple, le 6 fAvrier 2023, soit quelques jours aprA s ses nouveaux engagements, BNP Paribas participait A  l'Amission d'une obligation d'une valeur de 2,5 milliards de dollars pour le gAant BP. Les projets pAtroliers et gaziers prAvus A  court terme par BP Amettraient autant de gaz A  effet de serre que six nouvelles centrales A  charbon sur toute leur durAe de vie.
Elle continue d'utiliser l'argent de ses +7 millions de clients pour financer le dAveloppement des Anergies fossiles A  travers le monde.
Soutenez-nous, signez la pAtition Y
See translation",
"Great win for our UK team. The UK Department for the Environment, Food & Rural Affairs (Defra) just signed a partnership with Cognizant. Defra selected us to deliver essential digital services to enable them to enhance the UK's landscapes, improve biodiversity and encourage innovation. Congrats Rohit Gupta!",
"""Resilient supply chains in a dynamic world"" was the topic of this year's DHL Forum, and I had an insightful fireside chat with Will Heywood, VP of DHL Supply Chain.
We discussed lessons learned during the chaotic times of the pandemic and how #SupplyChains have transformed over the last four years. Throughout our discussion, one thing remained constant: the need to embrace change.
Times of disruption give us the best opportunity to shape the future, and as I shared with Will, digitalization and industrial technologies are driving new ways we're thinking about supply chains and #manufacturing at Siemens.
Amid #SupplyChain disruptions, we've seen that the future of the industry is what I've been calling "" glocal.' Global innovation is and will continue to be essential, but local production capabilities will be vital to increasing resilience against future disruptions.
Roger Libby",Supply chain
"Today concludes this year's World Economic Forum Annual Meeting in Davos. It's been an honor to meet with industry and policy leaders to help shape the partnerships needed to tackle the challenges facing the world today. This year's theme was ""Cooperation in a Fragmented World,"" and in both casual conversations and official presentations there was clear agreement that the challenges addressed in Davos will require unprecedented levels of cooperation between governments, research institutions, NGOs, and many other entities.
The event's organizers not only acknowledged the importance of cooperation in the abstract sense, but pointed specifically to increased cooperation between governments and business as essential to solving a range of economic, energy, and food crises.
We've had a close working relationship with WEF for 20 years, and much of our recent collaboration has focused on these very issues. For example:
""We're exploring the many ways that food system transformation can alleviate poor nutrition, reduce carbon emissions, create good jobs, and reduce waste. As we note, public/private partnerships and action-oriented multi-stakeholder coalitions will become increasingly important if we are to understand, assess, and navigate the trade-offs in complex food system transformations.
""Our Circular Transformation of Industries initiative, launched in collaboration with WEF, INSEAD, and the University of Cambridge, explores how leaders can scale efforts in circularity (the economic model based on reduce/reuse/recycle), going beyond current small-scale partnerships that limit impact to more inclusive models that dramatically accelerate results.
""Discussions at WEF also underscored the importance of policy in driving decarbonization and energy transition. Attendees noted the Inflation Reduction Act should prove truly transformative for the United States, and expressed hope that other regions will step up their policy support. We continue to work with WEF on a number of climate initiatives, including the Leaders for a Sustainable MENA (Middle East North Africa) group, the Alliance of CEO Climate Leaders, and our joint research into voluntary carbon markets.
As a global organization with nearly 20,000 employees, we are committed to reducing our own environmental footprint. Last year we achieved carbon net negative status, and we continue to take our decarbonization and sustainability efforts further. At Davos I saw similar passion and commitment among many of the attendees""quite a few of whom are, I'm proud to say, our friends and clients. I know the challenges we face are not easy, but I remain confident that even in these fragmented times we can achieve virtually anything when we all work together.
#WorldEconomicForum #Davos2023 #BainatDavos #atBain Bain & Company",
"An OMS, or Order Management System, is a software solution that streamlines and automates the various stages of an order's lifecycle, from order placement to fulfillment and delivery. It enables businesses to efficiently manage orders from multiple channels, such as e-commerce platforms, physical stores, and marketplaces, while also integrating with other essential systems such as inventory management, warehouse management, and customer relationship management.
An OMS can improve the efficiency and accuracy of your order processing, which will enhance customer satisfaction and increase overall revenue. Here's how:
- Evaluate needs - Determine your business requirements, such as order volumes and product types
- Choose the right OMS - Select a system that meets your needs, considering factors like scalability and integration capabilities
- Integration - Connect the OMS with existing systems, such as e-commerce platforms and inventory management
- Monitor and optimize - Review OMS performance and make adjustments as needed
Does your company have an integrated OMS in your ERP or a standalone solution?
#software #commerce #scalability",Supply chain
"Now more than ever, it is time for business leaders to analyze and transform their #supplychain. With 42% of executives ranking suppliers as a top-3 important stakeholder, the supply chain plays a critical role in a business' resiliency and agility as it navigates pressures from inflation, geopolitics and unsettled equity markets.
Read more of my thoughts on how leaders should evaluate their supply chain strategy over the next year here:",Supply chain
"Following our stop in Wisconsin this week, the NAM met with manufacturing leaders and policymakers in Indiana and Louisiana as we continue our #CompetingToWin Tour.
In Fishers, Indiana, Sen. Todd Young joined us at INCOG BioPharma Services' brand-new facility, where we discussed the importance of advanced manufacturing. Sen. Young was a lead sponsor for the CHIPS and Science Act""bipartisan legislation that makes manufacturers in America stronger.
Next, we headed to Harahan, Louisiana, where Rep. Garret Graves joined us for a tour of Laitram LLC, a manufacturing leader in seafood and nuts processing equipment. Rep. Graves is committed to boosting U.S. manufacturing competitiveness by modernizing our broken permitting process.
Read more about our latest stops below. (Photos by David Bohrer/NAM)
Indiana: https://lnkd.in/ehdZXbYC
Louisiana: https://lnkd.in/e2PMJYTF",Supply chain
Ravi Kumar S addresses the European analyst and advisor community. He talks about Cognizant's past heritage and how India's second-largest stable of tech talent must tool up for the future... https://lnkd.in/ec4YhXtb,
"Last week, Torod B. Neptune and I had the privilege of visiting Ireland and meeting with our dedicated employees, valued customers, and Irish government officials. The commitment and passion I witnessed from our Medtronic team in Ireland was nothing short of inspiring, and I'm immensely proud of the incredible work they do to improve lives each day. We're not just building innovative medical technologies; we're forging meaningful connections and making a real difference in the world. I'm also thrilled to announce our new partnership with the University of Galway, which will enable significant expansion of the University's MedTech ecosystem, progress its current range of STEM programs, and support the establishment of two new research institutes. It's an investment in our future, a testament to our shared commitment to advancing healthcare, and a promise of even greater things to come. Learn more about this exciting partnership here: https://bit.ly/3QvxIhv
Thank you to Gerry Kilcommins, Briony Wade, Alma Curran, Medtronic EMEA, and the entire Ireland team for your warm welcome. I'm already looking forward to a return trip!",
"Proud of the progress Intel Corporation is making in Ohio and this multi-year journey we're on to build more resilience in our supply chains.
This ""Silicon Heartland"" site will support our most advanced process technologies so our foundry customers can create next-generation products across a range of applications, from high-performance mobile to AI.",Supply chain
"Data Mining is the process of discovering patterns, relationships, and insights from large datasets using various techniques like Machine Learning, statistics, and Artificial Intelligence. By leveraging data mining, your company can gain valuable insights to improve operations and drive efficiency. Here's how:
- Identify inefficiencies - Reveal hidden patterns and trends within your operational data, helping you pinpoint areas where processes can be streamlined or automated
- Enhance decision-making - Uncovering insights from historical data, data mining can help you make better-informed decisions, allowing you to optimize resource allocation, reduce downtime, and boost overall operational efficiency
- Predictive maintenance - Analyzing equipment data can help you predict potential failures or maintenance needs, enabling you to schedule repairs proactively
- Supply Chain optimization - Identify trends and patterns in supplier performance, customer demand, and inventory levels to optimize procurement, warehousing, and transportation processes
- Quality control - Identify factors that contribute to product defects or variations, enabling enhanced quality control measures
By leveraging data mining, your company can uncover hidden opportunities for operational improvement, leading to increased efficiency, cost savings, and a stronger competitive edge.
#datamining #data #machinelearning #artificialintelligence",Supply chain
"We're expanding our AI partnership with Meta, as we bring the power of Bing to Meta AI's chat experiences.",
"So many amazing ways that our communities celebrated the pineapple yesterday! Have fun, and celebrate success! #pineapplepeople #greatplacetowork",MISC
"We couldn't be more excited and grateful to announce the final close of our fourth generation of funds. It is a great privilege to work with our team, our network of entrepreneurs and partner companies, and most importantly our limited partners who entrust us with their capital and mission. Great opportunity ahead!!",
"The Constitution makes it clear that Congress's power to borrow money does not include the power to default on such borrowing.
My advice to Joe Biden on how to deal with the debt ceiling? Ignore McCarthy and the Republican radicals and continue to pay the debts of the United States.",
"Wrapped up an inspiring week at #Perform2023 in Las Vegas, where we announced the most significant innovations for the platform in our history. Data is exploding in volume and complexity, increasingly moving observability from optional to mandatory. These innovations will provide the answer-driven automation needed to help enterprises manage the modern cloud. I am proud to be part of the Dynatrace team. Plus a huge thank you to our customers and partners for making this a breakthrough event. https://lnkd.in/eevnRU89",
"This International Women's Day, learn how investing in gender diversity, equity and inclusion can potentially increase a company's""and your portfolio's""bottom line. Emily Thomas, CFA, Head of Investing with Impact, explains. https://mgstn.ly/3ZL1Kj2",
