postContent,theme
"Help the State of MN find diverse members for the Governor's Advisory Council on Climate Change!
Minnesota is on the path to a clean energy future "" and you can play an important role in that future. The Governor's Advisory Council on Climate Change is accepting applications now. Apply here.
Spread the word and encourage others to apply. Minnesota's Climate Action Framework, launched by Governor Walz and the Climate Change Subcabinet in September 2022, serves as our North Star in making decisions about climate actions. The Framework offers the climate vision for our state as one where we are carbon-neutral, resilient and equitable.
We are seeking members from all corners of the state, with individuals who have experience in business, agriculture, conservation, economic protection, and other relevant stakeholders, who will give voice to Minnesotans who have historically not had a voice in decisions impacting Minnesota's climate.
The board has 15 members who will be appointed by Governor Walz. They will serve from September 2023 through April 2025, with meetings each quarter. Board members also serve as important advocates to communities across the state to help Minnesotans understand and take action to protect our climate "" and our children's future.
For info on how to apply:
https://lnkd.in/gciGmkAb
For more info about Minnesota's Climate Action Framework:
climate.state.mn.us
Thanks for taking time to apply or to encourage others to apply.
#climate #publicservice",
"Last fall Walmart agreed to acquire Alert Innovation, a robotics automation company that develops material-handling technology for automating order fulfillment in retail supply chains. Thankful to spend some time today in the Boston area with this group as well as have the opportunity to meet with the full people team. Excited about the partnership and continued evolution of our supply chain and market fulfillment centers at Walmart! #Digital
Link to announcement last fall: https://lnkd.in/gQgAy-v4",Supply chain
"Today, we launch TSG Advisors, a national consulting firm specializing in education. We aim to convert insights into impact and help businesses and organizations grow and thrive as they navigate increasingly complex governmental waters. Check out our website to learn more: www.tsgadvisors.com",
"Quantum technology is rapidly advancing, bringing us closer to solving previously unsolvable problems. And at IBM, we're laser-focused on bringing useful quantum computing to the world.
Yesterday, at the G7 Summit, we took a big step forward towards this new era with the announcement of our 10-year, $100 million partnership with the University of Tokyo and University of Chicago to develop a 100,000-qubit quantum system by the year 2033.
Already, we've charted the path to scale quantum processors to thousands of qubits but we recognize we cannot usher in this new era of supercomputing alone. As ever, we see the potential and scale that comes from collaboration with like-minded, similarly ambitious institutions.
Together, we will explore and advance four key areas required to realize a system as this scale: quantum communication, middleware for quantum, quantum algorithms and error correction, and components with the necessary supply chain.
We do not underestimate the challenge before us, but we also see a clear path forward with the collective effort and resources IBM and our partners will bring to bear.
I invite you to learn more about how we are charting the course to 100,000 qubits and the era of quantum-centric supercomputing here: https://lnkd.in/g6d-SDbu",Supply chain
"One year ago today, we launched Amazon Clinic with the mission to make health care easier and more accessible. By connecting customers to trusted, high-quality telehealth providers and offering choice and price transparency, we believed we could create a different health care experience "" one that is focused on the customer. Amazon Clinic's 24/7 virtual health care marketplace connects customers (via the Amazon website or mobile app) to third-party, licensed clinicians who quickly provide affordable and trusted care for more than 35 common health concerns. Customers browse a list of available telehealth providers and select the one that best meets their schedule and budget, then connect directly via message- or video-based consultation. They can receive the treatment they need, whenever and wherever they need it, in minutes and hours vs. days or weeks. And we've continued to expand our ""what, who, and how."" We launched with message-based consultations in 32 states and now offer video visits nationwide for more than 35 common conditions. Since launch we've grown our list of treatable conditions, and decreased patient wait times and cost. We've doubled our roster of third-party telehealth providers. All of this has contributed to a 97% customer satisfaction rating. I'm incredibly proud of the team behind Amazon Clinic and their relentless customer obsession and commitment to delivering a world-class service. We made great progress in our first year and can't wait to share what we're building for year 2. At Amazon, we're no strangers to tackling complex challenges. We start with a core customer need and work backwards to build innovative solutions. Step one of our Amazon Health Services journey was removing common barriers to accessing medication by leaning into Amazon's world-class logistics capabilities with the launch of Amazon Pharmacy. Next, we leveraged our unique ability to create a marketplace and connect customers to the products and service they need through Amazon Clinic. Lastly, we've leaned into our ability to create a delightful membership experience for customers with One Medical. We're using the best of Amazon to make it easier for customers to get care, get meds, and stay healthy. As we build the everything store for health, we see this as an important first aisle.
Activate to view larger image,",Supply chain
"People think GoodRx is the place with the coupons, but we also publish amazing research about prescription access and affordability. We recently published this article in the Journal of the American Academy of Dermatology (JAAD) in partnership with the Henry Ford Health medical system in Detroit. We're working to fix our healthcare system, and our researchers are leading the way.",
"We know it feels like the world is on fire right now. You can provide some hope and fight with Oxfam for the most vulnerable among us this hashtag#GivingTuesday. All gifts are doubled if you give today. Make a life-changing impact from Ethiopia to Ukraine to Gaza and beyond. You can help fight for a more equal future.
https://lnkd.in/eWJpnd5C",Environmental Sustainability and Climate
"What a great week having our global leader Roland Busch with us in the U.S. for meetings, an #OptimisticOutlook podcast recording (more on that to come), and a very big announcement: our $220 million investment in a new rail manufacturing hub in Lexington, N.C.
I'll share just one quick takeaway""that in the announcement we saw a core theme in our meetings become a reality: our world is becoming more ""glocal."" Like the internet fueled globalization, shifting many American manufacturing to other countries, technologies now coming of age and supply chain realities will be every bit as influential in *localizing* production here in the U.S.
Now, as Roland said, this doesn't mean decoupling "" taking production from one area and moving it elsewhere. Rather, it means that, as the transformation of industry and infrastructure accelerates "" and as global events spotlight the need for supply chain resilience "" global production networks are now diversifying. Companies are growing their overall manufacturing capabilities and, as glocalization takes hold, choosing to do this closer to the point of the demand.
Which is exactly what we see in Lexington! Siemens is meeting growing U.S. demand for rail by tapping into rail innovation that's been tested and continually refined across our global team, then bringing production close to our East Coast customers. This provides Siemens with a bicoastal #manufacturing presence!
This is only the start of glocalization and the benefits we'll see to jobs, our economy, and to sustainability. And I'm so proud to be part of #TeamSiemens in this moment where we can make such a significant impact.
Activate to view larger image,",Supply chain
"The most recent "" Take Action to End Violence' event hosted by Brady was a great night to raise awareness and work towards making our communities stronger for all. W. Kamau Bell was a thought-provoking and engaging moderator, asking hard-hitting and important questions of Coach Steve Kerr and Stephen Curry. The team raised over $1M, making it one of their most successful fundraising events ever. Thank you to the Brady organizers for continuously working to make our communities safer and bringing attention to this important issue. hashtag#endgunviolence hashtag#whatwestandfor",
"We're investing $100 billion to build a more resilient and secure semiconductor supply chain in the U.S.""boosting our economy, bolstering national security, and ensuring America's ongoing technology leadership. Learn more: https://intel.ly/47gFIJ6",Supply chain
"What an exciting day to see our very first HEYDUDE stores open this week!! Congrats to the whole team for making this happen""they look beautiful!! #goodtogoto",
"The Qualcomm 212S and 9205S modems combine cellular and satellite connectivity, enabling real-time device tracking in remote areas. This is game changing for Qualcomm Aware, our cloud-based #IoT supply chain platform for device management. #TeamQualcomm",Supply chain
"Great article and video showing how SOLARCYCLE is creating an industrial-scale recycling process for solar. This diverts old panels from going to the landfill, reduces carbon pollution from making new panels, builds the supply chain for domestic solar manufacturers, and creates lots of jobs in the process. So great! #solar #supplychain #recycling #video",Supply chain
"we need more insight into how to design sustainable supply chains and Chris van Bergen, MBA knows of what he speaks...order the book!",Supply chain
"We will be presenting the latest clinical, preclinical and manufacturing data from our investigational #GeneTherapy portfolio at this year's American Society of Gene & Cell Therapy 26th Annual Meeting, and we look forward to seeing you at our booth #455! Read more about our presentations here: https://lnkd.in/e9QMNZKk
#ASGCT23 #RareDiseases",Health outcomes
"We're excited to introduce KPMG Trusted AI, our pledge to responsibly and ethnically harness the transformative power of artificial intelligence. As it continues to reshape our world, we're navigating this change with integrity and responsibility. With this pledge, our clients can count on us to deliver AI-powered solutions that are not only innovative but also transparent and reliable "" and it's a promise to our professionals that we will continue to foster an environment that encourages innovation but never at the expense of ethical considerations. Join us on this journey as we shape a future where technology and ethics go hand in hand, setting a new standard for the responsible use of AI in business. hashtag#AI hashtag#ethicalAI hashtag#responsibleAI",
"Leaders must have confidence that their #AI systems are functioning reliably and accurately, and they need to be able to trust the #data being used. This article has fantastic insights on the #transformative potential of AI: https://lnkd.in/gGw7H79X",
"The month of June is always special to me, and I'm feeling especially proud this year. Newsweek just named Nike one of America's Greatest Workplaces for LGBTQ+, and I had the great honor of appearing on Fast Company's 2023 Queer 50 list. These lists recognize our progress and commitment to diversity, to inclusive benefits, and to our teammates. As CHRO for NIKE and a member of the LGBTQ+ community, there is nothing more important to me than our culture of belonging. We want each and every teammate to feel valued, respected and free to be their most authentic self. As I celebrate PRIDE with my teammates around the world, my heart is full. I am so thankful to be part of this incredible team and caring company that puts its people and purpose first. Y Y3i ""Y Y
#PrideMonth #SwooshLife #FCQueer50
https://lnkd.in/ga_Peewj",
The #semiconductor supply chain has been particularly volatile over the past few years. Governments are looking to invest in more secure and reliable systems to safeguard and diversify the global #supplychain. Investment across the entire supply chain is needed for true risk reduction. Read my thoughts in Fortune: http://bit.ly/3YyxWFj,Supply chain
"I'm excited to share our work examining the use of AI to predict whether colorectal cancer has spread elsewhere just by looking at the primary tumor tissue itself.
In this study, we use clustering of machine-learned embeddings to generate human-interpretable visual features of tumor regions, and then select those features that add the most in predictive value when combined to known clinical and pathological variables associated with cancer spread. In this way we prevent simply selecting visual features corresponding to what is already known.
We demonstrate that this approach does indeed boost predictive performance, can improve risk stratification of cancer patients, and use visual analysis of the selected features to build on work suggesting the interaction of fat and tumor may be important in tumor behavior and outcome.
Full paper: https://lnkd.in/gFq5Me7q
Nature Health blog post: https://lnkd.in/g5nR-tEW",
Extending thanks and praise to all veterans and their families. Happy Veterans Day!,MISC
"Microsoft and Qualcomm align forces to accelerate and scale on-device #AI. On-device AI brings more reliability, privacy and personalization for #GenerativeAI applications in PCs, cars, phones and more. Even when there's no connectivity.",MISC
"It was an honor to meet with President Yoon Suk Yeol this week. Qualcomm has many key partners in South Korea, and these expanding collaborations are driving digital transformation across industries, accelerating the paths to #5G Advanced and #semiconductor supply chain resiliency.",Supply chain
"I find our Hewlett Packard Enterprise Customer Innovation Centers (CIC) a constant source of inspiration. The global experiential showcases highlight our edge-to-cloud technology solutions through compelling demonstrations and thoughtful, collaborative dialogues between HPE SMEs and our customers and partners. Last week, I had the pleasure of celebrating the first phase of the London CIC refresh, which now better highlights how our innovation accelerates outcomes and advances the way we all live and work.
Thanks, Matt Harris, Marc Waters, Rebecca Wright, and the local HPE team for an incredible visit. https://lnkd.in/erhE3FzT",
"Saturday is Earth Day, a day that calls attention to environmental issues and the need to address them. At Thermo Fisher, we realize our responsibility as the world leader in serving science is to create a healthier, cleaner and more sustainable world. That's why we're continuing to reduce our impact on the environment and helping to address climate changes.",
"Special dinner with Chef Daniel Thomas, Dr. Lisa K. Fitzpatrick MD, MPH, MPA, and Deloitte #healthequity leaders Josh Lee and Nicole Kelm discussing #foodasmedicine. We can change our health and the health of millions if we undo what we've been programmed to think about food, rethink manufacturing and supply chains, and unleash its power to feed and heal the world.

Anthony Waelter Barb Renner Jay Bhatt Kulleni Gebreyes Kwasi Mitchell",Supply chain
"Energized by two hours with 80+ ESG leaders in The Wharton School's state of the art WAVE classroom exploring the toughest critiques faced by the ESG movement as well as the promise offered and challenges faced by trailblazers like Engine No. 1 in a rich live discussion. Thanks to the amazing support of Fida Kanaan, Erika Callaghan, Cindy Payne , Michael Marolla , Erik J. Froelich , Quentin Stoltzfus, Donald Custer, Eric Hamberger, Patti Williams and all the others at Wharton Executive Education who helped it feel as if we were all together in the classroom. #whartonesg #executiveeducation #esg #esginvesting #esgleadership #esgstrategy",Environmental Sustainability and Climate
"A defunded IRS means a tax evasion free-for-all for the ultra-rich.
The richest 1% already evade as much as $163 billion a year in taxes.
This is why the GOP relentlessly tries to gut IRS.
It's all a ploy to help their wealthy mega-donors.",
How Generative AI is empowering manufacturers and revolutionizing data monetization,Supply chain
"Joining this year's #JPM2023 conference, I was impressed by the vast number of companies deploying cutting-edge science and innovations with one overarching ambition: to relentlessly drive personalised healthcare forward for patients. We, at Roche, are eager to partner and join forces with our peers to leverage each other's expertise, better understand diseases, develop novel diagnostics and uncover valuable insights from data and genomics. Ultimately, we aim to transform healthcare and improve people's health, something we will only achieve by closely #partnering with all stakeholders in the healthcare ecosystem.
#futureoffinance #rocheproud",MISC
"We are proudly celebrating two phenomenal female Makers!
Kayla Brown and Danyal Marie Harris have been nationally named as 2023 Women MAKE Award recipients!
As a pillar initiative of the The Manufacturing Institute - MI,
Women MAKE America recognizes women in science, technology, engineering and production careers who exemplify leadership within their companies.
Women MAKE Award Honorees and Emerging Leaders have accomplished success within their companies and have proven to be leaders in the industry as a whole.
Libbey is proud to support #MFGwomen and efforts to close the gender gap in manufacturing by increasing the number of women in the industry to 35% by 2030.
#MFGWomen
#WomenMAKEAwards
#ManufacturingInstitute",
Congratulations Lisa Paley on her appointment as Chair of the Consumer Healthcare Products Association (CHPA) in the US. Lisa has a wealth of experience in our industry and has always had a real passion for consumers and customers and for delivering better everyday health. I'm really looking forward to seeing what she accomplishes in the role.,
"When you reach for a Kenvue product on the store shelf, chances are you dont think about its journey into your hands. You just appreciate the fact its there when you need it.
 
A seamless #SupplyChain is key to our mission to deliver everyday moments of care when people need them most. And there are so many behind-the-scenes links that make up this supply chain. It starts with our trusted suppliers. 
 
Its not every day you have the opportunity to gather so many incredible companies in the same room, but thats exactly what we did when we launched our new supplier program this week. Not only did we introduce leaders from key suppliers to Kenvue as a stand-alone company, giving the event an extra-special energy, but around every corner we found new ways to grow together, including supporting our Healthy Lives Mission. Were leaving that room with a shared vision for the future.
 
I have every confidence in our ability execute with excellence and meaningfully impact consumers. A huge thank you to Paula Davila Martinez and Alexandra Tarmo for your outstanding leadership in bringing this important event to life, and as always to my fellow leaders, Thibaut Mongon, Jan Meurer, Luani Alvarado, Charmaine England, Caroline Tillett, Paul Ruh, and Bernardo Tavares this is just the beginning.
 
#WeAreKenvue #EverydayCareTogether Bertrand Klehr Stamatis Kontzias Donika Kirk Aisha Phillips, MBA Chris Corrado Lisa Kessler Natasha Zuyev Lynn Evans Shannon MacDonald",Supply chain
Great conversation with CNN about the challenging journey up ahead to build a new semiconductor supply chain.,Supply chain
"The question of merit and who deserves what is a very complicated one that we are grappling with as a society. With an increasing focus on diversity in many domains, backlash sometimes focuses on the departure from ""pure merit.""
Usual arguments for ""pure merit"" include some measure of test scores, academic performance, previous experiences, publications, etc. But those of us who have been involved in selection processes for academic programs or jobs need to fess up. Pure merit is always contextual. And context is incredibly hard to measure and imperfect.
And because of context is hard to measure""we often take shortcuts. We look at the schools from which someone graduated. The names of the companies on someone's resume. A recommendation from a someone we know. We see these as proxy measures for merit. But they are imperfect at best.
And time and time again, unless prompted to do otherwise by force or by circumstance, it is human nature to always seek and select the familiar. To apply proxies for merit instead of doing the hard, imperfect work to see if someone who comes in a different package from the one we know is capable of success. Which is to say""whatever the changing and sometimes unjust law of the land""we must constantly contend with the imperfections of our judgment. To try to be fair to everyone. To create and give opportunity to people whose merit may come in unfamiliar forms. Because when we fail to do so, we rob ourselves of access to the kind of transformational talent we need to challenge our own broken status quo.",DEI
"Our shareholders invest in L3Harris Technologies for our differentiation in three key areas:
Our strategy as the Trusted Disruptor
Our cost effective, agile products and solutions
Our 46,000 team members committed to our customers' critical missions
""as well as our experienced, dedicated management team. Thank you Edward Zoiss for your partnership in sharing our #L3Harris story today at the Wells Fargo Industrial Conference.
Also pictured: Matthew Akers, CFA",
The industrial metaverse enables more resilient supply chains and localized manufacturing through the use of existing tools such as digital twins.,Supply chain
"Introducing Engine No. 1's second actively managed thematic ETF. Transform Supply Chain (SUPP) seeks to provide investments in companies that will drive supply chain resiliency in the long term, creating value through relocalization of manufacturing, automation and innovation, and transportation and logistics management.
Explore SUPP: https://etf.engine1.com/
#Investors #ETF #SupplyChain",Supply chain
"For as long as I've worked in the industry, there's been a belief that consumerism would fix all that ails American healthcare.
Consumerism's strong proponents believe that patients""operating more like shoppers for other goods and services""will unleash the power of competition to improve outcomes and reduce costs.
There are a number of reasons that consumerism has failed that go largely undiscussed:
The Market For Clinical Care Is Inelastic
In other markets for goods and services, new entrants join the market when there's an opportunity. In the United States, the supply of clinicians is largely inelastic because of our system of regulating healthcare professionals. The number of medical school, residency, and fellowship positions is largely fixed and not particularly dynamic. It takes, for example, 10 years to produce a new gastroenterologist (4 years of medical school, 3 years of residency, and 3 years of fellowship). If we really wanted to test the idea that competition could improve outcomes and lower costs""we might open our borders to physicians from other countries and not require them to retrain in the US system (as the state of Tennesse is now doing) or expand allowable scope of practice between disciplines of medicine.
Consolidation & Poor Anti-Trust Enforcement
All segments of healthcare have undergone massive consolidation in the last 20 years. Communities that previously had choices of 5-6 hospitals now have 1 large health system in its place. Physicians who previously practiced independently are now parts of big health systems. These systems exist to elevate selling power with payers and keep prices high. Health plans, for their part, have done the same thing and consolidated as well""and patients in some markets have many fewer choices than they once had of plans, hospitals, and medical groups. A functioning market requires lots of players in order for prices to move elastically.
There Are Massive Information Assymetries
In order to have a functioning market for healthcare goods and services, patients need information about the quality of services they are purchasing. Unfortunately, such information is mixed in quality. Why? Quality measures capture only a small fraction of the clinical scenarios that are relevant to patients. There are literally 100,000s of different clincial scenarios and it is near impossible to measure the skill/capability of a clinician or health system at managing all of these clinical scenarios. Averages may/may not be helpful fo patients in understanding whether a clinician or health system is best at managing their particular scenarios. While there have been efforts to introduce greater transparency, these efforts are surface level at best""not for lack of effort, but because it is so complex. And there remains more art than science in many clinical scenarious making defining a ""gold standard"" very difficult.
Do you still believe ""consumerism"" can fix what ails American healthcare?",Supply chain
