postContent,themes
"Texas Children's Hospital is set to become the first major children's hospital with a robust Virtual Nursing Network. In October, team members assembled to bring the vision for virtual nursing to life. We are so proud to offer this innovative service to our patients and families starting in the NICU  YZai ""Innovation is contagious, and nurses are especially primed for it,"" said System Chief Nurse Executive Jackie Ward, DNP, RN, NE-BC, at our kickoff event last October, ""They are critical thinkers who get creative with solutions and look at problems from multiple angles""they are tenacious and caring, constantly assessing situations to improve patient care.""This innovative approach to patient and family care brings a virtual nurse to the clinical care team from a remote hub. Through virtual interactions, parents and caregivers can access supportive resources without bedside care interruptions. The virtual nursing care model allows for the removal of administrative tasks from the bedside nurse and takes family-centered care ""beyond the bedside"" by offering coordinated, convenient support to patients using technology.""Protecting our teams from burnout continues to be a top priority""with this redesign of duties, we can work to retain nurses who may have otherwise left the bedside and continue delivering compassionate care to families"" shared Ashley Simms, MBA, BSN, RN, NEA-BC, Assistant Vice President, Nursing.hashtag#healthcareinnovation hashtag#healthcareheroes hashtag#virtualnursing hashtag#OneAmazingTeam",Digital Transformation
"Leaked! Bard will be rebranded Gemini, with upgraded voice and file-uploading. A paid version arrives as early as Feb 7th. BUT. Bard still drives me nuts. Gemini gives me bizarre answers. The weirdest conversation I had, in the form of a one act play:This play is entitled ""Google: Get Your (stuff) Together,"" to borrow a phrase from my friend and colleague Scott Galloway.(A note about this performance: I've shortened answers. I've retained the original conversation in full form.) ++++++++++++++++++++++++++++++ {Conor enters Stage Left.}CONOR: Hey Bard. Question for you - which version this is? Am I was now using Gemini Pro? I read that this is supposed to be that and that's awesome.BARD: (politely)I can't actually answer yes or no, I'm afraid. It's confidential. I'm sorry about that. CONOR:Weird but okay. Can you give me the juiciest AI news of the week?BARD:I'm afraid I have no real time access to the internet.CONOR:Really? Even though you're Google?BARD:Yeah, I'm really sorry.CONOR: (Starts a new chat.)Please give me the weather in NYC.BARD:Sure, here you go. Bundle up!CONOR:Wait you told me you didn't have access to the internet but you apparently do?BARD: (This is a direct quote)""So, when I say I don't have access to the internet, it's referring to my lack of ability to freely browse the web like a human. But, for specific tasks where real-time information is crucial, I can access and process limited web data.""CONOR: (direct quote)""Crucial? What's that mean? Can you define crucial?""BARD: (direct quote)""When it's absolutely necessary for completing the task, or is not in my training data, or where the potential benefits out weigh the potential risks.""CONOR:""Can you define "" potential risks'""?BARD:Yeah - bias, private, manipulation, stuff like that.CONOR:""Would it help if I took out the word ""juicy"" from my query?""BARD: (enthusiastically)Yeah it would!CONOR:Okay, can you give me the latest AI News of the week please?BARD:Sure, here's some news from 10 months ago.++++++++++++++++++++++++++++++ It went on.Look, I love Google. I use all their products. I'm never betting against Google. But honestly. I never get good answers from Bard.(Also don't start with they now have image generation. I've tested that too, it's on par with Dall-E, and insanely late to the party.)Maybe this is just my experience - would LOVE to hear from anyone else's experience!!",Digital Transformation
Unlock the power of dynamic product ads on Meta with Smartly.Our testing revealed a 9% lower CPA for video+image compared to BAU DPA. Easily generate up to 40k dynamic product videos at scale with Smartly.io. https://lnkd.in/dDczdTn5,Digital Transformation
"Smartly Y HelloFreshAds across 13 countries. 80% time freed up. 9% lower CPA.Some key results of our successful partnership with HelloFresh, a global food solutions group and meal kit delivery service provider.Watch the success story video below and check out our blog (azi  https://bit.ly/48W7ueJ) to find out how the brand leveraged our hashtag#AI-powered hashtag#advertising platform to execute their Meta ASC campaigns.hashtag#worksmartly hashtag#adtechhttps://lnkd.in/dMcfGnsn",Digital Transformation
Not everyone understands B2B lingo. Professionals on LinkedIn do. Reach B2B audiences with targeting tools built for you. https://lnkd.in/gERfsJnU,Digital Transformation
What is Meta's Dynamic Media for Catalog Ads and how to make the most of it with Smartly? YsCheck out how our hashtag#AI-powered Dynamic Video Ads will maximize the untapped potential for elevating your hashtag#advertising campaigns. Y https://bit.ly/49phsVMhashtag#worksmartly hashtag#adtech hashtag#meta hashtag#ASC,Digital Transformation
We are happy to have one of our latest innovations highlighted in the WSJ!,Digital Transformation
NVIDIA has announced it will work with clients to create custom chips. This is a massive add for Nvidia if they can pull this off. Here are some implications.,Digital Transformation
I'm happy to share I have completed MIT's Program in Digital Transformation,Digital Transformation
Superior Performance of AI/Human Collaboration in  Neuroimaging,Digital Transformation
"Sometimes, it's the simple things that make the biggest impact. A great example of continuous innovation within our mobile app was the recent enhancements to our HealthSafe ID (HSID) capability for members to register for access.

One of the most frequent pain points we hear from our consumers is difficulty for dual eligible (DSNP) members (people with both a Medicare and Medicaid plan) in registering for an account. This population in particular is often dealing with some of the most complex healthcare challenges, and many times have lower access to digital resources and healthcare literacy.

In our new mobile experience - if the member chooses the wrong registration path or health plan, the HSID application will do everything it can to search for other plans in order to help ensure our members are able to register. This not only eliminates the burden from our members having to try and navigate account setup, it gives better access to the wealth of capabilities our market leading mobile ecosystem has to offer. 

Little changes like this can make a huge difference, in this case: we've seen double digit registration success growth in just a few short days! That's millions more members every year with better access to care. 

I am extremely proud of the team that made this happen. Heather Fisher - Anderson, Jared Carr Mike Litecky Peter Armstrong Amanda Loomis Kenneth Bearl Ashok Singh Bisht Marius Bologa Bridget Feickert Christopher Casey Logan Charles Zachary Crnecki Marta M Saputo Jonathan Daccarett Mike Dahl Eric E. Ryan Felton Tony Gregory Patricia Mazur Bhumika Patel Dan Proskauer John Somrock Abraham Sturman Scott Vandeleest Ashutosh Singh Suthaharan Sivasubramaniam and Sri Chari - thank you all!!!

#theBestMobileAppGetsBetter #dreamTeam #goAppGo",Digital Transformation
"Digital transformation is a buzzword that often conjures up images of cutting-edge technologies. However, digital transformation is not only about adopting new tools and systems (although an important aspect); it is also about changing the culture, processes, and mindset of an organization. In fact, I've read many articles that argue that the human and organizational aspects of digital transformation are more important and challenging than the technological ones.I've had the pleasure of working alongside my leader Brett Brunick for close to a decade now and I've seen firsthand how he leads and takes on organizations and their old practices to achieve the transformation they need to compete with industry and succeed. Not only digitally, but culturally. I think of him as somewhat of an expert on this topic, so I wanted to share his words of wisdom directly in an article he penned for InformationWeek. https://lnkd.in/gw9snj4h",Digital Transformation
"a Emory Healthcare's journey with Abridge aIn August 2023, Emory Healthcare announced an enterprise-wide agreement, making Abridge the generative AI solution for all of their 3,450 clinicians. Just months later, there is already a tangible impact on the day-to-day workflow and well-being of clinicians at Emory, who use Abridge within Epic across several specialties and locations. Watch this inspirational video of Emory's journey with Abridge as they ""invest in technology that makes patient care better and also makes the lives of our healthcare workforce better""""Joon S Lee MD, Chief Executive Officer, Emory Healthcare.",Digital Transformation
"Sharing the next case study from our American Medical Association Future of Health series featuring Oshi Health's digitally enabled care model.

Read more on their #innovative approach to GI care delivery and how it's helping improve the #patientexperience. https://lnkd.in/erdDgXSD 

Manatt Health Jared Augenstein Allie (Levy) Chafetz Laura Fritsche, MHA Sameer Berry, MD, MBA",Digital Transformation
Our partnership with A1 Telekom Austria AG and Microsoft shows how hashtag#5G Edge Slicing can be a win-win for enterprises and network operators: enabling a range of new industrial use cases and unlocking new 5G revenue streams.,Digital Transformation
"Y YY34 AI aids paralyzed patient in regaining feeling and movement!Using AI brain implant technology, a person paralyzed from the chest down has successfully regained movement and sensation in their arm.Through ""thought-driven therapy,"" microchips in the patient's brain transmit signals to their spine and muscles, enabling them to move their arm and experience sensations.This development offers hope for individuals with paralysis, potentially granting them more independence and improved quality of life.Follow AI Echo for more useful content!hashtag#ai hashtag#patientcare hashtag#improvement",Digital Transformation
"Introducing Sora, our text-to-video model.Sora can create videos of up to 60 seconds featuring highly detailed scenes, complex camera motion, and multiple characters with vibrant emotions.We'll be taking several important safety steps ahead of making Sora available in OpenAI's products.We are working with red teamers "" domain experts in areas like misinformation, hateful content, and bias "" who are adversarially testing the model.Y: https://openai.com/soraPrompt for Video: ""Beautiful, snowy Tokyo city is bustling. The camera moves through the bustling city street, following several people enjoying the beautiful snowy weather and shopping at nearby stalls. Gorgeous sakura petals are flying through the wind along with snowflakes.""",Digital Transformation
"Very proud to share this article highlighting our TeleNursing program in the early phases of program design and implementation. Hats off to an amazing team of TeleRNs and supporting cast! hashtag#leadingmedicineRoberta Schwartz Lindsay R. Gail M. Vozzella @shannan hamlin, Gabbi Maris, MHA Amy D. Waterman",Digital Transformation
See how AES is leveraging new advancements in renewable energy technology for a cleaner future. https://lnkd.in/gQGRydGd,Digital Transformation
"Every day at Leaf Home our marketing, sales and field teams  are in touch with thousands of homeowners who are looking to learn more about the products and services we provide. We strive to deliver a seamless and exceptional customer experience and our online Self-Scheduler is the latest example of this commitment.   We now  allow homeowners to schedule home visits  for estimates in a few quick clicks through our web experience. YTM Simple but powerful because previously, the process involved speaking with up to three separate people Y  , which could be frustrating and time-consuming for busy homeowners.  This improvement is not only  good for our customers, but it also benefits our business. We see a higher number of appointments, lower cancellation rates and higher sell-through rates when homeowners are setting up their own appointments. Y Leveraging this tool has also freed up time for our team from calendaring tasks, creating a true win-win from both a customer experience and operational efficiency standpoint.  Launched as an A/B test and now being rolled out to all our users, this is the outcome of a  phenomenal partnership between our Growth Product, Technology and Transformation teams Brian Swedenberg Phil Newlon Jeremy Hough Samantha Albarran Y Giving more power to the customer is at the heart of building a great hashtag#d2c business and we are always looking for new digital ideas to test that simplify and elevate the hashtag#customerexperience in the home services space.Y If you have an idea, we would love to hear from you.",Digital Transformation
So proud of Humanas newest awesome app that simplifies our customer experience and improves developer productivity all at once! Congratulations!,Digital Transformation
"Ys Big News! Smartly enables faster, simpler and more effective ad creativity with Generation on Feeds!  YZ  Introducing our enhanced AI-powered solution, empowering brands and marketers to generate personalized, scalable creatives with ease. Early results speak volumes""Foot Locker saw a 32% CTR uplift and Emma "" The Sleep Company a 125% ROAS increase!Join us at the forefront of ad innovation. Learn more Y hashtag#WorkSmartly hashtag#AI hashtag#AdTech hashtag#CreativeInnovation https://lnkd.in/eBxbitfu",Digital Transformation
"Ys Big News! Smartly enables faster, simpler and more effective ad creativity with Generation on Feeds!  YZ  Introducing our enhanced AI-powered solution, empowering brands and marketers to generate personalized, scalable creatives with ease. Early results speak volumes""Foot Locker saw a 32% CTR uplift and Emma "" The Sleep Company a 125% ROAS increase!Join us at the forefront of ad innovation. Learn more Y hashtag#WorkSmartly hashtag#AI hashtag#AdTech hashtag#CreativeInnovation https://lnkd.in/eBxbitfu",Digital Transformation
"When you shift your company from a project-led operating model to a product-led operating model, it necessitates a major overhaul to the way work gets done. When that doesn't happen, you see significant breakdowns and nothing ever gets made.One of the most common tensions occurs between product and IT when companies transform, and I love the way Ahana Roy Choudhury illustrates that in this article. Operating model transformation is critical to the success of digital transformation because the old ""linear"" organizational structures, initiative funding models, and siloed teams can't scale to support the kinds of customer-centric digital experiences companies are investing in. In other words, you can't have one without the other. And if I'm rambling, it's because I'm so passionate about this (it's kinda the reason I started Tuckpoint Advisory Group).https://lnkd.in/g5nmx-3R",Digital Transformation
"Our #MobileHealth Program is helping to fill in the gaps of care around the triad! Berry Jones received a diagnosis and treatment plan from Cone Health's Mobile Health Program without having to leave his neighborhood. Hear his experience, and learn more about the program from Olugbemiga Jegede, MD, MHA, CPE, FACP, FAAPL, FACHE! 

https://lnkd.in/eXq_SVgE ",Digital Transformation
https://lnkd.in/emAjWFtA,Digital Transformation
"Dinesh Keerthi, MSEE, MBA at St. Jude Children's Research Hospital sharing their BMT data architecture and workflows. They have Epic data (for clinical care), legacy Cerner Corporation data, STEMSOFT Software data (for CTL product lifecycle management, patient clinical data management and CIBMTR reporting), and other sources feeding into Microsoft Azure Synapse, with PowerBI providing analytics.Dinesh calls for a BMT Common Data Model which would enable interoperable analytics.ASTCT & CIBMTR (Center for International Blood & Marrow Transplant Research) hashtag#Tandem24 IT & Informatics Track.",Digital Transformation
"""We are designing the product and the manufacturing systems and the factory all at the same time."" - Soufiane Halily, VP of Form Factory via NPRRecently, Soufiane Halily, VP of Form Factory, and Mateo Jaramillo, CEO of Form Energy, gave Glynis Board from NPR Pittsburgh / 90.5 WESA a tour of our manufacturing engineering facility outside of Pittsburgh, PA and of Form Factory 1, under construction in Weirton, WV. They spoke about Form's iron-air battery technology, lean manufacturing approach, and our plans for local hiring in the region, as we prepare to open Form Factory 1's doors later this year.Tune into their discussion via this NPR story: https://lnkd.in/gcFuVGQf",Digital Transformation
"We wrapped up our banking conversion with the release of our awesome new national brand. 

Welcome to Flagstar. Were so glad to have you with us!",Digital Transformation
"We're excited to announce Sora, our first system that can create video from text captions",Digital Transformation
"So there's this new tool out there called Motif Analytics. To the extent that I understand it (which, you know, minimally), it's like regex for event data. They created a very specialized language for manipulating and analyzing events, so that you don't have to write some god-awful SQL query full of self-joins and window functions to figure out how often thing X happens after thing Y, without thing Z happening in between. SQL could do this, of course, but the writing a query like that would be long, tedious, and easy to mess up. Motif, by contrast, is precise and compact. If you knew how to use Motif - even if you didn't know it that well and had to frequently look up its syntax when you used it - it would be pretty silly to think, ""eh, forget it, I'll just use SQL instead, the queries are huge and I get them wrong all the time, but at least I don't have ever Google how do to anything."" The thing is, ever since ChatGPT came out, that's basically what we're trying to do to SQL itself? There are tons of companies and products that promise to replace SQL queries with English questions. But, English is to SQL was SQL is to Motif: A more verbose, more tedious, and less precise language that often makes doing a job *harder.* Imagine trying to describe some multi-step SQL query in English - or even just instructing a bot on how to do a join without using the word join. It'd be a nightmare. For fancy analyses, SQL isn't a necessary evil that computers need to understand us; it's a useful virtue that we need to tell computers what we want. So like, yeah, SQL chatbots are cool and all, and I'm sure one day they'll get quite good at writing SQL. But I'm not sure we'll ever want that, not because computers will need SQL to query a database, but because we won't be able to express ourselves in English.",Digital Transformation
CoPilot Notebooks will help with more complex projects and really brings a developer experience to creative projects! What do you think? Do you see yourself using hashtag#microsoftcopilot notebooks?hashtag#Azure hashtag#openai,Digital Transformation
"Ys Exciting News Alert! Ys DI Squared is here and ready to revolutionize your business solutions! Y14a  Whether it's streamlining operations, boosting efficiency, or enhancing your customer experience, we've got you covered. YY Drop us a comment or message to learn more about how we can tailor our expertise to meet your unique needs. Let's take your business to new heights together! For more information, contact - Ross Conrad or Brittany Madgehashtag#DISquared hashtag#BusinessSolutions hashtag#Innovation hashtag#DataIntegration hashtag#DataAnalytics hashtag#Qlik hashtag#QlikSense hashtag#BI hashtag#DataStrategy hashtag#AI hashtag#SaaS hashtag#Snowflake hashtag#Talend hashtag#Mail&Deploy hashtag#Vizlibhttps://hubs.li/Q02mqj6N0",Digital Transformation
"ICYMI: We launched our new mobile app for CenterWell Pharmacy customers last week. Its designed with seniors in mind and features a simple user experience to make things even easier for our patients  and its getting a lot of great attention. Our customers are happy, and Im so proud of the team behind the app who has brought this to life for our pharmacy patients who can now spend less time worrying about their prescriptions and more time living their best lives.


Daniel Polk Tom Kirtz Gaurav Khanna Craig Klopatek Dalia Powers",Digital Transformation
"Elevance Health approaches technology issues "" particularly AI "" by putting people first. We put AI in action by empowering our associates with AI and GenAI powered solutions so they can deliver higher quality experiences to the people we serve. Thank you for the energizing discussion Reena Sooch, Punit Singh Soni, Jerome Revish, and Aashima Gupta at ViVE this week.hashtag#vive2024 hashtag#healthcareIT",Digital Transformation
"We're continuing to reimagine developer tools for this era of AI with GitHub Copilot Enterprise, a customized companion that places the institutional expertise of an organization at the fingertips of every developer.",Digital Transformation
"At hashtag#vive2024 OpenNotes announced the launch of the new OpenNotes Lab - designed to explore the space where patients, clinicians, notes, and AI meet. Really excited to be working with the amazing Liz Salmi and the OpenNotes team (Cait DesRoches, DrPH MSc , Tom Delbanco, MD , Jan Walker, and more) in building the OpenNotes Lab!Y Read more on this announcement: https://lnkd.in/duXjEpaX",Digital Transformation
We're opening our Supercharger network to NACS-committed automakers starting today. See supported vehicles a http://tesla.com/NACSHost Supercharger at your retail property a https://lnkd.in/g6T4D_8c,Digital Transformation
"Tesla Supercharger network is open to NACS automakers starting today.This is the first time Tesla superchargers are offering Plug-and-charge experience to non-Tesla vehicles and a lot of hardwork went into making this happen from vehicle OEMs, MSPs, Tesla backend, Supercharger HW/FW teams to our super-active Service Engineering teams. Personally, it was a big challenge to architect and drive the ISO15118-2 implementation while also ensuring the interoperability is not affected under the accelerated timeline. But none of this would have been possible without the support of the fantastic Supercharger FW team driving all the FW/SW development, Integration/Validation team and Service Engineering who worked late nights in the background to make it happen.Ross Olson Rangaraj Srikanth Alexander Rudzki Jonathan Tran Alan Tao Amirali Dolatabadi Aristos Athens Taylor Watanabe Anudeep Juluru Eli Hammer Tyler Chen Micki Rentauskas Benjamin Davies Ahmed Tsoroev Minoru Tsuru Wenjing Xu Nicolas Riart and many other teams and individuals who worked behind the scenes. Kudos to everyone involved!hashtag#tesla hashtag#superchargers hashtag#nacs hashtag#evcharging",Digital Transformation
"Revolutionizing Cardiac Care: A Milestone at SIF2024, Scottsdale. Joined by Dr. David Rizik and Dr. Hermiller, we achieved groundbreaking success in live transcatheter mitral valve replacement. Utilizing a 29mm Sapien S3 valve in a decade-old 31mm CE Magna, we saw a dramatic gradient reduction from 18mmHg pre-op to 2mmHg post-deployment. Remarkably, the entire procedure was conducted with Protego, ensuring zero radiation exposure. A testament to the advancements in modern transcatheter redo valve surgery. To learn more about SIF: https://lnkd.in/gyHW2RX7HonorHealth Research Institute David G Rizik, MD, Scottsdale Healthcare Heart Grouphashtag#CardiacInnovation hashtag#SIF2024 hashtag#RadiationFreeSurgery",Digital Transformation
Ethernovia is at the forefront of Ethernet connectivity for the future vehicles. I am pleased to announce the availability and sampling of the most advanced Ethernet Automotive Multi-Gig physical layer transceivers in the industry.,Digital Transformation
"Only Five months in at Smartly & I'm really amazed at all the product development that has gone into helping our clients efficiently scale using proven AI - it just works.Really cool video link below on how we partnered with our friends at HelloFresh to help them drive growth, reach new audiences and engage their existing customers with our hashtag#AI-powered hashtag#advertising platform.This collaboration with HelloFresh resulted in a more efficient and simplified ad creation process, 80% of work time freed up, and 9% lower CPA.Thank you Andreas Katsiamis and all of your teams for the great partnership! https://lnkd.in/ezXJuTGqhashtag#aiautomation hashtag#casestudy hashtag#performance hashtag#teamwork",Digital Transformation
"Great transparency from Anthropic sharing the system prompt of the current API of Claude. It helps us understand why it works the way it does.My assumption why the generated text sounds much more human than previous systems:#1 it's more heavily trained on human qualitative annotation (RLHF)#2 the system prompt says ""the way a highly informed individual would"" + gives it a human name (""Claude"") which leads the system to pick the answers with the highest probability of sounding human.Would be super cool for the community to be able to research & explore more of what makes a chatbot sound more or less human (which is a different metric than how accurate it is by the way).",Digital Transformation
