postContent,themes
Enjoyed talking with Christopher Patterson about our Voice AI work and more with Becker's Healthcare.hashtag#voiceai hashtag#voiceactivatedworkflow hashtag#contactcenter,Digital Transformation
"YZ Today, I bring to you the frightening world of Photoshop's rendering of humans, a part of its generative AI. Simple prompts, terrifying results. May your dreams at night be devoid of such terrors.I'm overall impressed how quickly adobe was able to integrate some generative AI into its software suite. In some areas it's simply FAR behind - especially when rendering humans. Overall, I'm happy to see large companies produce beta software and releases that aren't perfect. This is a good pattern IMO. hashtag#photoshop hashtag#generativeai hashtag#aiart hashtag#ai hashtag#design hashtag#generativeart",Digital Transformation
"So excited to be invited as keynote at Moveworks Global. We use this incredible technology as our smart virtual assistant which we call Red across Honeywell globally. With GenAI ... Red is getting smarter and smarter, improving our global employee experience one use case at a time! Thanks to Bhavin Shah and Varun Singh for making technology that just works and for leading the integration of GenAI into the Moveworks platform. This will result in a more intelligent and improved holistic employee experience. Thanks to my team Angela Bhurji and Salah Kaddumi for making the vision a reality!",Digital Transformation
"This is insane! OpenAI CEO Sam Altman shows how to build your custom AI agent in less than 4 minutes and without writing a single line of code Y 3The fact that you can now create and sell your GPTs / AI apps without knowing how to code represents a monumental shift in technology we haven't seen in 15 years.Just think about it:- GPT Advisor can help you validate your startup idea and give advice from the best VCs in the world.- GPT Engineer can write software and build various applications for you.- GPT Teacher can be your personal tutor and help you learn anything you want.- GPT Analyst can perform stock market research and generate insightful financial reports by analyzing vast datasets.- GPT Creator can help you generate content ideas, optimize your LinkedIn posts, and help edit your newsletter.And that's just the tip of the iceberg. The future of programming is Natural Language and it will change entrepreneurship forever.P.S. check out Ylinas.substack.comY, it's the only newsletter you need for all things when Finance meets Technology. For founders, builders, and leaders.",Digital Transformation
"A pleasant surprise ""14i  Excited to share my journey in digital transformation! Ys Just earned the prestigious hashtag#TopVoice badge on LinkedIn for my insights and expertise. YGrateful for the support and looking forward to inspiring more in hashtag#DigitalTransformation. YLet's connect and drive innovation together! YY hashtag#TopVoice2023 hashtag#TechInnovation hashtag#Technology hashtag#Digital hashtag#digitaltechnology hashtag#businesstransformation",Digital Transformation
"Absolute madness.OpenAI CEO Sam Altman shows how to build your own GPT app in less than 4 minutes - without writing a single line of code.The ability to build and sell these AI apps without any coding knowledge is going to be one of the biggest shifts in technology this century.We could potentially see an explosion of new products and solo entrepreneurs in the coming years.________If you want to learn how to build, sell or use GPT apps, sign up to my AI newsletter with 450k+ readers. I'll be sharing notes on building GPTs as soon as I get access: https://lnkd.in/d2ZcidKG",Digital Transformation
"Today, we're excited to unveil watsonx.governance "" a product that will help businesses automate responsible, transparent machine learning and hashtag#GenAI workflows on one integrated platform.A critical component of watsonx AI and Data, watsonx.governance can help businesses:Y Automate hashtag#AI lifecycle governanceY Proactively manage riska... Facilitate compliance with policies, standards, and regulationsGet the details on the general availability coming next month, here: https://lnkd.in/gGmNSZZg",Digital Transformation
VentureBeat writes about the earth-shattering effect of the release of Llama and Llama-2 on the LLM landscape.,Digital Transformation
Beautiful,Digital Transformation
"I am proud to announce that Cumulus is live and the Cumulus machine is available for pre-order. I'll be sharing more of my journey later today, taking you behind the scenes of how this revolutionary machine came to life.",Digital Transformation
"As one of the AI Ambassadors for Honeywell.. I was one of the early adopters of Copilot. It massively improves productivity across roles. Our developer experience platform is now powered by Copilot, which means we are building more cool products and features faster on hashtag#HoneywellForge hashtag#copilot",Digital Transformation
Excited to share my blog post below about our digital transformation process at HealthEdge!,Digital Transformation
"If done right, AI has the potential to enhance, enable and liberate creativity. Today my colleagues at Google DeepMind and YouTube announced Lyria, our most advanced music generation model to date. This project illustrates two important points about how we can maximize the benefits of AI. First, the best and strongest uses of AI will come through collaboration. And second, we're just beginning to see the potential of AI to assist with our most ambitious, imaginative and creative endeavors. And just as important: We're also taking measures to do this responsibly and have been working on that for a while, from working closely with creators, to including watermarking all Lyria-generated audio with SynthID technology. Much more to come. For now, congrats to my colleagues at Google DeepMind, YouTube and many others across Google (incl. Demis Hassabis,Neal Mohan, Lyor Cohen, Vivien Lewit, Tom Hume, Eli Collins, Jesse Engel, Rushil Mistry, Douglas Eck, Christopher R., Dr. Arathi Sethumadhavan, Mahlet S., Mira Lane and so many others)https://lnkd.in/g6eeRxPD",Digital Transformation
"Today we're announcing two new milestones in our generative AI research: Emu Video & Emu Edit. These two new models build upon our previous work in both images and videos to deliver impressive new results in high quality, diffusion-based text-to-video generation and controlled image editing using just text instructions.More details azi  https://bit.ly/46hkj15Emu Video paper azi  https://bit.ly/3sBio9IEmu Edit paper azi  https://bit.ly/3QBj2vY1i a Emu VideoThis new text-to-video model leverages our Emu image generation model and can respond to text-only, image-only or combined text & image inputs to generate high quality video. It uses a factorized approach that not only allows us to train video generation models more efficiently but also produces higher quality video generations.The outputs of this model were preferred by 96% of respondents over our previous model based on output quality in human evaluations.2i a Emu EditThis new model is capable of free-form editing through text instructions. Unlike many existing models, Emu Edit precisely follows instructions and ensures only specified elements of the input image are edited while leaving areas unrelated to instruction untouched. This enables more powerful and reliable editing and iteration.To train the model we developed a dataset containing 10M synthesized samples of input images, instructions and target outputs "" the largest dataset of its kind to date. As a result the model demonstrates a new state-of-the-art in both qualitative and quantitative evaluations for a range of image editing tasks.While this work is still fundamental research, we see exciting potential for future cases for this technology to enhance the way we share, communicate and express ourselves in creative ways in our family of apps. We're excited to continue pushing this field of work forward.",Digital Transformation
Explore how this CPG manufacturer implemented hashtag#MicrosoftAzure to automate its commercial environment and use data analytics to deliver on its revenue goals.  Ready for a deep dive?  hashtag#PwCMicrosoft hashtag#MSpartner hashtag#MicrosoftAzure hashtag#Transformation hashtag#TechPowered,Digital Transformation
Smartly OG Innovation. Drives performance well beyond the marketplace average.,Digital Transformation
"As one of the AI Ambassadors for Honeywell.. I was one of the early adopters of Copilot. It massively improves productivity across roles. Our developer experience platform is now powered by Copilot, which means we are building more cool products and features faster on hashtag#HoneywellForge hashtag#copilot",Digital Transformation
"Had a great time talking with Robb and Josh on the Invisible Machines Podcast chatting about the roll out of the AI@Morgan Stanley Assitant and the thrill of creating a sophisticated analytical solution for our FAs. 

Check it out below.",Digital Transformation
"Meta AI just dropped EmuVideo, generating 4-second short videos at 512x512 resolution and 16 FPS. Idea is quite straightforward: text -> image first, then do a ""super-resolution"" of the image along the temporal axis to synthesize motion.Long-form videos, however, are still out of reach. I see short videos as a kind of ""system 1 thinking"": you don't need much reasoning to generate 4 seconds. But system-2 type video generation needs coherence, long-term memory, and much higher computational cost.Regardless, EmuVideo is still a big upgrade on the video diffusion quality. Congrats to the Meta AI team! https://lnkd.in/gSavYt77",Digital Transformation
"This article is written by J. Todd Frazier, System Director, Center for Performing Arts Medicine, about how music therapy is incorporated into healthcare practices at Houston Methodist.",Digital Transformation
"In this era of digital health transformation, it is imperative to strike a delicate balance between reaping the benefits of AI and doing it safely. I'm pleased to announce our latest publication, co-authored with Kevin Mooney, Esq., Senior Director of Enterprise Data Governance. This article emphasizes the importance of a holistic, multidisciplinary approach to accelerate digital innovation while safeguarding sensitive patient information.",Digital Transformation
"I'm excited to connect with colleagues and industry peers to discuss the potential of Artificial Intelligence (AI) in healthcare and other industries. AI has the ability to revolutionize patient outcomes, increase productivity, and bring life-saving treatments to the market faster. How is your organization utilizing AI to solve problems and better the future of healthcare. hashtag#AIinHealthcare hashtag#HealthcareRevolution hashtag#PatientOutcomes hashtag#Productivity hashtag#GBIImpact",Digital Transformation
"More and more, top medical organizations are using analytics to personalize care. As part of its future Innovation Institute, Shepherd Center will establish a data analytics program to advance precision rehabilitation for people experiencing the most complex conditions, including spinal cord and brain injuries.
 
Shepherd Center is uniquely positioned to join other leaders in transforming healthcare for the future, says Deborah Backus, PT, Ph.D., FACRM, vice president of research and innovation at Shepherd Center. 

Learn more about how organizations are deploying analytics. https://lnkd.in/gXa9tkCd #PursuingPossible",Digital Transformation
"New on Best Execution: Planixs launches liquidity data insights solution, CEO Neville Roberts gives insight on how the how the new tool aims to unlock the power of financial institutions' untapped liquidity data to provide accessible and actionable data and analytics.hashtag#markets hashtag#data hashtag#trading hashtag#analytics hashtag#technology hashtag#liquidity",Digital Transformation
"Gemini is finally out. Its technical report, while 60 pages long, is light in details. I did a quick read-through and here's the summary.1. Gemini was written in Jax and trained using TPUs. The architecture, while not explained in details, seems similar to that of DeepMind's Flamigo, with separate text encoder and vision encoder.2. Gemini Pro's performance is similar to GPT-3.5 and Gemini Ultra is reported to be better than GPT-4. Nano-1 (1.8B params) and Nano-2 (3.25B params) are designed to run on-device.3. 32K context length.4. Very good at understanding vision and speech.5. Coding ability: the big jump in HumanEval compared to GPT-4 (74.4% vs. 67%), if true, is awesome. However, the Natural2Code benchmark (no leakage on the Internet) shows a much smaller gap (74.9% vs. 73.9%).6. On MMLU: using COT@32 (32 samples) to show that Gemini is better than GPT-4 seems forced. In 5-shot setting, GPT-4 is better (86.4% vs. 83.7%).7. No information at all on the training data, other than they ensured ""all data enrichment workers are paid at least a local living wage.""hashtag#gemini hashtag#llms hashtag#multimodal hashtag#aiengineering",Digital Transformation
Excited to be a part of this great initiative!,Digital Transformation
"Starting today you can try a demo of Audiobox, our new foundation research model for audio generation.Try Audiobox azi  https://bit.ly/3v0hxQGThe demo includes a range of Audiobox's capabilities:"" Zero shot TTS"" Description-conditioned TTS"" Voice restylization"" Text to sound effects"" Voice infilling"" Sound infillingPlus Audiobox Maker, a demo that combines these capabilities to create a story using generative audio.",Digital Transformation
"Its alive!!

https://lnkd.in/gB2dA8hk #tefca #qhin #interoperability #healthcare",Digital Transformation
"I was honored to share my passion for analytics in a recent Forbes article highlighting three trends paving the way for transformation in health care. Here's a recap: ai  Personalized recommendations. Tools informed by data can help care providers recommend equally effective and more affordable medications, helping reduce financial barriers to care. Y Reimagined plans and experiences. Wearable devices can provide insights about our health, but the key is knowing what to do with that information. Resources offering real-time, actionable feedback can bring significant value and encourage healthier lifestyle decisions, especially when integrated with a comprehensive care plan. Y Strategic collaborations. Cultivating new relationships can help drive innovation and bring together novel approaches, offering an opportunity to scale solutions to maximize impact. One example is the UnitedHealthcare Accelerator, which helps early startups grow and facilitates a pathway for commercialization. These approaches are driven by data and present a unique opportunity for us to make health care more equitable and affordable. Check out the photo below at the Optum Innovation Center where we are helping build the future of health care and read the article for a deeper dive on these topics: https://lnkd.in/gJwhhnaz",Digital Transformation
"From automation to machine learning and natural language processing, artificial intelligence has been a part of BlackRock's DNA for years""and continues to be applied across eFront technology. Our collective view is that generative AI will change every aspect of our society just as the internet, mobile phone and web search have changed how we live and communicate.  Given that backdrop, I join all of my BlackRock colleagues in sharing the excitement around our private preview launch of eFront Copilot""within eFront Insight. By integrating generative AI with eFront platform capabilities""across private markets investment data and analysis""eFront Copilot will help institutional investors unlock new efficiencies and workflows within eFront.  Simply ask eFront Copilot to: Access quick analytics to understand key metrics and trends in your portfoliosInstantaneously visualize exposures, performance, and riskConfigure layouts efficiently and access existing Insight functionality directly in the cha Learn more here: https://bit.ly/3GKfDGD",Digital Transformation
"It's a big week for us at May Mobility. We are launching our first rider-only service in Sun City, AZ! Read about our plans in: TechCrunch - https://lnkd.in/gSp6RtBJThe Verge - https://lnkd.in/gY-uXTXwForbes - https://lnkd.in/g-KKKRWphashtag#maymobility hashtag#autonomousvehicles hashtag#technology",Digital Transformation
"Check out this latest American Medical Association Future of Health issue brief focused on best practices for #datasharing in #digitalhealth today.  

And many thanks to Manatt Health for their ongoing collaboration on this important work and all of the contributors to this resource! ",Digital Transformation
We have some very exciting activity happening across Honeywell to further enhance our recently announced Mega trends while simultaneously building upon our customer and partner relationships. See John Waldrons perspective below. #honeywell #GenAI #futureshapers #innovationinaction,Digital Transformation
"Digital Transformation is much more than simply replacing old, outdated information systems.  Rather, it's about creating a modernized infrastructure that has direct and positive impacts on how the enterprise performs work.",Digital Transformation
Today we announced the first Oracle Database@Azure service is now generally available in the Microsoft Azure East US region. My colleague Pradeep Vincent details the architecture highlights behind Oracle Database@Azure and how customers can use our high performance Oracle Exadata Database Service and Oracle Autonomous Database directly from their applications all within Azure data centers. Congratulations to the team in delivering this game changing hashtag#multicloud solution happen!hashtag#OracleCloudInfrastructure hashtag#OCI,Digital Transformation
"My hashtag#startup Nectry has come out of stealth, and we are looking for our ideal first pilot customers!  I'll appreciate any suggestions (self-nominations or otherwise).Briefly, Nectry looks like an hashtag#AI chatbot that replaces a human software-engineering consultant.  Tell it what features you want in your hashtag#enterprisesoftware , and it builds the app while you watch -- with no need to read (let alone write) code.  Under the hood, the most important innovation is in design of the right novel application hashtag#programminglanguage and other abstractions, drawing on ideas from the research fields I mostly work in, like dependently typed hashtag#functionalprogramming.",Digital Transformation
"This year, you are going to hear a lot about ""Spatial Computing"" and ""Mixed Reality."" But what exactly do these terms mean? And how do they relate to the terms we have been hearing for a while now, like ""augmented reality,"" ""virtual reality,"" and ""metaverse""? Here's a crash course on the terminology linked to the next wave of computing:Y Spatial Computing is the umbrella term for technologies and processes that enable computers to perceive, interact with, and navigate 3D space. This includes augmented reality, mixed reality, virtual reality, autonomous vehicles, robotics, and more. Y Augmented Reality (AR): AR overlays digital content on the real world. Users can see and interact with virtual content as if they are in the space around them with devices like smartphones and smart glasses. For example, you see a 3D dinosaur superimposed onto your living room through your phone, looking like it's standing next to your couch. YZ Mixed Reality (MR): The best way to think about MR is a subset or more advanced form of AR. It goes beyond the overlay and provides a deeper integration and interaction between the real and digital worlds. It typically involves advanced spatial awareness, more complex interactivity, and a higher degree of immersion (such as a headset). For example, using a headset, you see a 3D dinosaur roam around your room, walk behind your table, cast a shadow under the lamp, and playfully react when you toss a virtual ball, utilizing the entire space as its stomping ground. Yi  Virtual Reality (VR): VR immerses users in a completely digital environment where they can interact with virtual objects and scenarios as if they were real. It typically requires a headset, often called an HMD or head-mounted display. For example, wearing a headset, you find yourself in a simulated prehistoric world, standing next to a life-sized dinosaur in a fully immersive 360-degree environment.What about XR? XR stands for ""Extended Reality"" and is the umbrella term encompassing AR, VR, and MR. IMHO, it was created because people get tired of saying AR/VR/MR in one sentence ;) Y Metaverse, IMHO, is a term that describes the future online experience, much like how we used ""the information superhighway"" in the early 90s. Matthew Ball defines this as ""a persistent and interconnected network of 3D virtual worlds that will eventually serve as the gateway to most online experiences and also underpin much of the physical world."" It is enabled by spatial computing technologies. Do you have other ways you have been describing these terms to clients, friends, colleagues, or family members? Leave them in the comments! NOTE: I want to recognize that there is a lot of history behind many of these terms that have been around for a long time (e.g., Milgram's mixed reality spectrum). The definitions above reflect how I see the terms currently being used. hashtag#spatialcomputing hashtag#metaverse hashtag#augmentedreality hashtag#virtualreality hashtag#mixedreality hashtag#technology",Digital Transformation
"I am thrilled and honored to share this amazing news with you all: UnitedHealthcare's mobile app is now the number one app in the world in the Medical category on both Apple and Google app stores! This is a huge accomplishment that reflects the hard work, dedication, and passion of hundreds of people who make the UHC app the best way for our members to interact with us.The UHC app is not just an app, it is a powerful tool that empowers our members to take charge of their health and wellness. Whether it be finding high quality, affordable care, connecting our members to amazing benefits, managing prescriptions, accessing digital ID cards, building cost estimates, or accessing spend for you and your family, the UHC app is here 24/7/365 to provide an unparalleled experience!I want to take this opportunity to thank everyone who has contributed to the success of the UHC app, from the developers, designers, testers, marketers, analysts, project managers, to the leaders and stakeholders who have supported and guided us along the way. You are the dream team that makes the UHC app the best mobile app in the world!I also want to thank our members who have trusted us with their health and wellness needs, and who have given us valuable feedback and suggestions to improve the UHC app. We are always listening and learning from you, and we are committed to making the UHC app even better and more user-friendly every day.Let's celebrate this milestone together, and let's keep up the good work! The UHC app is not only the number one app in the world, but also the number one app in our hearts! hashtag#goAppGo hashtag#theBestMobileAppGetsBetter hashtag#dreamTeam",Digital Transformation
"The UHC App - The Number One Mobile App (in the Medical Category) on both Apple and Google app stores!! Congratulations to all the product and tech team members that relentlessly and carefully listen to consumers, find and build new features every week and repeat it the next week and the week after with 100X speed to make the member experience amazing! Hans Hage Julie Durham and team......we are all so proud of you! and I know we are just getting started......so much to come in 2024.
Download the UHC app today!
#LetsGo
#100X
#ZeroDistance
#BeMore
Zack Sopcak",Digital Transformation
"The UHC App - The Number One Mobile App (in the Medical Category) on both Apple and Google app stores!! Congratulations to all the product and tech team members that relentlessly and carefully listen to consumers, find and build new features every week and repeat it the next week and the week after with 100X speed to make the member experience amazing! Hans Hage Julie Durham and team......we are all so proud of you! and I know we are just getting started......so much to come in 2024.
Download the UHC app today!
#LetsGo
#100X
#ZeroDistance
#BeMore
Zack Sopcak",Digital Transformation
